,article,article_date
317,"**What to expect from Budget 2017**

___

[IMAGE](http://www.livemint.com/rf/Image-621x414/LiveMint/Period2/2016/12/19/Photos/Processed/aj-kAvH--621x414@LiveMint.JPG)

___

Business will begin early for the Indian Parliament next year. With the winter session proving a washout, and the deadline for the goods and services tax (GST) looming, the government could convene the budget session of Parliament as early as the second week of January. The Union Budget itself will be presented on 1 February.

I expect a rash of people-friendly announcements in the budget. The narrative around demonetisation—the government’s move on 8 November to render invalid all old Rs500 and Rs1,000 denomination currency notes, 86% of the cash in the system—is turning negative in parts, although it is a measure of the goodwill Prime Minister Narendra Modi still enjoys that most Indians continue to put up with the fallout because they think it is well-intentioned. The move has hit business in the second part of the third quarter (October-December) and could affect business in the next quarter (January-March) too. The government needs to address this and the budget is a good platform to do so. Elections in India’s largest state, Uttar Pradesh, may happen as early as February. Modi’s Bharatiya Janata Party (BJP) is up against the governing Samajwadi Party, the resurgent Bahujan Samaj Party, and the Congress, which may or may not forge an alliance with the second. A year ago, the BJP seemed to be gaining a lot of momentum in the state where it swept the parliamentary elections in 2014 (although people have been known to vote differently in state elections). That’s changed, not the least because of demonetisation, and the budget is, again, a good platform for the BJP-led National Democratic Alliance government to regain its mojo.

If the elections in Uttar Pradesh have to happen in February, they will have to be announced sometime in early January. The so-called model code of conduct will come into effect immediately, preventing any populist measures from being announced by both central and state governments. This restriction, though, is unlikely to apply to the Union Budget, another reason why it will have to serve as the platform for such measures.

There have already been murmurs within the BJP—they are all you will hear in a party led by Narendra Modi and Amit Shah —about how the fallout of demonetisation is hurting the party, and some people- and business-friendly measures will, no doubt, quell these too. Industry will cheer even a watered-down GST and the government will try its best to finalize the fine-print of one in January. The government will likely announce wide-ranging cuts in income tax, both personal and corporate. That should boost both consumer and business sentiment. The tax cuts may be announced in the budget. With an eye on the rural economy, and Uttar Pradesh, the government is also likely to announce a farm package in the budget.

What else can we expect in the budget?

With the rail budget anyway being integrated with it, the Union Budget already comes with a built-in emphasis (and a big one) on infrastructure. With private investment still not kicking in, the government probably recognizes the importance of spending on infrastructure. The focus on solar and wind power, and highways and inland waterways could continue.

Digital and cashless are perhaps the two most used words by anyone in government since 8 November, when Prime Minister Modi announced the invalidation of old high-denomination currency notes. Both will get a fair share of attention (and money) in the budget too. I expect more sops and incentives for cashless transactions and the makers of hardware required to power such transactions.

Other (perennial) favourites of the government, schemes such as Make in India, Skill India, and Start-up India will likely get a look-in too.

It is important to recognize the kind of budget India needs at this point in time. There are times when a country needs a budget that can spur growth. There are other times when a country needs a budget that can cut expenditure. There are still other times when a country can get by with a middle-of-the-road budget that maintains the status quo. Then, there are times when a budget has to focus on a specific sector—agriculture, for instance. The budget which finance minister Arun Jaitley will present on 1 February needs to have a different and singular objective. Demonetisation has left people feeling low and tired. While it is effecting one kind of behaviour change, towards cashless transactions, it is also encouraging the hoarding of cash and forcing people to defer expenditure. Consumer, business, and investor sentiment are all down. The budget needs to change all that. We need one that is, in letter and spirit, true to that cliché popularized by headline writers—a feel-good budget.

We will probably (and hopefully) get one.

R. Sukumar is editor, Mint.

___

^Version ^: ^0.6a ^| [^Changelog](https://www.reddit.com/r/anti_anti_adblock/comments/4ssi0u/change_log/)

^Function ^: ^I ^post ^the ^article's ^text ^as ^a ^comment ^if ^the ^website ^is ^adblocker ^unfriendly.

[^I ^accept ^commands!](https://www.reddit.com/r/anti_anti_adblock/comments/4u2iwn/commands_accepted_by_the_bot/)



___

^Powered ^by [^newspaper3k](https://github.com/codelucas/newspaper)",2016-12-19 18:14:49
318,What can modi and the swachh abhiyan do if people do not want to change? ,2016-12-19 18:16:42
319,Completely agree with OP. Next step is data fudging. Wait and see how RBI suddenly discovers in the next couple of weeks that they had made an error in counting and the amount of deposited money is actually lower than what they'd reported. I actually think that they'd randomly identify a lot of suspicious accounts and screw them over without any investigation. Freeze those accounts and declare a windfall in the new year. Bolo har har Modi. ,2016-12-19 18:17:37
320,modi himself is a corrupt chutiya,2016-12-19 18:19:06
321,"In the Hindi heartland , the demon is being praised as a ""yagna"" and modi the chief priest who has taken the bold decision of yagna and purified the money.
Most of the people believe only in social media forwards these days and all of them have been successfully exploited by BJP to get the message across.

It is almost like the we are moving to a Putinesque democracy where everything is modified and marketed in such a way that it feels like success.

And in the midst of the demon they further slashed the PF yet again.",2016-12-19 18:34:53
322,"Exactly. All my bleeding heart liberal friends that cried on fb when modi won the elections have now suddenly become quasi-bhakths. Truly chilling phenomenon, the govt is legit fucking with our heads..",2016-12-19 18:38:53
323,Down with Modi Bhai!,2016-12-19 18:40:55
324,"These maniacs have crossed all limits now. Fuck these bastards. 

Let 2019 come we'll show modi what's up",2016-12-19 18:41:34
325,Yeah that's why we are in this cluster fuck for the past 40 days.  Because we aren't good enough for Modi! ,2016-12-19 18:41:43
326,"mera chutiya desh mahaan . Jai Modi , Jai Hindutva , himaes bhai roxxx",2016-12-19 18:42:09
327,people asked for this shit. they wanted to remove black money and when modi did this they're crying. ,2016-12-19 18:48:00
328,"Abki baar Modi sarkaar!

Agle baar Modi sarkaar!

Har baar Modi sarkaar!

**Har Har Modi, Ghar Ghar Modi.**",2016-12-19 19:09:16
329,Interesting that Modi finds no place.,2016-12-19 19:13:55
330,"Oh no, that would take so much effort. Why would I go out and vote and do other stuff to help my country. I would rather sit at home and bitch about Modi on Reddit. /s",2016-12-19 19:19:04
331,"&gt; This is cheating

Yes. Modi ji would be cheating on Amit Shah with Urjit Patel.",2016-12-19 19:28:57
332,Paranoid much?You give Modi more credit than he deserves.,2016-12-19 19:38:26
333,"&gt; Har Har Modi, Ghar Ghar Modi.

He did it. Literally. ",2016-12-19 20:04:53
334,If I didn't made it clear before I was referring to this one situation of demonetization(at least and at last). Not the whole shit their government or our Mudiji is doing. They understood that they were hammering the last nail in their coffin and Modi should understand that he is hammering the first one.,2016-12-19 20:18:37
335,"**Gujarat’s prohibition law friendly to tourists but sends residents to jail**

___

[IMAGE](http://www.hindustantimes.com/rf/image_size_90x90/HT/p2/2016/12/17/Pictures/spotted-photograph-hindustan-september-across-underage-liquor_048bfaaa-c400-11e6-913d-826c0833a15d.jpg)

___

A dry state for almost six decades, Gujarat has now made its prohibition law even more stringent. But that’s only for locals who could now end up in jail for three years and pay a hefty Rs 5 lakh fine if caught with a liquor bottle.

For visitors and tourists though it’s good cheer as access to alcohol has been made easier. The guests can raise a toast by just walking into the hotel liquor shop and furnishing certain documents.

Now, a click of the mouse can get them the permit required to consume liquor in Gujarat.

That’s two sides of the Gujarat prohibition model — strict for residents and friendly for tourists.

The prohibition policy started becoming tourist-friendly during the last few years of the Narendra Modi rule in the state and remained so under his successor Anandiben Patel, with more and more hotels getting licences to run liquor shops. Besides, the process for on-arrival permits at airports and hotels and even e-permits had been eased.

And now, the Vijay Rupani government that faces crucial assembly elections next year seems to have succumbed to the demands of two electorally important communities — OBCs and Patidars — to make the law tougher for locals.

“For the promotion of world class business events like the biennial Vibrant Gujarat Global Investors Summit (VGGIS) and tourism fairs like Rann Utsav (Desert Festival) — both conceived and promoted by Narendra Modi as Gujarat chief minister — the home department had to accept the suggestions of the tourism department to ease the prohibition policy for visitors,” said a top official from the home department.

On the other hand, the government on Thursday, while announcing an ordinance for stricter punishments to tipplers and bootleggers, called it the need of the hour.

“These (amendments) will help stop social, economical and moral deterioration of society,” said minister of state for home Pradeepsinh Jadeja.

Under their leader Alpesh Thakor, the OBC communities that account for 40 per cent of Gujarat’s over six crore population, had joined hands with SCs and STs to press for a stricter prohibition law and its better implementation.

Thakor also got support from Hardik Patel, who is spearheading the Patidar quota agitation, and Dalit leader Jignesh Mevani.

Besides Patidars and OBCs, the Rupani government also aims to win over women voters with Thursday’s ordinance.

___

^Version ^: ^0.6a ^| [^Changelog](https://www.reddit.com/r/anti_anti_adblock/comments/4ssi0u/change_log/)

^Function ^: ^I ^post ^the ^article's ^text ^as ^a ^comment ^if ^the ^website ^is ^adblocker ^unfriendly.

[^I ^accept ^commands!](https://www.reddit.com/r/anti_anti_adblock/comments/4u2iwn/commands_accepted_by_the_bot/)



___

^Powered ^by [^newspaper3k](https://github.com/codelucas/newspaper)",2016-12-19 20:29:51
336,He's been [since](https://www.google.co.in/url?sa=i&amp;rct=j&amp;q=&amp;esrc=s&amp;source=images&amp;cd=&amp;ved=0ahUKEwiLl62Ew4DRAhUMpI8KHWRFC24QjBwIBA&amp;url=http%3A%2F%2Fmedia2.intoday.in%2Findiatoday%2Fimages%2Fstories%2Fsalman-modi-story-size-650_012915050106.jpg&amp;psig=AFQjCNHXwbO8JicsWK-_iFKer1EhKkUOdw&amp;ust=1482246052991958&amp;cad=rjt) ages.,2016-12-19 20:31:40
337,"Modi is one of the worst and most dangerous politicians India has ever seen. For the first time in my life, I will be voting for Congress if they have a chance of defeating Modi in 2019",2016-12-19 20:32:08
338,"Is it killing the economy if a majority disagrees and would be willing to beat you up over it? Is a fact a fact if no one around you agrees to it?

Modi era has made me definitely more philosophical.",2016-12-19 20:33:38
339,Anyday I will pick Chidambaram over fascist Modi. No doubt about it.,2016-12-19 20:35:00
340,Modi to be minister of Making India Great Again.,2016-12-19 20:42:49
341,"Looks like people are running out of real life comparisons for Modi. Hitler, Mussolini, Venezuela and Zimbabwe doesn't cut it now. Even the fiction of Orwell isn't enough.  ",2016-12-19 20:46:13
342,"**Narendra Modi govt may hike base Income Tax slab from Rs 2.5 lakh to Rs 4 lakh, says report; spokesperson terms it 'baseless'**

___

[IMAGE](http://images.financialexpress.com/2016/12/income-tax-480.jpg)

___

The Narendra Modi government may increase base Income Tax slab up to Rs 4 lakh per annum.

Facing criticism from the opposition over demonetisation, the Narendra Modi government is considering a proposal to revise the base Income Tax slab and increase it up to Rs 4 lakh per annum from the current Rs 2.5 lakh per year, according to a report by India Today news channel.

The channel reported that the government may announce revised tax slabs before the announcement of Uttar Pradesh assembly election dates.

Quoting sources, India Today also said while people in the Rs 4-10 lakh income group may be taxed at 10%, 15% tax is likely for the 10-15 lakh income group. Similarly, while people in the Rs 15-20 lakh income group may have to pay 20% tax, 30% tax may be imposed on those having income above Rs 20 lakh.

If implemented, the new tax proposals will give a huge relief to taxpayers reeling under the impact of high inflation and high tax rates.

Currently, income up to Rs 2.5 lakh is exempt from tax, income from Rs 250,001 to Rs 5,00,000 is taxed at 10%, from Rs 5,00,001 to Rs 10,00,000 at 20% and above Rs 10 lakh at 30%.

However, government spokesperson Frank Noronha rejected the report about new income tax slabs. ANI reported him calling it “‘baseless and unfounded”.

Earlier on December 14, Union Finance minister Arun Jaitley had indicated that the government may reward the common man by lowering both direct and indirect tax rates in Budget FY18 as demonetisation is set to expand the tax net.

While the central bank is remonetising by constantly releasing new banknotes, which would be “significant” in the next three weeks, Jaitley said the strategy is to make future transactions substantially digital to reduce dependence on cash. “Once they (black money hoarders) are substantially digital, they will get caught in the tax net,” he said.

“Therefore, the future taxation level would be much higher than what is currently being collected. This would also enable the government at some stage to make taxes more reasonable which will apply to both direct and indirect taxes,” the minister said.

___

^Version ^: ^0.6a ^| [^Changelog](https://www.reddit.com/r/anti_anti_adblock/comments/4ssi0u/change_log/)

^Function ^: ^I ^post ^the ^article's ^text ^as ^a ^comment ^if ^the ^website ^is ^adblocker ^unfriendly.

[^I ^accept ^commands!](https://www.reddit.com/r/anti_anti_adblock/comments/4u2iwn/commands_accepted_by_the_bot/)



___

^Powered ^by [^newspaper3k](https://github.com/codelucas/newspaper)",2016-12-19 20:49:49
343,"
&gt; People wonder how brexit happened, how trump happened, how BJP happened - it's because of the morons like this lot who are so convinced of their intellectual superiority, that they refuse to engage in discussion and throw around terms. 

Kuch bhi. BJP happened because Modi is a strong candidate and Congress, AAP and third front were all chutiya. Go on FB sometime to see who is throwing around Bullshit terms and refusing to engage in discussions. 

&gt;This sub is an absolute bubble. 

If this sub is an absolute bubble, your viewpoint is a worse bubble to judge anybody who doesn't support BJP. ",2016-12-19 20:56:01
344,"Modi Kare toh Leela
Congress Kare toh character dheela ",2016-12-19 20:56:17
345,"Bar Bar Modi, Bar🥂 Bar🍻 Modi!",2016-12-19 21:00:09
346,"&gt;BJP happened because Modi is a strong candidate and Congress, AAP and third front were all chutiya

Are you aware there was a BJP before Modi? I'm talking about how BJP became a national level player. Or do you think there was no right-wing movement before 2014? 

&gt;your viewpoint is a worse bubble to judge anybody who doesn't support BJP

Oh for fucks sake, A) - nowhere in my statement have I defended BJP's actions, I support them on some issues and disagree on some, but I suppose if I criticise you randians I'm a BJP supporter bhakt yadda yadda right? Read my fucking post, I have labelled the government polarising as well, not just you lot. And B) - I'm talking about the people on this sub specifically, not the 65% of the population who didn't vote for BJP, stop getting your panties in a bunch. ",2016-12-19 21:11:25
347,"Delhi police under modi.

And this sub currently loves modi. So incoming on modi",2016-12-19 21:14:50
348,"If Modi wakes up and sees his shadow, then demonization of new bills happens all over again. ",2016-12-19 21:16:02
349,"

&gt;Are you aware there was a BJP before Modi? I'm talking about how BJP became a national level player. Or do you think there was no right-wing movement before 2014? 

BJP wasn't a national level player before 2014? Kuch bhi? And why do you think this was a right wing movement over anti-Congress/pro-Modi movement? 


&gt;Oh for fucks sake, A) - nowhere in my statement have I defended BJP's actions, I support them on some issues and disagree on some, but I suppose if I criticise you randians I'm a BJP supporter bhakt yadda yadda right? Read my fucking post, I have labelled the government polarising as well, not just you lot. 


You're the one labelling all the randians as morons for thinking this is a right wing movement or whatever, and criticising them for nonsense. Regardless when did I refer to you as a bhakt? I'm just referring to the what political party supporters do not want any discussions in this country. 

&gt;And B) - I'm talking about the people on this sub specifically, not the 65% of the population who didn't vote for BJP, stop getting your panties in a bunch.  

There are plenty of BJP supporters on this sub, who know and realise that the 'right wing movement' in the west is not comparable to the rise of BJP in India. 
",2016-12-19 21:21:15
350,TOI working over time to be anti modi or anti government,2016-12-19 21:47:49
351,"Many dont believe it is all for nothing and I happen to agree. Corruption has been dragging our economy down for so long and if we dont remove it before the demographic boom, we might not get another chance. My issue is only with two things. 1. Shitty execution 2. Availability of loopholes for political parties and not cracking down on Gold and land.

Don't mistake my intent, I do sympathize with you. My parents back home as well as grandparents had difficulties and I can see how it could have been bad for many others who were had a time pressure to get their hand on cash for things like weddings and hospital bills. But I don't think that could have been avoided in a move so drastic. Many point to western economists saying this could drag our economy down for years to come, that is such BS. Even they know it, they are uncertain just like everyone else. Capitalism will always have correction like the financial crisis and this is a forced correction before there is a crisis. Nominal growth would hold or fall a little while the inflation lowers to a larger extent and the effects of this will be felt years down the line if only the modi govt follows through with further reforms.",2016-12-19 21:53:38
352,"But let's all blame Modi, anyway.",2016-12-19 22:01:07
353,"**New Income Tax slabs the government is now mulling over**

___

*In a proposed revision, the Income Tax slab is likely to be increased from a minimum of Rs 2.5 lakh per annum to Rs 4 lakh*

___

[IMAGE 1](http://media2.intoday.in/indiatoday/images/stories/money4_647_110915035636_121916064415.jpg)

___

The Income Tax base slab is likely to be increased from a minimum of Rs 2.5 lakh per annum to Rs 4 lakh, sources from the Finance Ministry told India Today. 

The Income Tax base slab is likely to be increased from a minimum of Rs 2.5 lakh per annum to Rs 4 lakh, sources from the Finance Ministry told India Today. The move is being seen as 

[IMAGE](http://media2.intoday.in/indiatoday/images/stories/modi_042215023911.jpg)

Narendra Modi government's efforts to ease the pain following his decision to ban old Rs 500 and Rs 1000 notes, leading to economic slowdown and insecurities.It is expected that a formal announcement on revised tax slabs will be made by the government before the dates for the crucial Uttar Pradesh election are announced. 

It is expected that a formal announcement on revised tax slabs will be made by the government before the dates for the crucial Uttar Pradesh election are announced. Meanwhile, government spokesman Frank Noronha has rejected the report about new income tax slabs. He went on to term them as 'baseless and unfounded'.Also read: BJP welcomes Election Commission's efforts to rid parties of black money: PM Narendra Modi

___

^Version ^: ^0.6a ^| [^Changelog](https://www.reddit.com/r/anti_anti_adblock/comments/4ssi0u/change_log/)

^Function ^: ^I ^post ^the ^article's ^text ^as ^a ^comment ^if ^the ^website ^is ^adblocker ^unfriendly.

[^I ^accept ^commands!](https://www.reddit.com/r/anti_anti_adblock/comments/4u2iwn/commands_accepted_by_the_bot/)



___

^Rendered ^by ^PROMETHEUS",2016-12-19 22:04:49
354,"Ha ha.. if you had told me that many people would not vote for Modi or BJP, I would have agreed with you. 

But Congress? Clearly shows where your allegiance lies. And it clearly nullified your criticism of BJP or Modi because you are not a common man criticizing the government. You are a congress supporter criticizing BJP. No need for you to be taken seriously, as it is your only job. BJP and Congress supporters criticize each other just for the sake of it and it cannot be considered as valid arguments.

Lastly, not sure how people who value democracy would vote for a dynasty based party known for decades of corruption and also known for imposing Emergency on the nation. What a joke.

Tell me that those people would not vote for BJP. I can agree to an extent. Congress? Good joke.

",2016-12-19 22:09:23
355,"Bar Bar Modi, Hazar bar Modi",2016-12-19 22:16:32
356,"Quora is being run by BJP IT Cell now...have you read the cringe there? 
""Modi is the most hardworking man in the world, he works 16 hrs a day, I'm sure he wouldn't take any decision against the country"" ",2016-12-19 22:29:12
357,"&gt;You are a congress supporter criticizing BJP. No need for you to be taken seriously, as it is your only job. BJP and Congress supporters criticize each other just for the sake of it and it cannot be considered as valid arguments

Don't care what you think of me or my opinion. I have never voted for Congress.

Wait till 2019 and see it happen. Till then all Modi supporters can continue to live in denial. Remember Delhi and Bihar? 

The party which has the best chance to defeat Modi will get my vote. Currently, it's Congress. If it's Third Front, I will happily vote for the Third Front. Anyone but Modi in 2019",2016-12-19 22:42:24
358,I went from someone who was neutral about Modi (and hates Congress) to a vehement opposer. What a mess he has created.,2016-12-19 22:47:40
359,"But if you keep calling them racists due to political opinion it only makes them emotionally attached to that. 

I see that happening in India too. Modi was criticized so much by media that many simply saw him as a victim! They still do. ",2016-12-19 23:04:26
360,"This should be read:

[The Demonetisation Announcement Modi Never Made](https://www.newslaundry.com/2016/12/19/the-demonetisation-announcement-modi-never-made)

&gt; Citizens, I have something else to say, something important. Yes, I want to tackle corruption – it is the mandate on which I became your Prime Minister. But would it not be hypocritical of me to trumpet my war against corruption when my own party encourages corruption? I would be a liar and a fraud if I ask you to become honest while I and my party continue to be dishonest. For this reason, effective from tomorrow, the Bharatiya Janata Party shall not accept any cash donations. None. Zero.

&gt; Second, the BJP, irrespective of whether the Congress party follows suit, will come under the ambit of the RTI.

&gt; Third, many of you, much to my embarrassment, continue to remind me of a declaration I had made repeatedly during the 2014 general elections – that a government has no business to be in business. This embarrassment has become more acute especially as I am declaring a war on corruption. How can I accept a huge financial windfall from demonetisation only to then go ahead and waste it on sick public sector units? With what face can I again ask you to believe in me? Therefore, starting tomorrow, I have decided to set in motion the privatisation of 29 public sector undertakings, beginning with Air India and Hotel Ashok.",2016-12-20 00:14:36
361,"Kejri is asking for confrontation. If he would have kept his head down and delivered more such projects, even Modi would have been forced to praise him.",2016-12-20 00:14:58
362,"Yeah that's true. But the dude tweets like trump. His statements are along the lines of ""modi is literally Hitler""

Some calmness and composure would serve him well ",2016-12-20 01:03:49
363,"Biggest PR stunt ever.

And the effect Modi has on common people, it seems he has confirmed his 2019 seat after all.",2016-12-20 01:23:41
