,article,article_date
239,"BJP spokesperson : Look, how this Congress leader took prasad with left hand. Can anyone be more anti Hindu? Vote for BJP.


Meanwhile Bhakts on reddit : taking Prasad with left hand was a Congress own goal. How can they even think of competing against Modi with such complacency.

Meanwhile Modi : Rajasthan has a j and BJP has a j, hence BJP is natural for Rajasthan. 

Bhakhts : Modi is genius. 

",2018-08-14 12:53:12
240,"desi katte.

To someone in the criminal justice business this incident will be funny in hindsight. These idiots are so random and stupid, their weapons also aren't tested.

OTOH, this is as serious as can get. It's not PM Modi who is facing real assassination attempts but ordinary people who criticise him openly.",2018-08-14 13:26:31
241,Narendra Modi is a coward. The coward has not faced a single press conference in the last 4 years despite having massive chest. ,2018-08-14 13:47:32
242,That one tome Modi stood up at the World Economic Forum and said he got 6 *billion* votes. ,2018-08-14 15:30:22
243,"One thing I agree with him is that in this country, tv anchors,  religious clergymen and politicians are creating a sense of fear among people. What I hear about is Hindus vs Muslims or upper caste vs dalits. No one is trying to handle this situation. And now under this current government, suddenly Hindutva has risen among people. 
There was a havan in my house, day before yesterday. A Pandit ji ,explaining power of God, suddenly says that there are floods in Kerala because there are more Muslims there. I mean what kind of logic it is. 

The sad part is there no solution to this situation unless we change those people who are in power. They will keep on dividing us for vote banks. Whether it's Modi or Rahul or someone else, all of them are same creatures with different mask.",2018-08-14 16:24:03
244,"No, Not any other PM can.

For Modiji it's however very easy.

He can take these steps:

1) Announce that criticizing the government is not criticizing the country and whoever mixes these two, including me, has some alternate motive

2) Publicly state that the reporters who lost jobs because they criticized him should be reinstated immediately and that there should not be any punishment for criticizing the government or any  political leader (be it Modi, Shah or Gandhi).

3) Ask Delhi Police to sincerely investigate the shooting on Khalid, and motive behind the shooting. If Delhi Police is incompetent, ask home ministry to hand the inquiry to the CBI

4) Ask partymen and RSS to publicly condemn  the people who threaten reporters such as Ravish Kumar, Abhisar, etc ; Ask home ministry to investigate these people and make sure appropriate legal actions are taken by the government

5) Instead of refusing to send representatives to the anchors and news channels that criticize Modi and his government and only sending to those who favor him and his government, he could send representatives to all or none; this will show that Modi can take criticism and the representative can actually debate about their work in non-biased environment at the best or in unfavorable environment at the least.

6) Publicly condemn the terrorists who give death threats to journalist that criticize the government and rape threats to their female family members including kids. That's the least he can do. Since he is known to mark even the smallest occasion on his social media, posting such on social media wouldn't be such a great deal for social media savvy person like him.


There are many more things he can do if he really wants to. I am sure if he wants to do something, he has access to bright minds who are way smarter than I am and so I am confident that they can advise him on many more things he can do. It's not my job to suggest him, it's his job to get things done, that's why we voted him not so that we can hold his hand when shit gets real.",2018-08-14 17:03:38
245,"
&gt;There was a havan in my house, day before yesterday. A Pandit ji ,explaining power of God, suddenly says that there are floods in Kerala because there are more Muslims there. I mean what kind of logic it is. 

Why do you think he pandit really said that?

1. Because Modi won in 2014

2. Becaue pandit realised that his bigotry and hatred will be well welcomed and appreciated by your family. 

3. Hundreds of years of bad history between communities and people remaining ignorant and poorly educated. 
",2018-08-14 20:12:20
246,"To celebrate 72 years of India's independence, after tomorrow 1$ = 72 rupees.""
 
MA$T3R $TR0K3 BY Modi ji  !!! Libtards won't understand because they hate India and everything that is Hindu",2018-08-14 20:25:54
247,"Because I can't get elected. Because our genius common folks prefer retards like Modi and Rahul Gandhi who will tell them simple stories and short-cut solutions instead of long, complicated, painful reforms.",2018-08-14 20:31:30
248,"&gt;Because our genius common folks prefer assholes like Modi and Rahul Gandhi who will tell them fake simple stories

wow you only know modi and rahul,,,,,looks like you are that common folk",2018-08-14 20:35:35
249,"Frankly, that is the only place in the South that Congress can grow its numbers. People will assault congressmen if they ask for votes in Andhra. No one gives a fuck about Congress in TN. UDF looks strong in Kerala and the recent elections showed Congress bravado in Karnataka needs to be toned down. 

Telangana makes sense but for that they need social engineering. BCs make up most of the state population and with TDP gone who used to own that space, it is a good chance for Congress to grow. to that effect, there has even been a thawing of relations between Congress and TDP but many TDP leaders will not be happy with it. Rahul Gandhi is an idiot who thinks PR will beat Modi.",2018-08-14 20:39:34
250,"There was no attack on him in first place. It seems like a cooked up story by JNU intelligectuals. 


If someone 'like' modi wants to kill a cockroach like him he would be dead already. 
",2018-08-14 21:06:09
251,"Modi will utter some bullshit, Bhakts will try to talk the science behind shit.",2018-08-14 21:22:02
252,"Well if you are interested in Indian Politics just go through some good website which will help you gain knowledge about political parties present there. And we you want an unbiased political review just visit this website i found it wonderfull. 

You can read [Modi Government Review](http://www.politicalbabu.com/modi-government-performance-till-now/) here",2018-08-14 21:34:54
253,"&gt; ***'The falling rupee and failing economy is Modiji’s Independence Day gift to the nation,’*** **the Opposition party said.**

&gt; The Congress on Tuesday criticised the policies of Prime Minister Narendra Modi’s government after the Indian rupee hit a record low, touching 70.08 against the US dollar in early trade. The Opposition party took a jibe at the prime minister by citing Modi’s constant claims that his government would achieve in 60 months what the Congress had failed to accomplish in the “60 years” of its existence as a dominant party in the nation’s politics.

&gt; *“Modiji finally managed to do something that we couldn’t do in 70 years,”* the Congress tweeted.

&gt; Congress President Rahul Gandhi took to Twitter to [rebuke](https://twitter.com/RahulGandhi/status/1029288849162362881) the prime minister and shared a video of Modi criticising the erstwhile Congress-led United Progressive Alliance government for a drop in the rupee’s value in 2013. “The Indian Rupee just gave the Supreme Leader, a vote of no confidence, crashing to a historic low,” Gandhi tweeted.",2018-08-14 22:48:33
254,"I always wondered what was the strategy behind this non-policy. I call it non policy because it only pure PR and nothing else. What came out of it was Swachh bharat cess. 

For government and public, it added zero value. For Modi and BJP it created a lot of PR.",2018-08-14 23:08:14
255,"Before 2014: 

*Weak rupee means weak leader*

In 2017:

*Achually rupee is weak because of external factors and Modi is great.*",2018-08-14 23:11:57
256,"&gt; They are bigots and want the bigotry by fringe groups to continue  &amp; 
They are blind bhakts aren't exclusive.

True Story :

Me to Bhakt : Modi is extremist right winger who is a poor PM &amp; his 5 year tenure showed it.

Bhakt : Who cares ? Muslims &amp; seculars are scared, that's all we care about.

r/thathappened


&gt;2. They think rest are worse than him so lets' vote for him

Many moderates thinks this way. Congress &amp; Opposition parties have proved them right.",2018-08-14 23:20:32
257,Modi knows he cannot win in South. UP is his golden duck and he is simply not willing to give it up.,2018-08-14 23:20:51
258,"http://www.economicsdiscussion.net/money/depreciation/depreciation-of-rupee-in-2013-causes-measures-and-other-details/10871

Why rupee fell in 2013.

""The country is disappointed today because the government is neither concerned about the economy nor the falling rupee. It is only worried about saving its chair,"" said Narendra Modi, then Gujarat chief minister and a strong contender to the BJP's prime minister candidate.
",2018-08-15 00:09:29
259,"&gt; The crude oil is other major import which causes a large increase in demand for dollars. India imports crude oil for more than 75 per cent of its requirements. 

Despite having one of the lowest fall in crude oil, the Modi government still couldn't stabilise our currency points to their dismal skills. ",2018-08-15 00:22:29
260,"Oh no. Bhagwa brigade strikes again.   
What is happening in modi ji's rule everyone getting lynched. ",2018-08-15 01:05:42
261,"Social Infrastructure should be state sponsored. 

Tbh, in my home town, the KVs are far better than the private school people go for +2

You should actually look at European countries like norway and sweden, and sweden is socialist.

That our RTE has not been properly implemented is because of lack of political will

PSB meant public sector bank

Jindal has been failing for quite sometime. It is alive only coz of lobby. You can find out. A famous PSB in india is now all in NPA coz of Jindal. Consortium can't take action coz political lobby.

OOP or out of pocket expenditure in India is pretty high, given pvt sector recklessly charges healthcare. Even this Right wing govt accepted it. There's a lot of grey. 

And regarding your accusations of public excheqyer, ahem vijay malya ahem, ahem chanda kochar ahem, nirav modi (coughs laughing....)",2018-08-15 03:10:06
262,Only way is to vote Modi Jee out ,2018-08-15 03:27:57
263,"Man lengths people go to save this jackass Modi is just unbelievable.

Really? So we are one of the worst and you are saying no but they are even worse


Like wtf!",2018-08-15 03:53:44
264,"Indian Independence Day is that 1996 movie when aliens try to attack India and specifically Indian Parliament, but stop when they realize that Indians are doing a very good job of it themselves.  The mothership hovers over the Prime Ministers' house (Lok Kalyan Marg) and is about to destroy it with a beam of intense energy, when Narendra Modi climbs to the roof and places his metal cow statue at the center of it, in an effort to ward them off with its religious power.  The beam hits the cow, which absorbs all the energy and heats it, giving it an intense glow.  The aliens, confused, leave...leading Narendra Modi to have renewed strength and faith in the Gaumata (Cow Mother), accepting the victory as a sign of his divine right to rule, and thus pushing his religious agendas even further.  The world congratulates Modi for saving it, with governments donating vast sums of money for India's urban development.  But predictably, the politicians hoard most of it and only give token amounts to public spending.  Also, the Indian RAW (Research and Analysis Wing, similar to the western Secret Service) discovers at this time that during the recent attack, the alien mothership had secretly deployed dozens of shape-shifting aliens in India, to learn more about human life.  This leads to the formation of the MIB (Men in Bhakts) - where RAW agents pose as religious and devotional leaders so they can spy on accused aliens unsuspectingly.  This leads to a spinoff movie where special agents Jai and Kher are tasked with locating and incapacitating the aliens, using top secret, government-researched poojas and mantras, 'blinding' them with their religious zeal and thus overriding their memory.

Starring Saif Goldbhum, Dil Smith, Directed by Rohan Amrit",2018-08-15 04:25:05
265,"""Har har Modi, Ghar ghar Modi"" indeed ",2018-08-15 07:38:00
266,"Wah Modi Ji, wah@",2018-08-15 07:51:41
267,"Title doesn't say one of the worst, it says worst performing.
How much you hate Modi, this is a global trend. Every major currency has dropped its value.
I can get my buthole lubed so that mudiji can buttfuk me. 
You are no better than sanghis, can't handle a different opinion",2018-08-15 08:11:00
268,Rahul hugged Modi. What else do you want? He abused Modi physically.,2018-08-15 09:29:52
269,"About time.    

But what's the deal with Modi and setting the year 2022 as the deadline for everything?     ",2018-08-15 10:00:11
270,Fascist against fascist. Congress is down in the drains because of their own follies. Nothing can save India from modi for next 5 years atleast. ,2018-08-15 10:58:44
271,"word of ISRO over me, fair enough.

word of Modi over me? why you gotta hurt me like that. You are one brutal person.

Also i'm just theorizing.    ",2018-08-15 11:29:16
272,I don't like Modi either but I think just by being Prime Minister definitely guarantees him some solid credibility even though he often doesn't deliver,2018-08-15 11:32:57
273,"Hey for foul language, not in a good mood. 
Still, solely blaming/not-blaming Modi is not justified.
I am a minority, why would I support BJP",2018-08-15 12:36:11
274,Modi will go to space after exhausting every single country on the face of earth. Jai hind.,2018-08-15 12:54:29
275,The moon was not mentioned in the speech. Modi only said manned space mission.,2018-08-15 13:20:09
276,Let Respected Modi ji say that same thing instead of getting his power minister post fake NASA images of electrification,2018-08-15 13:23:05
277,"Excerpts from the article.

*""The behavior of sections of the Indian media over the past few decades has an eerie similarity to the behavior of Der Stürmer and Kangura in the run-up to violence, ethnic killings, and genocide. The sinister parallels were evident in the 2002 Gujarat. A study by PUCL in 2002 found that two vernacular newspapers – in particular, Gujarat Samachar and Sandesh – ran false stories, fabricated sensational headlines with the intention to “provoke, communalize and terrorize people”, which incited and encouraged Hindus to kill Muslims. ""*

*""Instead, the then Gujarat chief minister, Narendra Modi openly praised Sandesh for its work. During the course of events leading up to the Gujarat carnage and in its aftermath, the circulation of Sandesh rose considerably due to its pro-Hindutva stand.""*

*""French historian Jean-Pierre Chrétien describes the behavior by journalists in inciting hatred and violence as ‘the democratic alibi’. A democratic alibi divorces the question of ethics from the political and employs the mechanisms of mass conditioning and mobilization required to create group hatred""*

*""All the ingredients for conditioning a democratic alibi that existed in Nazi Germany and Rwanda exist in India today.""*",2018-08-16 13:20:57
278,Ghanta the stooge govt did a Modi turn in High Court,2018-08-15 13:37:12
279,"No they didn't pass. They did a Modi turn and said that the ""unofficial"" ban is still inplace",2018-08-15 13:37:38
280,"This this is the reason, it's effecting a lot of currencies, nothing to do with Modi or any party. 
Of course this sub will eat this shit up as it fits their agenda.",2018-08-15 13:42:44
281,"If ISRO is successful and Modi Kaka still at power, I bet it would be glorified on one of the Indian currency.",2018-08-15 13:49:49
282,"If ISRO is successful and Modi Kaka still at power, I bet it would be glorified on one of the Indian currency notes.

",2018-08-15 13:59:34
283,Modi knows how to change the country. Swacch Bharat was is the most important campaign which the country needed but never really pushed before. It has increased understanding between people. ,2018-08-15 14:08:13
284,Modi said India will eradicate tuberculosis by 2025. I don't trust any word coming out of the mouth of an Indian politician. I'll believe it when some ISRO official confirms it.,2018-08-15 14:12:07
285,Literally anybody. If a person does nothing. He/she would be better than Modi. Fucker is only dragging us down. And his chamchas think he's the greatest thing to happen to India ,2018-08-15 15:06:03
286,Apparently this was news in 2009. Modi is just jumping on the train now and they just updated the news from then. He's shameless. ,2018-08-15 15:07:29
287,"&gt;None. As there is no emergency, no one is forcing them to bend. 

Looks like you missed this story. For your perusal:
https://thewire.in/media/punya-prasun-bajpai-abp-news-narendra-modi

&gt; The thousands of crore, the government spends on advertisement is the bribe these editors and journalists live on, like leeches. 

1. Not every govt is PR driven like the current one, so they don't usually spend a billion dollars in ads
2. Govt ads are only one of a news paper's revenue streams
3. In the days of online news, I don't think govt ads have any impact

&gt;The model creates opportunity for some sharper tools to shill for the party which isn't in power, but once was and will be in future, in centre or in some state.

You are saying businesses are choosing to forego imminent revenues for the possibility of revenues in some uncertain future date. Wah ribiy-ji wah! You should apply for the chief economic advisor's post that has just opened up, surely the govt needs more talent like you.




",2018-08-15 15:46:13
288,"You keep going on about ""editors are just editing"", ""cartoonist doesn't get carte blanche"". No one is saying a contributor gets carte blanche to print ""whatever he wants"", that's just a straw man. 
No one here has disputed the editor's right to publish or not publish Acharya's cartoons; a particular bias has been alleged and therefore highlighted. 

Acharya has specifically, in his post, pointed to instances wherein the editors previously asked that a generic BJP figure, not Modi, be featured in his cartoons. This is in keeping with a similar direction made to other media outlets, evidenced in the ABP resignations episode, which is why Acharya's claims have garnered attention. It points to a pattern of behaviour. 

The idiotic, stupid thing (since you casually tossed in those insults in your apologia of a response) is to pretend that people are objecting to editors 'editing'. No one is. People are pointing to an alleged bias.",2018-08-15 16:22:05
289,"I think another crucial point missed, is that for ambitious individuals from the lower economic strata it is hard to get business loans all due to checks and balances put in. Place to prevent after the mallya, choksi, modi scandals",2018-08-15 16:36:14
290,"They also get free ad time (Ramdev's yoga shit) on DD and land at reduced prices coz connections.

https://m.huffingtonpost.in/2017/05/24/how-baba-ramdevs-business-has-boomed-since-modi-came-to-power_a_22106711/",2018-08-15 17:20:08
291," RSS/Modi
 ○ 
く|)へ
    〉 
 ￣￣┗┓             Logic
 　 　   ┗┓　     ヾ○ｼ
  　　        ┗┓   ヘ/ 
 　                ┗┓ノ 
　 　 　 　 　   ┗┓",2018-08-15 17:30:01
292,"Indians have One Enemy, it's name is MODI.",2018-08-15 17:31:40
293,"&gt; Modi knows how to change the country.

To make it more profitable for hi close friends.",2018-08-15 17:56:16
294,Hum sabka baap modi.,2018-08-15 18:11:07
295,"The accommodation is given to them as a courtesy. That is not corruption.  Oh and if it is, why didn’t Modi who is oh-so-anticorrupt remove them?",2018-08-15 18:42:04
296,"Interesting! If you want to quote from an article do quote accurately:
&gt;
First they rejected a cartoon showing a cow, saying, “The editor is not too happy with the cartoon with cow.”
For a cartoon on lynching I received this message: “There’s a bit of an issue. India Today Group has decided not to come out with any community-based cartoons.”
For one cartoon on Prime Minister Narendra Modi, they asked if I could “replace Modi’s character with any general BJP character”.
And then, “Editor is not comfortable with Muslim angle in the cartoon.”
And, “Editor didn’t like the demonetisation link with 100% electrification.”
&gt;Does all of these fall in line with your narrative of forced idealogical bias? 

Yes. If you can't see it, too bad. It actually becomes clear from this that Acharya wasn't simply ""slapping Modi's face in front of every crack in the pavement"". Anyway, since you don't seem to know the difference between a cartoonist and a cook, carry on. ",2018-08-15 19:40:25
297,Because Modi media does not want to cover a state which doesn’t vote for him.,2018-08-15 19:57:10
298,"Modi just rambled an ill thought speech? 


*colour me shocked*",2018-08-15 20:03:47
299,Modi turn is U turn right?,2018-08-15 20:31:39
300,"&gt; Have To Free Country From Disgusting Mentality Of Rape, As Long As it Not a BJP Politician, Says PM Modi

FTFY

",2018-08-15 21:30:09
301,So? Even if there is 1 rapist politician in BJP should Modi Ji not practice what he preaches in his speeches? Or is this also a *jumla*?,2018-08-15 21:33:43
302,"True.

&gt; However, even for a print journalist it gets tiresome to dodge the truthful mentions again and again and as a reporter who has always been critical of the establishment, whether the Congress, the BJP or the Shiv Sena, the current atmosphere of fear does curtail one’s freedom somewhat.

&gt; To that extent, I must appreciate and place on record, the Shiv Sena’s indulgence of reporters even at a time they ran terror in Mumbai. The party did attack journalists who were critical of Bal Thackeray but **Thackeray himself could distinguish between those who were genuinely critical of his ideology and those who had a vested interest in showing him down**. He called them “supari journalists” - those who were paid by his rivals to run him down - and thought nothing of putting suparis out on them. Even so, no one got killed, only beaten up by his goons. **At the height of his powers, Mumbai was never a city where journalists had to look over their shoulders for taking him on.**

&gt; But that was also because those journalists taking him on had never taken any favours from him or the Shiv Sena. Those who had knew they had to maintain a discreet silence.

&gt; But, as is apparent from leading journalist Karan Thapar’s desperate struggle to get BJP spokespersons on his show, much of the journalism in the national capital is about one’s access to the ruling dispensation. That is why, in LK Advani’s infamous words, even during Emergency, when the journalists were asked to bend, they crawled.

&gt; **Now they are not even being asked to crawl but prefer to prostate before the authorities anyway because of all their irons are in the government fire and of course, Modi has mastered the art of squeezing all those who may need licences (as television does), something he had perfected in Gujarat vis-à-vis both media and industry.**

&gt; The crowd-funded digital space is today often the most courageous news space in India. You don’t need government largesse, you don’t have to bend over backwards. **Only technology, then, can rescue our democracy.**

[Source](https://www.nationalheraldindia.com/opinion/modi-govt-dictates-news-to-fly-under-the-radar)",2018-08-15 21:35:36
303,Modi and TN Government are playing a very dangerous game.,2018-08-15 22:48:28
304,Couple that with Reddit also. r/India never showed attention towards this catastrophe unlike it's hate boner towards Modi.,2018-08-15 22:57:52
305,"Not Modi, It is TN fault",2018-08-15 23:33:43
306,Modi Model,2018-08-16 01:45:03
307,Look man.. Modi can try all these shenanigans but in the end he's going to fall back on communal shit that's all he's really all about.,2018-08-16 01:55:56
308,"This chutiya doesn't even know how to salute the Flag, he is turning around and saluting his cadre! So shameful.     
I remember when Hamid Ansari did not salute the flag following protocol and Modi (ignorant cunt that he is) did because he did not know the protocol and how the ex VP was hounded on social media. All the RSS cadre have problems with protocol because they have never hoisted the flag in their sorry lives in the Shakas.      
  
The BJP/RSS and their fake fucking nationalism will be the demise of India. ",2018-08-16 03:14:53
309,"This ritual of shooting an arrow at Ravana is symbolic of burai par achhai ki jeet (victory of good over evil) but Modi won't have that, instead what he did symbolises that he will destroy the weapons of achhai before they can reach burai.",2018-08-16 06:43:04
310,Plesse do that. Petty BJP and Modi has ensured that media covers Kerala crisis as less as possible,2018-08-16 08:32:49
311,"Arey TN people are pettier than Modi

They are like 5 yr old kids who don't want to share chocolates and don't want your help and yet have strong opinions on everything",2018-08-16 09:57:31
