,article,article_date
353,"That is the point of the article. Its not party-agnostic because the nauseating disinformation campaign launched by the media is not party-agnostic. 

I have been a Modi supporter before the elections but I feel their govt. is a big let down. However, the media is just fixated upon playing up the communal angle and spreading disinformation to actually focus on policies/issues that really matter and BJP is fucking up.

I never used to trust these foreign funding conspiracy theories floated by the BJP, but after the kind of blatant lieing NDTV and their ilk are resorting, I cannot help but agree that there is some truth in those statements. These christian missionaries and their funding has a clear agenda and this agenda is no good for India.
",2015-04-02 18:12:23
354,what will you vote for? 100 duck sized Modi ji or one horse sized RaGa?,2015-04-02 18:17:52
355,"swatch bharat abhiyaan

har har modi nepal main bhi modi",2015-04-02 18:18:47
356,Can i get 1 horse-sized Modi? ,2015-04-02 18:23:12
357,laal. Har har Modi?,2015-04-02 18:36:26
358,"&gt; Right wingers who admire Singapore and Lee Kuan Yew might be interested to know that in Singapore there are laws mandating that people from all communities are represented proportional to their population in govt housing. He firmly believed that taking everybody along was crucial to development.

A little bit of context to why the EIP (Ethnic Integration Policy) in HDB (Housing Development Boards) was taken up first introduced in 1989. 

In the 1960s, Singapore saw incidents of riots between Malays and Chinese - the foremost one being the [1964 riots](http://en.wikipedia.org/wiki/1964_race_riots_in_Singapore). Singapore was a part of Malaysia then. Tensions continued even after Singapore was separated from Malaysia, a year later, until the 70s. Post that Singapore was largely riot and (public) tension free. However, by the end of 1980s a trend emerged in the housing block allocations. People started living in Ghettos with *their* community/race. For example, between September 1987-1988; in the [Bedok](http://en.wikipedia.org/wiki/Bedok)/[Tampines](http://en.wikipedia.org/wiki/Tampines) zone 55% applicants for resale of HDB flats were Malays. In the same neighborhood, the population of Malays exceeded 30%. Similarly, the [Hougang](http://en.wikipedia.org/wiki/Hougang) area consisted of 90% Chinese population. The Singapore govt and the then Minister of National Development - [Dhanabalan](http://en.wikipedia.org/wiki/S._Dhanabalan) - were alarmed at this *ghetto* mentality and stepped in to curb it (or ""nip it in the bud"" as Dhana said). The EIP suggests that if a block or neighborhood exceeds a preset racial limit then flats in that block/neighborhood can't be sold to the race. For example, if the HDB neighborhood was set a limit of 84% to Chinese - the moment the limit is crossed new flats couldn't be sold to the Chinese. These preset limits are revised every few years as and when required.


&gt; So if Modi wants to learn lessons from Singapore , I'd suggest that this would be a good start.

Modi has already moved in the opposite direction. Read up on the Gujarat Disturbed Areas, Act which prohibits the sale of properties in areas which are marked by the government as ""disturbed"". 40% of Ahmedabad comes as ""disturbed"" apparently. Most Muslim dominated ghettos like Juhupura come under this act making it really difficult for a minority to [sell property or engage in real estate transactions](http://timesofindia.indiatimes.com/city/ahmedabad/Saffron-brigade-halts-Muslim-realty-deals-in-Gujarat/articleshow/11907061.cms). In Vadodara, this has been [extended till 2019](http://www.business-standard.com/article/pti-stories/disturbed-areas-act-extended-in-vadodara-till-2019-114100101416_1.html). I think 751 areas are under this act and overall has just led to the formation of more ghettos.
",2015-04-02 19:06:02
359,Yup that's what I was implying. Modi is no Lee Kuan Yew. He is in fact encouraging ghettos.,2015-04-02 19:18:26
360,"Yeah, I hate to make stories, but did he create the name after modi beautiful 'kutte ka bacha' remark?",2015-04-02 19:19:51
361,"I am always torn about LKY - one one hand he was surely authoritarian but on the other he was pragmatic and he got the results. One could argue that he was authoritarian because he was pragmatic.

The best part about LKY for me personally was that we was willing to change. He never envisaged Singapore to be separate from Malaysia and when it didn't go his way- took it on his chin and went ahead *with his job*. Another example would be Casinos in Singapore - *Gambling is not in our culture* to outgrossing the entire Las Vegas strip within 3 years of 2 casino launches.

I remember an article by Ed Smith on Cricinfo who once wrote an article about cricket captains. He basically said that there are no good/captains - there is a captain for the right time. Overwhelmingly, I believe the same to be true about political leaders as well - LKY or Modi.",2015-04-02 19:33:12
362,"&gt; My thought here is that in the Modi era, foreign policy has been a lot more nuanced, India has engaged with its neighbours, including some of the smaller countries. The country has been assertive as well with steps that have clearly worked positively.
&gt; 
&gt; The Modi govt was also a lot more silent vis-a-vis the media with a head down, work approach in a ""media doesn't like me anyway"" approach. In the absence of a PMO spokesperson and no set policy announcement focal point from the govt, Akbaruddin became the quasi de facto spokesperson

I think that nails it. ",2015-04-02 21:19:24
363,"Why the hell isn't the time right? Its never the tight time for science, technology or sports. Always some activist screaming feed-the-starving.

Do it, I say. Make us proud. Despite everything. And know modi, if he can recycle his suit, he'll fins good after use for his stadium.

Ussi mai navratri hoga. Large scale. #iPredict.",2015-04-02 21:48:00
364,"When this stuff happens to the BJP, the supporters say 'so MPs can't have other jobs'. When it's Congress or someone opposing BJP (everybody else), they'll argue to death about conflict of interest for anybody even remotely related to them. Vah, Modi gand mare ja rha hai sbki aur ye has rhe hai. Ise kehte hain apni hi gand mein danda leke dusron pe hasna",2015-04-02 22:08:56
365,"Simply put, Modi betrayed India's economic right. His slogan ""Maximum governance, Minimum government"" is bull shit. Modi stands for maximum government, though he is doing a far better job than most and a lot of good should come out of it.

My big hopes were structural reforms which are critical for altering the growth trajectory, and to date Modi has little to show for it. There are no large scale disinvestment plans. There is no large scale reduction of govt. strangulation of key sectors like education and health. There has been no  big taxation reforms and reduction of profilgate public spending. There have been no mega infrastructure plans.",2015-04-02 22:12:22
366,"That's not true essence, it *is* Indian democracy. What Modi did was actively fool the people into thinking it's a presidential election because he knows the amount of incompetence BJP is automatically associated with. People are finding out the hard way now. Fool me once, I guess.",2015-04-02 22:13:14
367,"Lmao. As if trampling in people's constitutional freedom of movement wasn't enough, dear leader is now gunning for the internet.Anyways supreme court will strike it down and then Ravi Shankar Prasad will stroke dear leader's dong by saying "" full credit to modi.""BJP congress tmc sp shiv sena all in the same boat. Any other party which has lent support to censorship on the internet?P.s: The govt also filed a review petition against the supreme court order on jat quota. But this is nationalistic vote bank. Sp and tmc's politics is of anti national vote bank.",2015-04-02 22:22:27
368,The modi govt should have never appointed him in the first place. But most probably he paid a huge kickback to be allowed onto the committee.,2015-04-02 22:30:44
369,"I'm not supporting it. I'm just saying I understand where that fear comes from. Personally these people are probably speaking from the CWG experience which was a bureaucratic failure on all fronts. If it happens in India, especially Gujarat you can be sure Modi will personally keep track of all movements. People on this subreddit have no idea the kind of hardass Modi is. ",2015-04-02 22:48:25
370,"If RBI starts using Indian paper , it would save a lot of money . I wish they go on with this proposal . There were talks about it earlier too . [It would be better as 40 per cent of the cost goes towards import of paper and ink.](http://www.dnaindia.com/money/report-rbi-should-use-indian-paper-ink-to-print-currency-modi-2074081)",2015-04-02 22:53:24
371,Chutiye hain sale. Only if Modi could see the public shaped slap on Atal's ass from 2004. ,2015-04-02 22:57:16
372,"I was anti modi during the elections and before the elections,


But I now think that this man is gold, a true leader.

Look at his dialogue when he celebrated richness of poor and poorness of rich, on successful opening of crores of bank accounts for poor.


He has a way to establish emotional connection directly with masses like no one has ever done before in India.


And apart from domestic issues, he is a great foreign policy player too.


I think what he is more interested in doing is, making business doing easy from the core, rather than simply looking at foreign companies to come with innovative solutions to do successful business in India(which UPA was doing)

This approach will surely make sure that more India based(&amp; owned) companies grow up rather than India being dominated by foreign companies ..


Go Modi.",2015-04-02 23:04:22
373,"bhenhod amit shah , bc fuck Jaitely and Gadkari. Also.. fuck Azam Khan, Mulayam singh yadav and Smriti Irani. Honorable Mention: FUCK MODI

 #Mauka",2015-04-02 23:39:59
374,"This kind of shaming is so good.


At least 80 Mbps average speed is needed to make India proud.

Go modi.",2015-04-02 23:56:29
375,"I think with a majority in parliament they will be able to implement reforms much more easily. Global economic conditions now are much better, so the indian economy *should* improve. It's hard to say how much Modi himself will be able to influence budgets. Typically the indian bureacracy has a huge amount of say in economic policy, as does the RBI which is mostly independant from the govt.

The ""gujarat model"" is not something the BJP will implement on a national level any time soon, by the looks of it.

But the electoral reality in India is that the prosperity of poor people (the majority) is everything. If the cost of living for poor people goes up even slightly, anti-incumbency kicks in. This is something BJP always worries about.

In Western countries the whole right vs left economics thing makes sense because the poor is a minority. On the other hand in India the poor is the very vast majority. There will always be huge amounts of social welfare and big government for the forseeable future.",2015-04-03 00:22:18
376,"MUJHE MODI JI KE SAATH BUTT STUFF KARNA HAI

HE IS THE MAN INDIA DESERVES ",2015-04-03 00:40:17
377,"The beef ban isn't MSM sensationalizing though, as is the dramatically increased censorship BS. It is only natural that when a center-right party sympathetic to hindutva comes to power, the far-right will get emboldened. It is the duty of government to reign them in. So far, it is clear that Modi could do more.

Yogi Adityanath and the assorted bunch of sadhvis really need to shut the fuck up.

In a poor country like India religious fanaticism is very real, and it's not just muslims who do it.",2015-04-03 01:00:42
378,"&gt;What is it with hard core BJP supporter's failure of understanding conflict of interest?

I get that you don't like BJP. You are free to not like it. You are free to sound sensible and mask yourself into not liking BJP for their good work under Modi.

The MP in question did not say thing wrong actually. If you analyze what he said, he said, if there was an indian study then, yes it would make sense to ban tobacco products because the ban is implemented by GOI which cannot act on reports by other countries' agencies. I mean would other countries act on indian agencies' reports about generic things?

For eg., in the Us, unless there is a US based report, they did not ban leaded gasoline. Even that took an eternity!",2015-04-03 01:37:00
379,"You've mistaken government with sound, reliable institutions. Small government does not mean anarchy, nor does it exclude the need for the government to establish credible institutions. Those institutions while a part of the government can provide little governance, but at the same time provide a ubiquitous platform due to its reliability, which would seem like big government. From the looks of it all Modi government is doing so far is trying to establish strong, reliable institutions that people can use to their own advantage. 

Furthermore small government in totality would be disastrous in India, especially considering the poverty. The government needs to direct its efforts accurately, and address isolated, disparate, and varied issues that adversely effect the bottom 80% of the people. This while does require a certain amount of government interference, and therefore ""strong"" government, can only be addressed by establishing reliable institutions, and disbanding/using the authority of the government to dissolve corrupt practices within the government, and in external institution by auditing industries, and establishing/enforcing proper regulations. 

I honestly don't know exactly what Modi is doing, but a strong government does not necessarily imply big government. So the idea of ""maximum governance minimum government"" may seem like an oxymoron, but it just means establishing credible institutions that properly proved governance, while the authority of the government, like socializing various sectors, is limited. ",2015-04-03 01:46:56
380,"I love modi ji passion, but every now and then he had a brain fart and come up with silly PR stuff ",2015-04-03 03:41:04
381,Fuck Kejriwal  and AAP and Modi motu too ,2015-04-03 03:55:26
382,Agli baar Modi Sarkaar?,2015-04-03 05:26:08
383,Facts are facts about Jayanti. But if you want to sing praises for Modi...you continue.,2015-04-03 07:01:31
384,Should i believe what India Today Group  says? They are openly biased about Modi and the BJP. Somebody please explain.,2015-04-03 07:42:55
385,"It's the same survery which ranked Modi as best PM, AK as best CM and Akhilesh as 2nd best. 

",2015-04-03 08:40:46
386,"This act is applicable to all institutions equally unless a state has its own regulations in place. This act is not an RTE equivalent in any way; that would have been the RTH act that Congress was contemplating in 2014, and now has been put on the backburner by Modi.

I meant that line for this act, not RTE. RTE is a major fuckup with intentions as fucked up as the consequences, or worse.",2015-04-03 12:06:35
387,oppose the 66a law when not in power... defend the law in SC when in power... and when court nullify the law make a new one with wordings which court cannot edit... zigzagzigazigaaaa.... uturns uturns uturns... this modi govt will make world record of uturns,2015-04-03 12:23:33
388,"Even modi is fair.

Why so much focus on Sonia Gandhi?

If modi was black, I don't think he would be this successful in today's India
",2015-04-03 12:38:24
389,"Black to bohot dur ki baat hai. If modi was a South Indian or from NE India, he would have been lucky to get the PM post.",2015-04-03 12:44:06
390,Wrong question.Are you anti-Modi ?,2015-04-03 14:53:36
391,"no i just believe in that everything is on ""e"" after modi and kejru nowadays

E-tax, e-transportation, e-ration card, e-rikshaw?",2015-04-03 16:32:15
392,"Call Modi.

What is this shit?",2015-04-03 16:49:37
393,"If I had the will, I would actually take up the job of driving you fuckers out of business and then delivering rektage personally to your eds and directors. Until then, I hope Modi does it.

Fuck you cunts. ",2015-04-03 17:22:49
394,"Ya man. OP clearly underestimates how good Modi is at demolishing things. 

/s",2015-04-03 17:30:21
395,Alright The (Not) Hindu reporting negative news for Modi... not interested..,2015-04-03 17:35:16
396,GoI and modi,2015-04-03 17:47:26
397,"&gt;Arvind had told us in June 2014 itself that he had never been part of any organisation where he did not have the final say. When we insisted on the committee system, he told us, “Tell me, which committee should I consult? But I will take the final call.” I told Arvind that even dictators consult people. Every general consults people. But they decide whom to consult and when to consult. In a democracy, there have to be binding consultations. It is [these] that matter. Everybody in the world consults, even murderers. If you bind yourselves to consultations, then it becomes democracy. We still thought that some institutional safeguards could work. We wanted this to survive. Prashant had lost all hope. He was at the edge for the past six months. I kept it dragging. I kept telling Prashant that this is much bigger than you and me. Thousands of people have invested their hope. We cannot let them down.


Where are the liberals expert in writing ""Modi is hitler"" articles off to?",2015-04-03 19:16:43
398,har har modi par kerala main no modi,2015-04-03 19:17:14
399,"Modi's wife is not the Vice President of BJP. Modi's wife is not an MP. Modi's wife isn't even in politics or public life.

The only people who'd regard this a valid comparison are those who really hate Modi and will look for any excuse to attack him. 

Sadly there are indeed a few such people in the comments.",2015-04-03 20:05:54
400,yeh lo haamar 15 lakh jo modi bhaiyaji ne diya tha,2015-04-03 20:45:56
401,"And Punjab was AAP's best showing across the country. 

Kejriwal doesn't care about AAP's strength in Parliament. He seems to believe Modi will be in power for 10 years, he just wants to hold on to Delhi until then.",2015-04-03 20:50:45
402,"sabki gharwapsi hogi, free ration card bhi milega, bol do apne friends se. har har modi ration ke dukaan pe bhi modi",2015-04-03 20:56:05
403,"&gt;The real breaking point came immediately after the Lok Sabha election of 2014 when Arvind wanted to form the government in Delhi. That very evening of results, around 11 pm, we went to his home. Arvind said it is all over, Modi is going to rule for the next 10 years. I told him, “Relax, just have a good sleep. We will talk about it tomorrow morning.” But he kept insisting that we have to form the government somehow. The next morning, he convened a meeting of MLAs. That’s when we realised that it’s serious stuff. 

Interesting. This appears to support the allegations that Kejriwal only quit as Delhi CM in the hope that Modi would not win and he would be able to become PM of a Third Front.

I wish Kejriwal had gone ahead with forming the Delhi government with Congress, because then AAP would have been exposed much earlier.",2015-04-03 21:14:48
404,KEJRWAL AND AAP PARTY SUPPPORT THE RIGHT OF THE MAN TO GET FREE FOOD.HE MUST BE RELEASED IMMEDIATELY OR KEJRIWAL AND AAP WILL CONDUCT DHARNA EVERY DAY IN DELHI. BJP HAS CORRUPTED THE MOTHER AND THE MAN DID ONLY THE RIGHT THING. MODI GOVT MUST PROVIDE FUNDS IMMEDIATELY TO BUILD A CANTEEN FOR THE MAN NOW THAT HE HAS NO MOHTER TO SERVE FOOD. WE ALSO DEMAND FREE WIFI FOR MOTHERLESS MEN,2015-04-03 21:31:23
405,Yogi Adityanath needs to understand politics is not about attracting attention but attracting votes. His quotes attract media attention but take away votes from Modi government.,2015-04-03 21:34:03
406,"Typical butthurt response from PB.

Why the fuck is his father who openly endorsed Kiran Bedi and Ajay Maken still in the party? In any other party he would have been kicked out on his ass.

Note to PB/YY, when your biggest supporters are the BJP/Modi fans, then you are not really in the business of 'principled' politics.

Feel free to start your own 'principled' party, and let's see how far that gets you. Dumb chutiyas who want to ride on the success of other peoples' hard work.

Get back to me when you have spent a night yourself in Tihar. Till then Kejriwal gets my vote.

Fucking slimy asshole.

Edit: Writing open letters and holding press conferences seem to be this guys favourite pastime.",2015-04-03 22:18:14
407,"nidhi shape out hogayi hain, modi bhaiyaji only likes slim and trim yoga bodies",2015-04-03 22:36:46
408,"&gt;Why the fuck is his father who openly endorsed Kiran Bedi and Ajay Maken still in the party? In any other party he would have been kicked out on his ass.

He is one of the founders of the party. He invested 2cr of his money as corpus, which gave the party a start. Suppose, you are a co-founder of a company, and its business is going bad because of another founder, what would you do? would you jump the ship or would you try to save it as long as possible? He endorsed them saying that AK is deviating from the democratic principles which is much worse in his opinion  (seeing a good guy he knew turn into what he is)

&gt;BJP/Modi fans

They wont vote for PB/YoYa, even if they form a separate party. All they were doing is, seeing how the principles and dreams sold by AAP are turning into a farse and enjoying the show. The real backers for PB/YoYa are some of the AAP volunteers and leaders.

&gt;'principled'

This is the damage AK has done by his quest for power and absolute control. an AAP supporter like you quoting the word principle in quotes !

About the Tihar Jail, AK told in the NE meeting that he turned to PB whether to apply for bond or not, and PB nodded to him not to. AK will even go to singsing if he thinks that it will fetch him some votes.(mark of a true politician, and these days its difficult to find such commitment to politics/power  from other leaders)


&gt;Fucking slimy asshole

This hole fought for 2G/Common cause/PILs...so dismissing him as such is unwarranted.
",2015-04-03 22:38:18
409,modi bhaiyaji khanna khila ke patana chathe hain,2015-04-03 22:57:19
410,He's a troll AK bootlicker and Modi hater.,2015-04-03 23:03:09
411,"&gt;Even though the Centre has the authority to quash any action taken by a state government against an IAS officer under the rules governing All India Service officers, the Modi government as well as the new Khattar government in Haryana have taken no measures against the action taken by the previous Congress government against Khemka.

same bottle, same wine. **AcheDIn**",2015-04-03 23:45:33
412,"ITT: People analyzing where AK was right, and what went wrong. Or about PB - what is real motive etc.. Point of the matter is - it doesn't matter. 

AK does NOT want the AAP model, the swaraj model, the ""alternative politics"" - because he knows that will never get him 67/3. AK is after the minority and ""mein gareb hu - mujhe sab free mein chaiye"" vote - which can be attracted very easily by giving freebies, encouraging religion fear and shoot-first-think-later kind (in short drama baazi) politics. ""EVMS tamper ho gaye hain"", ""Modi is Adani agent - isliye price bhada dega"". 


&lt;rant&gt;

In short the ""gareeb aadmi"" mentality - wherein a fucking taxi driver - earning probably much more than a govt. teacher is cribbing ..""kya kar rahi BJP govt. Platform ticket bhada diya"". Idiot, god knows how many times he will go to a station in how many months - but nahi ..""rate increase hua na..matlab ye anti-poor govt. hain. garib aadmi mein ho...."" Saala, you are earning at least a couple of thousand per day (paying zero tax), in big metros, doing more rides because of better roads, more malls, etc.  but you will hate this govt. for that 5 rupees increase in platform ticket.  

&lt;/rant&gt;

I feel this is very bad news for both BJP and even Congress. Irrespective of what you think about either party and irrespective of their corruption levels - the point is do you want them or a megalomanic anarchist as your leader. 

Why am i afraid ? Simple logic. minority vote, Myopic BPL and pseudo-poor (""gareeb aadmi"" mentality) voters (who have no interest in long term development coming from anyone). 

Irrespective of all paralysis by arm-chair analysis that we do here, there is no stopping AK now, when the facade of clean politics has come off. He will not even try that anymore. It will be ALL like his speech at the National Convention. Just pure spite and hatred, targeted at someone. And as many people fell for it, even on this reddit - many many more will in the outside world. 

",2015-04-03 23:46:52
413,modi is hitler...but kejru is apna local stalin...he is already kicking out the trotskyists as we speak...delhi is gonna be stalingrad in about 5-6 years or so,2015-04-03 23:47:34
414,If only Modi Government would use the poop to make methane and get free energy....,2015-04-03 23:54:33
415,"modi bhaiyaji bole jitna ""order order"" krna hai waiter ko kardo",2015-04-04 00:33:51
416,"&gt;He's leader of the seculars now.

This is so true, as only people I see now supporting AAP are either completely disillusioned morons or the ones who have ingrained hate for BJP/Modi. ",2015-04-04 01:40:39
