,article,article_date
122,"I mean I think it's good for the long run if NDA brings BJD into the fold, but you're right; he doesn't have much to bargain with right now. 

Edit: Actually Modi/NDA needs them for RS",2014-06-03 06:05:53
123,"&gt;An 87,000-strong online community, spearheaded by the BJP Communication Cell, will keep a second pair of eyes on governance to ensure implementation of all the promises made in party manifesto.

&gt;The aim to ""Transform India with Narendra Modi"" is not only to act as a pressure group on the government by not just tracking various schemes and their implementation, but also enabling citizens to exchange views and give constructive inputs. 

Modi critics here are free to join.",2014-06-03 07:04:58
124,"I'm going by Modi's 0 tolerance for crime. Also check some of his last few interviews. One of the questions asked was about his friendship with Pawar, and Modi said that they might have ideological differences but they were good friends on a personal basis.",2014-06-03 10:22:12
125,I find it funny how these days Modi critics are clutching the straw of *'BJP only got 31% votes so 70% of India rejected Modi!'* when it's fairly apparent that even those who didn't vote for the BJP generally agreed that Modi was the best choice for PM candidate among all the hopefuls.,2014-06-03 11:10:37
126,BJP may not get the same landslide victory in the next election. They might need coalition partners. Modi is too shrewd to completely dump them.,2014-06-03 11:20:22
127,"This message was being forwarded on Whatsapp - seems interesting

=============

Mr.Anil Bokil, one of the key member of Arthakranti Sansthan was given time to share to PM Modi before recent election. He was given 9min for sharing but Mr.Modi heard him for 2 hrs

Arthakranti Proposal
--

What is Arthakranti Proposal and who hasgiven the proposal?

“Arthakranti Proposal” has been given by a Pune (Maharashtra) based “Arthakranti Sansthan” which is an Economic Advisory body constituted by a group of Chartered Accountants and Engineers. This funda has been patented by the Sansthan

Arthakranti Proposal is an effective and guaranteed solution of Black Money Generation, Price rise and Inflation, Corruption, Fiscal Deficit, Unemployment, Ransom, GDP and industrial growth, terrorism and good governance

What is in the Proposal ?
---
“Arthakranti Proposal has FIVE point of actions simultaneously

(1) Scrap all 56 Taxes including income tax excluding import duty

(2) Recall and scrap high denomination currencies of 1000, 500 and 100 rupees

(3) All high value transaction to be made only through banking system like cheque, DD, online and electronic

(4) Fix limit of cash transaction and no taxing on cash transaction

(5) For Govt. revenue collection introduce single point tax system through banking system – Banking Transaction Tax (2% to 0.7%) on only Credit Amount

Important Points to note:
---
(1) As on today total banking transaction is more than 2.7 lakh crores per day say more than 800 lakh crores annually

(2) Less than 20% transaction is made through banking system as on today and more than 80% transaction made in cash only, which is not traceable

(3) 78% of Indian population spend less than 20/- rupees daily why they need 1000/- rupee note

What will happen if All FIFTY SIX Taxes including income tax scrapped :
---

(1) Salaried people will bring home more money which will increase purchasing power of the family

(2) All commodities including Petrol, Diesel, FMCG will become cheaper by 35% to 52%

(3) No question of Tax evasion so no black money generation

(4) Business sector will get boosted. So self employment

What will happen if 1000/ 500/ 100 Rupees currency notes recalled and scrapped :
---

(1) Corruption through cash will stopped 100%

(2) Black money will be either converted to white or will vanish as billions of 1000/500/100 currency notes hidden in bags without use will become simple pieces of papers

(3) Unaccounted hidden huge cash is skyrocketing the prices of properties, land, houses, jewellery etc and hard earned money is loosing its value; this trend will stop immediately

(4) Kidnapping and ransom, “Supari killing” will stop

(5) Terrorism supported by cash transaction will stop

(6) Cannot buy high value property in cash showing very less registry prices

(7) Circulation of “Fake Currency” will stop because fake currency printing for less value notes will not be viable

What will happen when Banking Transaction Tax (2% to 0.7%) is implemented :
---

(1) As on today if BTT is implemented govt can fetch 800 x 2% = 16 lakh crore where as current taxing system is generating less than 14 lakh crore revenue

(2) When 50% of total transaction will be covered by BTT sizing 2000 to 2500 lakh crores, Govt will need to fix BTT as low as 1% to 0.7% and this will boost again banking transaction many fold

(3) No separate machinery like income tax department will be needed and tax amount will directly deposited in State/Central/District administration account immediately

(4) As transaction tax amount will be very less, public will prefer it instead paying huge amount against directly/indirectly FIFTY SIX taxes

(5) There will be no tax evasion and govt will get huge revenue for development and employment generation

(6) For any special revenue for special projects, govt can slightly raise BTT say from 1% to 1.2% and this 0.2% increase will generate 4,00,000 crores additional fund

Effect if implemented today :
---

(1) Prices of all things will come down

(2) Salaried people will get more cash in hand

(3) Purchasing power of Society will increase

(4) Demand will boost, so will production and industrialisation and ultimately more employment opportunity for youth

(5) Surplus revenue to the govt for effective health/ education/ infrastructure/ security/ social works

(6) Cheaper and easy loans from banks, interest rate will come down

(7) Tendency of society will changes from scarcity to quantity

(8) Spare money for political system for clean politics,

(9) Prices of land/ property will come down,

(10) No need to export beef to cover up trade deficit

(11) Sufficient funds for research and development

(12) Society will be free from “Bad elements”",2014-06-03 11:31:49
128,"The Catholic church has said they have nothing to do with the case against him. It was filed by an organisation that most catholics haven't heard about. Some retarded organisation which decided to climb on the take-offence bandwagon.

Now that Modi is here, they are not likely to proceed. Even if they do, courts are likely to let him go - he has not said anything that can be proved as hurting communal sentiments. Most Christians talk the same way he did anyway, and have the same contempt to these 'miracles'.",2014-06-03 12:07:19
129,"http://ibnlive.in.com/news/extremely-saddened-shocked-by-the-demise-of-gopinath-munde-pm-modi/476329-37-64.html

Multiple news reports both on TV and online say Munde was travelling in an Ambassador. In fact I haven't yet read an article that says it was an SX4.

Agree with the rest. Such safety features should be made compulsory for all cars and not optional or else people will skip them just to save money.",2014-06-03 12:09:17
130,I think Modi became PM just so he could relocate...^hmmm ^smart ^fella ^this ^namo,2014-06-03 13:43:52
131,No this is the result of a few weeks of bhagwan modi. We vill be number one in no time!!,2014-06-03 14:22:20
132,"Pretty much this. When I read the part about making large transactions bank only, in the other thread, the first thing i thought of was, people are just going to use other forms of currency. Foreign, gold, crypto etc... What do you think happens to the rupee then?

Like communism, this is an idea that depends upon people not being smart/selfish, i.e. disconnected from reality.

EDIT - Don't read into the BJP bashing in that link. The author is quite anti-Modi, even if his points make sense.",2014-06-03 14:26:24
133,Modi Power,2014-06-03 14:29:40
134,Ismein Modi kahaan se aa gaya.,2014-06-03 14:37:36
135,"Actually why isn't modi intervening? We have goondaism, people attacked and buses destroyed.",2014-06-03 14:43:46
136,Modi said he will not tolerate any crime.,2014-06-03 15:55:26
137,Modi will save India.  /u/InternetOfficer will save /r/india.,2014-06-03 16:43:16
138,Ah so this is why Modi decided to move his home so far inland.,2014-06-03 17:01:45
139,"Akhilesh Yadav on incident:

&gt;Hurr durr look at me, I'm retarded.

Pappu on incident:

&gt;Rape is a state of mind.

Asaram:

&gt;Usko kaun bola tha judge karne ke liye? Bhaiya bol ke maaf karne ka tha na!

Mullah Mulayam:

&gt;Maaf kar do, galti ho gayi ladkon se. Ab hamara judicial machinery thoda kamzor ho jayega lekin galti to bachchon se hi hoti hai.

Modi:

&gt;Kya aap apni beti ko is haalat mein dekhna chahte hain kabhi? Un gundon ko turant giraftar kar ke kadi se kadi saza milni chahiye.

Maneka:

&gt; Will ensure CBI enquiry if the UP judges want me to.",2014-06-03 17:44:36
140,"what nonsense....this is nothing like /r/iamgoingtohellforthis ..your tolerance levels must be really low

and whats wrong with the tweet...insensitivity is shown for insensitive people.....what about the countless hours of abuse bj party supporters inundate popular people with on twitter? This instill hate? The other one Chari of BJ PArty said it was u ananthamurthy's fault that people were assaulting him and his house for speaking against modi.

In return this is nothing....just a minor jab.",2014-06-03 17:44:45
141,"Some of the comments:

&gt; I demand RESIGNATION of Mr. Narendra Modi as PM as well as MP, all this happening in state from where he is elected as MP. Such a shame.

.
&gt; Please make Azam Khan Chief Minister and all this will stop.",2014-06-03 17:49:59
142,Where they will pay the Modi price. ,2014-06-03 18:00:56
143,"nah,i have found him to be quite courteous the other times i have interacted with him.besides i support modi,so he will not take me to be just another sickular.",2014-06-03 18:42:27
144,"lol this niticentral part 2. 

Started by the same chaddi gang which was the force behind modi campaign - CAG (Citizens for accountable Governance)

Old wine, new bottle. Just like modi sarkaar.",2014-06-03 19:08:15
145,"This.I know lot of people are getting frustrated with no word from Modi sarkaar but I am sure behind those doors in Delhi,there is swift action going on right now.",2014-06-03 19:22:35
146,"So do you want RaGa or AK49 to be the PM.Seriously,what is happening is wrong and action definately needs to be taken and I believe I heard UP split plan by the Modi government being contemplated?

Whatever it is,I don't think the man is ignorant about this situation.",2014-06-03 19:25:11
147,"Something that well and truly infuriates me is how so many 'intellectuals' from India and abroad who abhorred Modi and appealed to the public to vote for 'secular parties' like this are utterly silent about these things.

For example, see documentary filmmaker Anand Patwardhan's Facebook and twitter pages. The only thing he's been writing about for over a week is how Hitler-esque Modi sarkaar is. Meanwhile the rest of India sees the wonders of secular raj in places like UP.",2014-06-03 19:45:26
148,"Only a fool would recommend voting SP or BSP. I don't know which intellectuals and seculars you've seen who support them. 

Also, for god's sake, criticizing Modi does not equate to supporting Akhilesh Yadav.",2014-06-03 19:48:55
149,"http://timesofindia.indiatimes.com/entertainment/hindi/bollywood/Bollywood-votes-for-their-PM/photostory/34148538.cms

*""Undoubtedly, corruption and governance are important issues, but we will have to vigilantly work out ways of holding our government accountable to that. However, one thing is clear: India's secular character is not negotiable! Not now, not ever. As Indian citizens who love our motherland, we appeal to you to vote for the secular party, which is most likely to win in your constituency. Jai Hind! ""*

There are the *exact* words that the Bollywood bunch used. Corruption and shitty governance means jack to them. By 'secular' they meant any party that was not the BJP, including Mulayam's bunch.

And many of these hypocrites are now silent about what's going on in UP these days and spend their days moaning about Modi, BJP and RSS instead.",2014-06-03 20:11:59
150,"All this drama to only end up saying ""shri vadra requires the protection, so we are going to extend it indefinitely"".

It has been made clear now that ""Shri Robert Vadra"" would always be on the green board. Shows the spine of Modi's government


&gt;Mr Vadra was under repeated attack from Narendra Modi

Anybody have a direct quote from a reliable news agency for this? Modi was asked during interviews about vadra several times and each time he copped out with a generic ""I won't take revenge"" rhetoric. ",2014-06-03 20:22:15
151,"Nah, I don't think you're seeing this properly. A lot of people are stupid fucks not worth listening to. You're saying that someone criticized Modi and supported SP, so everyone who criticizes Modi supports SP. 

There's no way to answer that kind of logic.",2014-06-03 20:27:23
152,Hardly anyone is defending him. No double standards. He is one of the old Advani coterie who were begging Modi for Cabinet berths and were denied. This case is probably the reason why he didn't get anything.,2014-06-03 20:42:56
153,"I am not talking about the media. Don't make false equivalences.

I am specifically talking about all the eminent 'intellectuals' who attack Modi 24/7 and wrote to the media, appealed to the public etc. in favour of 'secular' forces. Look at most of their websites, blogs, facebook accounts etc. and they are blissfully isolated from the SP's actions and still just moaning about Modi.

These are our 'eminent' public personalities that are supposed to be role models to influence the common man. Their cheapness and hypocrisy does not bother you at all?",2014-06-03 20:45:44
154,"That 'logic' comes from your warped mind, generalizing on my statements to attack me.

I never said

&gt;everyone who criticizes Modi supports SP.

Though I have no doubt your brain interpreted it thus. I said

&gt;http://timesofindia.indiatimes.com/entertainment/hindi/bollywood/Bollywood-votes-for-their-PM/photostory/34148538.cms

&gt;""Undoubtedly, corruption and governance are important issues, but we will have to vigilantly work out ways of holding our government accountable to that. However, one thing is clear: India's secular character is not negotiable! Not now, not ever. As Indian citizens who love our motherland, we appeal to you to vote for the secular party, which is most likely to win in your constituency. Jai Hind! ""

&gt;There are the exact words that the Bollywood bunch used. Corruption and shitty governance means jack to them. By 'secular' they meant any party that was not the BJP, including Mulayam's bunch.

&gt;And many of these hypocrites are now silent about what's going on in UP these days and spend their days moaning about Modi, BJP and RSS instead.",2014-06-03 20:47:10
155,I hope you are right but every move of govt is being followed by media but there hasn't been anything on this side so far.I just found it weird when Modi said in Delhi to remember gangrapes while voting.He's gone silent now.Although it is understandable that untimely demise of Mr Munde makes it difficult but i really from the bottom of my heart see the rapists get the most strict punishment.,2014-06-03 20:55:11
156,"&gt; Something that well and truly infuriates me is how so many 'intellectuals' from India and abroad who abhorred Modi and appealed to the public to vote for 'secular parties' like this are utterly silent about these things.

And then you cite some Bollywood people as an example of intellectuals. If you don't believe it's true of all/most intellectuals, you shouldn't have said it. And if so, then you agree with my statement that a lot of people shouldn't be paid attention to, they're just fools saying whatever whenever. If your logic isn't what I said it was, you can just explain that, and I'll take it back.

I'm leaving this exchange now. Don't think I want to play circular arguments with you. Call it my 'warped mind'.",2014-06-03 20:57:07
157,"&gt;The 'liberal fascists' 

Stop with the name calling. There have been posts here requesting being called stuff like 'modi bhakt' etc, so if that has to be respected, then please go on and respect others too. 

&gt;They took the most civilised approach and took the legal recourse that's available to them.

&gt;SBAS didn't go break the publisher's office or burn the books

So? You want congratulations on that? We aren't supposed to break into office/burn books etc anyways. You're supposed to be civilized enough not to do it, thats not something to appluad - it's something to be expected.

&gt;If you have a problem with the law, don't blame them for that.

There are plenty of laws in this land open to abuse. The *spirit* of the law is as important as the letter of the law. It is not in the right spirit to go ahead and try to ban books simply because they make you uncomfortable with your world view. What they are doing is legal, but bad in spirit (at least my opinion and of many others it seems - you of course, are free to disagree with it)
",2014-06-03 21:00:40
158,"&gt; And then you cite some Bollywood people as an example of intellectuals.

Many redditors did to justify why Modi is baaad. But then again, warped mind. Amnesia.

The media and public perception does indeed refer to such people as 'intellectuals' even though they're actually a disgrace to the word. Activists(the anti-communal type), filmmakers, assorted leftists etc.",2014-06-03 21:20:33
159,"I am worried by this news item. Every newspaper site and Twitter feed that I read seem to have different versions. 

What kind of car was Munde riding? If the driver of Indica ran a red light, how fast he must be going to create such a severe impact? Why would Munde cheap out on a car?

http://www.dnaindia.com/india/commentary-union-minister-gopinath-munde-dies-in-a-road-accident-in-delhi-pm-modi-calls-it-a-major-blow-to-the-nation-and-the-government-1993139

DNA says that he died of heart attack. However, as per some Twitter feed, his vertebrae broke, had a liver failure and this resulted into cardiac arrest.

Could there be some kind of conspiracy theory?",2014-06-03 21:36:34
160,"I was asking for a direct reference to the quote in my comment; modi attacking vadra.


This vadra frisking issue is a huge red flag. I'll reserve my judgements for a few more weeks to see how this plays out. This is not looking good.",2014-06-03 21:36:37
161,"The anti-Modi endorsement and the erasing of Kashmir is just the tip of the iceberg. A far larger problem is extremely high level of anti-Hindu prejudice at the Economist:

Examples of TE articles with name and publication date:

**1) “Bitter Fruit”, Aug 2008:** Article exercises double standard by calling relatively peaceful J&amp;K's Hindu minority protester “Militant” and aggressive J&amp;K's Muslim Majority protester “Protester”.

**2) “An uphill walk”, Sept 2012:** Amarnath pilgrimage is called “INVASION”.

**3) “Kashmir’s future: Fleeting Chance”, July 2011;”An uphill walk”, Sept 2012, “Bitter Fruit”, Aug 2008:** Amarnath shrine called “penis-shaped lump of ice”.

**4) “Shaking the mountains”, Dec 2010:** Article states that Amarnath pilgrims are unmolested; However, nothing can be further from truth. Amarnath pilgrims were massacred on several occasions. For instance, on August 2nd 2000, 34 pilgrims were murdered by terrorist who attacked makeshift pilgrim tents.

**5) “The Hindu rate of self-deprecation”, April 2011:** The title itself is unjustly anti-hindu. Both,red tape and corruption, are legacy of Nehruvian Socialism (that itself inherited the red-tape of the British Raj aimed at generating more stamp revenue for the Raj) and has nothing to do with Hinduism but Economist does not blame Nehruvian license, quota, permit raj. Instead, it cleverly abuses Hindus.

**6) “In search of a dream”, Sept 2012; “Now finish the job” April 2012; “The Hindu rate of self-deprecation”, April 2011:** Economist refers to India’s socialist era GDP growth rate as “Hindu rate of growth”.



**7) “The Swami’s Curse”, June 2011:** Article indirectly describes Ayurveda and Yoga as quack cures. Personally, I am neither a follower nor a supporter of Baba Ramdev and Lokpal movement but I was shocked by the tone, tenure, bias and foul language of the article.

I dare the Economist to publish an article called ""The Jewish rate of self-deprecation"" or ""The Imam's curse"". Hindus are an easy target because we generally don't react caustically to aspersions on our faith. There are exceptions of course but we are overall a peaceful bunch.

**8) Economist has many articles on Kashmir like Nov. 2010:** “The K Word”. They almost always omits “The P Word” (i.e., indirectly deny/downplay Hindu Pandit Plight). Only once “The P Word” was reluctantly mentioned.

**9) In 2012/2013 year, Economist has many articles on Bangladesh war crime trial &amp; political crisis:** Most articles condemn the war crime trial, attack the evidence, and question eyewitness account. The omissions and commissions, of this articles, indirectly deny/downplay 1971 Hindu Genocide (est. 500,000 to 1,500,000 Hindu civilians killed by the Pakistani Army), and 2012/2013 attacks on Hindus.

**10) Economist has printed many articles about Ayodhya dispute:** Almost all articles omit/suppress entire history and deny archeological evidence. **Example, Oct 2010 article “The uneasy split”** falsely claims that “there is no archaeological evidence to support either belief”; However, nothing can be further from truth. Archeological evidence of Hindu temple is a fact proven beyond reasonable doubt in UP’s high court.

**12) “Witchcraft in Assam Toil and trouble”, April 2012:** Article touts superiority and rationality of Islam and Christianity, dismisses native beliefs as superstition, and omits social reforms carried out by mainstream Hindu organisation like Rama-Krishna mission.

**13) “Shadow of a darker decade”, Aug 2012:** This article is directly and indirectly justifying the latest Muslim violence in Mumbai based on bogus accusations and numbers.Firstly, Economist claimed that ""In 1992,Muslims were targeted by Hindu-nationalist mobs and hundreds were killed"" but, in reality, Islamist, who got angry in wake of demolition at Ayodhya, started targeting Hindus. In first 2 days( January 6 and 7 1992) of rioting, 34 Hindus and 8 Muslims got killed, 138 Hindus and 34 Muslims were injured. On January 8 1992 at 0030 hours, 6 Hindus, including 5 women, residing at Radhabai Chawl were burnt alive. Radhabai Chawl massacre triggered hindu backlash. Official death toll is 900 (575 Muslims, 275 Hindus, 45 unknown and 5 others). Secondly,About 2002 Gujarat riots,. Economist wrote ""2,000 people, most of them Muslims, were killed"" but here are the factual numbers: 790 Muslims and 254 Hindus were killed.

(*) All numbers cited are from official government reports published by Justice SriKrishna Commission for Mumbai, and parliament report for Gujarat.

**14) “Bleak House” , March 2012:** The riots only started after the incident where Muslims burned 59 Hindus in Coach S6 of the Shabarmati Express. The article cleverly tries to blame Hindu victims of Godhra train massacre for their death, indirectly suggests that nearly nil (official number 254) Hindus died in subsequent riots, and exercises double standards.

The Economist stealthily planted a seed of doubt on Godhra verdict, and it keeps alive canards like ""dispute"" and ""accident"". The truth is that there was no major dispute which would spark such a horrific massacre. 

Only an extremely prejudiced media would try to dismiss fire started in the middle of an attack as mere accident, and indirectly absolve Muslim attackers of all responsibility. 

It puts active efforts to not let the readers know that 31 Muslims have been CONVICTED for conspiracy and murder for the premeditated burning of Hindu women and children in the Godhra train attack. This after careful investigations and free &amp; fair trials that have already proven guilt beyond reasonable doubt.


**Brown sepoys can make-up all sorts of bullshit excuses for each of these documented cases of anti-Hindu bias at The Economist (or The Guardian/NYT/BBC for that matter). However, Hinduphobia is the only succinct and parsimonious explanation. Remember Occam's razor.**

",2014-06-03 21:44:34
162,Congrats. Must have googled hard to find those sites. I don't condone them. Nor do I appreciate the pseudo-intelletuals making noise about Modi!Hitler! every day when they can see far worse things like these under the 'secular' governments they seem to prefer.,2014-06-03 22:02:14
163,"Good question! They usually have a bunch of cars floating around them. How did anyone get this close? What does it say about security?

He could have just taken the Metro and saved his life. Maybe that is something Modi could require. Would set an example, and save a lot of money.",2014-06-03 22:04:22
164,I don't want to say this but I do smell some conspiracy here. It looks untimely but it was timed really well by someone. Modi should order investigation on it. It may sound like shit but believe me.. This type of accident and with a cabinet minister? Doesn't look like a co-incident to me. Investigation is needed here.,2014-06-03 22:43:55
