,article,article_date
0,"But if you see Modi and vote for BJP, this is what you get. Similarly, if you see Kejriwal and vote for AAP, you might not get good results.

The country will change, let's start by changing our neighborhood. Quite honestly, its impossible to have a good government. The government will be bad in some field at least. It's impossible to satisfy everybody. xD",2018-02-10 00:27:48
1," &gt;it is way better than BJP



Lost me there.

They keep playing into BJP's hands, Congress never once has taken a higher ground or acted like a more mature party.


And there were multiple so many opportunities where they could have shown people that they are the anti thesis of BJP and endorse a completely opposite ideology.


But BJP stirs up some stupid shit and Congress rather than admonishing it in blasphemous disregard comes up with an even stupider response.



The only way to tackle BJP is to stop attacking Modi and start questioning the govt policies.Because there are a lot of missing links and loopholes there.",2018-02-10 00:36:55
2,"In kejru voice you only should say one thing ""Isme modi ji ka hath hai"", and what a surprise, it works in our current discussion too.",2018-02-10 01:31:47
3,"I see illiterates abusing modi ... Advertisement is really important, if you watch youtube you will know how much modi have uplifted India's image. 4 years ago no one gave a crap about India now everyone just can't stop taking about it. Congress is a big failure if you doubt it I would like to have a debate based on facts and figures.",2018-02-10 01:48:50
4,"I can ask for Secularism done better but I'm pretty confident that Modi is not the man who will give 

I also don't think de-regulating religion will make the country more secular since the religions may turn on each other and diminish regulation. The RSS will capture control of Hinduism, it's the single largest Hindu organization, someone similar will gain control of Islam.

We need state mandated equality at our current stage of development. I don't think reservations are a good way to achieve that - but I know that our society has a tendency to self-segregate the day the state steps out to take a nap.",2018-02-10 01:51:53
5,"In a country like India with so many different faiths, secularism can never be done right. There are just way too many complications there. Instead, let religion be limited to temples, mosques, churches or whatever and not included as part of someone's public life. We need make religion a private affair. Everyone will stop with religion politics if there is nothing to gain from it. All of it will continue to exist as long as people are appeased by the false claims made to them in the name of their religion. Whether it's Modi or Rahul Gandhi, they try to appease all religions and not just one.",2018-02-10 01:59:46
6,"After promising to arrest *damaadji* (Robert Vadra) within months of coming to power, 4 years later all Modi and the *Sanghis* can do is still cast aspersions on the Gandhi family without an iota of proof. Modi did say it right that *kamal mail mein hi khiltha hai* (The Lotus blooms only in mud), and hence the mud slinging ...",2018-02-10 02:05:03
7,"Nehru is a cuck, modi is the greatest leader we've had, ITT is all salty congressi stooges supported and sponsored by the mutt mods of this shitty sub reddit

No matter how much you lament, modi and Hindutva is here to say,and the electoral victory is going to be jizzing in your mouth going forward, all you cucks can go screw themselves.

I'm sure to be banned for this comment, but the ban just exposes the sheer hypocrisy of the paid mod of randia ",2018-02-10 02:17:22
8,"Would pay to see that. ""Modi demands trial by combat"".",2018-02-10 05:28:59
9,Modi and Shah are actively dividing the country. ,2018-02-10 05:39:01
10,"Call it what you want.

Like OP, I'd rather take an banana/orange up my ass than support Modi. Changing its name does not change the lenghts to which OP and me are willing to stretch the ~~truth~~ ass.",2018-02-10 06:12:54
11,Modi model.,2018-02-10 06:45:14
12,I am no fan of BJP but I didn't find anything sexist in the way Modi replied to Renuka's laughter.,2018-02-10 07:43:09
13,"We are asking for the cost not full details of avionic, radars &amp; weapons system ffs. 

Modi invited ISI to Pathankot , he doesn't give a fuck about national security.

",2018-02-10 08:02:41
14,"Moreover, when Nehru went to jail, he did not know that one day he would become the PM, or even if India will become free in his lifetime.

For all he knew, he could have died in some ""lathi charge"", or died of some disease in jail.

*Nehru was willing to sacrifice himself for the nation. Modi is willing to sacrifice the nation for his glory*. He brags about 56"", but isn't half the man Nehru was.",2018-02-10 08:35:49
15,"^This ^article ^is ^adblocker ^unfriendly, ^following ^is ^the ^text ^of ^the ^article. 

 ______ 
**India Can Play Key Role In Middle East Peace Process: Palestine President Abbas** 

 ______ 
**Ramallah: **

Ahead of Prime Minister Narendra Modi's historic Palestine visit, President
Mahmoud Abbas said he will discuss with him India's role in the Middle East
peace process and the creation of a multilateral forum of negotiations to
strike a final deal with Israel.

PM Modi, the first Indian Prime Minister to visit Palestine, is reaching
Ramallah tomorrow amid heightened tensions in the region after US President
Donald Trump recognised Jerusalem as the capital of Israel.

The unilateral US decision to declare Jerusalem as the capital of Israel was
challenged at the UN General Assembly where 128 nations, including India,
voted to turn down the move as ""null and void"".

""We are receiving Prime Minister Modi in a historic visit that will
demonstrate the strong ties and relations between the Palestinian people and
the brotherly Indian people,"" President Abbas told PTI in an e-mail interview.

Though India has shied away from becoming a party in the Israel-Palestinian
conflict, the Palestinian leader on several occasions has stressed on a
possible role for New Delhi in the Middle East peace process.

""We will discuss the recent updates with Prime Minister Modi, and the recent
developments in the peace process, the bilateral relations, and the regional
situations. And the possible role India can play in enhancing peace in the
region, as well as discussing different economical aspects beyond the existing
ties we already possess,"" President Abbas said.

Describing India as a ""very respected country in the international arena"", the
82-year-old Palestinian President said that India can have a possible role in
creating a multilateral forum of negotiations between the Palestinians and
Israelis to reach a final agreement.

He said PM Modi's visit to the region reflects India's long-held position of
supporting peace and stability in the region.

""We believe in the importance of a possible Indian role... to reach a final
agreement based on international consensus and resolutions, in which India and
other countries can be part of,"" President Abbas said.

""The long Indian position of supporting the two-state solution is well known.
India has supported the Palestinian cause throughout the years of conflict,
and we rely on the Indian support in order to reach the independence of the
Palestinian State,"" he added.

As Palestine works to establish an international multilateral mechanism of
negotiations, the Palestinian leader stated that ""India can play a role in
this"".

""The relations between India and Palestine are historical...This visit will
culminate the historic ties between the two brotherly people, and will help in
increasing and strengthening these ties that we possess,"" he said.

PM Modi would be skipping Israel during his forthcoming tour of Middle East in
a clear message that New Delhi is de-hyphenating its ties with the Jewish
state and Palestine. PM Modi had visited Israel last year in July in a
standalone visit that had led to many analysts questioning the future of the
Indo-Palestine ties.

When asked about India's growing engagement with Israel, an unperturbed Abbas
said that ""any state has the right to establish relations with other
countries"".

""We believe in the importance of our relationship with the brotherly Indian
State, the support of India to the Palestinian people, and the relationship we
possess with the Indian people, will not be effected by India s relations with
any other State,"" he emphasised.

""India has recognised the State of Palestine in 1988, and we cannot forget the
last Indian vote in favour of Palestine's rights in Jerusalem in the United
Nations General Assembly, and all the political stands that India has taken to
support the Palestinian rights in the international arena,"" President Abbas
said referring to India's vote at the UN.

India has consistently voted in favour of resolutions supporting the
Palestinian cause at international forums, an issue that has bothered
strategic partner Israel.

Israeli Prime Minister Benjamin Netanyahu recently said that he was
""disappointed"" at the Indian vote at the UN but also expressed hope that there
will be a possible change of heart over a period of time.

Appreciating India's assistance in strengthening Palestinian economy through
executing several projects in the Palestinian areas, President Abbas said that
""he cannot forget"" New Delhi's support and wishes to further discuss with PM
Modi areas of cooperation in the economic sphere.

A number of MoUs are likely to be signed between the two sides during PM
Modi's three-hour visit to Palestine under which India will provide funding
for a number of projects in the fields of health, education, culture and
women's empowerment.

""The Indian Government and its people have provided significant assistance and
aid to the Palestinian people by establishing training centres, schools, and
the necessary humanitarian aid to the Palestinian people under occupation in
the West Bank and Gaza,"" President Abbas noted.

""And in 2016 we laid the foundation stone to establish the Palestine India
Techno Park project in Ramallah, and we are also looking forward the
establishment of the Institute of Diplomacy that is kindly funded by the
Indian Government"", he noted.

__ Comments

A lot of Palestinian diplomats have received training in India and hundreds of
Palestinians have availed scholarships to study at Indian institutions as part
of New Delhi's effort towards capacity building in Palestine.

""We are working on promoting the economical relations through introducing
businessmen and investors from both sides on the available opportunities in
the sectors of tourism, technological exchange in many areas, including
industrial, agricultural, and information systems, and on the other hand,
signing government agreements to support businessmen and protect their
investments,"" he said.



 ______ 
 ^I ^am ^just ^a ^bot, ^I ^cannot ^reply ^to ^your ^queries. ^Send ^a ^[*modmail*](http://www.reddit.com/message/compose?to=%2Fr%2Findia&amp;subject=Anti+Anti+Ad+Block+Bot) ^if ^you ^have ^any ^queries. ^Please ^provide ^a ^link ^to ^your ^submission. ^We ^would ^not ^be ^able ^to ^help ^you ^without ^a ^link.",2018-02-10 09:12:21
16,Congress IT cell is finally waking up. They're being set up corporate style ala bjp last time . Expect more phrases like abkibar modi sarkaar this time around from congress,2018-02-10 09:15:59
17,"&gt; Imagine having a billion people with conservative medieval era laws and prosperity of a sub-Saharan African country

Holy fucking shit! Just the mental image of that sends shivers down my spine. 

In all probability we would have reached equilibrium with a few wars though. 

&gt;Modi seems to have taken this as a challenge. 

Truer words have never been said. ",2018-02-10 10:40:06
18,"I understand if you hate Modi and Shah ( I Too)

But please don't stereotype or malign the Gujaratis.

Your behavior is similar to white men and hindus, who vilify all muslims because of action of few extremists.",2018-02-10 10:59:07
19,"SMH, Book Burning were the tools of fascism and irony is these people who allege that India is heading towards fascism or modi is a fascist leader etc  ",2018-02-10 11:12:36
20,"&gt; our democracy has matured, institutions have strengthened and civil society has become more robust.

LOL! Modi ji knows how to set these anti-national Nehruvian institutions and societies right to realize the grand Bharat vision of vedic times.

Maturity, robustness jaaye bhaad me",2018-02-10 11:32:10
21,"But Modi is the best administrator! But Gujarat model! But we need a strong leader! But 'minimum government maximum governance'! 

Congratulations to everyone who voted for development.",2018-02-10 11:35:33
22,"All this Modi - the real Pappu has done is reducing these words ""secular"" and ""intellectual"" to words of insult! This alone gives you a clear idea of what kind of a poopshow he is.",2018-02-10 11:42:46
23,"^This ^article ^is ^adblocker ^unfriendly, ^following ^is ^the ^text ^of ^the ^article. 

 ______ 
**To Reaffirm India's Support, PM Narendra Modi In Palestine Today: 10 Facts** 

 ______ 
Prime Minister Narendra Modi is on a three-nation tour in Palestine, UAE and
Oman.



 ______ 
 ^I ^am ^just ^a ^bot, ^I ^cannot ^reply ^to ^your ^queries. ^Send ^a ^[*modmail*](http://www.reddit.com/message/compose?to=%2Fr%2Findia&amp;subject=Anti+Anti+Ad+Block+Bot) ^if ^you ^have ^any ^queries. ^Please ^provide ^a ^link ^to ^your ^submission. ^We ^would ^not ^be ^able ^to ^help ^you ^without ^a ^link.",2018-02-10 11:47:08
24,"Your thought process is wrong, you cannot distinguish between many and few, or between Modi and yugapurush (whatever that means). You should go to a doctor.",2018-02-10 13:13:50
25,modi,2018-02-15 17:57:13
26,"You perfectly described Narendra Modi, only replace technocrat with illiterate douchebag.",2018-02-10 13:51:36
27,Modi may be is all that you describe. How’s that any relevance to my comment. Kejriwal is a terrible politician by himself and not by comparison to any other terrible politician. ,2018-02-10 14:08:19
28,"^This ^article ^is ^adblocker ^unfriendly, ^following ^is ^the ^text ^of ^the ^article. 

 ______ 
**New tax score: Modi government bags Rs 26,500 crore from those who didn't file returns** 

 ______ 
Modi government's high-voltage drive to go after the big evaders has improved
its

tax

kitty this year, forcing the filing of at least 1.7 crore in extra returns
that took its mop-up close to Rs 26,500 crore till December.

Finance minister

Arun Jaitley

in a reply to Parliament said that the tax department had been identifying
non-filers by tracking in-house information and tallying it with data on high-
value transactions received from external agencies along with

TDS

and tax collected at source (

TCS

).

""The mechanism for collection and verification of financial information has
been broadened to include data in respect of various types of high-value
transactions from banks and financial institutions and high-value expenditure
from commercial establishments in the form of Statement of Financial
Transaction (SFT),"" the FM said, adding that the scope of TDS and TCS was also
expanded.

He said quoting Permanent Account Number (PAN) was now mandatory for
transactions of over Rs 2 lakh, including on property, shares, bonds,
insurance and foreign travel. This was yielding enormous data, which was being
mined by the tax department.

As a result, last year, as many as 35 lakh non-filers were identified, who the
tax department believe had a tax liability. Although the number is down from
67 lakh a year ago, many who had large cash deposits may have filed returns.

The move is part of an exercise aimed at deepening the

income tax

system with the FM saying this year, the target was to get 1.25 crore new
return filers.

He said that after identifying the non-filers, the government was using rule-
based algorithms to classify cases into various categories and monitoring
them. Text messages and emails were also sent to the targeted groups to file
returns and a compliance management cell had been set up to track responses.
This was followed by notices.

The system is now proposed to be made more stringent through a new mechanism,
called Project Insight, to target individuals and seek voluntary compliance.



 ______ 
 ^I ^am ^just ^a ^bot, ^I ^cannot ^reply ^to ^your ^queries. ^Send ^a ^[*modmail*](http://www.reddit.com/message/compose?to=%2Fr%2Findia&amp;subject=Anti+Anti+Ad+Block+Bot) ^if ^you ^have ^any ^queries. ^Please ^provide ^a ^link ^to ^your ^submission. ^We ^would ^not ^be ^able ^to ^help ^you ^without ^a ^link.",2018-02-10 14:24:34
29,"Classic whataboutism, how does that answer the question on what are AAPs achievements

Next I guess you will bleating that Modi is personally not allowing Kejriwal to do honest work in Delhi.

Just like Modi is claiming Nehru is the reason he is not able to achieve anything in last 3 years. Stop getting caught up in distraction politics",2018-02-10 14:25:59
30,"^This ^article ^is ^adblocker ^unfriendly, ^following ^is ^the ^text ^of ^the ^article. 

 ______ 
**India pushes for UN mission to visit Maldives** 

 ______ 
NEW DELHI: India is working with its international partners to ask

United Nations

to send a fact-finding mission to Maldives so that impartial observers can
assess the situation on the ground and nudge the

Abdulla Yameen

government into restoring democracy.

The move is part of hectic back-channel maneuvers New Delhi is currently
engaged in to exercise diplomatic options to deal with the crisis in the
island nation following President Yameen's decision to impose an emergency and
place the supreme court chief justice under arrest.

The situation in Maldives came up for discussion between Prime Minister

Narendra Modi

and US President Donald Trump early this morning. Sources on condition of
anonymity said most countries are looking to India to take a lead in dealing
with the problems in Maldives given its proximity and ability to influence
events in the archipelago.

""Both leaders expressed concern about the political crisis in Maldives and the
importance of respect for democratic institutions and rule of law,"" the White
House said in a readout of the phone call between Trump and Modi, the first
this year. Given Yameen's proximity to China which has invested heavily in his
regime, the India-US convergence is significant.

At the moment, India is exploring ""diplomatic options"" to get Yameen to see
sense. However, high-level sources said all options remain on the table if
normalcy was not restored in keeping with international opinion.

India earlier refused a request from Maldives to send a special envoy, foreign
minister Mohammed Asim who had travelled to Abu Dhabi expecting to board a
plane for New Delhi. After India's snub, Asim went on to Islamabad. There is
almost no likelihood that India will recieve any special envoy from the Yameen
government in the near future.

On Friday, Maldives asked China to provide ""security"" for its investment in
Maldives, a thinly veiled request for troops. China refused. In a statement,
India said ""We note that China has said that Maldives government has the
ability to protect the security of Chinese personnel and institutions in
Maldives. We hope that all countries can play a constructive role in Maldives,
instead of doing the opposite"".

Over the past few days, international voices calling for Yameen to return to
some sort of democratic rule are increasing despite China, Yameen's primary
backer, calling for dialogue between political parties in Maldives.

On Thursday, Yameen refused to meet senior European diplomats who were the
first foreign dignitaries to visit the troubled nation since his crackdown.
Envoys from the European Union, Germany and Britain arrived in Male. German
Ambassador to Sri Lanka, Jorn Rohde, said the trio requested meetings to
discuss Yameen's crackdown. ""Sadly the Maldivian government refuses dialogue
today with my UK/EU colleagues... Our requests were unfortunately refused,""
Rohde said on Twitter. ""That is surely not the way forward"".



 ______ 
 ^I ^am ^just ^a ^bot, ^I ^cannot ^reply ^to ^your ^queries. ^Send ^a ^[*modmail*](http://www.reddit.com/message/compose?to=%2Fr%2Findia&amp;subject=Anti+Anti+Ad+Block+Bot) ^if ^you ^have ^any ^queries. ^Please ^provide ^a ^link ^to ^your ^submission. ^We ^would ^not ^be ^able ^to ^help ^you ^without ^a ^link.",2018-02-10 14:32:49
31,"You misidentify Modi as someone why walks the righteous path -
 shows that you cannot identify things correctly. ",2018-02-10 14:38:52
32,"&gt; Do you think inherently there is a ""pro-BJP"" mindset in our nation, given how powerful BJP is at the moment, holding the power in many states? 

Yes. And I think this is one of Nehru's biggest failures. As someone's flair says, Nehru is responsible for Modi. Literally. His intention was right - he wanted to inculcate scientific temper, but his approach of top down trickle down science, by starting IITs and AIIMS doesn't seem to have helped reduce ignorance of the masses. Couple ignorance with joblessness, and what you get is the most fertile grounds for sanghi bigots to gain power. 

Which brings me to - the lackadaisical job growth might be just incompetence on the emperor's part, but it feeds directly into his vote bank. So even if he's not doing it deliberately, his incompetance is actually helping him.

&gt;I mean, there is the unproven EVM-hacking theory, but I can't decide if it's true or not.

While EVM-hacking is certainly possible - no system is ""foolproof"" contrary to UIDAI claims, especially in India when you can buy access for a few hundred rupees, I don't think we need to go that far to explain 2014. Tatas and Ambanis who were buying ministerial berths in UPA (remember Raadia tapes) said Modi was the best thing to happen to India before 2014 elections. Corporates disproportionately invested in the sangh for that election. American consultants and countrywide holographic ad campaigns ain't cheap. You think Tatas and Ambanis didn't expect better bang for their bucks? This might change given how much he fucked up the economy and how he gave bigger slice of the pie to noodle baba and Adani, but now those can fund him.",2018-02-10 14:39:37
33,"&gt; You misidentify Modi as someone why walks the righteous path

No I don't - I'm holding him to the standards he claims to adhere to himself. If he admits he's not a superhuman, doesn't work 36 hrs a day without pooping, and didn't leave his mommy ""for the nation"", I won't expect superhuman things from him.",2018-02-10 14:43:21
34,Great news. Cameras should be used only for crime control. Hope rapes will stop in national capital. Not to be used for surveillance nor tracking political opponents. https://timesofindia.indiatimes.com/india/Top-Narendra-Modi-aide-put-woman-under-police-watch-for-sahib-Websites/articleshow/25842511.cms,2018-02-10 15:05:20
35,"&gt;However, he lamented that “the evidence indicates a deficit of both political and bureaucratic will to ensure compliance with this transparency requirement. The Central Government has not committed to developing a mechanism to monitor compliance despite being reminded twice in Parliament”.

60 years of Congress are responsible because Nehru told bureaucrats not to co-operate with Modi.",2018-02-10 15:58:37
36,"Wow, I must say thats seems way too generous.

I know that Center &amp; LG have placed too many hurdles in their path. But I still think there are a lot of stupid things these guys are doing. 

For ex: 

- Instead of focussing on delhi, participating in elections else where and losing comprehensively

- Spend first half of their tenure doing too much anti modi shouting

- Though I know they are being framed in office for profit, there is still some truth that they did hold some positions. Whataboutism is no way to defend yourself.

I would probably say somewhere around 6.5-7/10 in my opinion.",2018-02-10 16:02:16
37,"&gt;it's a little too late now for the shaka gang to make drastic changes considering our democracy has matured, institutions have strengthened and civil society has become more robust. But Modi seems to have taken this as a challenge.

The judiciary and media have already fallen..Legislature is the only last hope now",2018-02-10 16:03:46
38,"&gt;Instead of focussing on delhi, participating in elections else where and losing comprehensively

They did well in Punjab but contesting Goa was a mistake...However, their recent performance in the UP civic polls was good.

&gt;Spend first half of their tenure doing too much anti modi shouting

Kejriwal has now revised his strategy and most of his speeches and tweets are more focused on work rather than Modi.


But given the fact that LG and the BJP are leaving no stones unturned in obstructing the work of the Delhi government..it is very natural that he would attack them.

&gt;Though I know they are being framed in office for profit, there is still some truth that they did hold some positions. Whataboutism is no way to defend yourself.

That's one major mistake that they did in their tenure..First,the post of Parliamentary secretaries should have been created and then the MLA's should have been appointed..so in this case even if the President had refused to sign on it..Their MLA's would have been safe! 

However, they did the opposite of it and Delhi seems to be heading for a mini-elections now.",2018-02-10 16:13:05
39,Because Nehru's great grandson is the opposition leader. If Rahul Gandhi or even Sonia Gandhi had not gotten into politics Modi would find no flaws in Nehru and would find some other dead politician to vilify. ,2018-02-10 16:15:43
