,article,article_date
0,Lol.. Good Luck trying to get someone apart from Namo.,2015-01-27 23:00:19
1,"People can only trust Kejriwal, that's why. You should check out AAP's fb pages. Put any NaMo fan to shame.",2015-01-28 01:14:21
2,"Yeah, the mods said so because there was indeed a NaMo army which was banned from reddit by the admins. Their chats were shared - their views, especially on women, were disgusting. ",2015-01-28 13:42:55
3,"I just made a payment of Rs 101 with obviously fake details - I stopped at the Verified By Visa sign (already donated Rs 3,001 to these people and don't want to throw any more money at them).

[Proof](http://imgur.com/FOdClyj). AAP website doesn't verify jack, nor does it ask for Passport numbers. Maybe it is different if you donating from abroad (as OP seems to be doing).

edit- NaMo army downvoting me for merely posting the results of an experiment?",2015-01-28 14:03:44
4,"Yeah, the NaMo army bit. No moderators of /r/India were involved in reporting them. ",2015-01-28 14:10:59
5,Cos Namo Army. They are brigading this thread cos they don't feel bad about themselves ,2015-01-28 14:28:21
6,"Dude, you seem heavily downvoted, NaMo army at work?",2015-01-28 21:25:06
7,"Kiran Vs Kejriwal
Anna Vd NaMo
.
Hey mom. Get me some popcorn. ",2015-01-29 01:02:50
8,"God forbid, if a Hindu IAS officer made the same statement. The NaMo army would be here in full strength to defend him.",2015-01-29 11:10:27
9,Pleasantly surprised how positively Indians have taken it in the comment section! I guess the article somehow missed the attention of the namo armie.,2015-01-29 13:22:42
10,"You know, Namo fans also have a sense of humour!-Namo fan",2015-01-29 15:46:47
11,"What we get from the US is a partner powerful enough to strong-arm the NSG into accepting India as a de-facto nuclear power, the removal of sanctions, opening up of the nuclear trade, and the ability to export Indian nuclear tech. 

The quid pro quo is that we award lucrative contracts to American suppliers and contractors as we build nuclear power plants. In a perfect world, we would have cocked a snook at the US and purchased French and Russian technology instead. Sadly, we don't live in a perfect world. The choice is between buying American technology and remaining a nuclear pariah forever and facing an electricity crisis in the near future. Both MMS and NaMo know that it isn't much of a choice at all.",2015-02-02 04:48:43
12,"My email was relentlessly spammed by BJP before the LS Polls. Now I have a filter which puts any email containing 'BJP', 'Modi', and 'NaMo' straight to junk.",2015-02-02 20:07:43
13,"https://www.google.com/search?q=2002&amp;prmd=ivnslpz&amp;source=lnms&amp;tbm=nws
2002 happened nobody is proud of it. But nobody wants to kill each and every one of the opposite religion. People want progress, people believe that modi will bring progress. Thus namo namo namo.",2015-02-03 17:39:41
14,"So, they take the videos down for being pragmatic and under no pressure and everyone blames NaMo. Wow, that's some messed up logic! o_0",2015-02-04 21:59:21
15,"And the narrative is everyone against AK. The fact is there is an array of leaders, media who are desperately fighting against NaMo. ",2015-02-05 20:04:21
16,"http://news.webindia123.com/news/Articles/India/20140320/2360174.html

&gt; Congress MP Union Minister Namo Narain Meena's brother and former Director General of Police Harish Meena, Chief Minister Vasundhara Raje's MP son Dushyant Singh and Olympic medalist Rajyavardhan Singh Rathore figured in the list of the 21 BJP candidates from Rajasthan.

http://www.telegraphindia.com/1140921/jsp/nation/story_18857310.jsp

&gt; Sushma Swaraj’s younger sister has got a BJP ticket to contest the Assembly election in Haryana.

http://timesofindia.indiatimes.com/city/mumbai/BJP-changes-Raver-nominee/articleshow/32390589.cms

&gt; Haribhau Jawale, who was renominated, will be replaced by Raksha, daughter-in-law of leader of the opposition Eknath Khadse. 

http://www.firstpost.com/politics/bjp-field-pritam-munde-beed-lok-sabha-bypoll-1729867.html

&gt; With BJP MLA Pankaja Munde, daughter of Gopinath Munde, indicating that she would not contest the bypoll to the Beed Lok Sabha constituency in Maharashtra, which fell vacant after her father's demise, the party has decided to field the late leader's other daughter Pritam for the seat.

http://www.newindianexpress.com/nation/Chhattisgarh-CMs-Son-Gets-BJP-Ticket/2014/03/19/article2116882.ece

&gt; Less than four months after BJP prime ministerial candidate Narendra Modi mockingly said that if Chhattisgarh Chief Minister Raman Singh were a Congress leader his son Abhishek Singh would have got an Assembly poll ticket, the saffron party has fielded the 34-year-old from the Rajnandgaon Lok Sabha seat.

",2015-02-06 19:51:09
17,"I have a fear that these polls will be a watershed moment in next 5-10 years of Indian politics. 

AAP wins - Back to the Freebie style politics. Didi, Nitish, BSP/SP will try to party with AK and I have a fear he will agree. (yes - Aap supports will downvote and question proof - but this is just a feeling a personal opinion, fear - if you might say). AK is power hungry. Sorry if you dont like it (yes. so is NaMo but the means and end-goals are different). Slowly, AK will turn ""secular"" that is my fear. Why? Because he has already morphed from ""anti-corruption"" to ""leftist/socialist"" and is already showing signs of ""caste/class-based politics"". Anything which will establish AAP as a national party will be acceptable - HECK !! he gave up Delhi just so that he could ride on the ""holier-than-thou"" wave for the Lok Sabha elections. That was the gamble he was willing to play!! Can any sane person do that? And please - if you feel that he left because of LokPal you are fooling yourself. Why else did AAP suddenly contest 432 seats( more than BJP) unless they wanted to ride that sentiment. Anyways I digress. 

BJP Wins - I am not saying that all will be great. But, according to me, the ONLY thing which matters for India at this time - is to establish itself as a manufacturing hub. Else our next generations are doomed. IT, and Call Centers will NOT feed the next generation. Already in the current job generation (10 years) are feeling the pain of stagnant salaries. 
IF Modi wins Delhi, his chances of winning Bihar, Karnataka, WB, UP go up. And that is important for him to - ensure that that Make in India is successful. Cause that will be his 2019 campaign. 


You can already imagine and feel how important this glorified municipal election is. 
Unfortunately, this is becoming a fight between highly myopic freebies such as ""free Wifi"" against the long term plans for the country. 
",2015-02-07 19:19:37
18,Namo Army V2.0,2015-02-08 21:34:07
19,"I think they did not do it - since they wanted the Delhi elections after MH, HR, JH, JK etc. And much before Bihar. 
I am not trying to justify that NaMo/Shah are some great strategists - they have miserably failed. But, frank enough - if they had done Delhi before and lost - the other 4 would have been much tougher. 
But, still They should see - what they did wrong. 
I think they got too offensive - and there was no need for that. 

",2015-02-10 23:38:28
20,"I am from Delhi and I absolutely love my city. I am not an AAP supporter, I am not a NaMo Bhakt either, but I would vote for BJP. 

Having said that. I wish AAP all the best. They ran a superior campaign which addresses people's problems, rather than the anti-Kejriwal campaign that BJP ran which pissed me off. They behaved like Cong(I) did during 2014 LS elections. 

I wish AAP all the best. At the end of the day it's India and Indians that count. If ANY party does good for my city and my country, it has my full support. And BJP for fucks sake, please control your fringe elements. NO Hindu supports them or thinks like them. I am an atheist but my family is Hindu and they are  absolutely embarrassed by Sakshi Maharaj and Yoginath. Mend your ways on the social issue and many more people will vote for you who identify with your economic or Indian national security outlook ( and by India's national security I don't mean, love jihad and shit, I mean dealing with Pakistan and China).",2015-02-11 05:56:27
21,"comprehensive write. If I'm to give one reason for BJP's embarrassing defeat, it's their focus on degrading, defaming AAP. I mean wth would NaMo announce in a rally *jo swiss bank account holders ko pakadna chahte hain, wo to khud money laundering karta hai*, especially when you know it's all fabricated by you. Sad to see PM fall to this.",2015-02-11 10:37:12
22,"I was here around the time of ""the shift""

The mods were not this strict, we had shit tons of trolls and every troll more or less knew each other.

/r/bakchodi was born around that time. brownboy was still the mod back then.

People used to have more reasoned arguments and less name calling. Trolls were just here for the lulz with no real political or any other inclination. There was a lot more leg pulling and a lot less name calling.

Then we started seeing the shift, it started with the votes. Articles about modi started flooding. Everything on the ""new"" page with pro modi stuff in it got upvoted, every post against modi got downvoted to hell.

Then it started happening on the threads. Finally a few dedicated right wing trolls started commenting. 

This was the flood of NaMo army.

Around the same time, I deleted my youtube channel and started going back to programming. All social media interaction dropped and I finally deleted my old reddit account as well.",2015-02-11 14:01:52
23,And chutiya Namo Army guys. All of them got exposed and banned from reddit for good,2015-02-11 15:30:19
24,NaMo replies: Nothing much.,2015-02-11 17:45:00
25,NaMo must be declared as a God,2015-02-11 20:36:53
26,"This temple has existed since 2006, just a new idol installed. Took him this long to speak against it? http://www.bangaloremirror.com/News/India/Bhakt-builds-a-temple-for-Modi/articleshow/46204301.cms

Also this temple in UP from last year. http://m.timesofindia.com/city/allahabad/Now-a-NaMo-temple-with-Modi-chalisa/articleshow/29345039.cms",2015-02-12 10:32:24
27,"Two reasons: 

1. His comment -ve about Modi -- Namo Army v2.0 Brigade 
2. He is a mod -- Randia Butthurt Brigade ",2015-02-12 14:00:13
28,"&gt; why LSP hasn't been able to do in 19 years what AAP did in 3

AAP is offshoot of an already a popular movement. it's birth, right from inception to delivery is witnessed, cheered and broadcasted on national media. 
LSP is not based out of delhi and it's not supported by media. You underestimate how much media played a role both in NaMo and AAP victory.",2015-02-12 18:42:31
29,"No. Fuck salman khan. Let him rot in jail for 20 years IF he is proved guilty.

OP compared bhai with Namo. Just wanted him to pull his head out of his ass.",2015-02-12 18:58:53
30,"JP on Politics, AAP, NaMo among others   
https://www.youtube.com/watch?v=bcKZ69BZqXA#t=853",2015-02-12 19:15:24
31,"NaMo is the new Sachin. Say one word against him, and the 'fuck-you fuck-you' army jumps in.",2015-02-14 11:45:34
32,"&gt;""And I hope that he (Prime Minister Modi) also wants goodness for the people of Delhi,"" he added.

Is chutiye ko koi bolega? At least check your grammar when you're addressing the fucking Prime Minister of India, lkb!

And I seriously didn't get the point of the article. 3 tiny paras about Asutos's heart-rending plea to NaMo, followed by six, *substantial* paras about Modi's speech at  RE-INVEST 2015 , India's first **Renewable Energy Global Investors' Meet** and Expo.

The two should have been completely separate articles.",2015-02-15 17:44:06
33,"There is a gang of people, called Namo Army. They brigade every thread. They were caught and got their accounts banned from admins. But then they are active the again ",2015-02-16 15:28:40
34,"Dude I know about Namo army lol :v
But I did not know twas happening again. BTW I am modi supportet as well so yeah,",2015-02-16 21:08:35
35,"There is a gang of people called the Ankit Lal brigade. They like to post 15 circlejerk threads per day attacking the BJP, Modi, Kiran Bedi etc. and then complain about how some imaginary new 'Namo Army' is brigading everything.",2015-02-17 03:11:28
36,Sri Lankan national anthem reads namo namo namo namo. He is the one he can do anything :p,2015-02-18 00:47:45
37,"&gt;This information was in the interrogation report of  Mr Headley that was given  to the Intelligence Bureau. The document was also made available to the media. But in the latter, the two paras that refer to Ishrat Jahan are missing. National Investigation Agency sources have told NDTV that Headley's comments are not legally admissible in any case other than 26/11 and his account is based on second hand information; so should be treated as 'hearsay'.

&gt;The Intelligence Bureau disagrees. It says it had inputs that the Mumbai teen and her associates were a terror unit, and in 2004, it was this information that the Gujarat branch of the Intelligence Bureau shared with the police.

NDTV claims that two paragraphs referring to Ishrat Jahan are missing in the document that was made public. Why?  NDTV is just  parroting whatever IB has told them. And then there's an ""independent"" confirmation from the FBI. Why should we trust NDTV's sources on this?


You can read further about the falsifications of the IB here - http://www.truthofgujarat.com/the-shocking-falsification-by-sunday-guardian-maligning-ishrat-to-save-namo/ 

",2015-02-18 18:36:50
38,it's like dash-news guys saying they will crack down on Namo army ,2015-02-20 00:34:16
39,Namo Army is still here :P ,2015-02-20 01:33:58
40,Namo Army in corporate world. ,2015-02-20 14:02:44
41,I am Brigadier of the Namo Army. Koi Shak? ,2015-02-21 01:35:56
42,"Yes, but not mano a namo.",2015-02-21 17:52:46
43,Scroll to bottom of the page for the fallen warriors of namo army.,2015-02-22 01:41:25
44,Praise Duarte. Praise namo.,2015-02-22 19:26:47
