,article,article_date
0,"If you don't vote for Modi, what are your other options? Hence, ignore everything.",2018-08-09 00:48:50
1,"&gt; *“Through the means of this great and historic house, I am going to become part of ongoing process of nation building.”* That’s how Amit Anil Chandra Shah, president of the Bharatiya Janata Party (BJP), began his maiden speech in the Rajya Sabha in February this year.

&gt; When Shah was elected to the upper house from Gujarat in August 2017, it was a turning point for him. Shah was no longer just the backroom ‘master strategist’, he was getting a front-facing role. He was no longer just the ‘Chanakya’ who won elections for his Chandragupta Maurya, aka Narendra Modi. He was going to become a part of the ‘nation building’ process.

&gt; ... Shah has virtually replaced Arun Jaitley as the voice of the government in the upper house.

&gt; ... Shah wants to outgrow the Chanakya image. He wants to be seen as a mass leader, an ideologue and, last but not the least, as someone interested in governance. 

&gt; **Soon after he won the Rajya Sabha election, a flurry of articles by BJP leaders and associates suggested there was an attempt to create a personality cult around him, similar to the one around the Prime Minister.**

&gt; ... His confidante Devendra Kumar, a psephologist, wrote an [article](https://economictimes.indiatimes.com/news/politics-and-nation/amit-shah-he-is-more-than-just-an-election-machine/articleshow/60050193.cms) in The Economic Times calling Shah as “more than just an election machine”. The hagiographical article reads virtually as a charter of the new image Shah is trying to build for himself ...

&gt; Kumar goes on to build a case for Shah as a politician capable of holding public office: *“Shah has remarkable administrative and governance expertise – a quality that people outside Gujarat do not know much about. As a minister in Gujarat for close to a decade he handled important portfolios… As party president, he reportedly gives critical inputs to union ministers in his routine interactions with them. Now, as Rajya Sabha member, it is only natural that he makes important contributions in policy-making”.*

&gt; ... The conclusion is inescapable. Amit Shah, 14 years younger than his mentor Modi, sees himself as Modi’s successor in the Prime Minister’s office. That’s why he needs to be the voice of the government in the Rajya Sabha.",2018-08-09 03:18:07
2,He's no mass leader. Yogi has been spoken of as a successor to Modi. First I'm hearing of Shah in that role.,2018-08-09 03:22:17
3,"&gt; He's no mass leader.

Neither is Modi. Nor is Yogi. But you've already seen the propaganda machines working overtime to ensure that people consider them as one. And if Shah is really the brain behind (he does control the purse strings), I don't see why a PR campaign showcasing him as a ""mass leader"" should fail ...",2018-08-09 03:28:08
4,"Ya, Yogi's brand is still being built but I would demur about Modi. A large enough section of Indians obviously like him. I mean, if Modi isn't a mass leader, then who is?

There was a long essay about [Baba Ramdev in the *New York Times*](https://www.nytimes.com/2018/07/26/magazine/the-billionaire-yogi-behind-modis-rise.html) recently and the author hinted that he had Prime Ministerial ambitions. I never thought of him that way but he's probably a more popular and charismatic figure than either Shah or Yogi and he could likely make a run for the job.",2018-08-09 03:37:32
5,"&gt; In a note published earlier this year, Nomura's Alastair Newton points out that during a Feb. 23 rally in Assam, Modi called for Hindu migrants from Bangladesh to be assimilated back into India. He said non-Hindus should be sent back to their home nations. 

&gt; But Modi's seeming religious intolerance, his ambiguous stance on women's issues, and the implications of his rule on Indian press freedom(especially as Hindu nationalists take to the internet to intimidate Modi critics) are cause for concern. Those celebrating Modi's win should be cognizant of what his rule could mean for a democratic nation.

Interesting to see the many facades that are now turning out to be true.",2018-08-09 03:43:03
6,"UPA-II was the epitome of a parliamentary system. MMS was never the 'prime ministerial' candiddate. The prime-minister is often described as the 'first among equals' and is not in any major way superior or more powerful than the council of ministers who are all equals.    
However Modi, like Indira before him - is clearly the only actually powerful man in the cabinet. This is because of the incredible fawning popularity that he has. In a parliamentary system - this gives him an inordinate amount of power which was never actually intended to be the prime-minsters.    
The British electorate is less prone to become 'fanboys' of any one person - so the system works well there. Not so much in India. ",2018-08-09 05:10:52
7,"**Modi’s Russia Visit- India’s Reliance Defence signs $6bn deal with Russian arms firm as Modi visits Moscow**

Modi’s France Visit- Anil Ambani’s Reliance Group ties up with Dassault after Rafale fighter jet deal

Modi’s Australia Visit- Adani’s Australia coal mine project gets final approval

Modi’s Bangladesh Visit- NTPC, Adani, RPower, Petronet sign pacts for projects in Bangladesh

Modi’s United States’ Visit- Reliance Defence signs warship repair pact with US Navy. The deal may generate Rs15,000 crore revenue for Reliance Defence over next three to five years

Modi’s Israel Visit- Adani &amp; Israel’s Elbit form JV for unmanned aerial vehicles",2018-08-09 05:52:14
8,[Heheh..](http://www.freepressjournal.in/mumbai/maharashtra-land-buyers-in-nanar-belong-to-trading-community-names-of-farmers-are-modi-shah-jain/1259635),2018-08-09 08:11:53
9,"This is the worst time to do something about it. These goons have the support of Modi and [UP govt., UP police threaten muslims](https://indianexpress.com/article/india/fearful-families-flee-uttar-pradesh-village-as-cops-crack-down-to-help-kanwarias-5298492/) and then take up their homes.

All we can do is pressure the opposition to force the government to act. If not, just sit on the sidelines.",2018-08-09 08:33:32
10,after having full control over media modi now wants to control last man standing SC,2018-08-09 08:34:36
11,Adani ambani mahindra etc. are gaining the most because they are the biggest industrialists in india. Others have also benefitted from modi government and this is absolutely legit way of promoting your industries. State of south korea helps Samsung which helps their exports grow and makes their currency stronger and their country richer.  They are not getting unsecured loans this is not crony capitalism. Would you be comfortable if HAL got the contracts after what they did with tejas? Tejas is finally being inducted as a face saving exercise by the defense forces and nobody wants it. Crony capitalism would be to push your banking system to a state of 80% NPAs.  ,2018-08-09 08:39:14
12,"Can you tell me when exactly did the scam happen?  
Was it when indian and french govt renegotiated the deal?(means french PM and indian PM are guilty) or when french govt gave offset contracts to reliance(implying france and reliance are guilty). Only modi cannot do scam because koi bribe dega nahi to modi lega kaise? you need two parties to execute the scam, modi govt did not give any contracts to reliance so when did the scam happen? Please explain Mr. ""fucking sad""",2018-08-09 08:59:17
13,Now I'd definitely look her up and her lectures to see what she has to say. Thanks modi govt for introducing me to this person who I otherwise wouldn't have cared about.,2018-08-09 09:30:48
14,But will Modi looking to give up the power ? If he is defeated in the next polls the party faithful may force him out but if he wins the next elections I see very little chance that he doesn't contest the next elections too of 2024 too with further erosion of Indain institutions and saffronization of the country.,2018-08-09 10:02:35
15,Modi vs WHO?,2018-08-09 10:35:05
16,I don't think 21 people will die of shock if Modi is sick. ,2018-08-09 10:52:05
17,"&gt; People like Manmohan Singh, **Modi** and vajpayee , who are clean are very rare 

ayy lmao",2018-08-09 11:17:19
18,Modi ne pure desh ko jaadu ki jhappi de di. ,2018-08-09 11:29:26
19,"4 years of Modi rule has convinced me that 99.99% of Indians are uneducated and unless the education system is overhauled, we will continue to churn out semi literate, semi educated, religious, superstitious imbeciles at industrial scale.",2018-08-09 11:58:07
20,They are friends of both modi and sonia. They can easily get away with it. ,2018-08-09 12:13:54
21,"Really? 10 posts in 2 days and r/india is Instagram? What about all the fucking political posts - ""Whom will you vote in 2019, will modi win in 2019, Should Raga be a PM in 2019, will AAP come back in Delhi, hurr durr and you don't bat an eyelid.

Be the change you want to see or gtfo ",2018-08-09 12:33:54
22,But PBhushan is following the path laid by Narendra Modi.,2018-08-09 12:44:19
23,I don't think you realize that ambani got contracts from france and modi had no role. ,2018-08-09 13:39:02
24,"The rot has entered the SC. The CJI is corrupt. No wonder Modi and Shah find it easy to control him.

One remembers that crook Winston Churchill's words:

\&gt; Power will go to the hands of rascals,  rogues, freebooters; all Indian leaders will be of low calibre &amp; men  of straw. They will have sweet tongues and silly hearts. They will  fight amongst themselves for power and India will be lost in political  squabbles.

It seems we are finally proving him right. We had a good run for 70 years.",2018-08-09 13:47:17
25,Good joke. TDP licked Modi's arse for four years quoting alliance dharma. Naidu is worse than Modi. He publicly declared Brahmins are the most virtuous caste while announcing a Brahmin corporation. Naidu has turned Andhra into a caste corporation. TDP is a Hindutva party.,2018-08-09 13:59:13
26,"Yeah Yeah, Congress sabotaged Judiciary all this years and now Modi snatched everything within 3-4 years. So gullible are people in this country to believe this horseshit.",2018-08-09 14:50:26
27,"It would work better with a multi-party system unlike the hyperpartisan two party system. The US has weird presidential elections with the electoral college, the primary system etc.

Both major Indian parties are very similar on economic issues. There are the occasional shocks like demonetization and there are differences in certain fields, as well as implementation and effectiveness. But in spirit they are largely similar. For example, GST was in the works for the last 3 administrations. This makes the impact of a presidential system lesser than in the US, limited to only social issues and the occasional policy decision.

There are problems with a presidential system, of course, but for the most part, a system similar to the French system might be useful.

Right now we're tending towards a warped election process, where a vote for the local BJP candidate is inseparable from a vote for Modi. Congress is also trying to do the same thing with RaGa, they're just less successful at it because RaGa has the charisma of a wet paper towel and a major reason why people do not vote for Congress.

I know that a lot of people would vote differently if the Prime Minister's selection (basically a president) is independent of the local candidate's election. Hypothetical example: you might want to vote for Tharoor as an MP because he's done good work; unfortunately, his winning increases chances of RaGa becoming PM, so you instead choose the clearly inferior candidate.

Anyway it'll probably pan out to be shitty in its own way.",2018-08-09 14:51:19
28,"&gt; All the ""good news"" about India - new tech innovations, new factories, new startups getting funding - seems to be coming from South India

what bullshit recent Samsung open one of biggest factory opening 
in noida
https://indianexpress.com/article/technology/mobile-tabs/samsung-noida-factory-world-biggest-mobile-factory-live-updates-pm-modi-5252188/

and second thing that qatar is one the richest country in the world
but extreme backwards socially
",2018-08-09 16:02:35
29,"If you were Reliance, why would you want your name dragged through the mud simply so that one party can attack another ? At end of day very few people pay attention to actual facts. Most see whatsappforwards of their choice; either modi bhakts or congress fans.

Explanations have been given in Parliament. The serving chief has come forward. 

US democrats, from Kerry (Swift boat), Obama(birthers) etc,Clinton (eg Beghazi/emails) have learnt that engaging an argument doesn't help them. It leaves the biased creating more peulation and arguments and the vast uninformed that there is smoke therefore there must be fire

But I am not the government or the BJP; I can't explain why they follow a particular course. Maybe they feel enough has been said. maybe they don't want to dignify the issue. Maybe they will pull the rug from under the Congress during the election after giving them lots of rope. Maybe they would rather spend their time and effort on sneaky tricks or productive work elsewhere. Maybe anything - I am not Modi, nor am I his advocate,legal or political.

Much of this is not honest speculation for any educated and informed person.

But the Indian system of procurement is problematic under any government, not least the UPA.",2018-08-09 17:36:22
30,"Dude it was a train that kick-started the stardom of modi-shah duo, doubt they let anything happen to her.",2018-08-09 17:43:21
31,"&gt; Indians have taken chutiapa in its highest form while picking their leaders.
&gt; 
&gt; 

Not by not choosing Pappu

But by choosing Modi

As if he's not equally or more stupid?

Also, I'd rather take a stupid who's humble enough to recognize their shortcomings and listens to criticism than an ignorant and arrogant psychopath. ",2018-08-09 18:14:52
32,Ye tujhe kis mahan insaan ne bataya? King Modi?,2018-08-09 18:17:38
33,"
Latest News
Live TV
India
World
News Beeps
Tech News
Opinion
Videos
Offbeat
Cities
Movies
Trending
Top Photos
News Alerts
Advertisement
HomeOpinion
Opposition Defeat Today Owes Much To Rahul Gandhi
Swati Chaturvedi
Published : August 09, 2018 14:34 IST
With the big 2019 election just eight months away, Prime Minister Narendra Modi worked the phone to win over Odisha Chief Minister Naveen Patnaik - his nine MPs - for today's big test in the Rajya Sabha. The ""united opposition"" was exposed as a shabby group once again - the NDA's candidate, Harivansh Narayan Singh, who is a parliamentarian from the party of Bihar Chief Minister Nitish Kumar, won the election for Rajya Sabha Deputy Chairman 125-105.
The opposition in parliament is a vivid depiction of the gang that could not shoot straight. After his show-stopping hug of Modi a few weeks ago, Congress President Rahul Gandhi appears to have reverted to ho-hum mode. He chose the lacklustre BK Hariprasad as the opposition candidate at the last minute. And for all Gandhi's talk of being willing to move the Congress to the backseat if that's what it will take to win over parties that don't like it (the YSR Congress, for example), he did the opposite. By forcing a Congress nominee as the opposition's candidate, the TRS, which had been lobbied hard by the BJP, voted for the BJP - exactly what Modi and Shah were hoping for.",2018-08-09 20:01:00
34,"I like OPEN magazine. It's one of my go-to publications along with *Outlook*, *Scroll*, *The Quint*, *ThePrint* and *Caravan*. I think some of the top editorial staff are lightly pro-Modi and they got rid of Hartosh Singh Bal, but most of the content is good and oftentimes [critical of Indians](http://www.openthemagazine.com/article/society/the-ugly-indian-tourist). It's in an odd position in that it manages to be liberal and cater to corporate *bhakts* at the same time.",2018-08-09 20:14:41
35,"Not really. It is not a matter of absolute power. One who has power should also have intent. Do you see any intent in Modi? He has absolute power. He is the Prime Minister of India. Where is the intent to curb all that I have mentioned? He is a spectator, a silent cheerer, an avid follower of those who advocate violence against women, against minorities, threaten them of rape, rejoice murder, heckle people and lynch them. Absolute power he hasn't yet. In his quest for absolute power, he forgotten his duty as the Prime Minister to stop the mob rule, to speak up against barbarism , to order the law and order to do its duty instead of trampling the victims of of terrorism of cow vigilantes. He may have ideas of fixing all these. Why is he sitting on them, if he has any? At what point of time and after how many lynchings would he decide to say ""Eureka""? When will he act? I know he can act very well in front of the camera but when will he act, show some action. What are we paying that chowkidar for?  Where is his intent?",2018-08-09 21:13:19
36,"It is basically the unfiltered trash that Hindutva leaders like Modi, Bhagwat, Subraminian vomit dressed up in what they think as an attractive package to appear as polished and intellectual as publications like TheWire, Caravan Magazine etc. 

The writing inside is pathetic. They do not have editorial standards. Probably because they don’t have a worthwhile editor as no journalist or an editor would work for a right wing hate magazine in their good conscience. ",2018-08-09 21:36:07
37,Narendra Modi has full consent to all kinds of violence as long as it serves his desire to be in power. People say that Narendra Modi instigated riots and pogroms in Gujarat in 2002. Wrong. Absolutely wrong. He did not do anything 2002 in Gujarat. That is the point. He just allowed the mob to do whatever they wished. He did not do anything. It is as simple as that.,2018-08-09 21:48:25
38,I'm liking that this journalist is taking modi's name on this scam. Wonder how many calls the producers are getting from the boardroom modi puppet.,2018-08-09 22:02:22
39,Are you really suggesting Modi and Co orchestrated this Bandh? ,2018-08-09 22:54:40
40,"&gt; The BJP and the RSS are deft at twisting historical facts to suit them ... Modiji and some RSS “ideologues” have quite shamelessly been trying to inveigle the RSS into the Quit India Movement, when in fact they actively colloborated with the British regime.

&gt; The facts are thus:

&gt; On August 8, 1942, at the All-India Congress Committee session in Bombay, Mohandas Karamchand Gandhi launched the Quit India movement. The next day, Gandhi, Nehru and many other leaders of the Indian National Congress were arrested by the British Government.

&gt; **The Rashtriya Swayamsevak Sangh (RSS) kept aloof from the Congress-led anti-British Indian independence movement since its founding by KB Hedgewar in 1925. In 1942, the RSS, under MS Golwalkar refused to join the Quit India Movement. VD Savarkar even urged “Hindus” to join the British military ... **

&gt; ... The British Government stated that the RSS was not at all supporting any civil disobedience against them, and as such their other political activities could be overlooked ... The Bombay government reported that the RSS had not, in any way, infringed upon government orders and had always shown a willingness to comply with the law.

&gt; **As a part of the build up to the Quit India Movement on August 8, 1942, all Congress MLAs resigned from their positions in provincial legislatures. However, they were not joined by their counterparts in the Hindu Mahasabha.** The Mahasabha instead chose to boycott the Quit India Movement and collaborated with the British to gain political power at the expense of the Congress.

&gt; ... Syama Prasad Mookerjee, who subsequently founded the Bharatiya Jan Sangh, the predecessor of the Bharatiya Janata Party, joined Fazl ul Huq’s Progressive Coalition as Finance Minister ...

&gt; ... When Mahatma Gandhi’s call for mass resignations came, Mookerjee, who was recently honoured by PM Modi on his 115th birth anniversary, refused to give up his position.

&gt; ... **Vinayak Damodar Savarkar, whose painting was added to Central Hall of Parliament by then PM Atal Bihari Vajpayee and who is celebrated as a “true patriot” and “Veer Savarkar” by PM Narendra Modi called for the Mahasabha and Rashtriya Swayamsevak Sangh to boycott the Quit India Movement. Which they actively did.**

&gt; ”While freedom fighters across India were chanting *“na ek bhai, na ek pai”* (not a single man, not a single paisa towards the British war effort)“, Savarkar, on behalf of the Hindu Mahasabha and the RSS, called upon all “Hindus” to join the British Indian “Army, Navy and Aerial forces in as large a number as possible” and to secure entry into “all ordinance, ammunition and war craft factories”.",2018-08-10 00:16:03
41,RSS kicks out people over a certain age to the *Margdarshak Mandal* ... can Modi win without the RSS - remains to be seen ...,2018-08-10 00:22:37
42,Now Modi will count it as employment.,2018-08-10 06:14:24
43,"&gt;Among other things, internet followers have been sent links to animated videos featuring Mr Modi as a yoga instructor. He appears as an androgynous, air-brushed uncle with flawless technique. 

What? Is this for real?",2018-08-10 08:32:26
44,"And no need to think that bjp is a Hindu party, trying very hard to prop up it's hindutva agenda, and the RSS is a secular social service origination that worked for the welfare of the poor no matter what religion or cast. Trust me when I say these things are in proven facts and don't think too much people. You are not suppose to this k or question authority because we have no proof. The government is a saint they can never do wrong. And modi is a fallen angel trying to fight evil and rid the world from the devil's influence. 

So people no proof means no need to think to hard . Just stay in your corner and eat some pakora fresh from our highly employed youth. No proof people no proof at all. Don't believe the word of the liberal scum. They always lie, listen to me I tell the truth. Modi is god and he shall rule over India as he is our beloved master and saviour. Heil Modi, the savour of India . No proof people go home. ",2018-08-10 09:52:39
45,There's a job for everyone at the Ministry of Truth. Har har Modi!,2018-08-10 10:25:41
46,"&gt;The criminal complaint filed by Neeraj Saxena on behalf of the NGO, Maulik Bharat
Trust, had alleged that Kejriwal had concealed his correct address and suppressed the
market value of his property in his affidavit given before the Election Commission.

All this scrutiny for Kejriwal while Modi &amp; Shah get a free pass.",2018-08-10 10:27:08
47,"Insecure, Egomaniac, Narcissistic and Desperate. Modi has managed to create a fake image of himself and now his army of bhakts and cybersena are desperately trying to protect that image online. 

I'm just curious, are they watching reddit too? that would be fun.",2018-08-10 11:00:46
48,"Not only that, those assholes bombarded the groups with their pro-modi stupid messages and propagandas but now in last one year suddenly all the groups became non-political as Modi's charm started to fade away and people realized whatever they were boosting as modi's success were actually his stupidity.

Now, one single post you make of an article or news that criticizes the lord and all of them start saying to keep groups non-political.",2018-08-10 11:28:00
49,And what will you do if they complain it to their modi police? They are not worth your time.,2018-08-10 11:46:24
50,"RSS did participate, but secretly. It happened that once Nehru complained to Rabindranath Tagore that Geetanjali should be renamed to Srimadbhagavatgeetanjali or else he would join Muslim League.  This irked Tagore because the name was too long. He quit Congress and joined RSS. After that Bhagat Singh joined RSS because Bhagat Singh was a fundamentalist Hindu and because he said, ""Mandir wahin banayenge"", he was hanged. The British judge was secretly a Muslim. This injustice inspired Subhash Chandra Bose to join RSS. It is written in Amar Chitra Katha that when Bose met Hitler in Berlin, Hitler gave him 2 options: (a) SS \[foren\] (b) RSS\[desi\]. Bose asked what the extra R was for? Hitler replied, ""R stands for Rickety"". That helped Bose to make up his mind. Once Gandhiji also wanted to join RSS. But it was that Nehru who brainwashed him to stay in Congress. Even Sarojini Naidu secretly joined RSS during Quit India movement and wrote the following poems:  


My dead dream of India

In Praise of RSS

To the God of Pain in the Ass

Life in Sakha

Past and Future of Hindutva

The Congress's rival

The Coromandel rioters  


So, Narendra Modi is correct in pointing out the contribution of RSS in our freedom movement. He should in fact teach History in Cowford University. Oxford can't do justice to his knowledge. ",2018-08-10 13:00:50
51,"this was written by Punya Prasun Bajpai who recently quit after 14 years working for ABP news. its just a **sucker punch** at BJP (Modi &amp; Shah), which is childish.

Politics is not clean people get murdered, disappear or worse. He was pressured to not say anything directly against those two, which is wrong but not illegal, I mean their finances depends on a network which needs support of people in power.

Its the oppositions role to fund the machine when not in power to keep uttering against people in power. That's what I actually hate, not the goon, Hinduatva and blatant racism of BJP &amp; RSS but utter stupidity on part of Opposition.",2018-08-10 13:07:40
