,article,article_date
332,"&gt; Why would the BJP government choose an 87-year-old Indira Gandhi loyalist, with links to leaders of the erstwhile Soviet Union, for its first big-ticket appointment in the Ministry of External Affairs (MEA) — as president of the Indian Council for Cultural Relations (ICCR), the country’s cultural interface with the world?


&gt; The answer becomes clearer when Chandra begins to list the qualities that he admires in Prime Minister Narendra Modi. For Chandra, Modi is a “man of ideas, not of ideology”; who from a practical point of view “supercedes” Mahatma Gandhi; who has made “a much more meaningful impact” on the lives of the poor than Karl Marx; and who is virtually an incarnation of God (“woh bhagwan ke avatar hain”).",2014-11-01 13:02:57
333,I have a test tomorrow. Have to study. Will chip in later for the science education and promotion part. Let the modi fanboys and modi haters fight it out!,2014-11-01 13:22:49
334,Not a Modi fan. But I think the logic of this post is Swami-esque level misleading.,2014-11-01 13:56:33
335,"&gt; Followers of the most corrupt party in the history of independent India.

agree with you on this, look at Modi who made billions by selling tea and used that money in his campaigns and marketing to fool people. #respect

",2014-11-01 13:56:45
336,"&gt;”He (Modi) kept a fast for nine days (during Navratra), and kept working, woh bhagwan ke avtar hain (he is an incarnation of the God). This shows he has great attachment to values, and India is based on a value system. He doesn’t have any foreign back accounts and black money. He doesn’t have a son or a son-in-law. For him, the country is his son and son-in-law. India needs such a PM.” -",2014-11-01 14:21:48
337,"Or you know, allow multi brand retail FDI.

Which was killed precisely because the middle men didn't want any competition.

I've gone over this topic on this forum too much to really give detailed long form answers.

Modi killed retail FDI in favor of his vote base. There's talk about ""alternative"" models to achieve the same goals that gets brought up. But the fact is that direct competitor from experienced players was stalled in favor of vested interests.

And before anyone gets onto their high horse about how "" we don't need foreign help to do retail, we can do it on their own"" - talk to me after you actually read the proposed retail FDI bill which was shot down. 

If there ever was a bill that over favored india, it would be the bill which was killed. The bill was hugely pro indigenous market development and would have crushed the middle man.

Middle men who mind you - haven't taken the step to combine a refrigeration unit with a warehouse for over 3 governments. 

I was quite surprised by their political capital - they managed to push back reliance and they managed to stop pro competition reforms.",2014-11-01 14:22:03
338,"&gt; Funding

that was not mere funding, it was highest amount of money ever used by a politician in campaign. they were never in power hence seem less corrupt. check situation in MP. And btw, Congress is fast cleaning up, these old congressis are already out of main routines like diggy etc. and fyi, there are already such 116 opportunist congressis are in lok sabha. thanks to modi for adopting them. ",2014-11-01 14:28:14
339,"&gt; they were never in power hence seem less corrupt. 

INC was in power, and we know what they did.

&gt; check situation in MP.

What about it?

&gt;  Congress is fast cleaning up, these old congressis are already out of main routines like diggy etc.

Strange then, that his is the only interview appearing in ToI today. 

&gt; there are already such 116 opportunist congressis are in lok sabha.

Are you hurt by them not wanting to serve the family forever?

&gt; thanks to modi for adopting them. 

Keep thanking him. You're gonna be doing it for 9 years more.",2014-11-01 14:48:52
340,"&gt;we know what they did.

I also know how modi gifted lands to adanis...ohh sorry, it was not corruption, it was funding.  Modi is not a saint.

&gt; Are you hurt by them not wanting to serve the family forever?


so they are honest now for you. I am glaaad.


&gt;What about it?

very recently VYAPAM scam. 

 Crime rate. MP tops in crime rates in India. 


&gt;Keep thanking him. You're gonna be doing it for 9 years more.

let time decide. 
",2014-11-01 15:01:33
341,"Most people simply say someone is a troll because they do not know how to debate them with logic. I am confident in my intelligence. It is only rational thought that can take human society forward. Not belief in extreme right-wing ideologies, such as those espoused by Modi and his cohorts.",2014-11-01 15:27:06
342,"&gt; I also know how modi gifted lands to adanis...ohh sorry, it was not corruption, it was funding.

So is that the modus operandi of every Congressi everywhere? Lie, lie, lie till it gets accepted as the truth? He clarified this on national TV. I would bother repeating it if you would stop spouting that lie, but I know you won't, so I won't bother either.

&gt; Modi is not a saint.

Are you in middle school? Two comments above I agreed that everybody is corrupt. INC is just the worst.

&gt; so they are honest now for you. I am glaaad.

Dude, please come back on Reddit after getting a real certificate from a real school. Maybe education might help your comprehension.

&gt; Crime rate. MP tops in crime rates in India. 

Right, cos crime everywhere else is under control. Also, source.

&gt; let time decide. 

Keep Rahul Gandhi in charge and it'll be for 14 years more. Oh wait that's right, y'all can't look beyond the first family.",2014-11-01 15:28:42
343,"It is sad that you think this is satire. There is no comedy in the left-wing. It is a serious struggle against religious bigotry and authoritarianism. Mark my words. If India does not wake up to the encroaching absolutism of the religious right, it will descent into a dark age that is ruled by Hindu authoritarians like Modi. I fear that that dark age has already started.",2014-11-01 15:31:18
344,"I am curious why everyone thinks I am a troll. I am trying to promote rational thought and provide my logical points about the dangers that India faces from right-wing authoritarianism by people like Modi and parties like the BJP. For this, I am being called a troll? I think you are taking the easy way out because you cannot debate me.",2014-11-01 15:32:14
345,"I agree with you 100%! You are the first voice that has not mocked me. I think people here are simply scared that a younger person is able to out-debate them.

The campaigns by Modi are populist measures designed to distract the population from the encroaching Hindu authoritarianism. ",2014-11-01 15:34:11
346,"What, are we worshipping Modi now?",2014-11-01 15:36:17
347,"&gt; Cos he didn't clarify that on National TV

wow so funny. A. Raja has also clarified. Modi is defending himself. CAG has accused him of causing loss of several thousand crores. please excuse me on that, honesty part. and its not like adani and ambani are giving him those thousand crores in good-will. 

&gt;No, not another code monkey.

yes there are software coolies, but programming is much beyond that. its about maths. so please, for fuck sake, don't generalize here as well. I asked if we could have a healthy discussion on technology, so that you can measure how ""uneducated"" i am. anyways. 
",2014-11-01 16:08:23
348,But Modi is pretty average,2014-11-01 16:11:41
349,"I read an interesting article which is related to the point you're raising. Most political parties try to align themselves with national heroes and try to bask in their achievements. Congress and BJP are no different. Like /u/cameovermyself said, don't choose sides, just enjoy the show.

&gt; [Why it’s so easy for Modi to appropriate icons he’s opposed to (and why Indians buy 'Mein Kampf')](http://scroll.in/article/684915/Why-it%E2%80%99s-so-easy-for-Modi-to-appropriate-icons-he%E2%80%99s-opposed-to-(and-why-Indians-buy-'Mein-Kampf'))

",2014-11-01 16:22:44
350,"As far as Modi and Shah are concerned media's been producing 'news' out of rumours and lies for many years, from what I have seen.

For example, I remember those articles about him not knowing history and mistaking Chandragupta Maurya's identity or such? In the actual speech he said no such thing.",2014-11-01 16:46:56
351,"A fair point raised..  do you have any clue on the fiscal deficit figures when the baton was handed over to the Modi Government June ?

Nationalism is not about defending the Modi government on whatever it does, same way as opposition should not be a massive circlejerk on every single account. 

A large part of the nation has huge expectations from the present government and one can only hope for the sake of our future that the government would deliver on its promises  on a prioritized basis. 

Let's talk about fiscal deficit numbers and their trend two years from now.. and if they haven't reduced, it would start to show up on our currency, borrowings, credit ratings and a lot of other parameters.. . which would drive away industry - the basic plank of the development dream. This dream is too big to fail.

",2014-11-01 17:02:51
352,But but Hindu India under Modi+RSS should be the same as Pakistan. Why has the sickular opposition not been beheaded till now? ,2014-11-01 17:59:04
353,"Dude, you should tone down your way of expressions. I was prone to unintended hyperbole like you and came around. Also things aren't as black and white as you think. Your language just sounds exactly like a mix of troll and satire. I'm just being honest. Go with similar attitude in anywhere in reddit and you will be treated as same. 

A majority or at least a major chunk of modi supporters wouldn't be quiet if he deviated from the secular traditions and opted an overt Hindu policy. Nobody knows what is in Modi's mind but I'm not convinced he is as stupid and saffrony as Advani. The only major risk to Indian government right now is the possibility of modi dropping dead and  his vacuum being filled by moronic cesspool that is  the rest of BJP.  Modi convinced an entire nation that he is the right one for the job and he looks like he may be. Don't be a blind fanboy to Congress or any other party.  You are being the very force you fight against. Even the masses of poor and uneducated are smart to some degree these days. I've voted on few elections and quote surprised how the masses are smart enough to vote and successfully elect entirely different parties to local, state and central levels(same day) evaluating how each party's manifesto and candidates would be better placed in different levels for the best results. While I was being a dumb fanboy and gave all three votes to same party. If politics seems that simple to you, you should reevaluate your stance. ",2014-11-01 18:34:20
354,Modi has a vagina. :D,2014-11-01 19:49:55
355,Modi transcends our three-dimensional world.,2014-11-01 19:53:01
356,"[Full Mirror](http://i.imgur.com/fyuVM5U.jpg)

**Summary**: Even as India and Pakistan were exchanging fire across LoC in J&amp;K earlier this month, the two countries had track-II diplomacy going simultaneously in a tony Dubai locale.

**Content**: NEW DELHI: Even as India and Pakistan were exchanging fire across LoC and the international border in J&amp;K earlier this month, the two countries had track-II diplomacy going simultaneously in a tony Dubai locale.Attended by former ambassadors and? prominent members of the civil society from both sides, the track-II Dubai Dialogue Group discussed ways to deal with any fallout of another 26/11 type of terror strike in India with assistance from any Pakistani state or non- state actor. They also focused on what the two governments could do to keep dialogue going despite the recent cancellation of foreign secretary-level talks.The meeting took place with the knowledge of the Indian government . ""We discussed all issues including J&amp;K, terrorism and Afghanistan. The MEA (ministry of external affairs) was kept informed and we will soon give a report to them (about the dialogue output),"" Gen Ashok K Mehta, the convener of Dubai dialogue, told this newspaper.A file photo of Prime Minister Narendra Modi with Pak counterpart Nawaz Sharif in Delhi.While the government is not associated with the Dubai group, its approval for the same to go ahead in difficult circumstances is significant as it came at a time when neither country seemed sure about how to move ahead.India cancelled the scheduled August dialogue because of Pakistan High Commissioner Abdul Basit's meetings with Hurriyat leaders and the Narendra Modi government is not expected to make any concession at least until the J&amp;K elections.At the same time, Pakistan has announced that any proposal for resumption for dialogue, in whatever form, has to come from New Delhi as it was India which torpedoed the fledgling dialogue resumption process. Many are looking at the upcoming Saarc summit in Kathmandu as an opportunity to start afresh with a bilateral meeting, or at least a short pull aside, between Modi and Pakistan PM Nawaz Sharif but so far neither country has even dropped a hint about any such proposal.The Dubai track-II group was formed in 2003 taking into account the Parliament attack and the subsequent Indian army build-up? which sparked fear of a full-scale war. According to Mehta, ?the format was tweaked a bit this time to focus mainly on ways to deal with likely consequences of another Mumbai-type adventurism by any Pakistan-based state or non-state actor. The Modi government, as India's response at LoC/ IB made manifest, would certainly like to be seen as responding to such an attack with a lot more spunk than what was witnessed under the previous government. Mehta though said the change in format had nothing to do with a more assertive government in place here.The Dubai dialogue also had representatives from Kashmir from both sides. Apart from Mehta, ambassador Jayanta Prasad also participated in the dialogue. The Pakistani delegation was headed by Humayun Khan?, former ambassador to Afghanistan. The group has met every year since 2003, including days after the Mumbai attacks, to look at ways to improve relations.

*[Send Message to owner](http://www.reddit.com/message/compose/?to=padmanabh) | [Github](https://github.com/lekhakpadmanabh/ToIBot)*

",2014-11-01 20:16:55
357,"so for next two years, it didn't see sunlight under vajpayee govt... who made this publicly accessible ? I think you are commenting because of your hatred because when at first place, I am talking about giving credit to people for good things irrespective of their party.

In an unrelated note, Modi is following several UPA policies (which he used to oppose because of greed and lust of power),  but people give credit to Modi for that.",2014-11-01 20:26:45
358,"I agree that UPA was instrumental in implementing it.

However it was not their idea or something they came up with.

&gt; I am talking about giving credit to people for good things irrespective of their party.

:) all evidence to the contrary.

&gt;In an unrelated note, Modi is following several UPA policies (which he used to oppose because of **greed and lust of power**)",2014-11-01 20:50:31
359,you forgot to include Modi,2014-11-01 20:55:17
360,"&gt;:) all evidence to the contrary.

I said that because you tried to twist my simple and honest comment. 

now when we are at, what do you think it was that made Modi blatantly oppose UPA policies / schemes during campaign (which he adopts later) other than greed and lust of power ? national interest,  ummm no.",2014-11-01 20:55:39
361,"Do you even har har modi, mitr?",2014-11-01 21:01:39
362,Why do I get the feeling that these chutiyas are big fans of Modi?,2014-11-01 21:20:18
363,"Yeah because that's the only possibility. In a state where Congress is ruling , ofcourse it has to be Modi's men to create such havocs. 

And the answer to your question in a non-sarcastic manner is : It's because of your political inclinations and hate for Modi. Ped se patta bhi gire toh hay hay Modi , murdering environment bolne walo mein se ho aap.",2014-11-01 21:25:14
364,"well any case lets hope because its technically a probe into congress? i think? so pls do this modi saar, however he isnt even incharge of all this, he has more important stuff to do, lol",2014-11-01 21:27:34
365,"Vote for Modi-ji. He is going to bring 'achche din' for us poor folks.

And also bring back all the black money.",2014-11-01 21:31:55
366,"Feel free to downvote the skeptic in me : 
A bit late in getting to the Sikh votebank for Delhi elections. Modi and BJP with their actions this week have already taken steps towards the Sikh community. This seems like more of an afterthought to save whatever they can. ",2014-11-01 21:43:37
367,"Kejriwal promised Varanasi that he will do something for them even after the elections.

&gt;Addressing a public meeting after the roadshow that continued for over five hours, Kejriwal said, “This election is being fought by both Hindus and Muslims and BJP’s Prime Ministerial candidate will suffer a defeat by a margin of two lakh votes following which BJP will be finished”.

&gt;He also claimed that Congress leader Rahul Gandhi was losing in Amethi to AAP’s Kumar Vishwas by at least one lakh votes, after which Congress will “disintegrate into pieces”.

&gt;The AAP leader said that regional leaders like Mulayam Singh Yadav and Jayalalitha may try to form a government this time, but it will fall apart within one or two years. Thereafter fresh polls will take place and AAP will get a clear mandate to form the government, he said.

&gt;“I know you will support our movement to clean the system. I had gone to Rohaniya and adjoining areas and got the impression that 70 per cent people will support AAP,” he said. Kejriwal alleged that Modi was doing politics even on Ganga Arti. “He spoke lies. He was given permission to perform Ganga Arti, but he did not do so. I performed Ganga arti along with my wife yesterday. Nobody prevented us,” he said.

&gt;The person who is trying to exploit Ganga Arti for political mileage and politicising the issue, that person should not be supported, he said.

&gt;“**He came by helicopter before elections for two hours, do you think he will come here after elections.I will always be with you. I will be always there for Kashi and be with you to help you.** This time helicopter politics will not work,” he said.

",2014-11-01 22:33:53
368,"So, basically you have no intellectual honesty and just want to use whatever issue you can find to throw some muck at Modi. Even such a serious issue as farmer suicides. No point talking to you",2014-11-01 22:34:50
369,"ITT: City kids who have never laid foot in soil giving farming gyan to farmer.

Sorry OP from the rest of us sane folk. People are allowed to not want to give a blowjob to Modi (I think).",2014-11-01 22:39:45
370,"What horse shit is this? Change.org is used to petition online for change regarding something, not *HURR HURR MODI MODI*.",2014-11-01 23:01:55
371,"lol , no one likes uncomfortable questions be it Modi or Vadra ",2014-11-01 23:16:51
372,You are the one who is comparing farmer suicides viz. deaths. Point me a comment on this thread where I blamed Modi? ,2014-11-01 23:20:32
373,"&gt;Modi and BJP with their actions this week have already taken steps towards the Sikh community.

Is it similar to the steps they have taken towards the Muslim community in Gujarat?

'Rip out an unborn baby from the mothers' womb.'

'Unleash the murderers and rapists on any Muslim in Gujarat.'

'Try to suppress any news of the atrocities in Gujarat 2002, in the name of nationalism/patriotism.'",2014-11-01 23:21:33
374,"Not disputing that. Both of them are engineers / scientists though. IIT's are well respected for engineering / science (as they should be), my question is why this general 'cool'-ness should extend to anything beyond engineering / science. Christopher Nolan doesn't have anything to do with Engineering. 

tl;dr: 

if engineering / science: go crazy and invite anyone related to the field, they'll probably show up 

if anything else: stick to desi cool - C Bhagat, Modi, Kejriwal, Raghu from Roadies, All India Bakchod, Pentagram, Deepika Padukone, SRK, Salman Bhai, Arnab, Rajdeep, Sachin, Virat Kohli, .... you get the picture. People who are well known in India but aren't anything great outside.  
",2014-11-01 23:47:37
375,"Agra Muslims are communal. Agents of Modi.

/s",2014-11-02 00:08:44
376,"exactly, these journalists should ask questions to modi who is in power..but at that time, these chutiyas were busy in selfies and now asking vadra to answer..why the fuck vadra should answer.. go and probe..ask govt to probe..majak bana raha rakha hai bhencho",2014-11-02 00:13:39
377,"Agra Muslims are communal.Agents of Modi.
Janta is communal.Agents of Modi.
Modi is an Ambani/Adani agent.

Sab mile hue hain ji.",2014-11-02 00:23:44
378,"I'm no modi bhakth, but i simply could not understand why news laundry writes articles such as these http://www.newslaundry.com/2014/10/28/how-modis-ancient-science-could-rewrite-history/    

It feels more like somebody's personal blog, not a news outlet. A lot of news laundry's articles are filled with useless criticisms which are not constructive in any way. They might not be indulging in the same kind of cheap tricks and other media outlets, but they do write some cheap stuff.",2014-11-02 00:33:29
379,"this is insanely stupid..he pushed down mic and that's it..how is this an attack on journalism.

these are the same honest and brave journos busy taking selfie with modi instead of asking questions..because they can't dare to.",2014-11-02 00:43:55
380,thanks to modi ji,2014-11-02 00:59:59
381,"Translation :

In this video, an interview session is going on in a flight. The journalist suddenly starts asking uncomfortable questions to Modi about riots and his role etc. Modi decides to keep silent on it. 

Didn't say ""Dosti Bane Rahe"" though.",2014-11-02 01:28:45
382,You aggrandize yourself despite showing no signs of intelligence here. You present no evidence of your claims that India is becoming some playground of the right-wing. You present no evidence that Modi is as bad as you say he is. You throw your support behind partisan hacks like Arundhati. What is all this if not a joke?,2014-11-02 01:43:24
383,"In all this...that great unsung PM, a true nationalist...PVN Rao will get buried. Sonia and co have already buried him, Modi most likely won't care...and this is very sad because as a nation we owe him a lot. We could have been Mugabe's Zimbabwe but aren't thanks to him.

That said, I think Modi is being churlish here. All said and done (as much as I hate her) Indira was a PM of this country who lost her life in service to the nation (sure, her son started the whole fuckin thing by patronizing an unknown Bhindranwale for petty gains)...but she was still our PM. A mention and a wreath. Also this kind of churlishness one can expect from the fake gandhis, but Modi is a bigger person.",2014-11-02 02:00:37
384,"No, that's incorrect. The plant was mired in tax disputes (before Modi) and was never sold to Microsoft. ",2014-11-02 02:02:41
385,"Rao will also be appropriated one day, if and when his name evokes any emotion en masse. 


I hate that the Congress party, because of their hero worship (and to Nehru's credit, he was a *very* popular mass leader) began to propagate a very unbalanced emphasis on various national figures. I don't think they should've tried to co-opt them since all of these people - from Patel to IG - belong to the nation. The same goes for former prime ministers... who cannot be treated as the properties of their respective parties. 


And I don't think Modi should try to act as the arbitrator of legacies, either, because he, or those who will follow him, are vulnerable to the same biases stemming from politics. Besides, legacies are incredibly complex (and might I add ""dynamic""). Eg: The relationship between Indira Gandhi and the Sikhs. 



Now, correct me if I am wrong, but to your point about Bhindranwale: weren't the Akalis in want of ""*azadi*"" when Bhindranwale was propped up against them? ",2014-11-02 02:16:55
386,"
[Full Mirror](http://i.imgur.com/MxKy00G.jpg)

**Summary**: Giving an idea of the nature of next year's Budget, Prime Minister Narendra Modi on Saturday said it should be ""full of new ideas"" with transformational and measurable deliverables.

**Full Text**

NEW DELHI: Giving an idea of the nature of next year's Budget, Prime Minister Narendra Modi on Saturday said it should be ""full of new ideas"" with transformational and measurable deliverables. 



 In an interaction with secretaries of various ministries and departments, he said the budget should be ""output to outcome-oriented"", inferring that investments should have measurable outcomes, sources told PTI. 



 During the interaction over 'high tea' at his residence, the Prime Minister reviewed the progress of work being done on various government initiatives, including the 'Swachh Bharat' and 'Digital India' campaigns, and asked the bureaucrats to take decisions without any fear while assuring his full backing. 



 While talking about the next Budget, he said it should have transformational and measurable deliverables. ""It should be full of new ideas,"" he said, in a hint of how the proposals should be.

*[Message Owner](http://www.reddit.com/message/compose/?to=padmanabh) | [Code](https://github.com/lekhakpadmanabh/ToIBot)*
",2014-11-02 02:34:22
