,article,article_date
0,Can you see a u-turn here: http://www.financialexpress.com/news/modi-slams-diesel-price-hike-hits-out-at-manmohan/1002427 ?,2014-06-01 00:13:06
1,"He may be a shit (even though he is still an elected leader) but that is up to the people to decide. What we should expect from a journalist is the facts not someones imagination. Now when you read another news, we wouldn't know what to believe and what not to believe.

This is not the first time. The 'puppy' remark of Modi or several remarks of Rahul Gandhi and Kejriwal is taken out of context. You have the right to be outraged as this has been a long standing problem and especially state like UP should fix their law and order problems (Unfortunately for most of the people it will die down after a week or two.). My simple point it dont let anyone interpret the news for you. News agencies may have biases, they may choose to report or not report certain news, they may interpret the news(to an extent because personal opinions cannot be avoided) but imagination is unacceptable. ",2014-06-01 00:13:30
2,It was a fuck-ton of spam-ish posts by him saying Christians of Goa are about to get mass-murdered by Modi.,2014-06-01 00:28:51
3,Modi moving fast ,2014-06-01 00:57:49
4,"1. Jairam Ramesh said it first and the very same people who are jerking off to this quote from Modi were upset and saying shit like: 'Y HE NO SAY MOSQUE, FUCKING PORKISTANI!!!'

2. He's the PM now and we should judge him by what he does and not what he said he'll do months ago.",2014-06-01 01:03:42
5,"Din't the AAPtards shout ""Sheila haari hai, ab Modi ki baari hai"" when they got 28 seats in Delhi? What happened bro?",2014-06-01 01:31:33
6,This guy is just mad that Modi left him out of the circle. Thank god that Modi was smart enough to leave this buffoon out. ,2014-06-01 01:49:11
7,... and that is the reason he was left out in the cold by Modi. Guy's gotta know when to stop the motormouth.,2014-06-01 02:02:08
8,What happened? He was full of praise for Modi just last week.... seems to be a joke!,2014-06-01 05:29:00
9,"100 party system is not democracy. Its crap.
2 is probably over reaction.  But not more than 5 would be appropriate. 

Americans have more unity because of the fewer number of parties they have.
and its not just 2 parties that exist legally in america.
people usually vote for donkey or elephant. 
Don't believe what all you see on liberal media.

They don't actually believe their method of voting (two parties only) isn't working. If it wasn't working, they wouldn't have a stable democracy for over 75 years (ignoring the beginning of 20th century).

2014, indian electorate was united by only one factor - Modi factor.
Except this time last 3 decades of india's elections have seen coalition governments. I am not sure you understand what happened because of these coalition Governments. Power of the central government dilutes.

Please give due thought before dismissing the idea.",2014-06-01 05:33:42
10,Thanks a lot Modi!,2014-06-01 06:43:48
11,"Dear AAP supporters,

Please stop writing self-righteous, smug, condescending letters telling everybody what is right for them. We can think for ourselves. Most people who supported Modi did so because they saw his work in Gujarat and appreciated it. They did it *despite* the media's persistent attempt over the last ten years or so to paint Modi as Hitler and to corner him in 2002 riots. Voting for someone because he has performed well is an excellent reason to for him. Instead of congratulating them for this, you choose to belittle their wisdom as ""manufactured opinion""! 

You know what is a manufactured opinion, you unexperienced, half-baked p.o.s.? The Lokpal bill. 99.99% people who support this bill do so not because they ever studied the bill in detail, or have thought about the problem of corruption with any seriousness, but just because there was a mass-movement which evoked strong feelings that was asking for this bill and which dominated media headlines for months. You want another manufactured opinion? That the lying, manipulative idiot Kejriwal is an honest man. Seriously, what did he ever do to deserve this image? How did he become the icon of honesty? Because media told us so. Just watch this [video](https://www.youtube.com/watch?v=WEpjDSX3l8U). Now that people have seen enough of him to know that he has nothing constructive to contribute to our polity and have moved on, you say they are ridiculing them because they are told to? No sir, the only manufacture opinion here is the one you hold.",2014-06-01 07:12:44
12,apparently it is true. Ambani purchased network 18. but why bhakts care. U know. modi ambani friendship.,2014-06-01 08:18:50
13,"The reason Subramanyam Swamy has so many supporters is because he is what stupid people think smart people sound like. I'm not the biggest fan of Modi, but am I glad that he didn't fall for this buffoon. ",2014-06-01 09:28:55
14,nah bro. Even BJP-Modi bhakta butthurt is high. This guy is impossible.,2014-06-01 09:56:39
15,"Well said. But it will fall on deaf ears. The people who are pro Modi here will never get your point. 
As you said, we are also moving towards a system where power is concentrated in the hands of a few rich people. Unfortunately the majority is too stupid to know or care.",2014-06-01 10:59:13
16,"Does this stuff really matter?
So much has been said against Modi and BJP but they just keep marching down their line. I expect that to continue. Owaisi will have to accept the outcome of Modi as PM and whatever he brings with it.",2014-06-01 11:02:36
17,"And this: http://ibnlive.in.com/news/rahul-failed-to-connect-with-the-people-says-kerala-home-minister/475824-62-126.html

Its a bit weird though. Kerala was the only place where in pre-election surveys, people preferred Rahul to Modi as the PM. And one of the new states where the party gathered up some seats.

",2014-06-01 11:29:14
18,"Sweet mother of God, that was quick. Modi is in a hurry. Good for him. Good for the nation.",2014-06-01 11:45:54
19,"&gt; you don't seem to understand how manufactured opinion works.

Is it manufactured opinion only when there is some big corporate that is creating it? I don't like using this term because it is heavily loaded (basically because of consistent abuse at the hands of idiots who like using catch phrases to lend credibility to their half-thought arguments), but if I had to, I would use it to mean any kind of opinion that has been created through a systematic campaign, with the people who form the said opinion are not convinced by logic or argument but by other means (e.g. media bombardment, groupthink, emotional manipulation etc). 

With that said, there is no question in my mind that the people's opinions regarding Janlokpal bill and Kejriwal are ""manufactured opinions"". Most people had never even heard of either before the massive media coverage of the anti-corruption. People were enraged at the extent of corruption that was getting exposed during UPA rule and the media just fed us with a magic solution that will cure the country of corruption and a messiah that will help us get that magic solution (earlier Anna and then Kejriwal). Media has been hand-in-glove with AAP from the start (Ashutosh, PP Bajpai and Rajdeep come to mind). How is this *not* manufactured opinion?

&gt; Start by looking how much the media hyped Gujarat, and which media did so, and who owns them, and maybe what they have to profit in doing so.

People had started talking about Gujarat much, much before Modi was made the PM candidate in 2013. The first time I had heard about Gujarat was at least 5 years ago when my Uncle (in air force) got transferred to Gujarat and had only the highest adulations for the way the government worked there. Most people had heard some or the other anecdotal stories like that even before the campaign.

Also, I would like to question your (unstated) claim that the media coverage around Gujarat was entirely (or even predominantly) positive. Modi forced the media to talk about Gujarat by harping about his Gujarat model of governance. However, most of the times, IIRC, while media accepted the (undeniable) economic growth story of Gujarat, they usually followed that by accusing the Gujarat model of governance of not being ""inclusive"" and lacking in important human development indices. And who can forget the decade long campaign of the media against Modi vis-a-vis his role in 2002 riots? 

Finally, on the point of business houses funding Modi's campaign and what profit they have in doing so. First of all, I would like to point out, that is itself a manufacture opinion because I can bet my ass that (1) you weren't asking this question before it came up through the AAP propaganda machinery channel, and (2) you haven't really thought about this question on your own at all. If AAP, a political fledgling with ~2% national vote share, can get donations of more than 50 crores in less than a year time, is it that hard to imagine that a mature, national party, which is likely to win elections after 10 years of Congress rule, will find many, many genuine donors? I know a local businessman in Patna who donated 5 crores for Modi's Patna rally alone. People were *really* fed up of Congress misrule man.",2014-06-01 12:20:56
20,"&gt;     please do not believe everything the media tells you

if we had believed, RaGa would be PM and Modi in Jail.

people had eyes, ears and brains and they used it inspite of inaccurate media bombing
",2014-06-01 12:26:51
21,No problem. There is an army of people like you who will ignore all real issues like these and only rake up whatever petty matter they can use to bash Modi.,2014-06-01 13:11:38
22,"AAP won seats only where BJP didn't file a candidate and not because biggie stayed away from.  

Mark my words if AAP want rise up again they will have to start with the city  municipal cooperation elections. Narendra Modi did this to increase BJP base in Gujarat in earlier years.",2014-06-01 13:30:14
23,"&gt;The buzz inside 10 Janpath is that people will be disillusioned with the Modi government sooner than later and come back to the Congress fold. It is being said that the outcome of the state polls to be held later this year may demonstrate the preference for the grand old party amongst voters as the BJP is bound to falter. The misplaced optimism is based on the presumption that if the party could make a remarkable recovery in the late 1970s when both Indira Gandhi and Sanjay Gandhi had lost their seats, why cannot it do so again?",2014-06-01 13:55:39
24,"His brother had challenged Modi ""We'll see how you'll become Wazir-e-Azam (without our support)"". Now BJP has clear majority without a single Muslim MP. I say the BJP should thank Akbaruddin Owaisi for the venom he spewed. 

MIM has so much heartburn now, I almost feel pity for Asaduddin. But the monster doesn't deserve it.",2014-06-01 14:28:21
25,"&gt;They did it despite the media's persistent attempt over the last ten years or so to paint Modi as Hitler and to corner him in 2002 riots.

This seems to be a typical BJP-supporter cry of self-pity, the media is against us

&gt; Instead of congratulating them for this, you choose to belittle their wisdom as ""manufactured opinion""!

Congratulating whom? He has won the elections, he is the PM. How do congratulations matter?

&gt;You know what is a manufactured opinion, you unexperienced, half-baked p.o.s.? The Lokpal bill. 99.99% people who support this bill do so not because they ever studied the bill in detail, or have thought about the problem of corruption with any seriousness,

99.99% - stats coming out of thin air?

""You know what is a manufactured opinion, you unexperienced, half-baked p.o.s.? The Lokpal bill. 99.99% people who support this bill do so not because they ever studied the bill in detail, or have thought about the problem of corruption with any seriousness,""  - That is again your opinion

&gt;That the lying, manipulative idiot Kejriwal is an honest man

If Kejriwal is an idiot, then I am not sure what to say about the other politicians who are in the government right now.. So Smriti Irani is better than Kejriwal?

&gt;Seriously, what did he ever do to deserve this image? 

You have absolutely no clue about the grassroots work done by him.. Remove your colored glasses, and read more about Parivartan.. 
The Ramon Magsaysay award is not given to everybody

&gt;How did he become the icon of honesty? Because media told us so

Tell me one dishonest thing done by him, and I would agree with you. When you have people like Yedurappa in the BJP party, and Nitin Gadkari as a cabinet minister, I am surprised to see your moral high ground.

I appreciate your faith in Bhagwan, but sometime it helps to think critically
",2014-06-01 15:58:36
26,It's possible to not be a fan of both the dynasty and Modi.,2014-06-01 17:33:21
27,"Free run for Modi without RSS agenda means no ""temple run"".. only ""development run"". .",2014-06-01 17:36:37
28,"This is the exact attitude that the OP is ranting about. AK is not infallible. In fact he was the worst amongst the candidates for the PM's post. And Modi by far was the best. The issue people voted for was not  corruption. It was  development and AK had nothing to show for it. He didn't even follow his own agenda of anti corruption.

If you think the OP is ranting about media then you're wrong. His point is despite everything against Modi, he had something to show to the people. Not hot air.",2014-06-01 18:02:21
29,I agree. Gadkari/BJP plan on ethanol is BS. Ethanol never was an alternative fuel. We can grow food crops instead of fuel crops that will be converted to ethanol fuel. Hope they reconsider this. Wrong move BJP/Modi.,2014-06-01 18:34:07
30,"The fact that such a toxic comment is being upvoted shows this subreddit hasn't changed at all. Immediately jumping to a conclusion that this thread was made by an AAP supporter, personal attacks, defending modi out of nowhere, luring hypothetical questions, just what the fuck.

What redditors could do here is downvote these toxic comments before trying to start a debate, debating on the basis of toxicity like this only makes matters worse. I request the /r/india mods to have a zero tolerance policy on direct personal attacks/different party attacks etc., though this seems low profile but it just adds fuel to fire.

p.s we needed this thread before/during elections.",2014-06-01 18:40:57
31,Abbe tere chutiya comment pe comment maarne se defender/shill nahi ban jata koi. Thand rakh...modi aa gaya hai..keep calm and 24/7 lund choos,2014-06-01 18:41:30
32,"Good job PM Modi. ""Secular jholawalas"" are imploding with rage. I like this.",2014-06-01 18:47:57
33,"That doesn't mean that the migrants are the ones you start beating up.

For all the tensions that arise the scumbags should be screaming at the UP politicians for mismanagement. After all, these guys, for all their rhetoric, vandalism and violence, do care about the integrity of the nation while trying to preserve their Marathi identity.

Raj Thackeray did say in one of his interviews (either to Arnab or Rajdeep) that he wanted Modi to focus on bettering UP first. Maybe he should have, in his speeches, insulted the Yadavs, Mayawati etc for not bettering their state.

Absolutely nothing justifies avoidable violence. Before you give it the tone of our skirmishes and wars with our neighbours, remember that we were defending our interests when we were attacked first, and we were trying to uphold our integrity. In that case violence was not avoidable.

Also, I don't know who downvoted you. This is a matter of serious discussion where opinion should not sway the direction of votes, only content and presented arguments should.",2014-06-01 19:03:33
34,"&gt; AK is not infallible. In fact he was the worst amongst the candidates for the PM's post. And Modi by far was the best

This is again your opinion. AK is far better than RaGa.. 

&gt;His point is despite everything against Modi, he had something to show to the people. Not hot air.

Tell me one leader in the past thirty years, who has formed a party and won a state election in just one year..

How many years Modi has been politics? How large is BJP? How much money did they spend on elections? Modi was going all over India in a private jet.. AK was taking an overnight to Benares with his family.. it's grossly unfair to compare the two of them.

You show me one leader who has the courage to take on the incumbent parties. Show me one person, who within one year is considered as a third challenger apart from Congress and BJP.

You are comparing this to AK who just launched a party to a party which has been around for decades, which a well oiled machinery working for it, thousands of crores to spend, and leaders who have been in politics for lifetime.

It is very easy to beat a man when he is down.. but learn to admire the courage and self-belief which AK has shown. I am sure we all can learn something from him to better our own career and life.
",2014-06-01 19:09:45
35,"Inefficient yes, but it is getting better. For India which has a lot of sunshine (and often, much more than needed), putting up solar farms in barren areas will slash the oil bill, and cut down pollution hugely. If solar power is combined with LED lighting, that would help hugely too. I remember reading that if every house in the US switched to LED lighting, they could remove one power station.

[Here](http://en.wikipedia.org/wiki/Solar_power_in_India) is the wiki page on it. I am not saying that Solar power is efficient; I am saying that India has no choice but to go for renewables and solar.

Edit: Just saw the autowikibot's posting below. The 2.1 TeraWatt is where India needs to aim in solar. Of course, it should be treated like railway tracks are, that is, continuously upgraded over decades as the technology evolves.

Edit: to reiterate, solar farms can be situated near population centers because they don't pollute and transmission losses can be minimized. Also slightly off topic, putting a wind turbine on every transmission tower (or something like that) will go a long way too. [Here](http://peakenergy.blogspot.com/2009/02/buckminster-fullers-critical-path.html) is an article by Buckminster Fuller, originator of the geodesic dome. Quote:

&gt; Bucky's research led him to conclude that humanity could satisfy 100% of its energy needs while phasing out fossil fuels and nuclear power. In one example, he calculated that **a wind turbine fitted to every high-voltage transmission tower in the US could generate three-and-a-half times the country’s total power output at the time.**

If you have the polticial will, you can do all this, and maybe even more. That is why I am very hopeful with Narendra Modi at the helm.",2014-06-01 19:44:18
36,"Do a search for 

'Modi jokes' in this sub and you'll see two threads titled post election jokes",2014-06-01 19:49:12
37,"Not just Swamy. There are a lot of people that he's associated with. If you know about his work, you'd know who they'd be. Rajiv Malhotra is close to Narendra Modi, Arun Shourie, S Gurumurthy, Ram Jethmalani, Ajit Doval etc too. ",2014-06-01 20:26:26
38,"Good one,. But problem is adequate security is needed. And so are industries.

If done successfully, modi will reverse the seats of, pro muslim parties and help establish BJP as a powertul force up north",2014-06-01 20:34:33
39,"Readers of The Hindu must be confused. Nearly a decade of anti-Modi articles and suddenly so much u-turn, so much luuurve. ",2014-06-01 20:47:02
40,"I wonder what Modi sarkar will do with this guy. I remember his brother talking in in Hyderabad sometime back. ""Kai ka Modi, Kidhar ka Modi?"" [Check this video](http://www.tubechop.com/chop/wALlNEpF07Q)",2014-06-01 20:49:09
41,"Did you all personally go to Gujrat and assess how well Modi is performing? On one hand you tell OP not to speak for everyone , on the other you're doing the same yourself.",2014-06-01 20:53:42
42,"Akhilesh's views are very much like candidate NaMo - http://www.financialexpress.com/news/modi-slams-diesel-price-hike-hits-out-at-manmohan/1002427

&gt; Criticising the diesel price hike, Chief Minister Narendra Modi on Thursday said it would affect farmers the most.
“There have been deficient rains in some states...by increasing diesel prices by Rs 5 per litre, the government has created more pain for those who are already suffering,” Modi said, addressing a poll rally at Valsad in south Gujarat.
“The diesel hike will have a cascading effect and prices of all essential things will go up. This price hike will prove to be very bad for the farmers of the state where there is drought-like situation,” Modi said.
Targeting Prime Minister Manmohan Singh for the price hike, he said, “The prime minister is sinking the ship of this country.”
",2014-06-01 20:58:02
43,"Read that as ""Modi, can we please have flairs back?""",2014-06-01 21:03:00
44,Modi is not Shivraj.,2014-06-01 21:04:54
45,good ones! just make sure you time them perfectly. and some modi jokes also.,2014-06-01 21:20:43
46,"Well that's not the point here right, we were talking about Modi no? 

&gt;40-50 paise every month

We should talk about it when BJP does it continuously. Going by that thing *inflation* if you happen to know about it, this is something NDA inherited from UPA &amp; this 50 paisa hike could be attributed as it's result.",2014-06-01 21:29:23
47,Hmm Modi has been reading up on Art of War by Sun Tzu,2014-06-01 21:54:02
48,"Modi should sue him for slander for calling him a dog in public, as an elected representative.",2014-06-01 22:14:23
49,"No, but most people have met people who have gone there for some work and seen Gujarat first hand. 

&gt; On one hand you tell OP not to speak for everyone , on the other you're doing the same yourself.

First of all, I never told OP not to speak for everyone. I asked him to not be condescending to everyone else and pronounce their wisdom and choice as a ""manufactured opinion"". Secondly, I am speaking not for everyone, but for most BJP/Modi supporters. I know there is a group of crazy right-wing people who support BJP because of their xenophobic ideas, but I am sure that the majority of BJP supporters are not like that. If you just talk to people, your friends or even see what kind of responses people were giving all over the country on TV, you would see that there is much truth in that claim.",2014-06-01 22:24:54
50,Rahul needs the escape velocity of Jupiter to get so far away from our minds that we don't think of him. Don't blame us. His mother wanted this clown to be where Modi is today.,2014-06-01 22:31:58
51,"Well, if this doesn't happy, I'm gonna go complain to Modi ji. He will get medival on our mods' ass.",2014-06-01 23:05:41
52,"I still don't see how BJP supporters could play the 'help, mainstream media is against us' card. Other than notable left wing media like the hindu , tehelka or so, most media was figuratively yelling MODI! MODI! ",2014-06-01 23:48:42
53,"may be you should wait up a little bit. I'd say 2 yrs. But expect a lot more to happen within an year. at least 10 big encouraging moves are made by govt in very short time. let the parliamentary sessions begin. this term will be unlike anything seen before even if it don't act innovative but enough if just doesn't act lazy, and evidently Modi doesn't run lazy govts. we've tolerated incompetence for long thanks to spineless leadership in the past, a brief wait does no harm. ",2014-06-01 23:57:04
54,"One additional joke: ... Mamta asked when modi will fall in love. But modi will never do that, because he is against (sexual) congress. 
 ",2014-06-02 00:00:13
55,"Sorry but AAP walon ko logo ne jeeney nahi diya tha, ye alag baat hai ke Kejriwal Rahul The Wall ki tarah wall na ban paye. Regardless of BJP bhakts' hate for me for saying the last line, I am hoping for the best from Modi. I liked it when he said, ""no h8 m8s, lets do da deblubment"". Please do note, I was also waiting and hoping for the best when Shri Shri Kejriwal ji CM bane. Jai Mata Di!",2014-06-02 00:16:24
56,"My point is that you cannot trust the AAP. The founder did not have a good stint in his real day job. He used and dumped Hazare when he dumped his principles to win elections. He ran away when offered the chance to run Delhi. He suddenly decided that communalism was worse than corruption.

The younger demographic who has never seen the adversity of the seventies and the eightees is likely to look at Kejriwal in awe and see a great hope in him. To those of us who have seen those lost decades and lived through them, the ideas he espouses are repugnant. Between Modi and Kejriwal's coterie, it is a no-contest.
",2014-06-02 00:33:58
57,"in that case, Narendra Modi works for Illuminati which a secret state controlled only using Hitler's brain",2014-06-02 01:03:18
58,http://www.dnaindia.com/india/report-ticked-off-by-narendra-modi-bjp-mp-removes-father-as-representative-1992780,2014-06-02 01:13:04
59,though a modi fan lets be real. It must have taken months to test etc. so not truly the new govt thing.,2014-06-02 01:32:39
60,"Modi sarkar is going to do nothing different. if anything, they are going to make matters worse for us. India is going to go from a so called democracy to a full fledged capitalistic system, where the big businesses will flourish at the expense of the middle clad. period. ",2014-06-02 01:41:43
