,article,article_date
214,"I am surprised that in such an age of rationality, these countries want to follow pseudoscience like yoga. 

They should actually look to proven techniques from kinesiology.

It is troubling that a person like a person like Modi is promoting pseudoscience. No doubt this is part of a larger authoritarian pan-Hindu ideal.

**Edit:** The person who has downvoted me should actually debate me. But it's ok. It only proves that you do not have the ability to engage me in a debate.",2014-10-31 09:20:18
215,"Bohras are a business community from Gujarat, they are a very transactional people and have always supported Modi.",2014-10-31 09:30:36
216,"&gt; . Modi and doval are trying hard to counter the spread of wahabism with the help of bohras.

Proof?

Bohras are mercentile,that is all(even their name 'Bohra' is from an old Gujarati root meaning 'trader').",2014-10-31 09:40:58
217,"The US needs to engage India. But if you are able to pick up subtle nuances like me (I have been reading since I was 3 and that too at a higher mental-level than 99.9% of children my age), you will see that Kerry is actually saying is that he doesn't want to engage an extreme right-winger like Modi. I live in the US and even though I am still young, I am very interested in the political direction of this country. More so than my peers. This country is very much to the right and it is quite hard for intelligent, rational, liberal people like myself to live in an increasingly Christianized right-wing environment. So I think a liberal like Kerry can see that in Modi (but of course it is in Hinduism in the case of Modi). But he cannot say it outright because of the subtleties of geopolitics.

His comment is actually saying ""The US will engage with India but only when the Indian democratic system matures again to elect someone who is not an authoritarian right-winger"". We came close to that in the US with Romney and liberals like Kerry (which includes me) have seen that danger come to pass in India. As an Indian-American I am fearful for the future of liberal thinking in India.",2014-10-31 09:41:45
218,"[**@ANI_news**](https://twitter.com/ANI_news):
&gt;[2014-10-31 02:29:47 UTC](https://twitter.com/ANI_news/status/528010920048332800)

&gt;We cannot divide history &amp;amp; legacy according to our ideologies : PM Modi [*pic.twitter.com*](http://pbs.twimg.com/media/B1PfIfBCUAAKJu5.jpg) [^[Imgur]](http://i.imgur.com/XgR33UR.jpg)

----

[^[Mistake?]](http://www.reddit.com/message/compose/?to=TweetPoster&amp;subject=Error%20Report&amp;message=http://reddit.com/2kus8w%0A%0APlease leave above link unaltered.)
[^[Suggestion]](http://www.reddit.com/message/compose/?to=TweetPoster&amp;subject=Suggestion)
[^[FAQ]](http://np.reddit.com/r/TweetPoster/comments/13relk/)
[^[Code]](https://github.com/buttscicles/TweetPoster)
[^[Issues]](https://github.com/buttscicles/TweetPoster/issues)
",2014-10-31 09:47:04
219,"&gt;""Media is an embarrassment to themselves as well as to the PR officials of Modi who would be feeling insecure about their jobs""",2014-10-31 10:43:53
220,So where were you when a Sanghi like Modi said 'Sabka saath...'. Was that also a sudden realization of secularness pre-elections?,2014-10-31 10:57:06
221,Modi,2014-10-31 11:10:56
222,"What logic is this? 

If Modi/AK/Some Chutiya starts saying Internet cures homosexuality, then would you stop using it?",2014-10-31 11:28:22
223,"When has he ever said anything else? Be it his Gujarat campaigns or actual work? Don't forget Modi's communal Gujarat has the highest number of Cat A Muslim bureaucrats and according to the UPA's own commission, Muslims (in terms of per capita income etc) are much better of in Guj than other places.

If anything, he has been consistent in his sabka saath sabka vikas. So much so that it is believed that in the 2012 Guj elections, approx 30% of the Muslim populace voted for Modi.

AK? Moved from Congress down down, corruption down down to ""Communalism is the greatest poison"", his top party leaders were encouraging Muslims to be ""more communal"", he was seeking the blessings of Mullahs who had issued Fatwas on Taslima Nasreen etc etc.",2014-10-31 11:32:53
224,CM Modi always talked about all the power being centralized in New Delhi. Now PM Modi wants to take powers away from the most local bodies and give them to New Delhi?,2014-10-31 12:35:18
225,why you do this to us modi jee ,2014-10-31 12:45:11
226,"I am getting tired of all these Congress supporters and journos constantly saying media is sycophantic to Modi when the reality is so different.

When he called Mohandas Gandhi 'Mohanlal' by mistake even that got front page coverage. Black money, textbook revision, gas price increase, RSS editorials, love jihad... The NDA has been getting only negative news as far as I can see in any newspaper or news channel. The media is not holding anything back.

I am not sure what alternate reality the kind of people referred by the OP are living in. They have zero evidence that the media is pro-Modi. They(and the posters here on r/india too) just keep saying ***'Media is sucking Modi's balls, because.... Er, um... We said so and we'll keep saying it 10,000 times, remember Goebbel's Law!'***",2014-10-31 13:39:12
227,"I agree with you on first line. 

There is one more angle to it, weren't bjp/modi supporters going nuts on such things when UPA was in power. forget supporters, even Modi was doing this, making irresponsible statements. So I seriously think you people are facing heat of your own fire (you may or may not agree, but I believe, its a fact).

",2014-10-31 13:43:49
228,Now have Modi and the RSS communalized and divided 50 nations? ;),2014-10-31 13:46:03
229,"Well the prices of diesel is falling due to drastic fall in crude oil. Modi or the government didn't do anything in particular to reduce the price. Moreover, I feel that they should continue at the current price to cut the deficit that is present. I know it isn't a very populist view but loss making PSU are funded by your money.  ",2014-10-31 14:05:54
230,"I wonder if this is related to the media's reluctance to cover the TMC links with terror groups in details.

They are both Socialist parties who are against Modi, and many journalists apparently share their idealogy.",2014-10-31 14:15:24
231,even Modi lives a lavish life and spends full-heatedly on events. Hypocrisy glitters like sun-shine. ,2014-10-31 14:23:05
232,"http://www.manushi.in/articles.php?articleId=1707#.VFNWLBm3RAg

&gt; However, the Special Investigative Team appointed by the Supreme Court exonerated Modi of this charge on the ground that that the actual statement was- “Kriya pratikriya ki chain chal rahi hai. Hum chhate hain ki na kriya ho aur na pratikriya” (A chain of action–reaction is going on. We want that there should be neither “action” nor “reaction”)",2014-10-31 15:00:18
233,"Look, I think we're all really past the name-calling point. I don't like having to see people mocking the ""other side"" on every post. When Modi does something good, let's talk about what he did, rather than make fun of people we disagree with. It's petty, and quite annoying frankly.",2014-10-31 15:09:15
234,Tongue in cheek comment man. Modi is in pretty good shape for a 60 year old,2014-10-31 15:10:26
235,"Here is a non-mobile link: http://hindustantimes.com/india-news/pm-modi-to-flag-off-run-for-unity-for-vallabhbhai-patel-birth-anniversary/article1-1280796.aspx
 
^[Sourcecode](https://github.com/Kharms/untouchedURL) ^| ^[Feedback?](http://www.reddit.com/message/compose/?to=untouchedURL&amp;amp;subject=untouchedURL%20feedback)",2014-10-31 15:16:06
236,"So are you acknowledging that the 2002 remark is characteristic of the entire left/liberal/secular/whatever? If not then I dont know what you are upset about.

Its not about saying something stupid, its about blowing everything way out of proportion. Theres a certain large bunch of people who cant digest seeing modi with power and would pounce on any chance to bring him down, and I personally love to see them mocked",2014-10-31 15:38:01
237,"&gt;  weren't bjp/modi supporters going nuts on such things when UPA was in power

Sir, find out the price of crude oil and UPA's actions during their regime, you will get your answer",2014-10-31 15:43:34
238,"Proud of him. He was Kattar Secular &amp; Congressi all through his life. Even people who hold diametrically opposing views respect him like Modi etc.

edit : downvoters ? doesn't Modi want a Congress-Mukt Bharat ? doesn't it shows he has so much hatred for congress ideologies which was founded by likes of Patelji.",2014-10-31 15:58:07
239,"&gt;So are you acknowledging that the 2002 remark is characteristic of the entire left/liberal/secular/whatever?

I am acknowledging it, yes. There's a lot of people who have been absolutely unable to come to terms with Modi being the PM, and they resort to petty comments whenever they can. I won't call them left/liberal/secular, though. I am all three, and an admirer of Modi, simultaneously.

&gt;and I personally love to see them mocked

Well, that's the difference between you and I. I believe in the power of downvotes; mockery is just stooping to their level. Send them to the bottom, don't emulate them.",2014-10-31 16:04:06
240,"One of the very few good things that the UPA regime did was increasing diesel prices in baby steps. And am glad, the current NDA regime did not reverse it and move to complete deregulation. Not that they had any options considering the fiscal mess left behind, but still never underestimate the stupidity of the governments and Modi deserves a small pat on his back for not being stupid. ",2014-10-31 17:24:26
241,"
""Our own people were killed. The incident was not a wound on the throat of any community but a knife, a dagger on India's century-old great social fabric,"" -PM Modi. As a ""bhakt"" i didn't think my respect for him could increase any further but it has. 

",2014-10-31 17:59:52
242,"Diesel prices have been down for a while thank ISIS for that,and modi haven't decreased the price price yet  as a service to the first family he wants  to make sure crony  masters are getting multiple times of profit",2014-10-31 18:00:44
243,"Boss I was just referring to the fact that we're far from low prices since gas price effect will have a spill over effect. Sorry for snapping. 

As for gas price, UPA is shit. But Modi is equally bad. Right now price is $6.2. I expect it will go to 8.4 since price revisions have been promised every 6 months. 

The issue is not TVM. The issue is crony capitalism. You sign a contract with the govt. to deliver the gas the govt owns at $2.2. Reliance got the contract because they bid lowest. And then since you basically own both national parties you get price revision upwards. If this was going to happen we'd have far more efficient companies pumping gas from KG basin. The govt. should have made it clear that this is the price structure they intend to follow so other companies would have bid equally low. The entire thing is a joke. 

The best part is, this is domestically produced gas for domestic consumption. But it's priced in dollars. ",2014-10-31 18:45:53
244,"Did you read sivaramakrishnan report ?? I think they gave an excellent and unbiased report .  
  
Best locations based on land availability , water , infrastructure are 

Vizag and Nellore but both of them are located At far end.  
  
Donakonda region has 30 k acres of govt/forest land and it also has good ground water and access to nagarjuna sagar .  
  
A capital city is only for administrative purposes not anything else , we do not need to spend so much money on a new city , create enough facilities for administration and employees.  
  
Aside from the location the new capital needs HUGE tracts of some of the most fertile lands in india and the cost of purchasing land here will be so huge that you can create double infra in a cheaper region.  
  
CBN and jagan are both colluding in this capital real estate scam , why do you think jagan is so silent on the location of capital ?The real reason CBN won is due to Modi factor + loan waiver (which is stupid costing state 30000 crores) .  
  
&gt;his experience in developing a capital city out of nothing and I think he is doing exactly what he is elected for.
  
LOLOLOL if you think hyderabad model of capital is good then your  playing right into the hands of the real estate mafia. Why do we need a new capital , when we can develop existing ones with all that money.  
  
Look at Telangana today everything depends on hyderabad , there is practically no infra outside it , we dont ever want to replicate that model and CBN is still doing it. You think TDP is not corrupt ?? sand smuggling already started , govt offices are just as corrupt, contracts are going to TDP members, practically nothing changed  except that the media is owned by TDP bigwigs.
",2014-10-31 19:02:43
245,"This thread perfectly shows the hypocrisy and duplicitousness of Modi's critics.

On one hand they keep saying he should be more inclusive, should reassure minorities, should not be too jingoistic, should try to normalize relations with Pakistan etc. etc.

But when he or his government tries to do any of this the same people immediately start attacking him for being a hypocrite and liar, bringing up his and the BJP's past etc.

It makes it very difficult to treat them as anything but trolls, since they have already made up their minds about Modi and do not seem to care about anything besides excuses for criticism and abuse.",2014-10-31 19:32:39
246,"&gt;I am acknowledging it, yes. There's a lot of people who have been absolutely unable to come to terms with Modi being the PM, and they resort to petty comments whenever they can. I won't call them left/liberal/secular, though. I am all three, and an admirer of Modi, simultaneously.

*Claps*

",2014-10-31 19:36:12
247,"Its confirmed! Modi is one big troll.
What a namuna yaar!!!",2014-10-31 19:51:27
248,"You based your whole argument on a report by a committee that didn't even visit the Donakonda region before favouring it in their report, Siva Rama Krishna is nothing but another joke that the evil congress played on Andhra.Coming to the Modi wave, dude do you even know andhra, were not for their alliance with TDP, the BJP would not have won deposit in any of the places it stood in Andhra. The total votes of the TDP MLA's was 50,000 more than the votes of the BJP MP in Vizag, if the Modi wave was so strong what is the BJP'S score in municipal and local body elections that were held just 1 month before general elections, why did the TDP win the majority of the municipalities, zilla parishads and mandal parishads even though it went alone. More than 50% of the rural populace in Andhra doesn't even know who Modi was until he won the election and became prime minister, I doubt if many of them even know him now.It would have been a big joke if Donakonda were to be made a capital, the 40K crores you were talking about earlier wouldn't even provide roads for Donakonda, it would have been simillar to the time when Tughlaq changed his capital.Coming to the role of capital and development, what is development, isn't it not the ability of the government to provide a reliable platform, where on people could build and improve their living standards, is it not just a buzz word for employment and investment opportunities. Hyderabad brought millions out of poverty and improved the livelihood of millions more, it may not be the best development model, but it sure its on of the proven ones in India, decentralisation can be done when the state has enough capability to stand on its own feet, when it can't even put a roof on its own head in one village, trying to buy villas in 10 cities is madness.",2014-10-31 19:51:46
249,"Yeah dude, but Reliance is fucking everywhere. Parimal Nathwani, Group President, Corporate communications is Rajya Sabha MP and link between Modi and Ambani. Tremendous influence. 

Same with Congress- Anu Tandon.",2014-10-31 20:02:00
250,"Had some non-BJP leader said it you'd praise it for being an inclusive statement reassuring our minorities.

Ironically this is what various Leftist commentators have been asking Modi to do and say.",2014-10-31 20:03:32
251,"#####&amp;#009;

######&amp;#009;

####&amp;#009;
 [**Saurabh Patel**](https://en.wikipedia.org/wiki/Saurabh%20Patel): [](#sfw) 

---

&gt;

&gt;__Saurabh Patel Dalal__ (born 28 August 1958) is a [politician](https://en.wikipedia.org/wiki/Politician) in [Gujarat](https://en.wikipedia.org/wiki/Gujarat), a state in western India.

&gt;He is currently a [Member of Legislative Assembly](https://en.wikipedia.org/wiki/Member_of_Legislative_Assembly) in the 13th [Gujarat Legislative Assembly](https://en.wikipedia.org/wiki/Gujarat_Legislative_Assembly) or __Gujarat Vidhan Sabha__ (ગુજરાત વિધાન સભા) and has served in the same capacity in the 10th, 11th and 12th Legislative Assemblies as well. In the Gujarat Legislative Assembly Elections that concluded in 2012, he contested and was directly elected from the single-seat [constituency](https://en.wikipedia.org/wiki/Constituency) of [Akota](https://en.wikipedia.org/wiki/Akota), an urban area in the western side of [Vadodara](https://en.wikipedia.org/wiki/Vadodara) city.

&gt;He holds the post of State [Cabinet Minister](https://en.wikipedia.org/wiki/Cabinet_Minister) in the [Narendra Modi](https://en.wikipedia.org/wiki/Narendra_Modi) led state government. Considered to be one of the most Educated Ministers serving in the Cabinet, he holds the portfolios for [Energy](https://en.wikipedia.org/wiki/Energy) &amp; [Petrochemicals](https://en.wikipedia.org/wiki/Petrochemicals), [Mines](https://en.wikipedia.org/wiki/Mining) &amp; [Minerals](https://en.wikipedia.org/wiki/Minerals), [Cottage Industry](https://en.wikipedia.org/wiki/Cottage_Industry), [Salt](https://en.wikipedia.org/wiki/Salt) Industry, [Printing](https://en.wikipedia.org/wiki/Printing), [Stationery](https://en.wikipedia.org/wiki/Stationery), [Planning](https://en.wikipedia.org/wiki/Planning), [Tourism](https://en.wikipedia.org/wiki/Tourism), [Civil Aviation](https://en.wikipedia.org/wiki/Civil_Aviation) and Labour &amp; Employment.

&gt;====

&gt;[**Image**](https://i.imgur.com/Nm2E3u6.jpg) [^(i)](https://commons.wikimedia.org/wiki/File:Saurabh_Patel_\(Dalal\).JPG)

---

^Interesting: [^Gujarat ^Legislative ^Assembly](https://en.wikipedia.org/wiki/Gujarat_Legislative_Assembly) ^| [^Council ^of ^Ministers ^of ^Gujarat](https://en.wikipedia.org/wiki/Council_of_Ministers_of_Gujarat) ^| [^Akota ^\(Vidhan ^Sabha ^constituency)](https://en.wikipedia.org/wiki/Akota_\(Vidhan_Sabha_constituency\)) ^| [^Gujarat ^Legislative ^Assembly ^election, ^2012](https://en.wikipedia.org/wiki/Gujarat_Legislative_Assembly_election,_2012) 

^Parent ^commenter ^can [^toggle ^NSFW](/message/compose?to=autowikibot&amp;subject=AutoWikibot NSFW toggle&amp;message=%2Btoggle-nsfw+clp6bsz) ^or[](#or) [^delete](/message/compose?to=autowikibot&amp;subject=AutoWikibot Deletion&amp;message=%2Bdelete+clp6bsz)^. ^Will ^also ^delete ^on ^comment ^score ^of ^-1 ^or ^less. ^| [^(FAQs)](http://www.np.reddit.com/r/autowikibot/wiki/index) ^| [^Mods](http://www.np.reddit.com/r/autowikibot/comments/1x013o/for_moderators_switches_commands_and_css/) ^| [^Magic ^Words](http://www.np.reddit.com/r/autowikibot/comments/1ux484/ask_wikibot/)",2014-10-31 20:08:56
252,"how's it relevant.. it was hindu vs. muslim and not modi vs muslim.. but hey, how can you let it go.. modi must be blamed for something right.. ",2014-10-31 20:09:20
253,"&gt; hindu vs. muslim and not modi vs muslim

That's what you say.",2014-10-31 20:28:09
254,"Assuming that dividing the country implies the start of a separatist or an extremist movement and a violent counter-reaction to that, Mr Modi is factually wrong. Sikh Militancy and the Khalistan movement were a reality much before 1984. Countless Sikhs and Hindus had already suffered from the hands of Khalistanis in late 70s and early 80s. In-fact, Bhindranwale's was at his peak in 1984. 

Loss of every innocent life is condemn-able in strongest terms, and what happened in '84 Delhi was nothing less than a genocide. But here, the attempt by NaMo is not to reach out to the people affected by those horrendous events. Instead it is to deflect attention from a  significant historical movement forever etched in BJP's (and Sangh's) legacy, i.e Babri Masjid demolition and the ensuing communal disturbances. The events in '92 divided country country like no other event before. One can read ""Dongri To Dubai"" (or watch 'Black Friday', ~~another movie harassed by the censor board~~) to know how the events in Ayodha finally culminated in the Mumbai bomb blasts. 

Whenever the state becomes complicit in the murder of innocents, it triggers a chain of event which results in deranged individuals taking vengeance by attacking the innocent civilians. 

PS: Edited. ",2014-10-31 20:37:24
255,Support a party that committed genocide. A party which has actively shielded and promoted those responsible for the killings. Yet you have the nerve to call Modi a murderer? ,2014-10-31 20:43:04
256,"Even now, it's certainly not a modi job. Oil price is not Something that can be controlled by a country or a person, unless you're the king of Saudi Arabia. ",2014-10-31 20:43:27
257,"I still remember Rahul Gandhi's *'My grandmother was killed by a Sikh. For a long time I was angry with them...'* during the Lok Sabha campaign.

It was Modi who pointed out that the whole Congress was angry with them and butchered thousands of Sikhs across India. Rahul had conveniently omitted that in his speech.",2014-10-31 21:01:31
258,"About Kamal Nath, I agree he should be not be given posts even he was proven ""not-guilty"" . I won't argue that because he role was dubious. 

http://en.wikipedia.org/wiki/Kamal_Nath


&gt;Kamal Nath was indicted by the Nanavati Commission on allegations that he was involved in the 1984 anti-Sikh riots. Only one witness, Mukhtiar Singh, testified to seeing Nath lead an armed mob that attacked and demolished a Gurudwara in Rakab Ganj.[25] However, there was no evidence that he incited the crowd. In fact, one of the key witnesses, Indian Express Photographer Monish Sanjay Suri, stated that Kamal Nath tried to disperse the crowd, and there was no evidence that he encouraged violence during the riot.[26] Several Sikhs were burned alive during the attack.[27] Nath responded to the Commission, saying that he visited the Gurudwara later in the day to investigate the agitation and urge peace.

&gt;The Commission Report observed that Nath's testimony was ""vague"" and ""not consistent with the evidence"" and that his version of events was ""A little of strange."" However it disregarded the contradictions in his testimony, saying ""It is also required to be considered that he was called upon to give an explanation after about 20 years and probably for that reason he was not able to give more details."" In conclusion the Commission said, ""In absence of better evidence it is not possible for the Commission to say that he had in any manner instigated the mob or that he was involved in the attack on the Gurudwara"".[28] Justice Nanavati further stated that ""it would not be proper to come to the conclusion that Kamal Nath had in any manner instigated the mob.[26]""

&gt;Canadian Sikhs protested his visit to Toronto 23 March 2010.[29]

&gt;On 6 April 2010 Sikhs for Justice[30] a US-based human rights advocacy group along with two individuals Jasbir Singh and Mohinder Singh filed a lawsuit against Kamal Nath in the Southern District of New York for leading the mob that killed Sikhs and attacked Gurdawara Rakab Ganj in Delhi on 1 November 1984. The lawsuit was filed under Alien Torts Claim Act and Torture Victims Protection Act. US District Court issued summons to Kamal Nath asking him to respond to the complaint. Kamal Nath received summons and complaint the same day in the evening while he was in Manhattan, New York.[31]

&gt;The court complaint was dismissed in March 2012 by Judge Robert Sweet of the US District Court Southern District of New York, against Nath, who stated that the court lacked jurisdiction in the case.[32] The 22-page order granted Nath's motion to dismiss the claim, and the judge also noted that 'Sikhs for Justice' failed to ""serve the summons and its complaints to Nath in an appropriate and desired manner.



Now in contrast, would you like me to draw some contrast about politicians you defend and their involvements, their hate speeches and your defense, like Amit Shah, Modi and several BJP leaders of Gujarat ?

Don't worry, I won't do that because its gonna be useless.",2014-10-31 21:02:31
259,"If all people who voted for BJP or Modi across India, all 300 million or so of them, are just fanatics who supported 2002, then all Congress supporters are 1984 apologists.

While we're making gross generalizations, an example.",2014-10-31 21:05:28
260,"&gt;Now in contrast, would you like me to draw some contrast about politicians you defend and their involvements, their hate speeches and your defense, like Amit Shah, Modi and several BJP leaders of Gujarat ?

No. I would simply ask you not to be hypocritical.

&gt;Don't worry, I won't do that because its gonna be useless.

As useless as convincting you that Congress post Indira has nothing to do with Gandhi's ideals beyond the PR?",2014-10-31 21:07:35
261,Are you one of those who think Modi was the one who set fire to Sabarmati express and killed dozens of RSS pracharaks and their families just to have an excuse to riot? And that he also killed 300+ Hindus during the riots to just to give the impression that they were two-sided? ,2014-10-31 21:08:32
