,article,article_date
153,"^This ^article ^is ^adblocker ^unfriendly, ^following ^is ^the ^text ^of ^the ^article. 

 ______ 
**Nagaland Assembly election: Baptist church body appeals political parties not to support BJP** 

 ______ 
Written by

Kallol Dey

| Dimapur |

Updated: February 11, 2018 11:34 pm

PM Narendra Modi (left) and BJP chief Amit Shah.

The ‘RSS brand’ of politics of the ruling Bharatiya Janata Party (BJP) has
come to haunt the party in the Christian majority states of Nagaland and
Meghalaya this election February. In Nagaland, elections are fought more on
tribal, village and individual lines than by manifestos or ideologies of
political parties. Given that all candidates are usually Christians, religion
too does not count in electoral politics. But this time around, religion has
cast shadow on the elections with the Baptist church launching a rather
unprecedented direct attack on BJP by calling on ‘believers’ not to surrender
Christian principles and faith for the sake of money and development into the
hands of those who seek to “pierce the heart of Jesus Christ.”

The Nagaland Baptist Churches Council (NBCC), apex body of Baptist churches in
the state, in an open letter to presidents of all political parties in
Nagaland, stated that India had experienced the worst persecution of minority
communities in 2015-2017 under the RSS-backed BJP government. “We cannot deny
that the Hindutva movement in the country has become unprecedentedly strong
and invasive in the last few years with BJP, the political wing of RSS, in
power,” the NBCC general secretary observed in the letter adding that “God
must be weeping when Naga politicians are running after those who seek to
destroy Christianity in India and in our land.”

When asked about the unprecedented stand taken by the church, Rev. Zelhou
Keyho, the NBCC general secretary, talking to indianexpress.com said, “This
time it has really become a threat (RSS-backed BJP). That is why we felt we
had to make a strong statement not only on behalf of the church here but also
on behalf of Christians in the country in general.”

The church leader is wary about the political ambitions of the BJP in the
three Christian dominated states of Meghalaya, Nagaland and Mizoram. “It is
not just political interest,” he claimed but eluded substantiating on what
agenda the BJP-RSS combine has in North East. He pointed out the conferences
being hosted in Assam by the RSS and said the “tremors are being felt in
Meghalaya and Nagaland.”

**BJP’s strategic alliances**

Despite a growing presence, BJP has been on the backfoot in both Nagaland and
Meghalaya for issues like ‘beef ban’ and atrocities against minorities,
particularly Christians. That has apparently driven the BJP to go into the
polls with strategic alliances with regional parties. In Nagaland, the BJP
sealed alliance with the Nationalist Democratic People’s Party (NDPP). Asked
about the BJP-NDPP alliance, Rev. Keyho said, “At this moment, I will not be
able to comment on NDPP but getting a regional party has emboldened the BJP.”
He added that “while politicians will say BJP is only a political party and we
are not part of RSS, it is just political talk.”

The Baptist church leader further said that in a big country like India whose
beauty lies in its diversity of cultures, traditions and practices, it is
wrong to say that that the country has only one religion. “Considering
Christianity a foreign religion (in India) is strange. Hinduism is practiced
in Indonesia, Malaysia and Thailand as well. So if those people say that
Hinduism is a foreign religion, get out of the country, we will surely feel
bad.” Rev. Keyho categorically added, “The beauty of the secular nature of the
country has to be preserved (sic).”

The Nagaland BJP is yet to reply to the NBCC general secretary’s open letter.
When indianexpress.com contacted M Chuba, Nagaland BJP campaign committee
incharge, he said the NBCC statement is “kind of a threat for us.”

“What the church said about us (BJP) is totally opposite to what we stand for.
We stand for development. There are no proper roads, electricity and demand
for students’ scholarship is responded with water cannons; so many anti-
incumbency factors. Our objective is to focus on development and preserve our
own identity,” Chuba asserted. On equating BJP with RSS, he said that the two
are different organisations. “RSS is kind of a national volunteers
organisation, BJP is a political party. The NBCC general secretary is
confused.”

Meanwhile, the Congress has gone on an all out attack on the RSS. In a recent
press conference in Dimapur, Lok Sabha MP Gaurav Gogoi, who is also Congress
observer for Nagaland elections, said the RSS-backed BJP is manipulating
democracy and constitutional values. “This BJP doesn’t believe in people
power. It is of the RSS, for the RSS and by the RSS… Christmas has been
converted into Good Governance Day, Easter has been converted into Digital
India Day and for the first time it is rather unfortunate that the Rashtrapati
Bhavan did not hear Christmas carols during last Christmas,” Gogoi said.

For all the latest North East India News, download Indian Express App

© IE Online Media Services Pvt Ltd



 ______ 
 ^I ^am ^just ^a ^bot, ^I ^cannot ^reply ^to ^your ^queries. ^Send ^a ^[*modmail*](http://www.reddit.com/message/compose?to=%2Fr%2Findia&amp;subject=Anti+Anti+Ad+Block+Bot) ^if ^you ^have ^any ^queries. ^Please ^provide ^a ^link ^to ^your ^submission. ^We ^would ^not ^be ^able ^to ^help ^you ^without ^a ^link.",2018-02-12 08:22:58
154,Modi 2019 : ache pakode khilane wale hai,2018-02-12 08:33:28
155,"Lol why are people downvoting this? You hate india or modi?

Don't confuse the two. ",2018-02-12 08:47:18
156,Modi quora rape sax,2018-02-12 08:51:45
157,"If you want to be successful, earn crazy cash and get support from low narrow minded people of India (so called Modi bhakts) just play a nationalist card and no people will ever see anything else than that. Sadly I see many celebrities and famous people in other field using that for their own success and popularity like Akshay Kumar. I feel really sad when I see so much fake people all around the country. 

The movies which Akshay Kumar made in the past few year were not supposed to be made as a movie. If you really care about such issues do something in the public for it. Making a low class and level movie with no proper script and story and just making millions of it doesn’t seem what a true loving citizen of our country does considering how you fucking boast about your social work for our nation which is practically NIL. 

Akshay Kumar just stop showing your fake nationalism just like most people of our country including Narendra Modi, I miss the time when nationalism was a true thing. I wish things change otherwise India will become a piece of hell to live in. 

Peace ✌🏻 ",2018-02-12 08:57:25
158,"^This ^article ^is ^adblocker ^unfriendly, ^following ^is ^the ^text ^of ^the ^article. 

 ______ 
**In Oman, PM Narendra Modi Slams Congress For ""Misgovernance"": 10 Facts** 

 ______ 
PM Narendra Modi led delegation-level talks with Sultan Qaboos of Oman.



 ______ 
 ^I ^am ^just ^a ^bot, ^I ^cannot ^reply ^to ^your ^queries. ^Send ^a ^[*modmail*](http://www.reddit.com/message/compose?to=%2Fr%2Findia&amp;subject=Anti+Anti+Ad+Block+Bot) ^if ^you ^have ^any ^queries. ^Please ^provide ^a ^link ^to ^your ^submission. ^We ^would ^not ^be ^able ^to ^help ^you ^without ^a ^link.",2018-02-12 09:30:24
159,"^This ^article ^is ^adblocker ^unfriendly, ^following ^is ^the ^text ^of ^the ^article. 

 ______ 
**$3.6 billion in hidden bad loans spotlight Indian banking stress** 

 ______ 
**By Anto Antony**

India's regulator unearthed about $3.6 billion of

bad loans

in the books of the country's biggest bank, amplifying questions about
distress in the financial sector given underreporting by some rivals as well.

State Bank of India on Friday said an audit by the central bank showed soured
debt was about 232 billion rupees ($3.6 billion) higher than what the state-
run lender reported for the end of March 2017. The biggest private lender HDFC
Bank Ltd. had a 20.5 billion rupee divergence, while ICICI Bank Ltd. said --
without elaborating -- that it isn't required to make disclosures on the topic
even as provisions for bad loans climbed. It had reported a divergence in the
previous year.

Indian banks must disclose such discrepancies if the gap between reported
numbers and the RBI's audit findings is more than 15 percent. State Bank of
India's admission is particularly striking because the lender is often seen as
a proxy for the nation's economy, where the ratio of bad loans has surged to
be among the highest in the world. The problem has grabbed so many headlines
that Prime Minister Narendra Modi cited it to attack the policies of his
predecessor in parliament last week.

""If India's premier state-run bank is reporting such divergence it shows how
deep the rot runs in the nation's banking system,"" said Hemindra Hazari, a
Mumbai-based independent banking analyst who has covered the sector for two
decades and publishes at Smartkarma.com. ""Cleaning up this mess is going to
take much more effort and time than what people expect.""

State Bank of India's shares fell 1.7 percent to 296.4 rupees in Mumbai on
Friday, extending this year's drop to 4.4 percent.

Most of the accounts identified by the RBI in its risk assessment were already
on the stressed asset list ""in one way or another,"" State Bank of India
Chairman

Rajnish Kumar

said in a conference call with reporters. The bulk of the divergence -- about
100 billion rupees -- came from the power sector, he said.

Divergences occurred earlier as well, though what's changed is the mandatory
disclosure of the gaps, central bank Deputy Governor N S Vishwanathan said
last month.

**Unnerving Divergence**

The regulator has also sought to reclassify loans given by a consortium as
non-performing for all the lenders involved if it was considered non-
performing on the books of one of them, as part of tighter asset
classification norms that came into effect from 2016.

""The divergence in asset quality from numbers reported earlier is unnerving,""
said Asutosh Kumar Mishra, a Mumbai-based banking analyst at

Reliance Securities Ltd

. ""While the loan growth is showing early signs of revival, provisions for bad
loans will continue to weigh on profit growth in coming quarters.""

State Bank of India on Friday reported a 24.2 billion rupee loss for the
quarter ended Dec. 31, its first in at least 17 years. Analysts in a Bloomberg
survey had predicted a 20.6 billion rupee profit.

The loss was due to hardening bond yields, treasury declines and provisions
for payments to employees, Chairman Kumar said during the conference call.

""I don't want to be very optimistic about the March quarter, nor am I
pessimistic,"" Kumar said. ""We can hope for a much better performance in terms
of most performance parameters"" in the financial year starting April 1, he
added.



 ______ 
 ^I ^am ^just ^a ^bot, ^I ^cannot ^reply ^to ^your ^queries. ^Send ^a ^[*modmail*](http://www.reddit.com/message/compose?to=%2Fr%2Findia&amp;subject=Anti+Anti+Ad+Block+Bot) ^if ^you ^have ^any ^queries. ^Please ^provide ^a ^link ^to ^your ^submission. ^We ^would ^not ^be ^able ^to ^help ^you ^without ^a ^link.",2018-02-12 09:52:34
160,"^This ^article ^is ^adblocker ^unfriendly, ^following ^is ^the ^text ^of ^the ^article. 

 ______ 
**Narendra Modi asks Shah and Jaitley to placate Naidu** 

 ______ 
NEW DELHI:

BJP

is making all efforts to reason with ally TDP on its various demands for
Andhra Pradesh, with PM Modi keeping a tab on the developments. But chief
minister

N Chandrababu Naidu

is not satisfied with the assurances and his MPs have threatened to walk out
of NDA if the demands are not met.

Modi has given the responsibility of placating TDP chief to

BJP president Amit Shah

and FM

Arun Jaitley

. He has also promised TDP leaders that he will get in touch with Naidu to
sort out the issues, sources said. Last week saw hectic activities from both
sides, with TDP protesting in Parliament and near the Mahatma Gandhi statue on
the premises. TDP MPs raised slogans and displayed placards in the Well of the
House.

YSRCP and some Congress MPs from Andhra too protested to press for giving more
funds to Andhra Pradesh. The Andhra CM was away in the UAE last week, but soon
after he returned on Friday he got a call from Shah. Modi is likely to speak
to Naidu after he returns from the four-nation tour. Modi has asked Shah and
Jaitley to mediate. The FM gave some assurances in his reply to the budget
debate in both the Houses, but this hasn't satisfied TDP.

The two BJP leaders are likely to hold discussions with TDP leaders this week.
Naidu has had his way with the Centre during the Deve Gowda and AB Vajpayee
governments, but does not have much bargaining power with the present
dispensation as BJP has a clear majority in the Lok Sabha. TDP is bargaining
hard and protesting aggressively to get more funds for building the new Andhra
capital in Amravati, the Polavaram project and a new railway zone at
Vishakapatnam.

""Naidu should realise that he can get more from Modi by discussing the issues.
The prime minister is not the type who will yield under pressure,"" a senior
BJP leader said.

Another senior BJP leader said the Centre found that Naidu has waived some
farmer loans and incurred other expenditure, but is demanding reimbursement
from the NDA government for them. Pandering to his request will lead to a
flood of similar requests from other states, including those ruled by BJP, a
situation the Centre does not want to get into.

BJP leaders are aware that TDP may finally pull out of NDA though after a few
months and closer to the elections — assembly polls in Andhra will be held
along with the Lok Sabha polls early next year. This may help TDP pin the
blame for not doing enough for AP on the Centre's ""non-cooperation"".



 ______ 
 ^I ^am ^just ^a ^bot, ^I ^cannot ^reply ^to ^your ^queries. ^Send ^a ^[*modmail*](http://www.reddit.com/message/compose?to=%2Fr%2Findia&amp;subject=Anti+Anti+Ad+Block+Bot) ^if ^you ^have ^any ^queries. ^Please ^provide ^a ^link ^to ^your ^submission. ^We ^would ^not ^be ^able ^to ^help ^you ^without ^a ^link.",2018-02-12 09:53:43
161,Not a troll looking at how it was written. Was made by some bhakts to make Modi look cool. It’s so bad. ,2018-02-12 09:55:23
162,"On a more serious note shit like this makes me feel that the line between political and non-political stuff has blurred to a point where the average man can't distinguish between it anymore.

This has been the most remarkable achievement of the BJP government. To integrate their political ideology into everyday stuff to the point where the 'right of centre' ideology becomes the default one.

Another example of this was Modi's face all over the U17 Fifa World Cup in October. What the hell has Modi got to do with an International Tournament being organised by an International Federation which was awarded to India during the previous Government?",2018-02-12 10:08:29
163,It’s about narendra Modi having 56 inch chest. ,2018-02-12 10:32:16
164,"^This ^article ^is ^adblocker ^unfriendly, ^following ^is ^the ^text ^of ^the ^article. 

 ______ 
**India, Oman sign 8 agreements as PM Narendra Modi meets Sultan Qaboos bin Said al Said** 

 ______ 
MUSCAT: Prime Minister

Narendra Modi

today held wide-ranging talks with the Sultan of Oman as the two sides signed
eight agreements, including pacts on cooperation in the field of defence,
health and tourism.

Modi, who arrived here from Dubai on the last leg of his three-nation tour,
led delegation-level talks with Qaboos bin Said al Said and discussed measures
to strengthen cooperation in trade and investment, energy, defence, security,
food security and regional issues.

""Charting out new frontiers in our bilateral relationship, PM @narendramodi
led delegation-level talks with Sultan Qaboos of Oman. The two strategic
partners discussed to strengthen cooperation in trade &amp;amp; investment,
energy, defence &amp;amp; security, food security and regional issues,"" Ministry
of External Affairs Spokesperson Raveesh Kumar tweeted.

Sultan Qaboos appreciated the contribution of ""honest and hard working"" Indian
nationals in the development of Oman.

After their talks, the two sides signed eight agreements, including an MoU on
legal and judicial cooperation in civil and commercial matters.

They also signed an agreement on mutual visa exemption for holders of
diplomatic, special, service and official passports and an MoU on cooperation
in the field of health, tourism and peaceful uses of outer space.

The two countries also signed an agreement on cooperation between Foreign
Service Institute, Ministry of External Affairs,

India

and Oman's Diplomatic Institute.

An MoU on academic and scholarly cooperation between National Defence College,
Sultanate of Oman and the Institute for Defence Studies and Analyses.

The two sides also signed annexutre to the MoU on military cooperation.

During his two-day visit, Modi will also meet Deputy Prime Minister for the
Council of Ministers Sayyid Fahd bin Mahmoud Al Said and Deputy Prime Minister
for International Relations and Cooperation Affairs Sayyid Asa'ad bin Tariq Al
Said.

Earlier, addressing the Indian diaspora at the Sultan Qaboos Sports Complex in
Oman's capital, Modi said the ties of India and Oman have always remained
strong despite the ups and downs in the political environment in both the
countries.

He also said that Indian diaspora has played an essential role in
strengthening these ties.

India and Oman have thriving links rooted in centuries old people-to-people
exchanges, Modi said.

More than nine million

Indians

work and live in the Gulf region. In Oman, they constitute the largest
expatriate community.

On the first leg of his trip, Modi had travelled to Ramallah, becoming the
first Indian prime minister to make an official visit to Palestine. From there
he visited the UAE, before arriving in Oman.



 ______ 
 ^I ^am ^just ^a ^bot, ^I ^cannot ^reply ^to ^your ^queries. ^Send ^a ^[*modmail*](http://www.reddit.com/message/compose?to=%2Fr%2Findia&amp;subject=Anti+Anti+Ad+Block+Bot) ^if ^you ^have ^any ^queries. ^Please ^provide ^a ^link ^to ^your ^submission. ^We ^would ^not ^be ^able ^to ^help ^you ^without ^a ^link.",2018-02-12 10:39:34
165,It's called licking the boots of modi and his pals.,2018-02-12 10:41:20
166,"Fake.

Modi purposefully targeting south indian leaders and/or congress leaders.

All the law agencies in India are now puppets in the hands of BJP",2018-02-12 10:46:10
167,Next Modi: Ek bakchodi,2018-02-12 10:46:14
