,article,article_date
132,"Copy-pasting the article as it is behind a paywall

&gt;In the wake of Indian Prime Minister Narendra Modi’s overwhelming victory in 2014, exit polls suggested that his success was due largely to widespread disillusionment with the United Progressive Alliance, the center-left coalition that had ruled the country since 2004. Throughout the campaign, Modi had positioned his Bharatiya Janata Party (BJP) as the vanguard of good governance and economic dynamism—a stark contrast, he hoped, to the coalition’s record of corruption and slow growth. Since assuming office, Modi has taken steps to differentiate himself from his predecessors, particularly with his second budget, which promises to improve the country’s infrastructure and remove bottlenecks in the energy sector. The most remarkable feature of his time in office so far, however, has been his engagement in a realm he scarcely mentioned during the campaign: foreign policy.

&gt;Modi has brought tremendous energy and dexterity to foreign policy in his brief tenure in office. Although it has not yet been a full year since his election, Modi has already visited a dozen countries, ranging from those in India’s neighborhood to some as far away as Australia and Brazil. Perhaps most significant, he has jump-started the bilateral relationship between India and the United States. In a remarkable departure from tradition, Modi hosted U.S. President Barack Obama as the chief guest at India’s Republic Day Parade on January 26. The invitation was highly symbolic: it was the first time a sitting American president had been accorded that honor.

&gt;For far too long, India has punched well below its weight in the global arena. Modi’s activism may thus be a sign that he is ready for a new era of Indian foreign policy, reflecting a belated willingness to engage with the world on a host of pressing bilateral and multilateral issues. In his visits to Mauritius, Seychelles, and Sri Lanka, for example, he has proffered security assistance, promised developmental aid, and promoted trade expansion—efforts that appear designed to counterbalance China’s influence in the region. Beyond India’s immediate shores, Modi has reached out to Australia, Japan, and the United States to boost existing security ties. Before Obama’s visit, Modi personally intervened to change India’s stance on a trade dispute that had deadlocked the Doha Round of global trade negotiations. During Obama’s visit, he sought to settle areas of discord between India and the United States, such as the fraught U.S.-Indian civil nuclear accord.

&gt;Despite Modi’s best efforts, however, domestic developments in India threaten to jeopardize his foreign policy initiatives. Even as he courts foreign leaders with grace, projecting professional cosmopolitanism, his government has tolerated, even abetted, a dangerous, parochial social agenda at home.

&gt;The first signs of such parochialism came in the early days of Modi’s prime ministership. In June 2014, Modi appointed a relatively unknown historian, Yellapragada Sudershan Rao, to the Indian Council of Historical Research, a government agency that awards grants and fellowships to Indian and foreign scholars. Rao, among other controversial views, believes that the two Hindu religious epics, the Ramayana and the Mahabharata, should be considered historically truthful, even in the absence of suitable archaeological evidence. In January 2015, at the annual meeting of the Indian Science Congress, in Mumbai, several scientists made similarly absurd claims. Among them: that Indian physicians had pioneered plastic surgery several thousand years ago, that helicopters had existed in ancient India, and that an Indian aviator had flown a heavier-than-air craft nearly a decade before the Wright brothers.

&gt;These statements can be dismissed as the fantasies of hypernationalist cranks and charlatans. But other developments cannot be so easily ignored, and they threaten to unravel the delicate social fabric of India’s secular order. The most disturbing of these is the emergence of the ghar wapsi, or “return home,” movement. This effort, the brainchild of various BJP-affiliated organizations, most notably the far-right Rashtriya Swayamsevak Sangh (RSS), seeks to convert members of other faiths to Hinduism. It has targeted mainly poor and working-class minorities. According to the Deccan Chronicle, an English-language Indian newspaper, at least 8,000 people in the southern Indian states of Andhra Pradesh and Telangana have been converted to Hinduism under the aegis of the program. The irony of this endeavor is lost on Hindu zealots: Hinduism, unlike Christianity or Islam, does not believe in proselytization, meaning that the very notion of conversion is anathema to the faith. Despite this inherent contradiction, the effort is well under way and has generated abject fear in the minority Christian and Muslim communities. The ecclesiastic leadership of both communities has begged Modi to end the program, but the prime minister has evinced scant interest in the matter.

&gt;More disturbing, the country has seen an uptick in religious violence, particularly in attacks on churches. In the past six months, eight churches have been attacked. Five of these took place in New Delhi, India’s capital, yet it took till mid-February for Modi to publicly condemn them. Despite the prime minister’s belated reassurances, members of the Christian community remain fearful. In an op-ed in The Indian Express, published March 17, 2015, Julio Ribeiro, a retired Christian police officer, expressed his anxiety about India’s tide of intolerance toward minorities. He wrote that he was beginning to feel like a stranger in his own country.

&gt;These episodes alone are sufficiently disquieting in a country of extraordinary religious and cultural diversity. But the outrageousness does not stop there. The activist Vijaykant Chauhan, for example, has launched a campaign in the densely populated state of Uttar Pradesh to prevent what he refers to as “love jihad,” or marriages between Muslim men and Hindu women. His campaign cannot be dismissed as that of a fanatic; it should be understood, instead, as part of a larger effort by a segment of Modi supporters to fashion a new social order. In their worldview, India’s minorities can exist only at the sufferance of the Hindu majority. During his campaign, Modi relied heavily on the grass-roots efforts of far-right organizations such as the RSS. Now these groups are asserting their claim to influence the country’s direction and ideology.

&gt;As Obama said in a recent speech delivered in New Delhi, however, India can ill afford this descent into religious intolerance. What’s more, Modi has little political future if his policies remain Janus-faced. On the one hand, he has actively and adroitly sought to engage the world. On the other, he appears willing to tolerate religious hatred and bigotry at home. In so doing, Modi hopes to straddle two markedly different constituencies: the first, sophisticated and cosmopolitan; the second, prejudiced and parochial. Thus far, Modi has managed to maintain this delicate balance. But things could easily get out of hand. For example, if a sectarian riot were to erupt in a major city, and the government were to be indifferent to the plight of the afflicted minority, Modi might be forced to relive his past. (In 2002, when he was chief minister of the western Indian state of Gujarat, ethnic riots in his state killed some 2,000 Muslims.)

&gt;Put simply, his juggling act cannot last. As India’s disturbing domestic developments swiftly draw global attention, Modi will find it impossible to sequester one realm from another. A government that is committed to promoting economic development, attracting foreign investment, and integrating India’s markets with the world is simply incompatible with one that allows intolerance to sweep unchecked across the nation.",2015-03-29 21:42:37
133,"Hahaha, with the support bigots like Modi have here, you might as well ask pigs to fly.",2015-03-29 21:53:31
134,"&gt;He didn't run away in the middle of the night like a coward.

So didn't Modi? He had told her before the marriage about his ambitions.",2015-03-29 22:02:17
135,"This concerns many BJP supporters as well. Namoarmy, whether it still exists or not, will be utterly retarded to not rail against Modi or BJP, this will harm the party in the longer run. Not to forget hurt the confidence of their supporters.

Even if you try to look at it in a non-partisan way, this will be one of the more shittier things that GOI can do.",2015-03-29 22:06:06
136,"&gt; Instant downvote! Under a fucking minute.

Yes, there are 5-6 people who regularly downvote stories that are critical of Modi from the new queue. There is only one way to counter this: actively vote on stories in the new queue. 

I don't see why BJP supporters should not outrage over this story. A corrupt leech like Pawar as the president would rank as one of the lowest points in our democracy. ",2015-03-29 22:09:38
137,"You can look at the vote percentage now to understand why people claim that it is incredibly difficult to criticise Modi and/or BJP on this forum.

Another story that suffered the same fate today: http://np.reddit.com/r/india/comments/30pas6/rajnath_says_he_will_try_to_bring_nationwide_ban/

Replace Rajnath Singh with Sushil Kumar Shinde, and beef ban with Haj - and you would have had that story on the top of /r/India with multiple people crying minority appeasement. However, no one seems to have a problem when it is their religious sentiments that are being catered to. ",2015-03-29 22:20:02
138,"Baat karna bhi nahi hota hai isse, sirf ego massage karne aur dusri deals karne ke liye Modi ko aisa nahi karna chahiye. I don't like this as a supporter of the party. Kalam sahab bade achche the, unke jaise achche logon ki kami thode hi hai is desh mein.",2015-03-29 22:29:26
139,Sahi hai. Hopefully this is another hit job and Modi isn't contemplating such a stupid move.,2015-03-29 22:38:03
140,"It's good for Modiji, right?  He takes advice from Sharad Pawar - http://articles.economictimes.indiatimes.com/2015-02-15/news/59166672_1_sharad-pawar-pm-narendra-modi-baramati

If Pawarji is in Delhi, it will help Modiji.    
",2015-03-29 22:53:52
141,"Not unlikely, pawar may be a devil but when u see bills getting stalled for entire session, ally trying to block u each step of the way. Its a necessity to garner  support. Tmc bjd supported these bills bcause they got the revenue n got benefits. I dont even believe that modi is not corrupt, he is a politician he wil do anything to retain power. In the process if development happens for this country then its because of that necessity. I got no reason to believe that he would not bring forth development even by signing the deal with a devil like pawar. Shovld i outrage ? If i dont get the results before 2019 then alternative will be automaticaly chosen. Beef ban wont help neither wil vote cutting strategy  ",2015-03-29 23:06:00
142,"excellent opp for a namo fan collect all pics make a collage .

* Modi knows * ",2015-03-29 23:15:20
143,"Guys!

Don't ask - Why is BJP making Pawar as President - focusing on Pawar. 

Ask - Why does BJP get by making Pawar as President. Focus on the Why? Rather than on Pawar. 
What does BJP need? What do they gain by doing this? Why do they need NCP? for Maharashtra against Shiv Sena? 

Doesn't BJP realize that opposition will give them a hard them for this. Media Savvy/ Pro Dev. Internet warriors will fry BJP for this. 

But, why - still. 

Instead of typing out anything - BJP will lose my vote blah blah. Let's think. Think like Modi. Why? 

Then think like Pawar. Why does he want to be president. Really? He wanted to be PM a long time ago. In India, The president's role is not required if there is a proper functioning executive and judiciary. Why does Pawar want the President post. What is he offering in return. 

Why? What for? Just to keep SS in check in Maharashtra? 

Or is there something bigger. 

Dividing Maharashtra? Something related to J&amp;K which requires President? 

Think guys. Think like Modi. Don't bring ""my anti-BJP posts were down-voted by  BJP IT Cell vote brigading"" into this. That is all childish stuff. ",2015-03-29 23:17:50
144,"I had one yarstick to measure Modi's performance: the Jaipur- Delhi highway. Congress dragged the construction for 6 years. When Modi came to power, immediately afterwards, I saw some construction being done

One year later construction has stopped again. Same as Congress. ",2015-03-29 23:18:48
145,"I don't give a fuck about BJP, AAP or Congress. I only root for Modi and if he has to make gutterchap pawar as president to secure RS votes, that is fine by me. However, the article does not cite two sources. Golden rule of journalism is that you have to cite two sources. Rest of my points are just a general commentary on some users on this sub.",2015-03-29 23:22:52
146,Modi is in SG?,2015-03-29 23:25:51
147,"""BSF shoots down a pair of Pakistani trekkers for allegedly carrying a suspicious baggage. Is Modi responsible for this sudden shift to aggressive stance by our military?""",2015-03-29 23:32:24
148,Did you see the pro Modi song this guy made? Why do you think hes been made the censor board chief,2015-03-29 23:34:16
149,"Kalam saheb - with all due respects - a very nice gentleman as President - and what does he bring to the table? Inspiring school kids. What else?  A genuine question. 

Patil - Let's not discuss that

Pranab Da - yes. he is bringing a few things to the table. He is expressing his opinion on quite a few matters off late. 

Maybe this whole thing - is to get in a powerful person as the President - so as to extract the maximum possible from the President's powers. 

Frank enough, for decades the President has become just a figurehead. I am sure even they have forgotten what his real powers are. But - maybe there is something - that a President can do or support - which is what Modi is after. 

As I said in another comment in this thread. Let's Think. What is the long con here. ",2015-03-29 23:36:53
150,"I hate Pawar and everything he stands for with every fiber of my being and while I might not be an ardent Modi supporter, I do think his strategies and policies are sound and goals noble. ",2015-03-29 23:38:42
151,"Like Modi: ""I need to win Maharashtra so I'll align with the devil""

Koi dharm imaan naam ki cheez hoti hai yaar",2015-03-29 23:48:17
152,"&gt;A highly-placed BJP source claimed that neither his party nor Prime Minister Narendra Modi would oppose him. Shiv Sena too has said that it would support a Marathi manoos.

So Pawar who couldn't even win BCCI election will get both Shiv Sena and BJP support - based ofcourse on an unnamed source. 

Chalu rakho raita failana tum log. 

",2015-03-29 23:51:00
153,"&gt; Like Modi: ""I need to win Maharashtra so I'll align with the devil""
&gt; 
&gt; 

They have already won Maharashtra for now. Even if SS removes support, NCP will support them  - and I don't think NCP wants the President post in return for support. They can ask for a gazillion things in return. President post is almost useless and just brings more limelight and focus. 

Rather, it seems to be the other way round - that Modi needs a certain kind of President. That is the question here. Why? 

",2015-03-29 23:55:42
154,Glad to hear that. This kind  of hit jobs against Modi are now regular. ,2015-03-30 00:11:17
155,Are you the Burqa Dutt raped by Modi? ,2015-03-30 00:39:46
156,"Ratan tata, vajpayee, sachin, Amitabh - fondly.
Modi - depends on how his term(s) go.
Rahul Gandhi- for all his debacles, dude still has a potentially long political career ahead, one never knows how it might go.

That being said, long term history will more likely remember kings and kingmakers. Whoever is the PM when the Kashmir issue is solved will take this prize.
",2015-03-30 00:43:27
157,This report blames Narendra Modi for farmer suicides. The article mostly covers government apathy to farmers in Uttar Pradesh. State governments (Samajwadi Party in UP) are much closer to farmers than Central government. If farmers are committing suicide  then it’s a bigger failure of the state government than Central government. I am not trying to shift blame but just saying blaming Narendra Modi for all problems means you think state governments have no power or desire to help farmers. ,2015-03-30 00:53:54
158,"I don't know if you support a political party, but you're asking the right questions, which even the most liberal, intelligent people are not askig. With a man like Modi, who controls everything that the media gets to know about him, every news about him begs the question; 'why, why is he letting us know what he is?' If a party source went out of his way to leak a story against modi's wishes, no matter how anonymous he is, you can be sure Modi will find him. So whatever we hear has a purpose. Take an up vote.",2015-03-30 02:54:51
159,"Dharm imaan nahi, Modi follows dharmatva imaanatva. Lel",2015-03-30 02:57:17
160,"It's not as if hasn't done anything to deserve ""fitting the narrative""

He expanded Aayush into a ministry when it was earlier a department under health

www.firstpost.com/india/pm-modi-creates-aayush-ministry-focus-yoga-ayurveda-1796275.html


He increased its funding from 400cr to  1214 CR. Can't find the source for this. Am on mobile. Should be easy enough to Google.


",2015-03-30 07:04:42
161,"Total expenditure on Department of AAYUSH in 2013-14 budget was 1259 CR ([Source](http://indiabudget.nic.in/ub2013-14/eb/sbe48.pdf)), but if Modi has increased in further, that would be stupid.

I am just against the agenda that paints it as if we were not *already* wasting a  SHIT tonne of money on this kind of bullshit.


EDIT: The budgeted amount during UPA-2 for AAYUSH was Rs 1259 crores. Under Modi is Rs. 1272 crores, just 13 crore rs extra.",2015-03-30 07:14:12
162,"So, as it turns out, expenditure on the AAYUSH bullshit has actually **come down by over 40% or by about 200 crores**  under Modi govt.",2015-03-30 07:29:54
163,"http://indiabudget.nic.in/ub2015-16/eb/sbe6.pdf

The budget of Union govt for AYUSH department has remained the same before and after coming of Modi govt.",2015-03-30 08:11:21
164,are you saying modi is a rapist?,2015-03-30 08:32:16
165,"They had a recent ""membership drive"" in mumbai. They came up to peoples' doorstep, did the usual pr stuff saying its not to join bjp its to join modi, then asked to show all mobiles at home and give missed call from everyone of them saying this way you have direct connect to modi and you can tell your problems. There you go 6 new ""bjp members"".

http://imgur.com/uAmKdn9

That's how they claim they are the biggest political party. This is why I hate them. Their campaign was fueled by this sort of online fake propaganda with pictures and photoshops of singapore and china  circulated as ""gujrat model"" and the amount of crap circulated on watsapp groups. And they had plausible deniability sayimg its all fan made while we know whose IT  cell is behind all this. Same goes for all the hideous comment sections on fb and news sites.",2015-03-30 09:57:08
166,I'd rather see LK Advani be the next President. He's been treated badly by Modi but he deserves better. He's also an elder statesman and will play the role of the ceremonial head well.,2015-03-30 10:04:30
167,"&gt;You can look at the vote percentage now to understand why people claim that it is incredibly difficult to criticise Modi and/or BJP on this forum.

I have seen AAP related threads (criticizing The Supremo) languish at 60% or lower. The same ""Modi followers"" are doing this also?

As we have discussed a 100 times before, every side does this, not that it makes it okay, but your posts consistently act as though it is only one particular set of people that do it.
",2015-03-30 11:02:28
168,Modi wishes.,2015-03-30 11:23:15
169,"Funny how until a few months ago Modi supporters who ranted against giving any space and attention to 'a party confined to one city', are now ecstatic and cannot seem to stop talking about it.",2015-03-30 11:39:11
170,modi did not give money,2015-03-30 11:43:23
171,Modi ne AAP join karli?,2015-03-30 11:51:58
172,"Don't worry, when Al Jazeera publishes an article criticizing Modi, they'll be soon dismissed by conservatives because they get funded by a Muslim country.",2015-03-30 11:55:09
173,"Show me a report saying simply that ""Center refuses to give Delhi Gov funds.""

**Edit:** Since you deleted your earlier comment, I'll append my reply here.

Nopes, but the cost does grow. And there's corruption in the system. Nothing that Kejriwal can't handle./s

Btw, if you want the *real reason*, it's that they did not prepare a budget, and therefore don't have the bureaucratic basis to request funds from the Center. And in the vote-on-account, they did not allocate anything to MCD (spent instead on subsidies.) Center pays Delhi Gov, and Delhi Gov pays MCD. That's the chain, and it is initiated by a formal request. And Kejriwal did not play any role in the vote-on-account, so he simply doesn't know why MCD allocation wasn't made.

Remember when they got elected and they went to Modi? One of the points they told the press was that they asked for money. The reply they got was please make the request, allocations will be made. (They were always made even when Congress was ruling Center and State, with BJP in the civic bodies. Politicians do not fuck around with civic amenities.) Well, they fucked up, and basically did NOT make the formal request.

Btw, have you heard any reports that say ""the Center refuses to give Delhi Gov money?"" You haven't. That's because they were not refused, they just never asked. Center को क्या सपना आएगा, ""चलो भाई, पता नहीं कितना पैसा चाहिए, आज सुबह सुबह मैंने दिल्ली सरकार को 10 हज़ार करोड़ खुद से ही दे दिए!""",2015-03-30 11:58:12
