,article,article_date
242,"When people like you are so blind and deaf why expect communication? 

Union ministers went on site to inquire about the rapes and put pressure on the Akhilesh government. Women and Child Welfare Minister Maneka Gandhi announced the creation of special anti-rape cells.

By driven by your political loyalties and blind hatred for Modi you closed your eyes, covered your ears and erased all such news from your memories and now are falsely claiming 'lack of any communication from this govt on the spate of horrific rapes over the past few days.'",2014-06-05 13:10:43
243,"I would actually have been  happy if AAP had gotten their act together and actually managed to form a strong opposition and outright replaced Congress, but instead they dun goof'd. Instead of focusing on the issues and the ruling government, they spent all their resources and energy on targeting Modi (which they failed eventually). Now, obviously AAP is an opposition, but not the opposition.   ",2014-06-05 13:11:00
244,Really? Because rapists in backward parts of UP would hear that statement and stop their misdeeds out of the goodness of their hearts? Are you this naive or just clutching at straws to attack the Modi government?,2014-06-05 13:11:31
245,"I think like Modi ji, we'll have to become PM to get the visa.",2014-06-05 13:13:12
246,Does it matter? Irrespective of what happens 5 years later you and your Kejriwal will still claim Modi did nothing just like when he did that farcical 2-day audit of Gujarat.,2014-06-05 13:21:12
247,I only worry of a vajpayee like scenario for Modi. It would be really sad to see rise of congress again,2014-06-05 13:26:42
248,modi has no opposition lol...at least in parliament :),2014-06-05 13:27:51
249,"Yes! *this*.

His  spoken English isnt very good, mainly because of his strong accent ( which is how Karan Thapar caught him off guard in that infamous interview where Modi walked out). Going by his tweets though, his written English is good ( if he does write his tweets ). Cant wait for his UN speech. Prod moment indeed. ",2014-06-05 13:38:36
250,People call modi anything but stupid or complacent is not among them. Be assured 2004 will not happen if they fulfill their promises to the people  ,2014-06-05 13:44:53
251,Fuck yeah! The not knowing English shaming and people feeling elitist because they speak a particular language needs to stop. And I'm glad Modi is not succumbing to it. Not after that Karan Thapar interview anyway.,2014-06-05 13:51:56
252,Everyone has plans like these. Modi is good at making sure the public hears about them.,2014-06-05 13:53:10
253,"What every corp shud aspire for is to empower the individual - the way Modi is going about empowering bureaucrats is really cool, i can't recall any prev politician empowering bureaucrats the way he is.  

What makes this extra cool is the fact that almost everyone wud have blamed bureaucracy as the factor pulling us down &amp; i guess Modi is out to make our biggest weakness as our biggest strength",2014-06-05 13:58:11
254,"&gt;Also, the BJP was keen to prevent the non-Congress parties from forming a bloc in Parliament, as proposed by Trinamool Congress chief Mamata Banerjee. Odisha Chief Minister Naveen Patnaik’s Biju Janata Dal (BJD), which has 20 MPs, is likely to be kept in good humour by offering the BJD the chairmanship of key parliamentary panels like the Public Accounts Committee, which was normally offered to the main opposition party.

...

&gt;However, both the BJP and AIADMK sources conceded that besides the post of Lok Sabha Deputy Speaker, Jayalalitha would expect Modi to offer much more. At least two Cabinet and two Ministers of State berths would be in order to “firm up” the support of the AIADMK, which has 10 MPs in the Rajya Sabha where the ruling NDA lacks majority to pass any legislation. 

While it's nice to see Congress left out, IMO the lady is extracting too steep a price for her support.",2014-06-05 14:00:12
255,"&gt; Everyone has plans like these. Modi is good at making sure the public hears about them.

By doing this he is also sticking his neck out. No politician ever does that. He is willing to commit and then be tried on it later. He has got balls man. He is literally challenging the naysayers to poke holes in his thought process which in itself is an excellent way to get feedback.",2014-06-05 14:02:10
256,"I am not calling him anything,  I am just saying even vajpayee did a lot of work but people didn't vote him back because he didn't give them doles. As much as I know from Gujarat model,  modi opposes doles.  ",2014-06-05 14:05:09
257,"The MMS govt got that bit right. The automatic and periodic change to the price in small increments is a fantastic and should have been done 20 decades back. This will take care of fiscal side and our rupee.

Now modi can focus on cutting the demand by providing alternative fuels and sources of energy. That will help keep inflation down.",2014-06-05 14:05:55
258,I think US will put Modi in the same bracket of 'unfriendly' state leaders like Putin. MMS cud be pushed any which way which was the reason Obama said that he'd miss him ,2014-06-05 14:10:11
259,Article on this very topic - http://m.firstpost.com/politics/speaking-hindi-how-modi-is-putting-indianness-back-into-india-1557541.html,2014-06-05 14:11:44
260,"i have my eyes and ears open, haven't heard a single thing from Modi about what he thought about the rapes. the whole world condemns us, and this guy is busy with his agenda.",2014-06-05 14:21:47
261,"One example:

&gt; [Narendra Modi cracks the whip in Uttar Pradesh rape](http://www.deccanchronicle.com/140530/nation-crime/article/narendra-modi-cracks-whip-uttar-pradesh-rape)

&gt; Prime Minister Narendra Modi on Thursday cracked the whip on the brutal rape and murder case of two minor girls in Uttar Pradesh seeking to demonstrate the BJP government’s “zero tolerance’’ approach towards crime against women. 

&gt; Mr Modi’s direct intervention came as the PMO on Thursday sought a detailed report from the Union home ministry on the horrific case of rape of two teenage sisters in Badaun in UP whose bodies were found hanging from a tree.

Its all about sending a signal. They can even direct the CBI now to investigate this case. Center is quite powerful and just by raising the issue they can ensure that state government gets pressured to act.",2014-06-05 14:34:40
262,"Yep.. no body is saying we are already a developed nation now that Modi in PMO. But it clearly look like some competent people with clarity are running with a plan that sounds logical and reasonable, which is in itself a difference from the opaque workings of previous governments.",2014-06-05 14:38:25
263,"Speed Post?! Damn, Modi had better take him seriously, then.",2014-06-05 14:44:28
264,"Is he the PM or the GoI spokesperson? Why do you need to hear his personal opinion on every single issue from Kashmir to Kanyakumari? Have various members of his Cabinet not spoken out? Or are they from some different party and do not speak for their PM?

When you see a ditch on the road outside your house do you expect Modi to make a statement about that as well? And if he doesn't that means he doesn't care about infrastructure, right?

But if this is your attitude let me ask you: What about Kejriwal? Bhushan? Yadav? Sisodia? Rai? Mayank Gandhi? Have a single one of your beloved AAP messiahs spoken out about the UP rapes so far?",2014-06-05 14:54:51
265,"If it had no importance all these Cabinet ministers wouldn't be talking about it and visiting Badaun. State BJP wouldn't be staging a dharna outside Akhilesh's office. You really think Modi had nothing to do with these? Ram Vilas Paswan even [filed a report](http://indianexpress.com/article/india/politics/badaun-gangrape-in-his-report-to-pm-ram-vilas-paswan-suggests-fast-track-trial-on-lines-of-nirbhaya-case/) about the Badaun case straight to Modi. No doubt it was God that ordered him to do it.

It seems to me that you are driven less by logic and more by your prejudices about what a misogynic communal monster Modi must be. Just because he himself has yet to make a statement about this you think he must be a supporter of rape.",2014-06-05 14:56:01
266,""" will need a strong moral force to take on Modi and that will be the AAP. For me that is my politics""
-Yogendra Yadav



/thread",2014-06-05 14:57:52
267,Not Modi. [But Piyush Goel](http://www.telegraph.co.uk/news/worldnews/asia/india/10872937/Indias-top-mandarins-issued-with-motivation-aid-Sir-Alexs-autobiography.html),2014-06-05 15:02:19
268,"&gt;The PM is said to have asked Paswan to file a report on the ground situation and incorporate suggestions for improvement as well.

For those assholes who are using the Badaun rape as a cheap excuse to attack Modi by asking why he isn't saying or doing anything about it.",2014-06-05 15:03:59
269,"Well its too long for me to type out a transcript. But essentially he places Modi and the BJP literally as enemies, and hatefully calls upon his supporters to stay firm and not be fearful. It's almost like a battle cry of sorts. And of course he appeals to Allah all throughout the video for obvious reasons. Then he goes on to call 'them' (presumably the BJP and its supporters) dogs and how these 'dogs' will force them to the ways of Allah. 

And the worst is left for the last. He says that they arrived in power to get wiped out. He calls on his supports to finish 'the gundas' off. He says blood will flow instead of water. It was pure vitriol through out, and I am surprised it didn't lead to some kind of scattered riots already.",2014-06-05 15:07:53
270,"I can see it happening. 


IMHO, ABV worked on a lot of projects which had long term gains/benefits for India. Golden Quadrilateral, River Linking et al. UPA benefited from it.
Impatient electorate did not see the short term benefits, hence voted BJP out of power in 2004. I strongly feel the same could happen to Modi :(
",2014-06-05 15:19:38
271,What does this mean for a potential Modi AMA ? Will he be allowed to speak in Hindi ? ,2014-06-05 15:22:22
272,"Some real offensive things to be honest. Said modi is a kutta (literally translated to dog, but meant to be much more offensive like a ""bitch"" in english), and said that Hindus are dogs that voted for him.

Goes on to say that we will kill of these Hindu dogs and force the will of allah on them. ",2014-06-05 16:00:43
273,I credit Modi. Ache din aa gaye. :-),2014-06-05 16:10:23
274,"Don't get me started about Mr Abbott. It's okay though, he'll only get one term. I don't know much about Modi but I hear he is a far sight better. The shark killings happen whenever a surfer is mauled. Most surfers disagree with it, they realize that they are intruding on the sharks domain so they are taking the risk. It's a rare occurrence as humans aren't a normal part of a sharks diet.
Sport is a great midway between the cultures and I wonder if we'd have a connection without it. Whenever I told someone I was Australian the first thing they would do is make a joke about the Australian cricket team. One guy even named every Australian cricketer he knew ",2014-06-05 16:13:20
275,"Apparently Karan Thapar had agreed to not talk about 2002 before the interview, but then he starting asking about it. So Modi just left the interview: [link](https://www.youtube.com/watch?v=QHS_eSoOBzg)",2014-06-05 16:13:39
276,"They showed up. Unfortunately it seems they only know how to do negative things, like their rhetoric.

http://timesofindia.indiatimes.com/india/AAP-MPs-vow-to-take-on-political-goondagardi/articleshow/36085237.cms

&gt;""Modi sarkar has 100 days. On the 101st day, we will demand answers from this government,"" Bhagwant Mann, AAP MP from Sangrur, said. ""The country is facing challenges of poverty, unemployment, inflation, political goondagardi ... there is too much dynastic politics ... the log from the loktantra has vanished (this is democracy without public participation),"" he added. 

They have no solutions. At some point of time they'll just carry out a dharna about why BJP has not miraculously wiped out poverty, unemployment etc.",2014-06-05 16:17:56
277,"Modi is very very very different from Vajpayee.

He might be on this statesman mode and all now, but I assure you 4 years from now, a lot of dirt (political dirt) will start tumbling out of the Congress cupboard. He will use that as a stick to beat them with while soft selling whatever his regime will achieve over the next 4 years.

If and when he demits office, it will be on his own terms.",2014-06-05 16:21:07
278,"If the PM had only issued something while his ministers (3 of them women btw), his detractors would be saying what Sashi Tharoor just said 'Under Modi, he removes e-Gom's and disempowers Ministers"".

Womens safety comes under Smriti Irani, and it is her job to make policy around it.",2014-06-05 16:25:04
279,"China's GDP in 1992 was less than half a trillion. Smaller base makes higher growth possible.

It is not impossible though. It'll be terribly hard, but if we can do it, it'll be the greatest thing in the world and Modi will have my vote for the next 10 years.",2014-06-05 16:30:51
280,"I'd gladly accept this.Instead of going us vs Modi government,they should expose real corruption in Punjab an watch BJP fall in Punjab next election.",2014-06-05 16:44:07
281,"When was the last time you head a Chinese premier address anybody in English? Or Merkel or Putin address the media in English?

Also, English is spoken only by about 450 million people in the world. I do get your point about English being spoken by those who matter, and no disputing it's supreme status as the language of international commerce and diplomacy, but many powerful leaders get by speaking in Russian or Mandrin, and am sure Modi would do just fine speaking in Hindi.",2014-06-05 16:55:04
282,"&gt;Is the AAP’s support base also the reason for its strident opposition to Mr. Modi? If so, why was this focus absent during the government formation in Delhi? “It has been my consistent position that Modi stands in opposition to the idea of India

His Gandhi dynasty roots are showing. So Madameji (an Italian) and Pappu who only work for the betterment of their own selves are what? An embodiment of India?

&gt;was also some resistance in the party to foregrounding Modi as that was not seen as our key strength. But even at that point I and Prashant [Bhushan] were clear that the principal opposition to the AAP was Modi.”

And the truth is out, on why AK suddenly, and overnight switched from an anti UPA / anti Congress plank to an anti Modi plank. His remote controls in the form of Salim Yadav and Referendum Bhushan had clearly been ordered by their remote control which resides in 10 Janpath.",2014-06-05 17:02:32
283,Amma is swinging towards Modi. She will have her way in terms of special concessions for TN (which have been pending for a decade now) in return for a on-paper issue based support in the LS+RS but off the books would be an unconditional support.,2014-06-05 17:05:04
284,"The most commonly understood language in the world is English.  If Modi can speak English, and he is addressing the UN, and his comments can be shared with the rest of the world via the internet, then he is smart enough to know that it is important to reach his audience with a language that is common to them, rather than a language that has to be translated into a common language.  More information:

http://www.loveinfographics.com/wp-content/uploads/2011/10/languages-on-the-internet-geography-infographic.png

",2014-06-05 17:09:08
285,"Keep your friends close, but your enemies closer.

EDIT: I actually don't like this shit. I wanted Modi to completely ignore Pakistan and use RA&amp;W to our benefit. I'm just hoping he is pulling off a Michael Corleone type plan here, but I doubt it.",2014-06-05 17:17:22
286,&amp; They call Modi Fascist ,2014-06-05 17:20:00
287,"Nawaz is 64, Modi is 63. ",2014-06-05 17:21:50
288,Top trolling by Modi ji.,2014-06-05 17:27:07
289,www.deccanchronicle.com/140530/nation-crime/article/narendra-modi-cracks-whip-uttar-pradesh-rape,2014-06-05 17:36:36
290,"It is not about South India or North India. I would like if Manmohan Singh had spoken in Punjabi. I would probably like if Modi spoke in Gujrati as well

Hindi =/= North India",2014-06-05 17:43:25
291,Modi had controlled most of the violence within 3 days. ,2014-06-05 17:59:52
292,"Of course. But one of the two official languages in India is English.  If Modi speaks it proficiently, then there is no problem speaking to an audience that understands English better than they understand Hindi.",2014-06-05 18:02:54
293,Mods of this sub need to be more proactive in making sticky threads whenever a major news happens and there is a barrage of related news in the new queue. The badaun rape case and swearing in ceremony of modi and his cabinet are some recent example where such threads would have been put to good use.,2014-06-05 18:03:13
294,Woh 'secular' hain. Above the law of the land &amp; 'cosy Delhi club' scrutiny! Someone should prepare a list of 'secular' &amp; 'communal' interventions by opinion makers. Silent on Owaisi and vocal on some xyz sena. Har hafte kisi channel par bulaya jaata BJP/Modi bashing ke liye. ,2014-06-05 18:12:19
295,"&gt; I wanted Modi to completely ignore Pakistan

Good thing you are not his foreign policy advisor. 

",2014-06-05 18:17:24
296,"Felt like a deja vu. Reminded me of this chat I had with a (Modi supporting) friend when I spent quite some time explaining yo him how the state was complicit in the riots, and he replied that the only reason he holds Modi in such high regard is for 'teaching Muslims a lesson' in 2002.",2014-06-05 18:24:40
297,"I honestly don't see the issue here. 

He is more comfortable speaking in Hindi, so he decided he'll be conversing in Hindi from here on in. 


Modi as an orator in English is no where close to Modi as an orator in Hindi. ",2014-06-05 18:37:57
298,"Sadly if Modi as much as touches him, the ""secular"" Indians in MSM and Social media including our friendly /r/India would be up in arms saying that Modi is the 14th avatar of Hitler.",2014-06-05 18:39:43
299,"China takes care of it's citizens much better than we do. They have better social security - something mnrega type schemes seek (but fail) to achieve. They have much better healthcare, education and useful infrastructure. They spend more of their budget on these things. When people are displaced by land development (dams, industry, new cities) they're actually taken care of unlike in India where they're basically told to go fuck themselves.

No matter who is in power at the center, we have a bloated and inefficient bureaucracy and a political class that is deeply corrupt and easily bought by corporations that don't really give a shit about anything other than the bottom line.

But we have ""freedoms"" so there's that. I am being cynical, but if you've ever been to China it's just incredibly hard to be optimistic about anything in our country. Regardless of how good/bad Modi is, it's not feasible to completely overhaul the rest of the country.",2014-06-05 18:40:02
300,"Yo Modi, I like what you did there. Keep it real !",2014-06-05 18:41:21
301,"When Giriraj said his dumb fuck ""People should go to Pakistan"", even places like /r/India erupted in an orgasmic frenzy. Do you see any ""seculars"" of this hallowed sub talking about this?

To them it is just a poor, oppressed Muslim venting out against the oppressive Modi regime.

&gt;No true secular would support him.


Very few of them exist in India today. Most are of the ""if you refuse to wear a skull cap, you are a Nazi"" type.",2014-06-05 18:41:49
302,"I totally approve of this. Pakistan finally seems to have a stable civilian government at the helm. If we can maintain cordial relations with them, we can devote our attention to solving our country's problems instead of trying to protect ourselves from their dickery.

Peace is good for business. Good that Modi is working on that.",2014-06-05 18:43:30
303,"If you touch him, you will have a 10000 articles in the guardian and other gora liberal papers along with 3000 hours of talkshows on CNN-IBN, NDTV and a 400 comment thread on /r/India talking about how evil Modi is destroying the secular fabric of this country by arresting a poor, innocent Muslim.",2014-06-05 18:44:45
304,"WTG, Modi! This is what we need. Further, he should ask these secretaries to ask the people who report to them to also make lists. Then we can clean up / speed up this system from top to bottom.

Meanwhile (Shashi Tharoor):

&gt; “And if indeed he is going to run such a hands on government, then he is going to be working very long hours.""

Yeah - its called doing an honest day's work. Something that the entitled family your party worships never figured out.",2014-06-05 18:55:14
305,"&gt;China takes care of it's citizens much better than we do. They have better social security - something mnrega type schemes seek (but fail) to achieve. They have much better healthcare, education and useful infrastructure. They spend more of their budget on these things. 

Agree.

&gt;When people are displaced by land development (dams, industry, new cities) they're actually taken care of unlike in India where they're basically told to go fuck themselves.

False. If anything the Chinese govt does the whole, ""go fuck yourselves"" shtick. Take even the 3 Gorges dam, they simply evicted people living there for 1000's of years and the people had zero choice in that matter. No court hearings, no stay orders, none of that stuff. Yes, in terms of recovery and over all well being, they would do much better than the average Indian slum dweller shunted out to make way for a highway.

&gt;No matter who is in power at the center, we have a bloated and inefficient bureaucracy and a political class that is deeply corrupt and easily bought by corporations that don't really give a shit about anything other than the bottom line.

Agree.

&gt;But we have ""freedoms"" so there's that. I am being cynical, but if you've ever been to China it's just incredibly hard to be optimistic about anything in our country

Really? Freedoms on paper never translate well into reality in India and most other 3rd world nations. Sure, I can post shit about MMS or Modi on my FB wall, a paper might write an Op-Ed abusing the ruling party...but do we (the average Indian) truly have freedom in this nation? Take Badun, the cops at first basically told the parents of the kids to bugger off, and only because of the gruesome nature of the crime and the media attention are things moving. If maybe they hadn't been hanged to death and media hadn't caught on, the kids and their parents would be powerless and freedom less in the face of an oppressive bureaucracy!

&gt;but if you've ever been to China it's just incredibly hard to be optimistic about anything in our country

I actually have. I have travelled to Chengdu, had a couple of MBA batch mates who were mainland Chinese, and I don't know man, if there is one key difference I spot in the attitudes of those I interacted with? It is the overwhelming sense of belief and pride in being Chinese and in a near certainty that they will own the coming century. It is unexplainable, but constant and all pervasive. Maybe it is the wrong demographic that I have been talking about, and am sure the poor farmer in the Xinjiang region would feel otherwise...or not.

About Modi, see we are all realists, nobody is expecting him to turn India into a first world power in 5 years, but what we want for a start is a functioning government that has the interests of the collective good in mind and not subversient to the whims and wishes of one woman and her family. 

We want him to lay the foundations for reform - labour law reform, power sector reform, ease the red-tape strangling every single aspect of life in India.

We want him to push development to the fore and only that or lack of it should decide electoral mandates - the Indian people have been doing this consistently well for the past 3-4 years though...rejecting freebies &amp; largely voting for cleaner development based parties (even if they are 2,3 times incumbent), I think this momentum will sustain and the system will itself cleanse itself of the filth of stuff like caste / religion based voting which allows scum like Mulayam and his son to thrive. Will this happen now? Certainly not. Will it happen in the next 10-15 years? Yes.

Change is finally coming to this so far benighted land.",2014-06-05 18:57:47
