,article,article_date
0,"See, the reason I suggested the 10k rule was so that at least the power remains with the people, the audience and not with the website (twitter) to decide whose content is posted on a different site (reddit). You can obviously raise the follower limit if you wish. Right wing or left wing, ideologies won't matter. At least start it for a trial basis, if it fails, you guys can rollback. Besides, most of the blame for witch-hunt is put on the Namo-army which won't attack right-wing journalists obviously.",2015-04-27 18:58:08
1,"GOI has a duty towards it's citizens and nepalese brothers and sister first. Other nationals have to be treated differently.

Shame on NDTV for wrong headline.. Same #presstitutes would bark on GOI (read NaMo)  if they had rescued foreign nationals along with Indians &amp; Nepalese. ",2015-04-28 10:29:12
2,"I don't ever see you say this when others whine about ""but muh evil Namo Army"".

For the record anybody whining about votes is just being asinine and that is my stance. Namo army or Aaparmy, if you must do so, please be consistent.",2015-04-28 11:45:23
3,Yup - same for me. A lot of people however can't see beyond NaMo Central.,2015-04-28 14:52:17
4,"They are doing so much don't you know. They brought 19ooo kids to Last Mumbai Indians Match with MI jerseys. ;)
Btw they are indirectly supporting nepal with help of NaMo. :P",2015-04-29 12:26:03
5,"Most of these farmers spend their childhood and better part of youth in farming activities only, so alternate careers which require at least semi skilled people is out of question.

This is why when RaGa says that farmers are backbone of our nation makes me seriously doubt his IQ.

This is contribution of various sectors to Indian economy : agriculture: 13.7%, industry: 21.5%, services: 64.8% (2013) 

So agriculture contributes 13.7% while it employees 52.1% of our workforce.

It seems highly unlikely to bring green revolution in agriculture sector considering that it depends entirely on environmental conditions which are mostly unfavorable these days.

The best plan of action for our nation should be to concentrate on manufacturing &amp; services skill development while increasing agricultural productivity per acre. This is exactly what NaMo wants to achieve.

But ""Congress &amp; sons limited"" as always is not going to think about what is good for entire nation.
",2015-04-29 15:37:10
6,"Why, you seem like such a level headed person otherwise. Believe in modi. Namo is where it's at.",2015-04-29 21:16:14
7,I feel pity for the journalists that give unnecessary importance to pappu RaGa. How can a politician take 59 days vacation &amp; come back as if nothing has happened in the mean time. Even the haters of NaMo must respect him for his restless hard work.,2015-04-30 16:55:58
8,Lol - Namo,2015-04-30 22:33:12
9,"&gt; Arun Shourie, one of the most influential BJP ideologues during the Atal Bihari Vajpayee government, on Friday launched a blistering attack on Prime Minister Narendra Modi, accusing him of poor handling of the Indian economy and turning a blind eye to the attacks on minorities and their institutions by the right-wing groups

.

&gt; Calling Modinomics ""directionless"", the 73-year-old author and politician said there was no big picture on the economy

!!!


To me what has been the most interesting dynamic is the unwavering support which Arun Jaitley for some *God-Knows-What-Reason* enjoys with NaMo &amp; Shah. Before LS2014 I was pretty sure he'd be cut down to size in this cabinet.


",2015-05-01 18:02:21
10,Lol...and his best frand mr. Shah is hellbent on getting those same Bangladeshis to Assam. Aur karo namo namo.,2015-05-02 03:03:40
11,NaMo = IndianMedia?,2015-05-03 13:50:17
12,anything related to india is now due to namo and caste system ,2015-05-03 14:45:02
13,"Ok. Namo, Namo.
",2015-05-04 11:50:38
14,If you want to follow NaMo on Chinese Twitter : WEIBO [click here](http://weibo.com/u/5581682776),2015-05-04 16:39:11
15,"Ha ha ha. Chinese internet trolls &gt; NaMo PR Machine^(TM)

",2015-05-05 14:22:43
16,Namo pr machine hasn't reached wiebo mate. Wait for a few months and if you go to wiebo you'll start thinking that the Chinese love modi and want to have his babies. ,2015-05-05 16:46:38
17,"Namo, Namo.",2015-05-05 20:45:00
18,NaMo army trying to hide their shame.,2015-05-05 23:38:22
19,"He is stuck, I really feel sorry for this guy... he had N number of stern warnings from the high command, with Gandhi dynasty showing a stern face to him when he toed outside the party line and commended NaMo and others, and now with the sword of Sunanda hanging over his head he can ill offered to make any enemies. So he is just going to lick it all up.",2015-05-06 00:44:54
20,OP says that this guy is a BJP supporter and is followed by namo so it must definately be true. Thanks OP for the certificate ,2015-05-06 18:34:56
21,"Yeah, and Namo has come to power for a Ghar Wapsi of the entire Pakistan population. Pak minister ""Don't get high on your own supply mate""",2015-05-07 02:17:24
22,"This post is at 7 karma points. The other one is at 0. such namo. much army.

http://np.reddit.com/r/india/comments/356szd/world_famous_economist_vs_world_famous/",2015-05-07 21:55:00
23,"Leaving those PMs aside who were in minority in parliament &amp; were propped up from outside by a bigger party, that leaves Nehru, Indira, Rajiv, PVNR, ABV, MMS &amp; NaMo in the fray.

The latter 4 rose through ranks &amp; became PM on own steam through sheer hard work &amp; merit. PVNR was pragmatic but more of a politician than a statesman, he was pulled down by his own party. ABV was a true statesman with a vision, and achieved a lot in the given time frame. MMS was a scholar, &amp; pragmatic, but his hands were tied, he never got a free hand to do what he wished to do, &amp; within those constraints his 1st term was quite good. NaMo is in ABVs mould and seems more pragmatic than ABV, ABV used to get overwhelmed by emotions. In key performance indicators of the Economy, NaMo's 1st year seems to be one of the best on record, with inflation at one of the lowest point &amp; a China beating growth to boot.",2015-05-08 07:20:04
24,"&gt; that leaves Nehru, Indira, Rajiv, PVNR, ABV, MMS &amp; NaMo in the fray.
&gt; 
&gt; The latter 4 rose through ranks &amp; became PM on own steam through sheer hard work &amp; merit.

While Nehru became PM because his father was PM before him.

&gt; NaMo's 1st year seems to be one of the best on record, with inflation at one of the lowest point

Yes, because of how the global economy has been over the past year; nothing to do with the BJP itself.

&gt; &amp; a China beating growth to boot.

No. India's GDP is growing faster (rate) than China's. India's growth (total) is also &lt;&lt; China's and will be so for quite some time.",2015-05-08 08:36:02
25,Send a tweet to Namo.,2015-05-08 18:50:22
26,Nope. There's strictly no shitting allowed on NaMo or BJP here or else your butthole gets filled with lotsa lotsa downboats.,2015-05-11 04:33:49
27,"This is the kind of bullshit that pisses me off. NaMo, you're no different. ",2015-05-11 10:37:24
28,"Nope. It still portrays BJP in a negative light. Everyone know BJP is the best political party ever and NaMo is our saviour. 

Time of India is funded by Ford Foundation used by CIA to destroy india.

The only objective source of news is http://www.bjp.org/",2015-05-11 14:25:03
29,... 10 years leap.. Bhai tries to get Namo out of jail. meh..,2015-05-13 19:17:14
30,Samsung should have paid money to Namo instead of Ellen for the Selfie it would destroyed apple by now.,2015-05-16 00:01:36
31,"The iphone 6 maybe? Wasn't he supposed to use an 'Make in India' phone?

Edit:- He uses the [smartnamo](http://m.timesofindia.com/tech/tech-news/Smart-Namo-the-Narendra-Modi-branded-Android-phone/articleshow/21398111.cms)",2015-05-16 09:48:46
32,Time for an RTI. It could even be a [NaMo](http://smartnamo.com/),2015-05-16 13:54:54
33,"No matter what he says, there's going to be roughly equal number of people who admire him, and those that make fun of him.

Sorta, kinda like AK or NaMo. This is one to watch out for, for sure!",2015-05-17 03:05:49
34,"People asking for Chinese leaders to have a social media presence. People, this is the NaMo effect in China.",2015-05-17 07:46:53
35,Reposting because Namo army downvoted previous post (Only 40% upvotes).,2015-05-17 10:44:09
36,Why would Namo army downvote bad news about AAP?,2015-05-17 13:02:21
37,He's known to regularly follow NaMo and like several of his pics. ,2015-05-17 22:43:28
38,namo,2015-05-18 12:34:52
39,Namo Namo,2015-05-18 14:23:43
40,"&gt; Relieved that the electricity prices have come down.

Are you sure its because of AAP and Kejriwal, and not due to PowerGrid putting a lot of efficiencies in place of late?

&gt; Delhi Police have this bad habit of getting in an auto, taking him places and not paying.

Ahmedabad Police is even worse! They generally stroll across to a poor fruit vendor or Bhel/Kachori stall owner and then, grab some fruits in wholesale or eat their fills at these places respectively. And they stroll away without paying a dime!

This has been reported in ToI several times, and is happening since ages right under NaMo's nose, long before NaMo became PM and was the Gujarat CM! How do you explain this fact now?",2015-05-18 16:42:11
41,I am planning to start a website called namofart.com or modifart.in which talks about every small fart by namo. Who is in?,2015-05-19 11:49:52
42,Its ok if he says it..I do not expect any philosophical quotes from pappu..What NaMo said was correct from 20000 feet level but as a prime minister he could have used more diplomatic language rather than being direct.,2015-05-19 17:47:12
43,"No he really did not. but what we should understand is that the things he says are right but not popular opinion &amp; congress which does not yet have anything against his government will use everything he says against him...

NaMo should read 48 laws of power :

**Law 4: Always say less than necessary**",2015-05-19 17:53:51
44,is this the first genuine goof up(speech) of NaMo?,2015-05-19 19:27:43
45,"The article is written by a juvenile trying to sound like an economist and foreign policy expert.
The gullible common man would have believed it except for a few telltale giveaways, like the badly written 5th standard failed English and the first sentence which mentions 'hidden achievements'. How can a narcissist and megalomaniacal person keep his achievement hidden?  That prompted me to have a closer look at the claims made by the author.

1.	BJP Govt.  convinced Saudi Arabia to not charge “On-Time Delivery”  Premium charges on Crude Oil – Young Petrolium minister  Dharmendra Pradhan &amp; External affair minister Sushma   Swaraj seal the deal. 
 What is “On-Time Delivery” Premium charges? 

Does a charge like this exist? I’m aware of Asian premium and yes Petroleum minister, Dharmendra Pradhan did raise the topic of Asian premium on his visit to Saudi Arabia and so did other Asian powers like China, South Korea &amp; Japan. As crude oil prices crashed to US$ 40 per barrel, Asian countries saw a good opportunity for Asian premium on crude oil to be removed. As of now the premium still exist. The author and great economist is very quite on who has benefited by oil prices crashing for US$ 120 during Manmohan Singh’s tenure to US$40 at the start of Modis tenure, all that the nation got was a measly Rs. 2 or 3 reduction in petrol /Diesel prices.

2.	India will  build 4 Hydropower station + Dams in Bhutan (India will  get share in Green energy will be produce in  future) 

Yes India will build 4 Hydropower stations in Buthan, but Modi or his government has contributed nothing in this; the deal was signed by the previous government. Modi and his government’s only contribution is Photo Ops, sound bites and 56 inch chest thumping.
(April 22, 2014) http://www.business-standard.com/article/economy-policy/india-bhutan-ink-pact-to-develop-hydropower-projects-114042200999_1.html  

3.	India will build Biggest ever dam of Nepal (China was trying hard to get that) – India will get 83% Green energy produce from that hydropower station in free – in future. 

This is the culmination of years of negotiation. The Nepalese government agreed to allow GMR in 2008 to construct the 900-megawatt Upper Karnali hydroelectric power plant in the northwest. But the project was delayed as the nascent republic was mired in instability with six government changes in as many years. Nepalese political parties also demanded greater benefits for Nepal from the scheme that is mainly aimed at exporting electricity to India.

4.	Increased  relationship with Japan and they agree to invest $30 Billion  in DMIC (Delhi – Mumbai Investment Corridor) 

Means nothing. The great leader of Burkina Faso increased relationship with Japan and they agreed to invest $ 300000 billion in their proposed school corridor.
 
5.	Increase  relationship with Vietnam and Vietnam now agree to give  contract of Oil exploration to ONGC-Videsh (UPA was not  ready to take because they are worried of china – major   conflict on south-china sea) 

The relationship with Vietnam is a continuation of previous government policy. We have been producing and selling natural gas from two blocks — LanTay and LanDo — in Vietnam for the last 30 years. India had show China the middle finger way back in 2011. 
(November 2011) Angry China can’t stop ONGC’s Vietnam hunt http://archive.financialexpress.com/news/angry-china-can-t-stop-ongc-s-vietnam-hunt/871919/0 
(November, 2013)Petrovietnam, ONGC Videsh sign oil exploration pact
 http://in.reuters.com/article/2013/11/21/vietnam-india-energy-idINDEE9AK01X20131121
(July 2012)  Vietnam extends contract, wants India's presence in 128 block
http://www.business-standard.com/article/companies/vietnam-extends-contract-wants-india-s-presence-in-128-block-112071500046_1.html 
(November 21, 2013) ONGC Videsh gets 5 oil and gas blocks offer from Vietnam http://zeenews.india.com/business/news/companies/vietnam-offers-5-oil-and-gas-blocks-to-ongc_89195.html

6.	Increase Oil Import from Iran despite there is ban by USA. Iran agree to sell in Indian rupees and it save our Forex. India didn’t  stop to build “Chabahar” port of Iran. 

Iran is India’s second largest supplier of crude oil since 2008, around 40% of our oil comes from Iran. India has been paying for Iranian oil in India rupees since 2013 not after Modi came to power as falsely claimed by the author.
(Jul 14, 2013) Iran agrees to take all oil payments from India in rupees http://timesofindia.indiatimes.com/india/Iran-agrees-to-take-all-oil-payments-from-India-in-rupees/articleshow/21067897.cms 
In fact Modi government had buckled under US pressure and reduced crude oil imports from Iran in March. Is the government paying back to the US for granting Visa to Modi?  
(Mar 31, 2015) India skips Iran oil imports in March under U.S. pressure
http://in.reuters.com/article/2015/03/31/india-iran-imports-idINKBN0MR0WT20150331 

7.	India –  Australia (NaMo is first PM to visit Australia after 28yrs)  Despite Australia is major supplier of Coal &amp; Uranium.  NaMo able to convinced Tony Abbott and now Australia   will supply Uranium for our energy production. 

The only one to benefit is Adani. India has enough coal; we do not need to import coal from Australia or any other country. We also now self sufficient in nuclear fuel, we don’t need nuclear fuel from Australia.
(April 8, 2015)  India registers record production of nuclear fuel. http://www.thehindu.com/news/national/india-registers-record-production-of-nuclear-fuel/article7081588.ece 
 
8.	China  favoring President lost election in Sri Lanka – Remember  UPA lost “Hambantota” port development – read latest  report of CIA where they mention RAW has major role in power  shift of Sri Lanka. Now Modi has confirmed he is visiting  Sri Lanka in April. 

More mumbo jumbo. A good excuse for one more foreign jaunt.
 
9.	With China  as Trade Deficit was increasing – NaMo force either  Anti-Dumping will be come soon or China have invest into  India. – China commit $20 billion Investment in India. 

Republic of Timbuktu has also committed to invest $2000 billion in India.
China display’s map of India without J&amp;K and Arunachal Pradesh, China issues stapled visa to Indian citizens of Arunachal Pradesh; and our great PM has agreed for Visa on arrival for the Chinese; this despite severe  opposition from intelligence agencies, the defence ministry and the home ministry. 
 
10.	On Security  – I think adding “Ajit Doval” in his team is the best  decision by NaMo. See the recent tie-up with Pantagon,  Israel &amp; Japan. Remember I.K.Gujaral as PM stop RAW’s  offensive operations in foreign countries.. Now see how we stop ‪#‎TerrorBoat and listen his word … “Any Mumbai like attack from Pakistan  and Pakistan will lose balochistan” 

It is better the author does not think, we will be spared such utter nonsense. ",2015-05-19 21:41:23
46,"11.	India  approve the Road in North east and around India china border  – Remember Just because China’s oppose ADB (Asian  Development Bank) didn’t give us fund during UPA regime   and UPA hold that file under “Environment Ministry”  node – Remember “JAYANTHI TAX” ? 

Approval and completion of projects are two different things. It will be considered an achievement if and when it is completed. 
Road projects in the North-East commenced in 2005,http://www.mdoner.gov.in/content/sardp-ne but progress is slow 
India's north-east risky terrain for road construction
http://www.business-standard.com/article/companies/india-s-north-east-risky-terrain-for-road-construction-113112000828_1.html

12.	India  manage to bring back 4000+ Indians from War zone Yemen  and also bring foreign nationals of 41 different countries  which put India’s name globally in rescue mission –PM Narendra Modi specially talk to Saudi Arabian king and  tell him to allow Indian Airforce planes to fly – as Saudi  Arabia was attacking on Yemen and Yemen sky was declared  NO-FLY Zone. 

In operation Safe Home Coming in 2011 over 15000 Indians were evacuated from Libya. In operation Sukoon in 2006 over 2280 Indians very evacuated from Lebanon. In 1990 the largest air evacuation in history 1,70,000 Indians were evacuated from Kuwait, this feat is unparalleled and entered in the Guinness book of world records. This was done as duty by our armed forces and the respective governments at that time. Only publicity hungry, megalomaniac like Modi will beat his 56"" chest and take credit for everything.

13.	India’s  Air defense was getting weaker day by day, NaMo has  renegotiated Rafale fighter Jets deal with France and bough  36 Jets on ASAP basis. 

The defence minister (the only minister in Modis cabinet who knows something) had proposed increasing the number of Su 30 MKI’s instead of the uber expensive Rafale. But Modi overruled him and ordered 36 Rafale fighter jets. Note; the deal is only for the fighters, does not include missiles or any ordinance, we will now be forced to buy them at super high prices as none of our existing missiles of smart ammunition are compatible with it. We have now added one more type to our already ridiculous diverse fleet of fighters with associated headache of logistics, training, syllabus, spares, ammunitions, etc.   
All this when our very own fighter Tejas is ready to be inducted in large numbers. 
LCA Tejas Takes Off with IOC-II 
http://www.indiastrategic.in/topstories3154_LCA_Tejas_takes_off_with_IOC-II.htm

14.	First time  after 42yrs Indian Prime Minister visits Canada, in  Bilateral deal, Indian able convince to Canada to supply  Uranium for India’s Nuclear reactors for next 5yrs.  It will be great help to resolve India’s Power  problems. 

India is self sufficient in nuclear fuel; we don’t need uranium from Canada or any other country.
(April 8, 2015)  India registers record production of nuclear fuel. http://www.thehindu.com/news/national/india-registers-record-production-of-nuclear-fuel/article7081588.ece 

15.	Canada approve On-Arrival visa for Indian tourists. 

It’s the other way round; India is giving Canadians Visa on Arrival. 

16.	Till yet we  were buying the Nuclear Reactor from Russia or USA and it  was much like bagger kind of situation because they were  worried about usage of Nuclear reactor for some  other use. Now Narendra Modi able to convince France and  now France will make Nuclear reactor in India. On MAKE IN  INDIA efforts.. with collaboration with Indian  company. 

Yes and all these years scientist from BARC and NPCIL were twiddling their thumbs and playing with Lego toy block, waiting for Modi to visit France. 
Nuclear Power in India  http://www.world-nuclear.org/info/Country-Profiles/Countries-G-N/India/

17.	During 26th  Jan Visit of Barak Obama, NaMo convince USA to drop rule of  Nuclear fuel tracking rule and sort-out Liabilities rules  which now open the gates for next 16 Nuclear   power plant projects.  

The rest of the world has stopped constructing new nuclear power plants and are closing down their existing one. India is now the new dumping ground for the West to dump their nuclear power plant.
Does the writer even know what is the Civil Liability for Nuclear Damage (CLND) Act.; and what it means.
India’s nuclear liability law will not be amended: Government - India has given a Memorandum to the US on Friday assuring them the same. http://indianexpress.com/article/india/india-others/indias-nuclear-liability-law-will-not-be-amended-government/

I agree that it will take some time for the government to show results and as an optimistic citizen I hope they will.  But these kind of juvenile write ups are nothing but taking credit for things Modi and his government have not done or just plain chest thumping when previous governments have done the same things better without making a song and dance about it. 

Does it justify the numerous foreign visits? The jury is still out. ",2015-05-19 21:55:09
47,"&gt;  Most people don't even know that there is a new Government in India in the country I visited.

US/UK media on the other hand is featuring way more on the new Govt. than ever before. No one knew who Manmohan Singh was, almost everyone knows about NaMo.",2015-05-20 03:07:25
48,"UPA 1 and UPA2 did nothing when one of the state's CM was denied visa. They didn't even try to diplomatically argue NaMo case.In fact, the congress MPs sent a letter to Obama and others to deny his visa. 
Now PM Modi goes abroad and talks to Indian diaspora about UPA;s scams and how an average Indian felt and how confidence went down etc...That's it. People are tearing apart their shirts now. Just need to find a reason to get outraged.. Nothing else for us Indians.

",2015-05-20 03:40:03
49,"It is the Govt **of India** and not just congress government or BJP government.

Politics should stop at the country's border. It is quite possible to lay out concrete changes, policy differences etc or even emotive appeals without being negative.

Indians abroad can get quite hardened and jingoistic, there are still die hard khalistani's out there. Beware rabble rousing. (not that NaMo is doing it, but he can be more statesmanlike)

",2015-05-20 11:42:43
50,"Many sane people know what NaMo actually said and what our media made out of it...Our media houses are no better than some shitty college students who copy the assignment of that one kid who by some jugaad completed his.

Those who start hashtags based on media news are equally as idiot as the media that starts the news.

NaMo should be careful. A leader speaks only that which is absolutely necessary..nothing more, nothing less.",2015-05-20 14:03:55
51,"As bad as that was, it doesn't justify un-statesman like behavior of NaMo. And yes, congies are worst offenders of this kind of behavior.",2015-05-20 23:23:47
52,"Lmao! The FUD in the thread is so high, it's hilarious to read it.

&gt;No matter how much you guys masturbate to NaMo remember

&gt;1) He is all for business. Even if it means prices go up and forest are destroyed. No wonder greenpeace is now being banned

&gt;2) Expect the right wing to intensify their collective shoving of their pre-dated ideas up our asses.

.

&gt; Naked capitalism? This is capitalism 101. Naked capitalism you'll see 2 years down the line when Ambani will tax you for walking on the footpath 

.

&gt;For those of you who are wondering WHY the government did this look athe drugs they are all from American companies. Plus it was done right before the trip. Modi is just desperate for foreign money

&gt;It should plainly obvious that Modi's economic plan from day one has been FDI and opening up India completely to foreign companies so he can rule for 10 years. Whatever effect it has on India in the long term is irrelevant to Modi's crony capitalism. He was literally begging the US companies to hurry up and 'come to India before its too late'. 


I think I'll need cancer drugs too.",2015-05-22 11:53:53
53,"Now #ModiMurdersDemocracy is trending on twitter. Hahaha. I guess they stopped paying the Namo army. The whole country is disgusted by our Feku PM.

Edit: I see our Namo army are furiously downvoting these posts. What a pathetic bunch of losers. Why don't you guys grow a pair and learn to take criticism like adults?",2015-05-22 17:55:14
54,"Read these articles completely and then decide if you want to kill yourself or not. [Left out of naredra modi's inclusive policies](http://m.firstpost.com/politics/left-out-in-narendra-modis-inclusive-politics-dalits-in-gujarat-1184031.html)

[Know your namo](http://www.mainstreamweekly.net/article4940.html) Even haryana is rich dude but we rest of Indians don't respect them.",2015-05-22 23:23:59
