,article,article_date
0,"The ""BRICS"" summit ended up being the IR summit. They were supposed to create a new credit agency: that didn't happen. India pressed China to forcefully condemn Pakistan: that didn't happen. Instead, China snubbed India and doubled-down on protecting Pakistan. South Africa and Brazil are both largely irrelevant to the world stage, so I don't even know why they are there. 

It seems Putin has gone all in on ties with India. Personally, I think this is good news. It gives India strategic leverage against the yanks and a diversified stream of energy/defence investment. Win-win, as they say. 

Well played, Modi. ",2016-10-18 00:22:45
1,"The Syedna of the Bohra Muslims endorsed Modi. All of his followers tend to follow in his footsteps. Just the one example I know of. Someone else here said Zakir Naik used to praise Modi on his shows.

[SOURCE](http://scroll.in/article/690304/why-bohra-muslims-are-so-enamoured-of-narendra-modi)

You hated BJP because of your textbooks, now that they change all the textbooks in Rajasthan etc, a whole generation will grow up knowing them as nothing but the saviors of ""oppressed"" Hindus in India.

You honestly think that India 12 years ago had Muslims and Hindus voting along similar lines with similar noise in their communities and now the opposite is true? What happened in 2004 that changed all this?",2016-10-18 00:22:48
2,"#Arvind Kejriwal flirts with caste, reservation politics in Gujarat

___

[IMAGE](http://images.indianexpress.com/2016/10/kejriwal-4805.jpg?w=480)

___

Delhi CM Arvind Kejriwal speaks during a press conference at his residence in New Delhi on Saturday. PTI Photo Delhi CM Arvind Kejriwal speaks during a press conference at his residence in New Delhi on Saturday. PTI Photo

Aam Aadmi Party national convenor and Delhi Chief Minister Arvind Kejriwal’s announcement that his party will fight the Gujarat Assembly elections came with a touch of leaning to caste and reservation politics, a move away from his usual anti-corruption agenda propagated across states.

Kejriwal has been courting young Patidar leader Hardik Patel for some months and his public praise for Hardik has increased in recent days. Hardik has spearheaded the Patidar reservation agitation and was in jail for around a year under charges of sedition before being released recently. Kejriwal condemned police action against agitating Patidars and called Hardik a patriot. It is notable that in the same light, his party has spoken against the BJP, SP, BSP and several others of doing communal or caste politics. He also spoke highly of Dalit leader Jignesh Mevani and OBC leader Alpesh Thakore setting a clear picture for his election agenda and the electorate he plans to woo.

Recently this year, leaders from Patidar Anamat Andolan Samiti were left flabbergasted when Kejriwal expressed his wishes to meet Hardik to show his sympathies to their cause. One of Hardik’s closest aides Akhilesh Katiyar even commented that Kejriwal’s party has “championed the cause of equality and freedom” and that the Patidars were surprised to see that the Delhi CM had shown his support for a “caste-based reservation movement”.

Hardik’s aides acknowledged in the past that the AAP did not have a huge vote base in the state and with the Patidars comprising over a quarter of the electorate, wooing them will be crucial for the party that had announced that it will fight on all 182 seats in the state. Hardik has on multiple occasions insisted that he doesn’t want to turn his agitation into a political one. However, if the AAP can put up a good fight against the BJP, which has lost significant support from the Patidars, and promise a push for their reservation movement in coming years, Hardik might just guide the support of the huge community to the benefit of Kejriwal.

Kejriwal’s move to invoke the Una incident shows that he intends to keep the incident alive during the poll fray. He condemned the incident where four Dalits were flogged publicly for skinning the a cow’s carcass. Kejriwal applauded Mevani for keeping the Dalit community together in the testing times. Thakore received praise for efforts against bootlegging in the state.

The AAP has done a fair amount of ground work in the state but it still isn’t as robust as in Punjab. If it gets the full support of Hardik, Thakore and Mevani, coupled with the anti-incumbency in the state, the party may pose a significant threat to the ruling BJP that is much weaker than how PM Modi left it when he assumed power at the Centre in 2014.

___

^Version ^: ^0.5b ^| [^Changelog](https://www.reddit.com/r/anti_anti_adblock/comments/4ssi0u/change_log/)

^Function ^: ^I ^post ^the ^article's ^text ^as ^a ^comment ^if ^the ^website ^is ^adblocker ^unfriendly.

[^I ^accept ^commands!](https://www.reddit.com/r/anti_anti_adblock/comments/4u2iwn/commands_accepted_by_the_bot/)



___

^Powered ^by [^newspaper3k](https://github.com/codelucas/newspaper)",2016-10-18 00:30:01
3,"Meanwhile if you speak out in favour of the BJP or against other parties you're called a Modi stooge, bhakt, internet Hindu or someone who is threatening India's very soul and plural values. Is that rhetoric any different?

&gt;We are treating politicians as celebrities and we are treating them as if they are above criticism of any kind.

Something nobody raising this viewpoint ever addresses is the fact that everyone should be open to criticism including critics themselves.

Most of the people criticizing Anurag Kashyap are NOT calling him anti national. If you look at the tweets listed in these articles most of them question why he is blaming the PM for the ban imposed by  a private filmmakers' body. This is a very valid argument but instead of answering it Kashyap and his supporters cry victim and scream *'I have a right to dissent!'* **At least explain why you are dissenting!**",2016-10-18 00:46:24
4,"#BRICS Summit: China bulldozed India's security concerns as Russia looked the other way

___

**Highlights**

1. Russia did not help India name-check JeM and  LeT  in the Brics' Goa Declaration

1. But it ensured that Syria-based Jabhat al-Nusra figured in the list

1. Strategic experts said India could do little while China managed to get its own way, even at India's expense



___

[IMAGE 1](http://timesofindia.indiatimes.com/thumb/msid-54903809,width-400,resizemode-4/54903809.jpg)

___

BENAULIM (GOA): China blocked India's attempts to include the names of terror groups like JeM and LeT in the BRICS'Goa Declarationbut what has hurt the government more, as sources said, is Russia's disinclination to argue India's case. The result, of course, was a declaration which failed to address India's core concern of the issue of state-sponsored terrorism.



What compounded the matter for India was Russia's recent military flirtation with Pakistan in the name of anti-terror exercise. In current global power play, Russia is seen increasingly as needing China more than the other way round, butMoscow's submission to the Chinese position on an issue related to India's security still has come as a revelation to the Indian authorities.



While Russia did not help India name-check JeM, which perpetrated bothPathankotand Uri attacks, in the Goa Declaration, it ensured that Syria-based Jabhat al-Nusra figured in it. As it seeks to bolster theBashar al-Assadregime in Syria, Russia has continued to target al-Nusra, which it accuses of seeking a Caliphate through barbaric methods, in the country. Like the Nusra, JeM and LeT too are proscribed by the UN. Russia called for ""relentless pursuit'' of al-Nusra in the declaration.



As strategic affairs expert Brahma Chellaney said, Moscow appeared willing to accommodate India's concerns in the Goa Declaration but, in the face of Chinese opposition, shied away from supporting India's case.



""The result was that the declaration failed to mention the most potent form of terrorism in the world, which is state-sponsored. And while citing groups like ISIS and al-Nusra, the declaration conveniently omitted any mention of the Pakistan-based organizations that the UN has designated as terrorist entities,"" he said, adding that the ""anodyne"" declaration called into question the utility of Brics for India.



With Russia doing precious little for India, China could shield Pakistani terrorism not only at the UN Security Council but also at a multilateral summit on Indian soil. In doing so, as Chellaney said, China rode roughshod over Indian concerns and showed itself culpable in the killing of 26 Indian soldiers at Uri and Pathankot.



While Russia itself has been the clear winner in terms of BRICS' focus on security related issues, China continues to call the shots on financial issues, leading to questions about the utility of Brics for India.



""China uses BRICS to advance its economic and political interests, including dominating the two financial mechanisms that the grouping has set up. But what does India get from BRICS?"" said Chellaney.



""Goa showed that while China manages to get its own way, even at India's expense, Indian officials do little other than put on a brave face. Even earlier, when China secured the right instead of India to host the Brics' New Development Bank, Indian officials were left flaunting a consolation prize -- an Indian to be the Bank's first president,"" he added.



The Goa Declaration came just a day after PresidentVladimir Putinassured PM Narendra Modi in their summit meeting that Russia would do nothing to hurt India's interests. As MEA secretary Amar Sinha admitted, there was no consensus on naming Pakistan-based terror groups because other countries are not affected by their actions.



Moscow also had its full say on Syria as the declaration called upon all parties involved to work for a comprehensive and peaceful resolution of the conflict taking into account the legitimate aspirations of the people of Syria, through inclusive national dialogue and a Syrian-led political process.



""While continuing the relentless pursuit against terrorist groups so designated by the UN Security Council, including ISIL, Jabhat al-Nusra, and other terrorist organisations designated by the UN Security Council,'' said the declaration.



___

^Version ^: ^0.5b ^| [^Changelog](https://www.reddit.com/r/anti_anti_adblock/comments/4ssi0u/change_log/)

^Function ^: ^I ^post ^the ^article's ^text ^as ^a ^comment ^if ^the ^website ^is ^adblocker ^unfriendly.

[^I ^accept ^commands!](https://www.reddit.com/r/anti_anti_adblock/comments/4u2iwn/commands_accepted_by_the_bot/)



___

^Rendered ^by ^PROMETHEUS",2016-10-18 00:50:01
5,"
&gt;The Delhi govenrment only needs to be concerned about Delhi, and for that it just needs to show results for its work as AAP once boasted they would.

Why? They are concerned citizens of the country too and if they feel they need to communicate something of national significance ( like the center running an aggressive malicious campaign against them) they have the right and duty to.

&gt;The results are not forthcoming and that is why they are having to use PR to promote themselves like the much-trumpeted Odd Even scheme that utterly failed to have any impact on Delhi air quality levels.

On the contrary , I think they are doing very well. The mohalla clinics for example are being imitated by Gujarat government. Some initiatives will work and some will fail as with all governments, but they have to counter the rabid PR that the bjp is throwing at them. if you look around , you would notice that the MSM is not focusing on any other CM. Even massively corrupt governments like TN, MP, Bihar and UPA don't get as much negative coverage as does the Delhi government and AK. I feel part of the reason is that AK is the one opposition that can pose a challenge to Modi  sooner or later and bjp knows it. 

&gt;And if you're making comparisons the Delhi government is still disproportionately spending more than any other in India including the Centre which faces significantly more media scrutiny on a daily basis.

Any source/proof for this ? or would I be called anti national for asking for proof ? 
",2016-10-18 00:55:33
6,"&gt;Why? They are concerned citizens of the country too and if they feel they need to communicate something of national significance ( like the center running an aggressive malicious campaign against them) they have the right and duty to.

The guidelines by Election Commission and courts have elaborated on this and it's common sense. The Delhi government's responsibility is to the Delhi people who elected them. Political games are a different issue. If any official communication has to be made to Delhi people it should only be through local media. 

If the CM wants to say or do something as a concerned citizen or opposition leader he should do so in his own capacity with his own money, not using state machinery and taxpayer money. Otherwise it becomes an open invitation to do political propaganda using the Delhi government funds. AAP fans know this and support it for that exact reason.

&gt;On the contrary , I think they are doing very well. The mohalla clinics for example are being imitated by Gujarat government

The fact that you only have this to brag about and immediately start harping how BJP is throwing PR at poor AAP(As if they don't do the same every day against the BJP and the PM in particular) shows things are not so well. When Kejriwal started his second term(first term too) AAP would repeatedly state that they wanted to develop Delhi first for 5 years and then show it as a model to the rest of India. Instead they're desperate to spread to other states as fast as they can because no matter how much they blame Najeeb Jung the undeniable truth is they've failed to keep many of their promises and lost a lot of ground with Delhi voters.

Kejriwal gets more coverage because he actively courts the media and bases his politics from Delhi where most 'national' media outlets have their headquarters. AAP intentionally started in Delhi BECAUSE of this reason and this easy exposure to the media was the main reason for their rise to prominence. It's obviously a double-edged sword because if you give off a negative image the media that is close to you will cover that too. This has nothing to do with PR campaigns and it's rich for AAP supporters to be complaining about that.

&gt;I feel part of the reason is that AK is the one opposition that can pose a challenge to Modi sooner or later and bjp knows it.

And that AAP's core supporters are behind them and defending them like yourself here: He makes you think he can defeat Modi. He knows that this is your main motivation and that's why for good or bad reasons he makes sure to stay in the limelight so that the sizeable population of ideologically motivated voters who will condone violence, corruption, casteism, communalism and literally anything so long as Kejriwal remains anti-Modi will continue to support him and defend his actions.

&gt;Any source/proof for this ? or would I be called anti national for asking for proof ?

I was the one wondering if I'd be called a Modi bhakt or BJP stooge or IT cell member since that's what AAP and their fans do to anyone who questions them or their allegations.

There are many articles about the increase in AAP's ad spending but since AAP is always obsessed in comparing themselves to the BJP(Role model? Aim to be BJP with Kejriwal instead of Modi?) I'll point to this:

**Google 'Modi government spent 864+ crore on advertisements. How can BJP justify it morally and have the right to attack AAP spendings on the same?'** and you'll find a Quora discussion with detailed analyses comparing the Delhi ad budget(for one city) with the Central ad spending(for all of India). (I can't post Quora links directly here)
",2016-10-18 03:17:16
7,Isn't r/India another of these places where opposing Modi is being trendy and abusing Hindus gives good karma?,2016-10-18 03:22:02
8,"No big deal. Simply ask her out on WhatsApp or call her or better would be in person. No movie dates. What to talk about? F- family, O- occupation, R- relationship, D- dreams. No Modi and Kejri talks. Politics are strict no no on few dates. Tease her, make fun of her, tell her stories about your weird cat or funny dog. Don't ever  be boring. Try to read her palm, touch her, HIFIs etc. If she says no to date, then move on to other girl. Keep options open. 
",2016-10-18 06:02:20
9,"But everyone wore Modi jackets.   
",2016-10-18 08:33:47
10,"Parrikar had earlier equated the Indian Army to 'Hanuman' and made a reference to the Ramayana in which the monkey God crossed an ocean after he was reminded about his extraordinary powers by Jamwant.

---

&gt; * After lauding Prime Minister Narendra Modi for the surgical strikes carried out on terror launchpads in Pakistan-occupied Kashmir (PoK), Defence Minister Manohar Parrikar on Monday credited RSS teachings for the Indian Army's successful operation.

&gt; * ""A prime minister who hails from Mahatma Gandhi's village, a defence minister from Goa, and surgical strikes... it's quite a different kind of combination, may be the RSS' teachings were the common core,"" Parrikar said at the 'Know Your Army' event organised at the Nirma University campus, according to ANI.

&gt; * The defence minister also said the Indian Army was giving a befitting reply to the ceasefire violations made by Pakistan even as he hit out at those seeking proof of the surgical strikes.

&gt; * Surgical strikes, he said, have increased the sensitivity among Indians regarding national security in a very effective way.

---



Here are some other news items:^credits ^to ^u-sr33

&gt; * [Congress calls Manohar Parrikar a 'national embarrassment' after Defence Minister credits RSS for surgical strikes](http://www.financialexpress.com/india-news/congress-calls-defence-minister-manohar-parrikar-a-national-embarrassment/421434/)

&gt; * [Manohar Parrikar links surgical strikes to his and PM Modi’s ‘RSS teaching’](http://indianexpress.com/article/india/india-news-india/surgical-strikes-manohar-parrikar-gives-credit-to-rss-teachings-3087525/)

&gt; * [Surgical strikes: 'RSS teaching' may have been at core of surgical strike decision: Manohar Parrikar](http://timesofindia.indiatimes.com/india/RSS-teaching-may-have-been-at-core-of-PoK-raid-decision-Manohar-Parrikar/articleshow/54900927.cms)

---

^I'm ^a ^bot ^| ^OP ^can ^reply ^with ^""delete"" ^to ^remove ^| [^Message ^Creator](http://www.reddit.com/message/compose/?to=sallurocks) ^| [^Source](https://github.com/hunkdivine/samacharbot2) ^| ^Did ^I ^just ^break? ^See ^how ^you ^can ^help! ^Visit ^the ^source ^and ^check ^out ^the ^Readme",2016-10-18 08:45:20
11,"&gt; The guidelines by Election Commission and courts have elaborated on this and it's common sense. The Delhi government's responsibility is to the Delhi people who elected them.

Source or I wont be able to take this seriously. As I mentioned the Delhi government is within its rights to spend it's advertising budget as it pleases. They have a CAG and an LG breathing down their necks to keep them in check. 

&gt;Kejriwal gets more coverage because he actively courts the media and bases his politics from Delhi where most 'national' media outlets have their headquarters. 

I was talking about negative publicity and hit jobs. I am sure Kejriwal doesn't court that.


 &gt;AAP intentionally started in Delhi BECAUSE of this reason and this easy exposure to the media was the main reason for their rise to prominence.

Let's not mix opinions and facts.  There were multiple reasons for AAP starting with Delhi. One was of the India Against Corruption campaign which had massive traction in Delhi with all the protests and marches going on. Delhi has a huge educated population which helps a party like AAP. The immediate reason was the outrage after Nirbhaya rape case and the then education minister throwing the gauntlet to Kejriwal to run for elections if he wants a say in the government. 

&gt;He makes you think he can defeat Modi.

The 67-3 result in Delhi kinda proves that he can. 

&gt;I was the one wondering if I'd be called a Modi bhakt or BJP stooge or IT cell member since that's what AAP and their fans do to anyone who questions them or their allegations.

I didn't call you any of those and I don't intend to. its not my style. I asked you for proof or source for claiming that Delhi's ad spend is disproportionate compared to other states. you went two paragraphs without a source and are sending me on a wild goose chase to look for sources(Quora of all places??). let's be more upfront with our sources and assertions shall we? 

",2016-10-18 08:56:09
12,"A day after Prime Minister Narendra Modi called Pakistan a ""mothership of terrorism"", China on Monday strongly defended its all-weather ally, saying it is against linking any country or religion with terror and asked the world community to acknowledge Pakistan's ""great sacrifices"".

---

&gt; * BEIJING: A day after Prime Minister Narendra Modi called, China on Monday strongly defended its all-weather ally, saying it is against linking any country or religion with terror and asked the world community to acknowledge Pakistan's ""great sacrifices"".In a sharp reaction to a question about Modi's characterisation of Pakistan at the, spokesperson of the Chinese foreign ministry Hua Chunying said China is opposed to linking any country to terrorism.Answering a question on Modi's criticism of Islamabad in aiding and abetting terror groups opposed to India, she said ""on counter-terrorism, China's position is consistent"".

&gt; * ""It is the same way we oppose linking terrorism with any specific country or religion,"" she said.

&gt; * China and Pakistan are all-weather friends.Noting that India and Pakistan are ""all victims of terrorism"", she said Islamabad has made ""great sacrifice to combat terrorism and this needs to be recognised by the international community"".To another question about Modi's criticism thatgiving them arms, financial support and helping them to cross the border to carry out attacks in India and whether it is China's view that international community should not take a stand on Islamabad's support to terrorists, Hu said: ""I understand your concern.

&gt; * It is the same way we oppose linking terrorism with specific country or religion,"" she said.

---



Here are some other news items:^credits ^to ^u-sr33

&gt; * [China backs Pakistan after PM Modi's 'mothership of terrorism' comment : World, News](http://indiatoday.intoday.in/story/china-defends-pakistan-modi-mothership-of-terrorism-comment-brics/1/788661.html)

&gt; * [After PM Modi's 'Mothership Of Terrorism' Remark, China Defends Pakistan](http://www.ndtv.com/world-news/after-pm-modis-mothership-of-terrorism-remark-china-defends-pakistan-1475261)

&gt; * [China defends Pakistan after Modi’s ‘mothership of terrorism' remark](http://www.thehindu.com/news/international/china-defends-pakistan-after-modis-mothership-of-terrorism-remark/article9230771.ece)

---

^I'm ^a ^bot ^| ^OP ^can ^reply ^with ^""delete"" ^to ^remove ^| [^Message ^Creator](http://www.reddit.com/message/compose/?to=sallurocks) ^| [^Source](https://github.com/hunkdivine/samacharbot2) ^| ^Did ^I ^just ^break? ^See ^how ^you ^can ^help! ^Visit ^the ^source ^and ^check ^out ^the ^Readme",2016-10-18 09:13:19
