,article,article_date
55,"Good, you are not in denial anymore. At your personal level, it comes down to who do you know. 

Football fans: try to influence them at a personal level, 

Some newspaper guys: try to get this thing in the local/national media, 

And yes, tweet to our PM, he is a person who will make it a point to listen to you. Heck, even make it a competition, tweet to NaMo, Raga and AK, make it a competition between them.

If you have some international presence, do the same things at the international level.

Main thing is do something, or at least shut up when someone else is doing something instead of being pessimistic.",2015-05-23 10:54:56
56,"&gt;Good, you are not in denial anymore. At your personal level, it comes down to who do you know. Football fans: try to influence them at a personal level,



Only like 1 in 5 would care about it enough to stop watching. Even that is wishful thinking.

&gt;Some newspaper guys: try to get this thing in the local/national media,

&gt;And yes, tweet to our PM, he is a person who will make it a point to listen to you. Heck, even make it a competition, tweet to NaMo, Raga and AK, make it a competition between them.

&gt;If you have some international presence, do the same things at the international level.

This is what could work. I was specifically talking about stopping coke and turning off football channel. That is dumb naive shit that won't do anything.

&gt;Main thing is do something, or at least shut up when someone else is doing something instead of being pessimistic.

Main thing is doing something that could actually work, not do silly shit like stopping to buy coke thinking you are changing something when you're just indulging in narcissitic first world tier delusional 'activism'.",2015-05-23 11:04:08
57,"&gt;  non pol threads   

Namo Army downvotes me on non-political threads also. A lot. For very non-controversial comments.   

&gt; non randia subs   

I would think more than half of that 20K would be from randia. And Namo Army chases me on non-randia subs and downvotes me occasionally (I don't post much on non-randia subs, though). 

&gt; What's your point.

You said you are being brigaded.


",2015-05-25 19:36:02
58,"I personally hate the 'official' AAP after their stint with bhushan and Yadav, but you have *no* idea how inspiring the AAP was to the Indian Left (read: anything left of centre in outlook), in showing that the BJP is not invincible. That the NaMo wave can be turned right back with wnough grassroot work (which the AAP undeniably did in Delhi) and agreed, maybe a bit of populism too.",2015-05-26 08:14:47
59,"I remember reading somewhere, about someone (was it NaMo himself) talking about Weather playing a role in the psyche of the people. At this time, with the harsh summer throughout the country, untimely rains already having caused some havoc - the general public is NOT in any mood for celebration. 

I hope that BJP has some common sense, to read the public pulse and does some big policy announcements as part of this week long ""celebration"". Frank enough, nobody other than BJP are interested in celebrating their 1 year. 

Without those policy announcements, MSM and opposition will ensure that this this week long celebration joins the ""monogrammed suit"" as more of a show-off than anything else. 

What the general public wants is the same what anyone would want in such a summer, some temporary respite from the heat and some hope that a cool monsoon will come soon. 

BJP needs to read this and give some temporary policy respite and work towards a ""cool monsoon"" of development. ",2015-05-26 09:21:54
60,LOL. Even Rahul Gandhi is taking the mickey out of NaMo. I don't think there has ever been such a PM in India's history who has been such a laughing stock.,2015-05-26 22:48:17
