,article,article_date
0,"&gt; Point is, Kejriwal would have been ridiculed either way

This. People don't realise this point and still support him blindly instead of supporting the cause for which AAP stands.

They don't have a central leadership mandating all decisions - this is both a good and bad thing. Bad because obviously it can lead to anarchy. Good because there will be no conflict of interest. Accountability will be so focused on the candidate in question that he cannot dream of doing anything illegal.

Kejriwal would have made a horrible PM what with having to deal with infractions from 2 neighbouring countries with a strong hand. So I'm happy Modi got elected but sad that people do not understand what a grass roots movement is. If they understood and voted the other way, it'd be sensible. But most people - like the entire adult populace of my family - have only one opinion: yaaro yevano. Nambalkku therinjavanukku vote podalaam. Fucking retarded mindset that stems from most Indian's aversion to taking any sort of risk.",2014-10-29 00:36:56
1,"The thing is, there is plenty of scientific research and advances that happened in ancient India. There are a lot of documented pioneers in science, medicine and math. We can stay in the realm of proven facts to use history as a motivational tool. Making stuff up like this takes the conversation away to an entirely different topic.

Modi has a very good PR team, I'm surprised they let this fly.",2014-10-29 03:04:42
2,"Your hate for bjp and Modi is very obvious.  I don't know the reason for it. By name you sound like a Hindu.  But what's the source of your hate. Which compels you to make 1000 of anti bjp, Modi comments and by extention anti nationalistic.  ",2014-10-29 04:46:56
3,"If Obama had made tall claims about getting science from Noah, you'd have fifty different viral videos crowding up Youtube, Facebook, and Twitter in which world class comedians ""slam"" him for his remarks. Modi got off easy.",2014-10-29 06:40:19
4,"So ... numerous Western leaders believe that a dead guy who may or may not have existed will come down to earth and save them, and look benignly upon those that go around making others believe the same ... and people have no problem with that. But Modi casually suggests genetic science may have been used in India and everybody has a problem? ",2014-10-29 08:11:03
5,"Speechless. Stunned into silence by the lengths people will go to defend pure bullshit.

&gt;modi probably knows that he's bullshiting,

This takes the cake though. Keep encouraging the fool to spout more of his ignorant crap. ",2014-10-29 08:23:26
6,"lol.. where did you see i'm defending anyone.. first, learn to comprehend things.. 

i'm just saying its a political score from modi's perspective.. what i did there is gave an explanation why modi would have done what he did.. did i say if he did the right or wrong thing?? 

you and your blind hatred!!",2014-10-29 08:31:10
7,"Until now, the Dawood hunt was all a bunch of horseshit. With Modi and Ajit Doval leading the charge, it does look like a possibility. They could've nabbed this prick years ago, but his capture or assassination would lead to a ton of corrupt politicians, officers and other corporate bigwigs who were tied to him. Sharad Pawar will be annihilated if this goes down as planned.

Let's hope Doval can make them shit their pants once more. The earlier attempt led by him was sabotaged by a tip-off from someone working for the Mumbai police.",2014-10-29 08:32:00
8,Yeah some Modi fans behave like assholes. Then start crying foul when they get what they deserve.,2014-10-29 08:40:46
9,[UT singing to Modi..](https://www.youtube.com/watch?feature=player_detailpage&amp;v=vO35DVm_5ts#t=22) ,2014-10-29 10:28:28
10,Media must stop getting its lingam erect whenever a Muslim personality shows his/her appreciation for Modi. Such news items underpin the generalization that a person hates Modi because of his religion. ,2014-10-29 11:11:29
11,"\&gt; be me . be a jatt  
\&gt; be bhakt and cleaning streets before diwali  
\&gt; Notice a Modi poster on bank wall   
\&gt; ohyeah.jpg  
\&gt; 150/150 erekshun . digs tunnel to locker room.  
\&gt; debris everywhere.  shit is so cash   
\&gt; grab stuff before returning to my Mahindra . drive off .  
\&gt; bank explodes as I walk off cause bollywood was filming the whole thing   
\&gt; woke up to the sound of ""better lovestory than twilight""  
",2014-10-29 12:09:54
12,"It doesn't matter whom yo name or not in the FIR. The investigation agency (ACB) investigates and files a charge sheet. The charge sheet should contain names that are supposed to be prosecuted. For example - the FIR on the Khriki raid did not mention Somnath Bharti's name but his name was filed in the charge sheet. Basically, name or no name in the FIR doesn't make a difference. It's the charge sheet which makes the difference because you then have a case against you in court. 

That said, what has the Modi government done against Vadra or Dixit? It was big election talking point in almost exclusively all of his rallies. ",2014-10-29 12:30:47
13,"i seriously dont get the point of this ""feature"".

there is SO MUCH to be done for the railways. forget high speed trains, we need normal speed trains. most trains in india are languishing at &lt;50kmph. so many seats run empty because trains are running at odd times and odd days. most compartments dont even have a consistent quality in their berths. trains are often late except for the destination and even if they keep time it is because of insane buffer or at the expense of other ""lesser"" trains.

there needs to be a sincere effort in improving the railways. tokenism such as this wont help anyone. instead of this wifi, if they had spent on a platform ticket vending machine, it would have been a lot more helpful.

similarly, before spending crap loads on bullet trains, it would be great if all trains can run at an average speed of 70-100kmph. note average and not top speed.

when modi said that he will start a railway revolution, i really expected a lot. but so far NOTHING of importance has even been announced. i dont consider bullet trains of being good to the country. they will only take away money from other real problems that the railways need solving (such as 70kmph trains, track doubling, civilized toilets, punctuality without buffer etc)",2014-10-29 12:34:26
14,"actually, i live in singapore too. so i know of the problems. my point was, the people were typically 3rd worldish in the past (and some say even in the present) and had low civic sense. the bull-headedness of the government helped transform the place. also, even in india, you can observe how depending on the state governments in power, cities begin to look better or worse. case in point is ahmedabad before and after modi and hyderabad before, during and after cbn",2014-10-29 12:51:08
15,"&gt; It doesn't matter whom yo name or not in the FIR

I am not saying that it does. That doesn't mean that I shouldn't call the bluff of AAP or AAP supporters when they are making misleading claims.

&gt; That said, what has the Modi government done against Vadra or Dixit? 

In his defence, he also didn't plan to resign in 49 days. He has still got about 90% of his term left to achieve all that he wants to.",2014-10-29 12:55:38
16,"And now the ball is in the Supreme Court's hands. Now hopefully we've had enough of blaming the government for everything. If the Supreme Court refuses to release the names to the public I wonder what will the Modi bashers say?

EDIT: I told you so.",2014-10-29 13:44:38
17,Something tells me the public drama over what turned out to be just a formality was done by the (increasingly politicized) Supreme Court to counter any public goodwill the Modi govt would have got from the black money list. And the media gleefully took the bait for the same reason.,2014-10-29 13:46:59
18,Watch this: The Ultimate Black Money Medley by Narendra Modi: http://youtu.be/zc8bfKF1z3s,2014-10-29 13:47:24
19,"&gt; and not the usual pro / anti BJP, Modi **\+ AAP, Cong, etc**

Exactly. I am fine with Flipkart, Amazon, Xiaomi circle-jerk though. ""NP"" works for me.",2014-10-29 14:25:26
20,"""Serial tyre slayer""

Probably is Rajdeep's new Proflie at Headlines Today , so that he can blame ""frenzied Modi supporters"" for it",2014-10-29 14:26:16
21,"The winner is Modi Govt. SC felled in its own trap. If one reads it correctly, Modi Govt has been given a great escape route. Now if someone asks the Government  about black money six month down  the line, they will say the matter is subjudice and its in court hand. And then who will question SC?   I think this is also what the crooks wanted to get the matter  into court hands where they will appoint sharpest mind and get out. Look at the IPL thing, Radia thing, Chidambaram election fraud thing and countless other thing.

The Government said they will reveal 50+ name in next instalments due next week. Guess what, its also gone. Maybe the Government also wanted the same thing and perfectly played the script. 

This is Bofors 2.0.   

Saap bhi mar gaya aur laathi bhi nahi toota. And those dharna people. Unka plan ka toh dahi wada ho gaya. 

",2014-10-29 15:03:42
22,"The votes are already changing. Just yesterday in the RSS thread (on separate canteens for vegetarians and non-vegetarians) my comments were heavily brigaded (most of them now appear as controversial). 

I regularly lose 200-300 karma any time I dare to criticise the current government. Not to mention the constant snark that is spewed with the constant reminders about how I am not patriotic like the RSS (because I don't stay in India). 

As a moderator, I get the see the constant reports that this subreddit receives. Criticise Modi = comment reported. ",2014-10-29 15:15:07
23,"I don't check history etc for users, but bear with me this time.

&gt;&gt;""Rs 1,347 crore will be spent on the main statue, Rs 235 crore will be spent on the exhibition hall and convention centre, while Rs 83 crore will be spent on the bridge connecting the memorail to the main land and Rs 657 crore would be spent to maintain the structure until 15 years after it is completed,"" Patel said.
This is unnecessary expenditure.

* This is at 14

&gt;&gt; The rioting and arson, the first big incident of communal nature since a long time, took place under the nose of the “world’s largest metropolitan police”, which reports to the Central government led by Narendra Modi. The latter had called for a 10-year moratorium on caste and communal violence during his Independence Day speech.
That was a good call (it was admittedly a good speech too).
Tension mounted once again on Friday night after former BJP MLA Sunil Kumar Vaidya allegedly visited the area and was reportedly greeted by furious chants of ‘Har Har Mahadev’. Locals alleged that he instigated people for a fresh round of violence immediately after one dies down
Everyone (his detractors and supporters) portrayed Modi as a strong man. Either everyone is wrong or Modi supports the fanatical elements in his party.

This is at 11

&gt;&gt;There is no reason to quote a report and then highlight some parts in bold as if it is written by god himself.
I bolded the parts I want to draw attention to. I am not accepting them as gospel truth.
Riots in UP? BJP did it.
I believe the general consensus was that BJP flamed the Hindus, SP flamed the Muslims. At least that's what I have read in various reports.
Terror modules in WB? ""I fear riots""- Mamta
I don't see that anywhere, the reports I have read have lampooned Mamta for her inept and dangerous handling of the situation.
However, all this aside, you haven't addressed the crux of my argument. PM Modi promised us a government free of riots. Yet, his party members have been on a rampage issuing communally charged statements.
I already believe that each party in India uses religion to garner votes. What is the BJP doing to change my perception? Going by the recent events, nothing. Not even token noise from the PM who was never shy of speaking.

* This is at 5

I could point out my posts where I am negative for trying to go against the bash RSS grain.

If this mythical brigade does exist, shouldn't all these posts of yours be at a grand 0?



",2014-10-29 15:28:19
24,"It happens on /r/worldnews too. Anything even remotely critical of India, Modi or the current government gets instantly hit by a barrage of downvotes and it gets reported for inane reasons. The opposite happens for posts praising the above. If anyone even thinks of posting a Pakistani viewpoint on an India-Pakistan thread they get buried with dozens of downvotes almost instantly.",2014-10-29 15:35:30
25,"&gt;Criticise Modi = comment reported

On /r/worldnews anything that is remotely critical of India, Modi or the BJP gets instantly hit by a barrage of downvotes and often gets reported too for bizarre reasons like ""spam"" or ""racism"". The opposite is also true.",2014-10-29 15:36:48
26,"r/india - poor people who gives a fuck , let's build smart cities when cities can't even provide basic facilities and this isn't mars-poverty argument , it's a reflection of statue building mentality.

Modi is the mayawati of middle class",2014-10-29 15:39:18
27,"&gt; Modi is the mayawati of middle class

That is absolutely fucking spot on. 

That said, Mayawati did do a lot of good work in UP, even with all her corruption. ",2014-10-29 16:44:30
28,"[**@firstpostin**](https://twitter.com/firstpostin):
&gt;[2014-10-29 11:36:45 UTC](https://twitter.com/firstpostin/status/527423792482508800)

&gt;All the facts that were revealed in the black money list were already known to the SIT: SIT chairman Justice MB Shah [*firstpost.com*](http://www.firstpost.com/politics/live-black-money-kejriwal-accuses-modi-govt-of-letting-off-the-big-fish-1774403.html)

----

[^[Mistake?]](http://www.reddit.com/message/compose/?to=TweetPoster&amp;subject=Error%20Report&amp;message=http://reddit.com/2knzxt%0A%0APlease leave above link unaltered.)
[^[Suggestion]](http://www.reddit.com/message/compose/?to=TweetPoster&amp;subject=Suggestion)
[^[FAQ]](http://np.reddit.com/r/TweetPoster/comments/13relk/)
[^[Code]](https://github.com/buttscicles/TweetPoster)
[^[Issues]](https://github.com/buttscicles/TweetPoster/issues)
",2014-10-29 17:09:16
29,"[**@firstpostin**](https://twitter.com/firstpostin):
&gt;[2014-10-29 11:33:12 UTC](https://twitter.com/firstpostin/status/527422898831511552)

&gt;It was the same black money list which was given to us in June: SIT chairman Justice MB Shah [*firstpost.com*](http://www.firstpost.com/politics/live-black-money-kejriwal-accuses-modi-govt-of-letting-off-the-big-fish-1774403.html)

----

[^[Mistake?]](http://www.reddit.com/message/compose/?to=TweetPoster&amp;subject=Error%20Report&amp;message=http://reddit.com/2ko181%0A%0APlease leave above link unaltered.)
[^[Suggestion]](http://www.reddit.com/message/compose/?to=TweetPoster&amp;subject=Suggestion)
[^[FAQ]](http://np.reddit.com/r/TweetPoster/comments/13relk/)
[^[Code]](https://github.com/buttscicles/TweetPoster)
[^[Issues]](https://github.com/buttscicles/TweetPoster/issues)
",2014-10-29 17:29:07
30,"[Look who's offensive in Trilokpuri riots](http://www.indiatomorrow.co/states1/2141-look-who-s-offensive-in-delhi-s-trilokpuri-watch-video)    
  
&gt;They managed to orchestrate full-fledged riots by spreading false rumours. This, along with the **overnight mobilization of hundreds of armed men**, has lefts cops with the task of establishing if there was any political hand in the entire episode.  
  
The video shows RoP guy firing a pistol. If the armed men were from the communal community, secular media gang would be covering this day and night, linking the rise of Hindutva elements with Modi becoming the PM. The reason they are not covering this is because police can show them these armed men belong to the secular community and that would make it impossible to run their media campaign against BJP/Modi/Hindus. Time to lay low on this one for our secular media gang.
  
",2014-10-29 17:29:41
31,"&gt; that's why Mr Narendra Modi has asked

LOL",2014-10-29 18:23:16
32,"He dreamed of becoming PM but as long as Modi is at helm in BJP, he won't. ",2014-10-29 18:31:13
33,"No way anyone can stop this from happening , modi will need to invest Huge sums for water treatment plants  like thousands of crores and **Maintain** them .  I dont think they will even consider this for all of ganga.   
  
Most rivers passing through cities are treated as drainage canals,  lietaraly every single one. If central govt constructs all treatment plants they must come under City coorpoation and we all know how clean and functional these are .  
  ",2014-10-29 18:59:47
34,"From a right wing perspective, sure. But about creating a broadcaster of international repute.....I really thought the Modi govt. would create a BBCesque institution since they've been hard done by past Congress govt. appointees. Sadly they like Congress are unwilling to see beyond narrow political considerations.",2014-10-29 19:24:42
35,"I don't know man. Hoga to Achha hoga.  But he isn't an idiot.  His money is not going to be in foreign bank accounts. at-least not going to be traceable easily.  So no-one can trap him easily like that. 

But Modi government has already fined Reliance. And the increase in gas prices are reasonable actually. Prophecies regarding ""Ambani agent"" hasn't been proven so far, much to the relief or disappointment of AAP. 

So I will wait.",2014-10-29 20:15:24
36,"&gt; SC just wanted to know the names, just so they feel important?

From [Firstpost](http://www.firstpost.com/politics/live-black-money-kejriwal-accuses-modi-govt-of-letting-off-the-big-fish-1774403.html)

""The court after hearing both sides, did not open the cover but directed that the sealed envelope be given to the SIT itself. The SIT will there after see what it has to do and proceed in accordance with law.""",2014-10-29 20:23:07
37,"Thank you! :)

Unfortunately, this is the second time when this government has commented wrongly on CAG. First, Modi said that CAG reports should not be used to attack politicians (right after he became PM), and now this. BJP should use CAG reports to improve its governance rather than declaring CAG or anyone else who questions them wrong (or CIA agent, as they love to call them) instead. I hope BJP will listen to BJP supporters at least.",2014-10-29 20:50:53
38,"&gt; But Modi government has already fined Reliance.

This was discussed at length here on r/India These fines are peanuts and happen every year including the previous govt. Also, these fines are not really fines but profits which are not shared. So, I wouldn't call it a significant step. 

The most concrete and significant step taken by Modi government against RIL is in the KG D6 gas decision which Jaitley recently took. They refused to increase price unless they got the required output.",2014-10-29 20:57:01
39,"Sure. File one against the Supreme Court, the new champions of anti-Modi-ism!",2014-10-29 20:57:52
40,Shah is obviously a missionary funded jehadi naxal trying to make Modi*ji* look bad. ,2014-10-29 20:59:29
41,"He has just been appointed. Give him some time before passing judgment on him.

Edit: Like you said yourself in [this comment](http://www.reddit.com/r/india/comments/2kmkpd/hunt_for_dawood_goes_global_after_modi_and_obamas/cln0cfh) when someone praised Modi and Ajit Doval before Dawood was nabbed:

&gt; Calm your tits. Let things get done and then eulogise them.

",2014-10-29 21:13:09
42,"&gt;You seem to be under the impression that people have made their minds up about the Modi govt in a negative fashion. They have not.

You'd have to be blind and deaf not to see a huge section of the media, social media, the academic establishment, and even posters here being critical and disdainful of this government from day 1. Most of them were like this for years and are only being consistent to their past behavior. They love to hate Modi and think their life's role is to bring 'objectivity' to political discourse by being his eternal critics.

You, thankfully, are not one of them, but it's not difficult to miss them on this thread. They're the guys constantly re-posting the same articles on black money drama, Fadnavis' 22 riot cases etc. dozens of times and circlejerking over them.

They love calling out to the 'bhakts' to answer for the Modi government's real or imaginary wrongs, but the fact is they themselves have a lifelong bhakti to the cause of hate against the Indian right wing.",2014-10-29 21:17:29
43,"Your agenda here(Seeing you only ever post a certain kind of article it's not difficult to see) here is twisting the facts.

The SIT, appointed by the Supreme Court, had the black money list for months. Its chairman, a retired Supreme Court judge, just said as much. The government was not hiding anything; the court just didn't trust it. Or didn't trust it *and* the SIT. Or simply wanted to rake up muck against the government in retaliation for trying to abolish the collegium.

As of now, things are the same as before. The Supreme Court has refused to reveal a single name from the list and just told the SIT to continue investigating. Drama over, and seculars unable to grasp how empty it was because all they wanted was an excuse for Modi-bashing and they got it.",2014-10-29 21:20:44
44,Thanks to our great leader Modi-ji.,2014-10-29 21:51:59
45,"Don't think this is without motive.

With the decision to abolish the collegium and Judgegate the new government is clamping down on potential for abuse of power by the judiciary, currently the most independent and unaccountable public institution in India.

This has rubbed most of the sitting judges the wrong way, hence you are suddenly seeing them become a lot more vocal and attacking the government on every imaginable excuse from the progress of the Ganga Cleaning Program to Jaitley not following minor formalities in the Black Money Probe.

But the fact that they are having to scream at such petty issues is ultimately a good thing for India; it tells me that the SC is unable to find any mega-scams, corruption, irregularities or other genuine cause for complaint against the Modi government, unlike the UPA. :D",2014-10-29 21:57:25
46,I thought Modi is PM due to Ambani.,2014-10-29 22:00:36
47,"Of course not! What they *already said* is that RSS is worse than ISIS:

&gt; In a recent article in the NYT, Mishra, while noting (correctly, in my opinion) the typical Indian envy of the west while simultaneously craving western approval, completely loses it and says the rise of Narendra Modi and the traditional right is something more dangerous than ISIS. He writes: ""Largely subterranean until it erupts, this ressentiment of the West among thwarted elites can assume a more treacherous form than the simple hatred and rejectionism of outfits such as Al Qaeda, the Islamic State and the Taliban.”

Source: http://www.firstpost.com/india/behind-pankaj-mishras-rants-a-pathology-of-hindu-phobia-and-self-hate-1772105.html",2014-10-29 22:07:06
48,"LOL. No, Mr Sardesai, I wont read your book.  
  
If you can lie through your teeth even when dozens of cameras were clicking around you, there is no doubt your book is full of crazy propaganda as your last desperate attempt to resurrect Mr Kejriwal and take potshots at Modi that you have been taking for years   
  
Although, its a must buy for the seculars. They will get more ""revelations"" and keep SM buzzing. Popcorn time!",2014-10-29 22:47:57
49,"PBM has been my favorite broad spectrum writer for a very long while. Anklesaria used to rule my world, till I started to read PBM. There was a point of time when I was really undecided about how I felt about Modi and BJP. Then I read 2-3 columns from PBM which basically said how a vote for BJP is much better (in totality) than a vote for Congress. That was THE guy I needed to say that for me to cross over onto the other side.",2014-10-29 22:51:47
50,"&gt;Many news anchors on various forums   
  
And who are these news anchors? Any chance of them being the *krantikari* type?  
  
&gt;I would like to know why Amit Shah saw Kejriwal as a threat.  
  
Threat? AAP was a local phenomenon. You guys still cannot get over yourselves, can you? Modi not a national leader becomes PM. Kejriwal a threat to Modi cannot even win half a dozen seats. And still you believe what this dolt Rajdeep spews?   
  
Atleast be realistic. Propaganda is not going to change ground realities. Although, I agree, it keeps spirits of secular party workers high. But spare the rest of us this buffoonery.",2014-10-29 22:58:08
51,is modi ever wrong in OP's book?,2014-10-29 23:15:41
52,Technically even Modi spent on renovating 7 RCR. He moved in late remember? This more a problem of entitlement across the political spectrum.,2014-10-29 23:16:02
