,article,article_date
239,"^This ^article ^is ^adblocker ^unfriendly, ^following ^is ^the ^text ^of ^the ^article. 

 ______ 
**India gets access to strategic Oman port Duqm for military use, Chabahar-Gwadar in sight** 

 ______ 
Written by

Shubhajit Roy

|

Updated: February 13, 2018 7:59 am

The Port of Duqm is situated on the southeastern seaboard of Oman, overlooking
the Arabian Sea and the Indian Ocean. It is strategically located, in close
proximity to the Chabahar port in Iran. (Source: Twitter/narendramodi)

In a strategic move to expand its footprint in the Indian Ocean region, India
has secured access to the key Port of Duqm in Oman for military use and
logistical support, top sources have told The Indian Express. This is part of
India’s maritime strategy to counter Chinese influence and activities in the
region. This was one of the key takeaways of Prime Minister Narendra Modi’s
visit to Oman over the last two days. He met Sultan of Oman Sayyid Qaboos bin
Said Al Said and an annexure to the Memorandum of Understanding on Military
Cooperation was signed between the two countries. Sources said following this
pact, the services of Duqm port and dry dock will be available for maintenance
of Indian military vessels.

The Port of Duqm is situated on the southeastern seaboard of Oman, overlooking
the Arabian Sea and the Indian Ocean. It is strategically located, in close
proximity to the Chabahar port in Iran. With the Assumption Island being
developed in Seychelles and Agalega in Mauritius, Duqm fits into India’s
proactive maritime security roadmap.

Recently, Duqm has seen a rise in Indian activities. In September last year,
India deployed an attack submarine to this port in the western Arabian Sea. A
Shishumar-class submarine entered Duqm along with naval ship INS Mumbai and
two P-8I long-range maritime patrol aircraft. India gets access to strategic
Oman port for military use, reconnaissance aircraft. The naval units were on a
month-long deployment with the aim of enhancing surveillance and cooperation.

Following Modi’s visit to Oman, the joint statement said the two sides noted
that the MoU on Military Cooperation, signed in 2005 and renewed in 2016, has
provided the general framework to strengthen bilateral defence ties. India and
Oman noted that the MoUs on cooperation in maritime security and between Coast
Guards of the two countries, signed in May 2016, have provided a firm
foundation for deepening institutional interactions. “Both sides expressed
satisfaction at the signing of an annexure to the existing MoU on Military
Cooperation between the defence ministries,” it said.

In August 2017, Oman signed an MoU with the United Kingdom that allowed the
Royal Navy to use the Port of Duqm. The agreement allows UK access to
facilities at Duqm, and among the vessels that will be allowed to dock at the
port is the HMS Queen Elizabeth aircraft carrier, the largest ship in the
British Navy.

The joint statement said the Indian side thanked Oman for facilitating
operational visits by Indian Naval ships and aircraft as well as Indian Air
Force aircraft to various ports and airports. “Recognising their common
responsibility towards promoting regional peace and security, the two sides
underlined the importance of further cementing bilateral strategic engagement,
especially in the areas of security and defence,” it said.

It also said that the two sides expressed satisfaction at the ongoing
bilateral security collaboration in the fields of counter-terrorism,
information-sharing and capacity-building, and the Prime Minister appreciated
the support extended by Omani security agencies on “specific issues of
security concern to India”.

They agreed to provide further impetus to the robust defence relations,
including through regular joint exercises by the three defence forces,
training of Navy, Air and Army officials, as also cooperation in the area of
coastal defence and through participation in defence exhibitions, the
statement said.

The Port of Duqm also has a special economic zone, where about $1.8 billion
investments are being made by some Indian companies. The Adani group had
signed an MoU with Duqm port authorities last year, but no investments have
been made so far. “The Prime Minister expressed his admiration at the ongoing
efforts and plans the Sultanate of Oman is making to diversify its economy and
welcomed the invitation to Indian companies to invest in various sectors in
the special economic zones of Oman, including SEZs in Duqm, Sohar and Salalah.
He offered India’s partnership and cooperation in areas of priority, such as
minerals and mining, manufacturing, logistics, infrastructure, tourism,
agriculture and fisheries, IT and IT enabled-services, skills development,
innovation,” said the joint statement.

In the context of strategic oil reserves near Duqm, it said the Prime Minister
reiterated India’s invitation to Oman to participate in building strategic oil
reserves in India. “Sultan briefed the Indian Prime Minister on Oman’s own
initiative to create its strategic oil reserves in Ras Markaz near Duqm. The
two sides agreed that there is broad scope for mutual cooperation in building
their strategic oil reserves,” the statement said.

Besides Sultan Qaboos, the Prime Minister met Deputy Prime Minister Sayyid
Fahd bin Mahmoud al-Said, and Deputy Prime Minister for International
Relations and Cooperation Affairs Sayyid Asa’ad bin Tariq Al Said.

He also visited a Shiva temple and the Grand Mosque, besides addressing the
business community, before leaving for Delhi. During his meeting with Modi,
Sultan Qaboos shared his views on turmoil in the region, especially in Yemen.
The Prime Minister thanked him for his efforts in securing the release of
captured priest, Father Tom, from Yemen last year.

“The two sides acknowledged the common threat posed by terrorism to peace and
security and agreed to continue working together bilaterally, regionally and
globally to counter this menace. They reiterated their strong condemnation of
terrorism in all its forms and manifestations, wherever committed and by
whomever, and declared that there could be no justification for any act of
terrorism anywhere,” said the joint statement.

The two sides also emphasised the need to “isolate the sponsors and supporters
of terrorism” and agreed that the international community should take urgent
action against all entities which support terrorism and use it as an
instrument of policy.

For all the latest India News, download Indian Express App

© IE Online Media Services Pvt Ltd



 ______ 
 ^I ^am ^just ^a ^bot, ^I ^cannot ^reply ^to ^your ^queries. ^Send ^a ^[*modmail*](http://www.reddit.com/message/compose?to=%2Fr%2Findia&amp;subject=Anti+Anti+Ad+Block+Bot) ^if ^you ^have ^any ^queries. ^Please ^provide ^a ^link ^to ^your ^submission. ^We ^would ^not ^be ^able ^to ^help ^you ^without ^a ^link.",2018-02-13 08:13:13
240,"Gulamgiri - Narendra Modi

My Experiments with Jumla - Narendra Modi

Annihilation of Middle Class - Narendra Modi",2018-02-13 09:27:22
241,Huh where did Modi use that term? Has the headline changed now or OP is using a different headline than the article? Seems mischievous from newslaundry if it’s the first ,2018-02-13 09:36:09
242,I can almost see BJP and Modi taking credit for this.,2018-02-13 10:11:20
243,"^This ^article ^is ^adblocker ^unfriendly, ^following ^is ^the ^text ^of ^the ^article. 

 ______ 
**Budget 2018: Hope higher tariffs are 'temporary phenomenon', says Rajiv Kumar** 

 ______ 
NEW DELHI: Niti Aayog vice-chairman

Rajiv Kumar

said on Monday that he ""hoped"" that higher tariffs in the Budget were a
""temporary phenomenon"". ""I hope this is a temporary phenomenon,"" Kumar said at
a discussion on the Budget at the

Vivekananda International Foundation

.

""

Make in India

has not been as successful as we had thought and therefore the Budget has
taken the route of greater import tariffs to give manufacturing a targeted
approach like we did in the case of Maruti (Suzuki)."" At the same event, two
members of the

Economic Advisory Council

to the Prime Minister (EAC-PM) expressed concern about various elements of the
Budget.

Kumar also urged members of EAC-PM to inform Prime Minister Narendra Modi
about their worries about the Budget. ""I hope the EAC-PM is sending a memo to
PM on the wrong choices made in this year's Budget as two of its four members
are saying so,"" he said, adding that the council is expected to highlight such
issues.

EAC-PM member

Surjit Bhalla

voiced concern about the imposition of long-term capital gains tax on stocks
in the Budget while another member Rathin Roy said the country's credibility
has been impacted because

fiscal deficit

reduction commitments had not been met.

""Reintroduction of the long-term capital gains tax is the most absurd policy
initiative of the government without any justification,"" Bhalla said, adding
that this will not fetch the government any more than Rs 5,000 crore against
the budgeted Rs 20,000 crore. He also said that the country is back on the
path of protectionism through increase in custom duties without any clarity on
how much revenue this will generate.

Finance minister

Arun Jaitley

had raised custom duty on imported juices, vegetable oils, furniture,
smartwatches, auto components and imported phones among other items in his
February 1Budget, as the government felt there was substantial potential for
domestic value addition in these sectors. Long-term capital gains tax was
imposed on stocks to ensure parity among asset classes.

The comments follow former Niti Aayog vice-chairman Arvind Panagariya's
article in ET on Monday in which he had said a ""new generation of bureaucrats""
is on ""course to erect the wall of protection all over again"". His successor
said that he doesn't see a return to the days of the licence-permit raj.

""I doubt there is a creeping reversal of the 70s when we had import tariffs...
Want to be assured to myself this (is) not (the) beginning of a new
phenomenon,"" said Kumar. The Niti Aayog, a government think tank and premier
policy making body, is chaired by the prime minister.

Jaitley had said in his Budget speech that the move on tariffs was meant ""to
further incentivise the domestic value addition and Make in India in some such
sectors"", which in turn would ""promote creation of more jobs in the country"".

At the

World Economic Forum

in Davos, PM Modi had championed global trade.

""Many countries are becoming inward focused and globalisation is shrinking and
such tendencies can't be considered lesser risk than terrorism or climate
change,"" he had said in comments that were seen as being in contrast with the
protectionist stance of the US administration.

**HIGH INTEREST RATES**

Kumar said the more critical issue in the country was high interest rates and
argued that there was scope to lower them, adding that they don't make sense
given the level of external debt, which is 18% of GDP. ""There is enough scope
to bring it down,"" he said.

The Reserve Bank of India kept rates unchanged last week as it warned about
inflation accelerating. Incidentally, January's retail inflation eased to
5.07% from 5.21% in December, according to data released on Monday.

Rathin Roy said the country is heading for a fiscal crisis in the next 10
years if remedial action wasn't taken. Dividend payouts from the RBI and
state-run units weren't high enough and the lack of coordination among
stakeholders had led to a significant dip in non-tax revenue despite the
disinvestment target for the year having been exceeded.

""Our credibility has been impacted because of our inability to meet our
commitments,"" Roy said. Jaitley said in his Budget speech that the
government's fiscal deficit will be 3.5% this year, compared with the targeted
3.2%. It pegged the fiscal deficit at 3.3% for FY19 versus the earlier pledge
of 3%.

Kumar said long-term capital gains tax had been imposed to bring household
savings back into the real estate sector, which had been hit by
demonetisation, as well as to ensure that any bubble in the surging stock
markets did not burst and hurt the middle class.

Kumar said the Niti Aayog has developed an outcome-based performance framework
for each of the 740 budget lines, which will be a game changer going forward.



 ______ 
 ^I ^am ^just ^a ^bot, ^I ^cannot ^reply ^to ^your ^queries. ^Send ^a ^[*modmail*](http://www.reddit.com/message/compose?to=%2Fr%2Findia&amp;subject=Anti+Anti+Ad+Block+Bot) ^if ^you ^have ^any ^queries. ^Please ^provide ^a ^link ^to ^your ^submission. ^We ^would ^not ^be ^able ^to ^help ^you ^without ^a ^link.",2018-02-13 10:14:50
244,"While we go on electing militants in Parliament, Vinay Katiyar, Yogi Adityanath, Khattar, Amit Shah, Modi - list of these madarchods endless. What an absolutely disgusting set of 'nose frowning high self opinionated 'electorate.",2018-02-13 10:23:47
245,ITT: people who gaily post Modi jokes but take great offence at a Rahul Gandhi joke. ,2018-02-13 10:24:17
246,"^This ^article ^is ^adblocker ^unfriendly, ^following ^is ^the ^text ^of ^the ^article. 

 ______ 
**Civilian construction near Army camps a problem: Nirmala Sitharaman** 

 ______ 
JAMMU: Defence Minister

Nirmala Sitharaman

has said that the construction of civilian houses adjacent to Army camps ""with
permission"" from authorities is a problem.

""Civil constructions are taking place near the boundary walls (of Army camps
across the country) and it is getting difficult to remove these constructions
because these are taking place with permission,"" she told reporters yesterday.

""I am studying the scenario in the entire country and will definitely come out
with a solution.""

Sitharaman was in Jammu yesterday to visit the people injured in Saturday's
attack on an Army camp in Sunjuwan by Jaish-e-Mohammad (JeM) terrorists based
across the border.

Six people, including five soldiers, were killed in the attack. Three
militants were also killed in Army retaliation.

The defence minister's visit to Jammu came as an ecounter ensued between
security forces and terrorists near a

CRPF

camp in Srinagar's Karan Nagar area. A CRPF jawan was killed and a policeman
was injured in the exchange of fire yesterday. The CRPF has claimed it
thwarted the attempt by the terrorists to attack its camp there.

Sitharaman blamed

Pakistan

for the terrorist attack on Sunjuwan camp and said Islamabad will pay the
price for the ""misadventure"". She said even though the evidence of Pakistan's
role in the attack may be shared, India reserved the ""right to respond
adequately at the time our choosing"".

Asked about her stand on

Jammu and Kashmir

government's amnesty for stone-pelters, she said, ""I think first-time
offenders were given amnesty and I am aware of that"".

On filing of an FIR against an Army major over the killing of three civilians
in Shopian last month, she said the case is ""sub-judice"" and today the Supreme
Court in response to the father of the officer has given a stay of 15 days on
the FIR.

""We have to see how it goes and we stand by our proud soldiers. In the call of
duty if they have performed something, (it) still has to be contextualised and
that is something on which I understand. I am not sure yet, but subject to
verification, the defence ministry will respond to the Supreme Court,"" she
said.

Sitharaman assured full support to the Army and said, ""The ministry of
defence, me as the defence minister, and the Government of India under Prime
Minister

Narendra Modi

's leadership will not let anybody down.""

""The Army is working under severe duress and we are conscious about it,"" she
said.



 ______ 
 ^I ^am ^just ^a ^bot, ^I ^cannot ^reply ^to ^your ^queries. ^Send ^a ^[*modmail*](http://www.reddit.com/message/compose?to=%2Fr%2Findia&amp;subject=Anti+Anti+Ad+Block+Bot) ^if ^you ^have ^any ^queries. ^Please ^provide ^a ^link ^to ^your ^submission. ^We ^would ^not ^be ^able ^to ^help ^you ^without ^a ^link.",2018-02-13 10:26:29
247,"^This ^article ^is ^adblocker ^unfriendly, ^following ^is ^the ^text ^of ^the ^article. 

 ______ 
**RSS' Hamletian dilemma in the run-up to 2019 Lok Sabha polls** 

 ______ 
The recent conciliatory missive sent by stormy petrel of Hindutva and

Vishwa Hindu Parishad

International vice-president

Pravin Togadia

, seeking to smoke the peace pipe with PM

Narendra Modi

after years of personal hostility, is a multi-layered development within the
Sangh Parivar. Responses to this overture will have significant bearing on the
Sangh Parivar's ability to forge a united front during the next parliamentary
polls.

In the recently concluded assembly elections in Gujarat, Togadia consistently
assailed BJP. While he did not back Congress directly, the VHP leader lent
weight to Hardik Patel besides making critical remarks on the state
government's performance, which contributed to challenges the party eventually
overcame to come out victors.

Togadia's message to Modi to ""come together"" and ""work for the nation""
followed bitter power-struggle for several weeks when the Sangh unsuccessfully
attempted to dislodge Togadia from his pivotal position within VHP and the
subsequent high drama when he went 'missing' only to surface a day later
alleging a plot to kill him in a false encounter. Indications of a backroom
settlement being hammered out was evident when Vijay Rupani's government
dropped charges in a two-decade old attempt-to-murder case against Togadia.

However, Togadia sought to extract a 'price' for undoubted compromise with his
personal ego that made him swallow conceit. The cost Togadia 'levied' on Modi
is a clever subterfuge aimed at trapping Modi in committing on issues over
which he would want complete freedom. Togadia's words of conciliation are
suffixed with ""matters of concern"" that the PM would want no reminding:
unemployment of youth, rural 'distress', state of SSIs and ""health of the
nation"". Moreover, Togadia continues making critical statements raising doubts
over his sincerity.

Additionally, the VHP leader flagged 'promises' that can be delivered in the
event of rapprochement between the two. Modi would not take kindly to
'reminders' served by Togadia - tackling escalating cost of education, law to
facilitate construction of Ram temple in

Ayodhya

, a cow protection law and rehabilitation of Hindus in Kashmir. Modi is
unlikely to ever put these issues on the 'negative list', but he would want
complete liberty to decide on strategy to calibrate advancement towards these
goals and not allow anyone to take credit.

Besides personal rivalry dating back to more than two decades, divergences
between Togadia and Modi mirror the gap between BJP and

RSS

affiliates like Swadeshi Jagran Manch, Bharatiya Mazdoor Sangh and

Bharatiya Kisan Sangh

. Each of these follow sector-specific charters and take little note of
compulsions of governance, which restricts elbow room for BJP leaders.

VHP, for instance, is launching another edition of Ram Rath Yatra from Ayodhya
on February 13 and would want Ram temple construction to start straight away.
Likewise, other affiliates active on economic, labour and peasantry fronts
gfrustrated when the BJP government moderates the stance adopted during
agitations when in opposition. The dichotomy between realpolitik and
ideological and programmatic idealism is normally balanced between BJP and
Sangh affiliates by the RSS leadership and failure to do this cost the party
dearly in 2004 and nearly did in Gujarat.

Despite relations between Modi and the Mohan Bhagwat-led RSS being healthier
than ever before, there are instances when government has faced tough
situations. Affiliates argue aggressive posture is necessary to retaining
pivotal position in competitive sectors. BMS, it is argued, will lose cadre if
they do not take up workers' issues wherever necessary.

This poses a Hamletian dilemma for the Sangh Parivar. If affiliates weaken,
the famed RSS network will be unable to turn out for BJP in polls. But if
affiliates get freehand to outrun rivals, government and ruling party get
destabilised. Indisputably, internal cohesion is lacking and the Sangh
leadership has failed to limit areas where affiliates must remain engaged. For
instance, in a liberalised world, there is a need to rethink relevance and
thrust of SJM. Likewise, the RSS must decide the extent to which VHP remains
unifocal on the temple.

Failure of the Sangh leadership to either find ways to accommodate Togadia and
his likes in other affiliates or marginalise them completely will queer BJP's
pitch in the run-up the next polls. RSS has coped with similar conflicts in
the past, but matters were ironed out by timely intervention from fatherly
figures. The present crop in RSS and BJP are contemporaries and those formally
anointed Margdarshaks have either paid scant respect or have not lived up to
expectations.



 ______ 
 ^I ^am ^just ^a ^bot, ^I ^cannot ^reply ^to ^your ^queries. ^Send ^a ^[*modmail*](http://www.reddit.com/message/compose?to=%2Fr%2Findia&amp;subject=Anti+Anti+Ad+Block+Bot) ^if ^you ^have ^any ^queries. ^Please ^provide ^a ^link ^to ^your ^submission. ^We ^would ^not ^be ^able ^to ^help ^you ^without ^a ^link.",2018-02-13 10:33:51
248,"While I agree that Congress doesn't know how to milk BJP's corruption.

I feel when it comes to BJP, people are willing to turn a blind eye.

In my family group, members used to post all kind of pro BJP and pro Modi shit.


Nowadays, I bombard them with all the Shit Modi says, how he's the new pappu and alll the facts about BJP corruption.

Almost all fuckers in all of my groups suddenly realized that these groups are for fun not political discussion.

I mean WTF?  People are interested to discuss politics only if it was to ridicule pappu and congress but can't discuss politics if it can't defend mudikaka and his party.


Same happens in Office too, when it was modiwave every scum on earth wanted to discuss it for hours and hours now their valuable time can't be wasted on political discussion.",2018-02-13 10:41:29
249,Reality check: https://www.google.com/search?q=modi+protest+abroad&amp;source=lnms&amp;tbm=isch&amp;sa=X&amp;ved=0ahUKEwjdhfvNk6LZAhVU8mMKHSRUD-oQ_AUIDCgD&amp;biw=1374&amp;bih=748#imgrc=wZ4xn_3IoO-sJM:,2018-02-13 10:56:12
250,"I took offence at Modi being derided as chaiwala. Am I allowed to take offence at a Indian citizen being called Italian, pretty much by the lot that worships a Canadian citizen pretending to be Indian nationalist for money?",2018-02-13 11:00:26
251,"Can you imagine the endless circlejerk bhakts would have gone into if anyone except Modi made the ""pakoda"" comment? Instead they have been producing pseudo scientific theories to justify his stupidity. 

At least Chairman Mao and his like had to seize power in a revolution. These spineless bhakts are doing it for free.",2018-02-13 11:27:21
252,"For some reason I thought this article was talking about Modi.


On a serious note, Why Only NRIs ? ",2018-02-13 11:46:36
253,"Truly, no.

The Indo-American groups which have *weight* in the States are very much anti-Indian/anti-non-Americans. They hate Indian workers and Indian companies, for taking their jobs. They don't care about India. 

Nor does India have an ounce of influence on American Foreign policy. Take the Kashmir issue, which America has never decided to side on with India or Pakistan. Or haven't you seen that US has armed Pakistan with weapons **to keep them a threat to India**; Like [Air-to-Air missiles](https://www.upi.com/Pakistan-acquires-US-air-to-air-missiles/86231168892765/) under the garb of fighting terrorists, as if guerrilla terror groups in Afgan and Pak have fighter jets. US has been doing this for [decades](http://www.nytimes.com/1985/07/12/world/us-rushing-missiles-to-pakistan-cites-air-raids-from-afghanistan.html).

It was the number of zeros on the cheques donated to Pakistan which made the Drumpf administration cut the cord, in order to save money and, fund themselves, their other sillier projects like the wall, on which they're running short on money to implement.

It's sad and hilarious at the same time watching such foolish or uninformed faith in others (Modi, Indian Gov, Indo-American groups, UNO etc) of Indians like us.",2018-02-13 11:48:51
254,"I don't know what bhangis like you and u/jayeshvv have against Swarajyamag.  That was the first link google provided me so I posted that,  here's a list of other publications with same reporting. 

https://m.economictimes.com/industry/energy/oil-gas/ongc-acquires-10-per-cent-stake-in-uaes-oil-offshore-concession/articleshow/62861205.cms
http://www.livemint.com/Industry/P6BLipGB5Hm20Xcjm2SuKL/ONGCs-OVL-partners-acquire-10-stake-in-Abu-Dhabi-oilfield.html
https://www.bloombergquint.com/global-economics/2018/02/10/india-is-said-to-win-first-stake-in-abu-dhabi-offshore-oil-block
https://www.washingtonpost.com/world/middle_east/modi-applauds-vibrant-relationship-between-india-gulf/2018/02/11/8f68fdb8-0efe-11e8-998c-96deb18cca19_story.html?utm_term=.640fff033806
https://english.alarabiya.net/en/business/energy/2018/02/10/In-a-first-India-oil-consortium-gets-stake-in-Abu-Dhabi-s-offshore-Lower-Zakum.html

All of them have reported exactly the same how that site did and even sm has waited Business Standard.  What's bug you guys have against Swarajyamag?  Am I missing something? ",2018-02-13 12:37:29
255,"That's because Modi jokes are spot on based on the idiotic thing he says and does, while this one just tries to to spread the false *Sanghi* propaganda that Rahul Gandhi is not an indian citizen. (Oh, I enjoyed this joke by the way - did make me smile at the cleverness of it).",2018-02-13 13:35:56
