,article,article_date
0,The real importance of Kejriwal/AAP is that it gave the demoralized opposition and media the hope that they could challenge Modi.,2015-03-28 00:02:53
1,"&gt; Too many to even count

You just gave two.

And lets see whose behind the riots shall we ? 

Vadodara riots :

&gt;**The riots reportedly flared up after an image, perceived as being offensive to Islam, was shared on Facebook**, Reuters reported, citing an official. [Source](http://www.ibtimes.com/race-riots-western-indian-city-vadodara-lead-police-arrest-140-people-1696257)

Take a guess who started the riots. And it wasnt riots exactly - just mostly muslims vs police.

Delhi riots :

&gt;""When I told them they couldn't drink near the chowki, they hit me and cut my scalp,"" Deepu said, claiming that at least some of the men were Muslims.

&gt;""They then ran towards the mosque and started stoning the chowki."" 

&gt;In the ensuing confusion, Naidu said, the donation box placed before the idols was stolen. [Source](http://www.rediff.com/news/report/toilets-temples-and-the-trilokpuri-riots/20141028.htm)

Guess who were the stone throwers ?

&gt;but law and order problems just find Modi wherever he is somehow.

TIL no riots existed before Modi.",2015-03-28 00:11:04
2,"I'll piggy back on the most reasonable answer here.

Add to that, of the educated, internet-savvy lot, the crude demographic we see here, which is in no way representative of India's demographic over all --- within this demographic there is a significant chunk that was/is supporting the message that AAP is sending out. There is also a similar and complementary other-half which supports BJP/Modi. As such, these are the only two that the sub at large identifies with (with the exception of the stray SS supporter, ahem ahem.)",2015-03-28 00:16:17
3,"Ok I'm on a computer now, and no, the only narrative I'm trying to follow is peace. 

Vadodara riots

http://indiatoday.intoday.in/story/police-arrest-150-for-vadodara-communal-riots/1/393386.html

&gt;The violence reportedly broke out after the images of Hindu Goddess Maa Ambe and Lord Ram superimposed over Mecca's religious shrine went viral on the internet. The violence coincided with Prime Minister Narendra Modi's visit to the US.

&gt;Communal tension has been prevailing in Gujarat ever since the Vishwa Hindu Parishad (VHP) asked the state government to issue a directive preventing Muslims from entering the places where garbas are organised. The VHP even stated that if the BJP government did not pay heed to it, the outfit would on its own initiate action to ensure Muslims did not attend garba events.

Delhi riots

http://www.business-standard.com/article/politics/toilets-temples-and-the-trilokpuri-riots-114102701414_1.html
&gt;""A public dustbin had been installed in the vacant spot and the Muslims used to park all their vehicles there. At Eid, they would sacrifice animals,"" said Sujata Naidu, a Block 20 resident, ""We removed the dustbin and put up the chowki to keep the place clean.""

&gt;Naidu said Sunil Vaidya, the Bharatiya Janata Party's former MLA from Trilokpuri, had encouraged them to set up the chowki, a stone's throw from the local mosque, and assured them of his support in getting permissions from authorities. The chowki was supposed to stand for 40 days till October 31.

So tell me, who do you think is responsible for the riots, and how exactly are these incidents not a direct fault of what was set in motion 25 years ago by Modi and his party mates? They let the VHP and hateful elements in the BJP run free, incite hate all over the internet and the country, without the BJP led govt (in power in both of these places at the time of the incidents) as much as batting an eyelid about it. How is it wrong to call a spade a spade?",2015-03-28 01:10:11
4,"There are a lot of pissed off journalists who dislike Modi, they will lick anyone who can sooth their egos, you know who I am talking about. ",2015-03-28 01:24:23
5,"&gt;Acceptance of gays is not universal. In fact, on the ground, gays face discrimination everywhere.

Kya bakchodi hai? So since they are discriminated against everywhere, its alright eh? most countries at least take the right stand.
Lower castes have also been historically been discriminated against, I wonder why the government formed a law banning caste discrimination, they were already getting discriminated against. What was the point? Yes that is what your ridiculous argument sounds like. 

&gt;Did you read about Indian students being denied internships/associate-ships because of this news? How would you want to metricize how much investment has NOT come to india, after the illogical branding of indian culture as rape culture?
 
One insane reaction for which she got called out for and there was a huge hullaballo with the German ambassador sending a strongly worded letter to the  faculty? it was an exception rather than a norm. Its unfortunate that such an image has been created but seriously you seem to defending every dickhole move of the government, its people like you who seem to be so oblivious to even the stupidest move of the government that concerns me.

&gt;No. It is actually people like you who directly bring bad name to India! Its like, if sepoys had not registered to fight for the british, they would not have ruled over India for 200 years. Rapes happen everywhere, which is sad. You are wanting to make it sound like modi wants rapes in India...Is this really not what you meant? f*ck you for being a dishonest person.

Really, we are sepoys? Good generalization! Just because we are against a dickhole move of the government because everything is a conspiracy!


Dude, if you really want to compromise on India's democratic integrity for developmental goals, I think the only way is an authoritarian regime that is well guided like Singapore with good trampling of all the liberty we have. Seriously. Ridiculous arguments.
",2015-03-28 01:29:54
6,"&gt; This is all about nothing but Kejriwal's XXXL sized ego. 

Don't think he would be comfortable with anyone and anywhere. People blame Modi for ego but that guy lasted for decades in RSS and then BJP on the other hand this guy is breaking the party. What he badly wanted was power and now that he has got in Delhi, he is showing his true color. 

I bet if Delhi assembly is suspended, this guy will again start all humble and honest card. ",2015-03-28 01:50:47
7,"&gt; Why is modi risking passing this now?

He cares more about the country than his personal popularity. Waise bhi, agar abhi nahi karega ye toh paanch saal mein results nahi aayenge, aur agar results nahi ayenge toh 2019 bye bye.",2015-03-28 02:29:27
8,"If the existing LAB has been a vote catcher, Congress would have won with huge margins.

Regarding media, it has always been against Modi. The new LAB is nothing but the one that has been in India for hundred years. ",2015-03-28 02:30:15
9,"his outburst:

1. I have donated money and sweated for AAP.
2. Why have you not put PB/YYs letter on the website. there is a 7 page letter, why is itnot there when you put the other side's version?
3. What have you done? Aren;t you ashamed ? Why the eff (long beeps) were you looking for Cong support when we were dying (figuratively) on the streets. You have betrayed us. Think about it (uses bad english). Kept demanding money... does it come free.
4. Who are these new kids on the block (refers to Arvind's coterie) ?and rant against Ashutosh...(doesn't have manners! when has he come).  PB is a respected lawyer, with SC judges praising him. if he had to do something wrong, why would he come here.. he raised the Coal scam issue, if he wanted to make money
5. You have broken the trust. Even Modi hasn't broken the trust.
6. You have screwed us. gets emotional.. says hasn't eaten food for    
10 days..
7.We have given cash (some 72K for travel)...money isn't free.
8. Rants against the coterie again...Ashutosh gets special mention...
6. Challenges Arvind's version of a journalist discussion with YY.. but is quiet on his own discussion with Garg.
(Volunteer asks him to wait for a day or 2, Arvind will come and sort it out.
7. Wants Ashutosh out of AAP. Has left his wife. you gave him a good seat.
8. people in my house aren't eating (gets emotional)
9. asks the volunteer to leave this, and not waste his time.
10. Abuses...(beeped out)
11. no better chance after getting 67 seats. when something good happens, carry it forward. (gets emotional.. cries.). 
12. Invokes God and exhorts them to get it right or you will repent later.
&lt;end&gt;

(Not perfect... not by a long shot..)
",2015-03-28 02:36:57
10,"so modi has to be a dictator and make right choices to have any real progress, no?",2015-03-28 02:42:00
11,"Nah, too big of a chance for things to go horribly wrong if totalitarianism happened. Burma, Cuba or even our shitty neighbors Pakistan and Bangladesh are examples of how that never works.

Even if Modi turns out to be a benevolent dictator the people under him, or the person that succeeds him might be a monster.",2015-03-28 02:44:35
12,"i agree with your sentiment. but i feel you don't give due credit to modi. he may have some minor ""hindutva"" agenda, but he is a practical and determined man compared to the other scum of the country.

",2015-03-28 02:44:50
13,"then what's your solution goddess of knowledge?

keep trash-talking modi on a sub that 200 people read? and shamelessly stay mum on leftist failures?",2015-03-28 02:48:59
14,"Well it's too early to tell much about Modi or his govt.

Personally I'm indifferent about Modi. I don't really hate him, and I don't think he is some kind of Hitler either. But ultimately he is just 1 man in a party with some very unsavory elements - in a country where states enjoy immense power and are in the control of scumbags. The current economic policies of the center seem fine for the most part, as is the foreign policy - no real surprises.

What works in Gujarat won't necessarily work in India. Also I don't think Modi's personal opinions matter unless they affect his policy in a negative way. There's a sense of hero-worship and cult following around leaders like Modi, Kejriwal and many other politicians in India. This shit really needs to stop. Probably never will though.",2015-03-28 02:49:26
15,"There is no easy solution, lol. Not sure why you think I trash talk modi. I just despise the far-right and far-left fringes.",2015-03-28 02:50:34
16,"&gt; What works in Gujarat won't necessarily work in India

what's your point. modi knows this too. 

the problem with you is, you sit there indifferent to everything, but have some kind of dangerous/borderline-psychotic hate for your so-called ""sanghis"" lol

but you have no balancing hatred for extremist leftists or minority-appeasers. the ones who blind poor minorities with religion, instead of focusing on their economic welfare and integration into indian society.",2015-03-28 02:55:46
17,"?! I remember him being quite indifferent to Modi, hating the right wing aspects while saying he'll be moderately good for India economically. 

Edit: and what is wrong with having an ideological bias?",2015-03-28 02:59:56
18,"I thought it's a her.

And I remember some consistent anti-right comments. so i guess in my mind i equated that with being anti-modi",2015-03-28 03:01:33
19,"Seconded. Modi making a comment on ONE church attack and Modi making a comment on RBI/Land/FDI are VERY DIFFERENT THINGS.

they certainly don't fall into just one blanket ""politics"" filter.",2015-03-28 03:04:17
20,"Idk if it's her or him, never bothered, don't care. 

As for anti-right, yes he is anti far right for the most part, doesn't necessarily mean anti-modi unless he does something far-right-ish. We all are smart enough to judge what Modi does instead of some imaginary monster he supposedly is inside.",2015-03-28 03:07:50
21,"It doesn't affect politics as much as you think.Look at the signs,Mayawati refused to join Congress protest the bill saying it'll affect her politically. She realizes that the Dalit community that she represents are pro Modi and anti Congress, why else would she refused brownie points?UP and Bihar politics are fought on castes, leaders and religion. Why are Sadhvis and Maharajs in BJP then? Yogi Adityanath is their chief in that region. TN is very different. BJP doesn't have a chance there. They've broken up with MDMK, and DMK is up in arms against them so probably they'll directly or indirectly support AIADMK.West Bengal politics again are completely different. People are way of the left and AITMC and BJP will probably announce someone like Ganguly as their star CM candidate.Tldr. Electoral politics are very different than impression of a government. Why do you think obliterated Congress won 44 seats in Maharashtra?",2015-03-28 03:14:27
22,"So what if Muslims have separate laws ? If they are happy with shitty laws what exactly is the problem ? 

Either way Vajpayee never touched UCC, and Modi probably won't either. Kinda funny how your great Mudiji allied with PDP, who are basically separatists. That's my point - political parties in India are no different they are ALL shitty.

If you seriously think the state of african americans is worse than that of muslims in India, you probably have been completely brainwashed by left-liberal american propaganda combined with sangh parivar idiocy emanating from India.

Like I said, look at the reaction to Ferguson.

In Britain the establishment completely hid the entire Rotherham sex scandal, so that Muslims weren't maligned. I mean how much more appeasement can you get ?",2015-03-28 03:44:12
23,Blame Modi. simple,2015-03-28 03:53:45
24,"At this point /r/worldnews has become infinitely better than /r/india if you ignore the occasional stormfront crazies that generally get buried with downvotes anyway.

I find it rather amusing that some Modi fanboys are cheering on the documentary curbs here, in another thread about chewing tobacco ban in Delhi; suddenly the opposite ""muh freedoms"" logic comes up. There's absolutely no ideological consistency at all in India it seems.",2015-03-28 04:46:31
25,"Well its about conversion, so you can have any religion, sort of like buying a pizza, so many choices, you gotta look at all of them.  
  
Talking about pizza, gave me the idea of opening a pizza shop that only has 1 pizza with beef, pork, shrimp, and is served with alcohol mixed with cow and pig sweat. Shop will be named ""Secular Pizza Shop"" with Aamir Khan as brand ambassador, Salman Khan as delivery boy, Modi as manager and Kejriwal can be our lawyer when pissed people come to protest about our ingredients.",2015-03-28 04:52:30
26,Law and order problems exist independant of Modi. What an asinine thing to say.,2015-03-28 05:50:16
27,"Not shifting any goal posts. I just realized i typed in US instead of UK.
But the comment still stands true. It was not long ago that blacks and women got voting rights in the US. You really think no documentaries were curbed in the US and that all documentaries on rape in India have been?

Thanks for agreeing on the diana documentaries. In fact most of the majority european ancestor countries have a ban on that film. 

And i am not for banning things.

I want people here to realize how important economy is and image plays a key role. Just look at very social fora where pakistan sympathisers simply show india as a rape nation. This is propaganda to stop indian economy. Although i feel india cannot be stopped especially because of the leader we have in modi, its important for us fellow indians to not exaggerate problems in india. This only scares investors and little does it do to actually address the problem in question.

WE solve our problems. NO ONE does. Remember that! Surely, not even 1% of criminals change their mentality by watching a documentary.....

For eg, who knows how many indian traders have been facing the same problem as the students faced inder that german prof.?",2015-03-28 05:56:02
28,"AP just went into OD twice in his govt and he spends lot of money on stupid things (yoga camps ,public meets , free stuff on sankranti) .  
 
Meanwhile his paid media tells that modi is to blame for all the ills of AP .  
  
AP is going to dogs while telangana is doing better who would have thought . ",2015-03-28 06:04:17
29,Inb4 paid Modi agent.,2015-03-28 06:31:31
30,"&gt; I haven't downvoted you, but I really feel compelled to do so. You have constructed an invisible enemy where none exists.

Neki kar, dariya me daal :-D 

&gt; There is no mention of BJP or any political party anywhere in the video.

OP and others have made several dog whistle references in his comments (India first, development). The direction of the discussion he is trying to put in place is amply clear.

&gt; Did you watch the video? The person touched on his army background, not his religion.

Again, not against the person in the video, but against the narrative that the OP and others like him, such as you, are working so hard to put in place. Then there is his comment history.. hard core congressi. Let him clarify that he (and others in this thread) are not blaming hindutva or BJP or Modi for this.. Ill upvote him. At the end of the day, a 10 second video with no context is being used to mislead people. So yeah. Downvote!",2015-03-28 07:02:12
31,"* because it's an emergence of a new party right in front our eyes

* because it's the first time 18-30 public is seeing raw politics that they themselves got involved in. How somebody who promised earth and moon etc etc 

* public is emotionally invested in him. Thousands upon thousands of people gave him online donations. Now who can afford online donations - our newly rich or job acquiring youngling class. So it's important for them to keep track of what's going on 

* this is most important: left sees him as a messiah against the satan that is BJP. Left  and Congress is willing to ally with anything that can challenge Modi or this nation will turn into a developed one with no poor vote bank. So naturally anything anti Modi is AK personified. AK has a big weight on his shoulders and he knows it. 

* because the left sees him as that, the right naturally has to attack him lest he begins top big. Which, my judgement is, he will. 


**tl:dr**; having seen the rise and rise of Mulayam, Lalu and other political creations like AK, my bet is that AK will become one of the leading politicians in the 2019 elections. Unless Priyanka shows up, it may very well be that AK will be **the** leader that opposition will gang up behind. So the mindshare is natural and a self fulfilling cycle. ",2015-03-28 07:08:26
32,When you say we are having much of a problem with what? I think its more impressive that given the odds and propaganda Modi has faced it is impressive he has attracted any business...,2015-03-28 07:53:20
33,To be really frank i believe that aap is the only party who beats bjp in election. we have to accept that there is modi wave in our country. And only aap have successfully stop this wave in delhi. And in present scenario no national party i.e. congress or regional party have capability to stop modi. That's why national media give more coverage to aap and in r/india we all know that mostly here are namo bhagats so no one leave any opportunity to bash aap that's why aap is hot topic on this forum. ,2015-03-28 08:27:54
34,Stop modi? You speak as if he's  hitler,2015-03-28 09:51:51
35,"Kejru supporters don't give a fuck about these stings. For them, it's all a conspiracy by Modi and Amit Shah who are using PB and YoYa to discredit Kejru. They have a different yardstick when it comes to Kejru and his buddies.

I got a message from an AAP supporting friend last night that was equal parts hilarity and hypocrisy. What he basically said was that...

&gt; Kejru is a political reformer and a lot of people are jealous of his success, so they are making fake stings to discredit him. People shouldn't fall for it and have faith in him. Above all, he's also human and we shouldn't judge as we are prone to outbursts of anger too.
&gt; 

",2015-03-28 11:51:59
36,"Modi, Amit Shah to haath mai popcorn laike baithe honge.",2015-03-28 12:18:53
37,"Wtf, why are people thanking modi for this? ",2015-03-28 12:21:45
38,"&gt; Sad.

It is amusing to see the new found love Modi supporters have for 'Salim' Yadav and 'Referendum' Bhushan.

Take your crocodile tears elsewhere.",2015-03-28 13:29:14
39,"wrong thread, this is not about modi. :)",2015-03-28 13:51:57
40,Mamata's constituency. Why isnt she proud of them? she was passing the credit to Modi.,2015-03-28 13:55:22
41,"I'm not talking about you per say, but a general tend on this sub. 

You are too intelligent to be working for the BJP IT cell, only the bottom of the barrel idiots go there. But you might be able to provide some insight into the overall social network and media blitz about AAP news. Sometimes it's interesting to hear from the ""other side"".

I really don't hate Modi - I'm mostly indifferent to him. About Amit Shah, well idk. Seems like an enigmatic fixer sort of person.

Oh and just to clarify, I honestly don't support any political party in India; I'm cynical about all of them. Maybe slightly more hateful about the fringes, especially from the far-right.",2015-03-28 13:59:02
42,Looks like one cannot be a true Muslim unless one hates Modi. ,2015-03-28 14:19:25
43,but who is going to save india from mein fuhrer modi saab,2015-03-28 14:28:41
44,And the headlines would read: Bangalore AAP member arrested for sharing picture of Hitler Modi.,2015-03-28 14:30:28
45,anything even remotely related to Modi is evil and dangerous to them..... bunch of jerks,2015-03-28 14:52:37
46,"&gt;India outperforms China by 50 ranks when it comes to transparency in governance, with China ranking 87th on the list.

AccheDin

Har Har Modi Ghar Ghar Modi

One Upvote = One vote for Modi",2015-03-28 15:18:31
47,All because of Modi. What a great administrator,2015-03-28 15:32:30
48,[Modi on this during elections.](https://www.youtube.com/watch?v=-GOFIFGZYa8),2015-03-28 15:39:50
49,"&gt; he violence reportedly broke out after the images of Hindu Goddess Maa Ambe and Lord Ram superimposed over Mecca's religious shrine went viral on the internet.

Exactly -  some hindooo internet warrior puts something on the fucking facebook and muslims start rioting on the street for that ? What different did I say that you have to quote a long ass post ?

&gt;""We removed the dustbin and put up the chowki to keep the place clean.""

WTF man ? Do you even read your sources ? Wanting to keep the location clean is now a crime ?

&gt;So tell me, who do you think is responsible for the riots,

Muslims. Your own sources tell that. If you had read through them you would have known that.

&gt;and how exactly are these incidents not a direct fault of what was set in motion 25 years ago by Modi and his party mates?

Are you insane ? Modi wasn't even on the scene 25 years ago. And you are a kid who doesn't have an iota of knowledge on the Hindu-muslim relation in India if you think everything started with 1992. 

Hint : It didnt. I'm not even going to go into the bad blood in north india because of the invasions and shit, but in more modern context, it has always been there since Partition. Huge ass, deadly month long riots have occurred in the 60s, 70s, 80s well before the ""25 years"".  Stop being this ignorant. It hurts.

And while we are the topic - since you consider that muslims are in the right to retaliate when shit is allegedly flinged at them, you must also be cool with hindus retaliating when 59 of their women and children were burnt in cold blood in a train right ? Or that is also somehow the fault of Hindus and muslims were the victims then ? That only muslims can be victims and hindus are perpetually the aggressors ? It is because of this pseudo-secularism shit and rationalizing the muslim violence that BJP won one of the biggest victories in modern electoral history and people still aren't learning.

&gt;hey let the VHP and hateful elements in the BJP run free, incite hate all over the internet 

Let me get this right - so you are not for free-speech and you want content regulated over the internet because it hits in the feels ? Then what is the difference between you and the ""kulcha warrior"" you guys love railing against. Both of you get butthurt at internet memes, only difference being the religion.
",2015-03-28 15:48:14
50,"We heard of them after elections too. According to BJP, Bangladeshis and Pakistanis were coming to campaign for aapnin Delhi. That's why Modi got his ass kicked by anti nationals",2015-03-28 15:49:30
51,fan? that guy is Zafar Sareshwala http://timesofindia.indiatimes.com/home/sunday-times/deep-focus/Zafar-Sareshwala-The-Muslim-who-bats-for-Modi/articleshow/26290224.cms,2015-03-28 15:55:37
52,Modi wala kahan gya.. maine dono upvote kiye the.,2015-03-28 16:11:46
53,We are okay with what Modi is doing. But definitely need to be saved from the great Kejru.,2015-03-28 17:44:02
54,"Well atleast you get that im being contrarian in this sea of namoarmy circlejerk. The others just chose to throw all sorts of expletives at me- anti national, Modi hater yada yada.As for the comment, I thougt it was relevant. It was intended to point out the hypocrisy of this sub. I remember the circlejerk when Kejriwal said people will voluntarily give up their land for infra or take people into confidence and they'll pay more taxes. While Modi makes quite similar remarks and they're applauded. Point is they're politicians and politicians don't always make sense. They try to appeal to emotion.",2015-03-28 18:29:34
55,"after modi became PM even the poor drink barista coffee

har har modi ghar ghar modi",2015-03-28 18:29:36
