,article,article_date
382,"&gt;Prime Minister Narendra Modi **hopes to accept an invitation** from President Barack Obama to visit Washington this fall, an Indian government source said on Thursday, signalling a new start in ties for a leader once denied a U.S. visa.

Meaningless wording, hinting that Modi _wants_ to go to US, whereas it is US which has extended the invitation. To drive home the point Reuters publishes the article with an unflattering photo in servile pose. More appropriately, Reuters should have written US hopes that Modi accepts its invitation. So much for ""unbiased international media"". Reuters is just a propaganda vehicle for Anglo Saxons. ",2014-06-06 11:52:20
383,"&gt; I believe that these hindu fascists have gotten some balls now that modi is in power.

YSK, MH is ruled by congress and NCP.",2014-06-06 11:53:37
384,"&gt;I'ts unlikely that Modi will care (for being called a slave-driving psycho). After all, he's been called far worse.

I am gleeeee-ful.  ",2014-06-06 11:59:59
385,"That pic of modi is really nice.
He looks good in Suit.",2014-06-06 12:20:56
386,while modi ji aney waley hai play's at a distance ,2014-06-06 12:23:48
387,"I've been wondering about that too. It's quite recent, and I've tried tweeting it to various prominent journalists and channels, so it's impossible that they don't know.

I guess it's just their hatred of the BJP's 'saffron' communalism at the fore which prevents them from badmouthing 'secular' communalism and making Modi look good in comparison.

Even though the media is supposed to be bought off by Modi. /S",2014-06-06 12:58:04
388,"There are people who think and there are people who do.

We need people who think, but in an executive role like the PM, we need people who do.

People like MMS should've been the guys working behind the scenes answering the ""Whys"" and letting people like Modi figure out the ""Hows"". 

I suspect Obama in the US suffers from a similar problem. He is a thinker, not a doer.

Thankfully, our PM doesn't look like that.",2014-06-06 12:59:44
389,Even I got suspiciously high upvotes for making anti-Modi remarks.I have since deleted the comments.,2014-06-06 13:14:50
390,"Great news. Need to be done meticulously.

Also, why is this tagged as 'Politics'. This is no way related to politics.

Proposal to create a new tag, 'Development', considering we are in Modi Sarkar :P",2014-06-06 13:45:30
391,"Great post.

I think, it was Mr. Modi who should be more credited with this move than BJP as a party.

Also, I think the reason for this was, again the tirade of the media against him in context of the 2002 incident. 

I think he was pissed off with the media, and decided to troll them by feeding no information and directly talking to the people using social media.

If you go back to the origin of paper-media it was used by countless leaders to talk to the masses. Today's people love to take to twitter/facebook. Times have changed, as you rightly said, and with changing times, people's tactics do too.",2014-06-06 13:52:57
392,I doubt people really care mate. The middle class and most groups voted for Modi in sufficient numbers. Saving the environment has never really been a poll plank. We're just lucky the environment hasn't been plundered utterly.,2014-06-06 14:26:44
393,That image - Modi looks more 'Murican than Obama.,2014-06-06 14:38:04
394,"OK enough! Please stop flashing whatever Modi is saying and doing! 

Being a Modi fan myself, I rather want to hear change in policies or reforms that the government wants to bring in more than about touching feet and kissing asses. ",2014-06-06 14:45:17
395,"Brigading means organized voting and I don't think that was the case. It seemed more like a knee jerk reaction to the Pune killing: pretty much everyone was pissed off at that killing and when a similar story of targeting minorities appeared, everyone picked up their pitchforks and upvoted it.

OP mentions that he got 20 immediate downvotes to his comment, but that was not the case as far as I remember, because [I commented below](http://www.reddit.com/r/india/comments/27dhuh/muslim_homes_mosques_madarassas_vandalized_by_mob/chzrb9y) him asking people to wait for more credible sources to come. At that point his comment had less upvote and downvote both.

One thing he might have noticed and others might have experienced is the hivemind at work, where any dissenting opinion gets immediately downvoted. This can be observed in any thread that is polarized in one direction. Try challenging something in a pro-Modi/Kejriwal thread and you will receive the same kind of downvotes. 

**tl;dr** - No organized conspiracy. Circle-jerkery because people were sympathetic because of the Pune techie killing. Please lets upvote such kind of news stories from credible sources only.",2014-06-06 14:45:53
396,"Why didn't you mention Modi ? 

You don't wanna know what Modi does withi his libido ? ",2014-06-06 14:48:31
397,Thats completely different topic. Ya they are assholes but it has nothing to do with Modi.,2014-06-06 15:27:10
398,"In other words,the sky is blue.The situation will not change with any party.[Cadres are switching from CP(M) to BJP,by they way.](http://thestatesman.net/news/58050-300-left-supporters-turn-modi-devotee.html)",2014-06-06 15:40:45
399,I know Modi is doing fine as long as these sycophants keep barking at him.,2014-06-06 16:09:42
400,how the fuck to put a spoiler tag. [PM](#s Modi) becomes a link,2014-06-06 16:15:11
401,"Good news, not really anything to do with Modi as of yet. But lets hope the momentum continues. We have alot of ground to make up on China.  ",2014-06-06 16:25:37
402,"I saw more Modi rally's telecast live even on channels like NDTV and CNN-IBN than any other politician.  
The ads were on every channel(news or otherwise) and persistent, the spokespersons were on every channel day in day after.  

The premise of the title doesn't hold water.",2014-06-06 16:27:08
403,"I should do a write up on the key disasters made by each of our PM's.

From a national security perspective though? Moraji FUcking Desai and Inder Fucking Kumar Gujral, they gutted our internal security apparatus.

For a foreign policy disaster and messed up industrial  / economic policies? Nehru.

Indira simply continued his thinking to a natural conclusion - he was Leftist, she went full on Social state planned economy mode.

Rajiv - SL was a bold move, kudos to him for that, but he did botch up the political aspects AND the military aspects by getting scared and not allowing the army a free hand in SL. Though his Shah Bano and meddling in Kashmir created yet another mess the country is still dealing with.

PVN and ABV they made mistakes, but they truly are two good PM's India has had who put nation above self and tried to do good for the sake of doing good.

MMS aka Sonia's PM? Nuff said.

Modi? We will see...he has another 5 years. As long as he can economically do what PVN did (bold reforms) while doing what ABV did for infrastructure and foreign policy...you can say that we would have a winner.",2014-06-06 18:14:34
404,"Niticentral is one of the few websites that has maintained good journalistic standards and have reported nothing but the truth. They may be slightly pro-modi, but that is because of good reporting.",2014-06-06 18:25:29
405,"&gt; Niticentral is one of the few websites that has maintained good journalistic standards and have reported nothing but the truth. They may be slightly pro-modi, but that is because of good reporting.

ROFL! And wonder how every post of yours gets 3 upvotes within seconds. Noticed this on a few other comments of yours when you were replying to my posts.",2014-06-06 18:44:11
406,"Good point.  Accusations without proof are a waste of time, and are, as you say, mere drama.  I do wish our political dialogue was more based on hard data and less on conjecture.  

I'm disappointed in Kejriwal that he hasn't presented his proof clearly.  His personal conviction cannot, obviously, be sufficient reason to waste the nation's time.

But proof doesn't seem terribly important in Indian politics, at least the way it is currently practiced.

I remember Harsh Vardhan accusing Kejriwal of (paraphrasing) working for US interests and Modi accusing him of working for Pakistanis.  None of that was based on evidence, was it?

Further, do you believe Kejriwal's accusations against Robert Vadhra were also baseless and therefore rash?  Because several BJP leaders essentially echoed those accusations.

",2014-06-06 18:44:47
407,"&gt; I remember Harsh Vardhan accusing Kejriwal of (paraphrasing) working for US interests and Modi accusing him of working for Pakistanis. None of that was based on evidence, was it?

And nobody took it seriously.

&gt;Further, do you believe Kejriwal's accusations against Robert Vadhra were also baseless and therefore rash? Because several BJP leaders essentially echoed those accusations.

In Vadra's case there was large prima facie evidence of wrongdoing, the Haryana government's treatment of Ashok Khemka made everyone suspicious, and here were even TV programs scrutinizing it. Ultimately the fact that the government blocked the proposed probe into Vadra's deals made it clear there was something shady going on.

In Gadkari's case he was probed and eventually cleared by the IT department.

I actually do think there is something shady about Gadkari's company, but Kejriwal should be taking the logical approach, highlighting known facts and using legal means to press for a more detailed investigation instead of doing jail bharo andolans and having his cohorts go door-to-door screaming *'Gadkari chor hai!'*",2014-06-06 18:49:53
408,"&gt; Kejriwal should be taking the logical group, highlighting known facts and publicly pressing for a more detailed investigation instead of just having his cohorts go door-to-door screaming 'Gadkari chor hai!'

Well said.

&gt;&gt;I remember Harsh Vardhan accusing Kejriwal of (paraphrasing) working for US interests and Modi accusing him of working for Pakistanis. None of that was based on evidence, was it?

&gt; And nobody took it seriously.

So Harsh Vardhan and Modi are basically guilty of similar ""crimes,"" except nobody took them to court for defamation? I'm sure you can't be saying that.  So what am I missing?",2014-06-06 18:53:33
409,"&gt;So Harsh Vardhan and Modi are basically guilty of similar ""crimes,"" except nobody took them to court for defamation? I'm sure you can't be saying that. So what am I missing?

Well, neither Modi nor Harsh Vardhan made as big a deal of it as Kejriwal and AAP have, practically making it their main slogan for the last couple of weeks and basing a large part of their Lok Sabha campaign on it.

I suppose Kejriwal does have grounds to file a defamation suit against them if he wants to.",2014-06-06 18:55:49
410,"yes, I agree. along with kafila,scroll and caravan. Ban anything that spreads false news and rumors. caravan indulged in that when they made unproven claims of aseemanand, rss and modi indulging in terrorist activities. These kind of false information could lead to unrest",2014-06-06 19:13:42
411,"Really??? Forced sterilizations of 20 year olds happened in emergency, and Modi is the dictator? Yes sirree.",2014-06-06 19:37:30
412,You forgot Modi.,2014-06-06 19:41:14
413,"[Was it overreaction then too?](http://www.dnaindia.com/india/report-rti-activist-arvind-kejriwal-arrested-in-noida-released-1495092)

I can't believe people are saying that Kejriwal is the one who has ""overreacted"" in this case. You yourself said that he could file defamation cases against Harsh Vardhan and Modi. He didn't, because that would be overreaction. Political people make accusations against each other everyday. It is part of their job. But all Gadkari is doing is being a crybaby. I don't know where you live, but if you live in Maharashtra you will surely know how corrupt the PWD department was when he was the minister.",2014-06-06 19:56:25
414,"Not much really in the article. Since these are really early days for Modi, they should have mentioned in detail his style of work for 12 years while a cm. 

These articles sound more like paid shills who are trying to create an image rather than report on reality.

These journos don't show they have done much research before writing articles. They just quote other newspapers instead of themselves going out in the field and collecting info from various attributable and authentic sources. 


I like Modi and I hope he makes India better. But these lazy asses of journos ...they are a piece of work.",2014-06-06 19:58:46
415,"No that system won't be preferred by this govt. Modi understands the political calculus in a more realistic and medium term manner. He knows that for all the good climate prep *could* do, economic growth will be more important. - and a good military. I expect increased govt spending on arms and army infra. 

The environment will focus on keeping what's going well going on, and removing things which can't be accounted/measured for. ",2014-06-06 20:04:00
416,"You have yet to see that.

Rest assured if Modi even does one fourth of what he's promised AAP will sit in permanent opposition across India.",2014-06-06 20:06:37
417,"""Slightly"" pro-Modi",2014-06-06 20:29:24
418,"Democratic presidents tend to result in poor Indo-US ties in the post-Reagan era. Its a combination of their domestic politics, worldview and geopolitical constraints. Obama is no exception (though he had briefly promised to be much better).

Further, in this case, there is the additional needle of the US haphazardly and prematurely mistreating Modi. Now, the PM may be a big enough man to forgive and move on, but a line needs to drawn in the sand - you disrespect our elected leaders, you will pay a price of some sort (not that the price in this case amounts to much).

If I was back in the US, I would pray for a Democratic successor to Obama. Now, I pray for a Republican one (and I know what kind of loonie bin crazies inhabit that party nowadays).",2014-06-06 20:39:09
419,"&gt;So Harsh Vardhan and Modi are basically guilty of similar ""crimes,"" except nobody took them to court for defamation? I'm sure you can't be saying that. So what am I missing?

Yes they may be, but it is up to the person being defamed to take them to court. No charges pressed = no court case. Gadkari felt butthurt so he too Kejru head-on.

Besides, don't forget that at the time Kejru made those allegations, the general public was actually believing a lot of the shit that he spewed.",2014-06-06 20:57:17
420,"&gt; They don't post articles like ""Hindu's slaughtered in Mumbai"" when such a thing never happened

Hence, I used the term dog whistle. NitiCentral comes up with batsh!t conspiracy theories.

&gt; that is simply a BJP centric blog page.

It is Modi-centric not BJP-centric. Check its articles on Advani in the run up to BJP's PM candidate announcement.",2014-06-06 21:01:45
421,Modi Chalisa,2014-06-06 21:42:15
422,Modi ke tatte!,2014-06-06 22:14:50
423,Understanding with Sonia on Babri case. No such baggage with Modi. They tried with Modi but in return Modi dared them on 2002 while he was in Gujarat. Now he is at the center stage. Whole different ball game.,2014-06-06 22:15:55
424,"Freedom of expression as offered by our constitution also has a counterbalance which charges a citizen to speak without the intent of hurting others.

Discussing corruption is one thing, but to have an opinion, that one is guilty/innocent is another thing that carries a certain amount of weight in society. Getting charged with a crime itself is treated badly today, and Modi is one of the most prominent examples.",2014-06-06 22:32:19
425,"I can see the headline:

Modi reveals his communal heart and takes on the avatar of Kali to kill secular babus.


MSM will have a field trip. :-)",2014-06-06 23:00:19
426,i'm expecting shashi tharoor to join the modi govt soon. Would be fantastic to have him as a union minister under modi. Also would be an excellent spokesperson for the BJP. ,2014-06-06 23:04:55
427,"&gt; Eighteen-hour workdays. Powerpoint presentations. Meetings and follow-up meetings. An obsessive boss who springs surprise checks on you. While this may sound like a particularly hellish scenario in a corporate office, it is in fact the reality of the beleaguered babus who suddenly find themselves in the middle of the Modi sarkar.

I find two things wrong with this: The babus being sympathized with. The same babus who shoo away an Indian citizen from their desks as if they were bugs. The same babus who ask for a slice of a govt compensation from a widow to actually get the compensation. 


An obsessive boss who springs surprise checks on you - really? Modi is not running his company, but a country and if he is showing obsessiveness in improving it and making sure his employees do their job. It is a good thing not a bad thing.



",2014-06-06 23:14:47
428,"Tomorrow, Modi will say, ""News papers, please stop publishing every line I say.""

*and they will print that too*",2014-06-06 23:35:17
429,I didn't know Modi contested from Bangladesh,2014-06-06 23:35:42
430,"&gt; The look in his eyes, at that time, cannot be described in words. It was like he knows his business and his place, as well as that of everyone else, in India.

*cringe* - when will we Indians stop worshipping politicians? Modi is great because of his vision and politics. But this level of servitude and fan-boying reminds me of congress-supporting villagers drooling over Priyanka Gandhi looks like Indira Gandhi, or dalits worshipping Ambedkar's photo and building statues of Mayawati, or AAP-guys' bhakti towards AK. 

I mean seriously? Modi's victory marked an era of Indian politics where people were actually driven by facts and objective analysis and not by blind emotion, and then we have this. ",2014-06-06 23:37:24
431,Modi bhakts must be grateful to YoYo Salim for this.,2014-06-06 23:54:48
432,"

&gt;Defamation and hurting someone's feelings only applies when the comments are patently false.

But if there is circumstantial evidence pointing to any wrongdoing then the statements are not ""patently false"", are they? 

Not a single minister from UPA-1 or UPA-2 has been convicted of corruption. By your logic, we must not accuse them of anything and BJP leaders who have done so should be jailed, and that includes Modi, right? ",2014-06-07 00:00:19
433,"Please do not automoderate this thread. 

It has become a kind of sacred ritual for some of us night owls to wait for, and even participate in, this quite *magical* thread created by /u/runninggeek quite religiously. 

In this thread there are no Hindus, no Mohammedans, no Sikh, no Isayi. There is no Modi and there is no anti- Modi. No blames and counter blames, no accusations and counter accusations,  no propaganda and counter propaganda. 

Instead, here in this thread, we have a clutch of anonymous people, hiding behind random names, talking about random things, *united by night*. This thread is *magical.*

Please don't take away the human element from this fun and make it as unmagical as the rest of often ordinary, and more often venomously  vitriolic, debating threads that fill this subreddit. ",2014-06-07 00:41:40
434,This is a bit too much. Next time masturbate **before** watching Modi vids to form a clear opinion. ,2014-06-07 00:57:39
435,"&gt;They take orders from the government in power considering their future. 

And the government in power at the time was Congress, that would certainly not want Gadkari to have his name cleared to help his chances in elections. And the IT dept wouldn't disobey their orders considering the immediate benefits/consequences.

&gt;And you conveniently ignored the portion where I suggested that the Congress and BJP may be hand in glove with each other.

Maybe. Maybe not. It was by no means 'obvious' like you claim.

&gt;Can't expect a civilized debate from a Bhajtard. Always resort to name calling when cannot find an argument. 

Looking in the mirror? Because you certainly aren't paying me any compliments.

&gt;Please tell me how many investigations have been launched against BJP's own scam tainted leaders?

Let's look at the most common bogeymen used by Modi critics.

Gadkari. Investigated and cleared.

Yeddy. Cleared by Karnataka High Court; now even Lokayukta Santosh Hedge endorses Modi

Arun Jaitley. unnecessarily probed by CBI for 2G, nothing found

Who else do you want? 

Of course, people like you you disagree with every investigation and judicial authority in the universe that clears them and want them to be hanged based on the contents of Kejriwal's mouth, but that is a different matter entirely.",2014-06-07 01:19:29
436,Nothing of note here. The author is simply twisting a few non-issues to make it look like Modi has disappointed the nation.,2014-06-07 01:39:26
437,"&gt;And the IT dept wouldn't disobey their orders considering the immediate benefits/consequences.

They sure do. Their punishment will be reversed and they will be rewarded for working in their favor.

&gt;Maybe. Maybe not. It was by no means 'obvious' like you claim.

I don't think I said 'obvious'. But you surely ignored it and then distorted it.

&gt;Looking in the mirror? Because you certainly aren't paying me any compliments.

I suppose you cant expect a compliment after you have abused someone.

&gt;Gadkari. Investigated and cleared.

[Gadkari was never investigated by the IT department.](http://timesofindia.indiatimes.com/india/Gadkari-was-never-focus-of-our-probe-I-T-department-says/articleshow/35138758.cms) Apart from Income Tax Act, there were various allegations of contravention of Companies Act, Prevention of Corruption Act and FCRA which were never looked into.

&gt;Yeddy. Cleared by Karnataka High Court; now even Lokayukta Santosh Hedge endorses Modi

It is very strange that you would bring up Yeddy to prove your point. It was Santosh Hegde who convicted Yeddy. So there was no political interference. If you think Hegde is a man of integrity then Yeddy is guilty. If you believe the High Court is right, then Hegde is wrong. I let your better judgement decide who among them is correct. Apart from that, there are several cases pending against him in the HC and SC.

&gt;Arun Jaitley. unnecessarily probed by CBI for 2G, nothing found

Seriously? You call that a probe? He was barely summoned once. So were other ministers from the NDA government. I don't think there is any NDA minister who had a probe against him in the UPA government.",2014-06-07 01:41:02
438,"&gt; Yeesh. Wait and see. It won't be long before you find the law was not as convenient to you as you think and begin questioning it, and the judiciary, again.

The law states that the burden of proof is on Gadkari to show libelous cause. Making statements from information in public domain is not libel. Never has been libel and any lawyer worth his salt will tell you not the convert a libel case into a criminal one because the onus lies on the prosecution. 

&gt; I see AAP has a well-oiled social network of stalkers around. Did Somnath Bharti train you, out of curiousity?

Since you are curious, the person who trained me to *stalk* (whatever the F that means on a public forum) is Amit Shah and Modi gave guest lectures. Modi seems to have a PhD in it and Amit Shah a Masters degree. But, well you were banned twice so you would know better how to stalk /r/India At least, now the sub knows that they are talking to a twice-banned reddit user.

",2014-06-07 02:59:20
439,"&gt; The law states that the burden of proof is on Gadkari to show libelous cause. Making statements from information in public domain is not libel. Never has been libel and any lawyer worth his salt will tell you not the convert a libel case into a criminal one because the onus lies on the prosecution.

Making grossly exaggerated statemetns about what a crook Gadkari is and how he should go to jail and making it the focus of a campaign, all based on inconclusive public knowledge, is certainly grounds for a defamation case.

&gt;Since you are curious, the person who trained me to stalk (whatever the F that means on a public forum) is Amit Shah and Modi gave guest lectures. Modi seems to have a PhD in it and Amit Shah a Masters degree. But, well you were banned twice so you would know better how to stalk /r/India At least, now the sub knows that they are talking to a twice-banned reddit user.

You know, I would tell you something about the many unscrupulous elements and practices within the AAP, from some of their ministers like Bhushan to their dirty, dirty, DIRTY social media campaigns, but you are yourself neck-deep in it. A lifelong fanboy indoctrinated with the dual tenets of blind loyalty to Kejriwal and blind hatred for anyone in the world who does not share the first tenet. Enslaved for life and afterlife.

Everyone on this forum already knows YOUR measure since a long time. And it isn't flattering. Suffice to say if AAP and its supporters end up forever on the fringe, mocked, shunned and hated by the mainstream society(which in turn they will hate in greater measure and label as bhakts, Sanghis, Ambani stooges etc) it was, is, and will forever be, well-merited. 

",2014-06-07 03:12:28
440,MMS started in 2004. Article from 2011. Modi starts in 2014. ,2014-06-07 03:25:10
