,article,article_date
312,"&gt;Addressing the 56th annual convocation of IIT-Bombay today, Modi announced a financial aid of Rs 1,000 crore for the institute, saying that six decades of ""constant trying"" had made it an institute of eminence.

Even though it's a target 1000 crore, which might end up being 100 crore given the fluff our government does, they are denying an entire state crucial help at the time of great need.

Basically right now, I'm more dependent on the NRIs of kerala who have black money, to give some help. ",2018-08-16 10:31:34
313,Not surprised.. And goes to show what anyone can expect from Modi and co.,2018-08-16 10:49:01
314,"Shame on you Modi. Shame on you.

Alienating and letting an entire state suffer just because they did not vote for you is the most villainous thing you have done this week.",2018-08-16 11:33:00
315,"Omg wtf is wrong with you?? How many times do I have to write the same fucking thing again and again.

I clearly told you multiple times, Modi needs to do something actionable first.At least arrest the fucking rapist in BJP and condemn them.He fucking needs o walk the wlak and not just talk.He fucking cant just say we have a rape culture when his own ministers are rapist.To free India of rape culture, just fucking maybe, he needs to kck and arrest his rapist ministers and members.There is a reason why BJP is called bhalatkari Janta party.

Is this simple enough for you to comprehend???

Also, this is how you fucking started the conversation 

&gt; If he says good he is a troll.

&gt;If he says shit he is a troll.

&gt;Noice.

But I still replied to you ""politely"" with a proper example, which was easy enough for anyone to understand. And you still whine about being rude.

I don't know whats wrong with you or why you don't understand this extremely simple concept of fucking cleaning your own backyard before asking others to clean theirs. If modi wants a rape free culture maybe first create a rape-free party and/or government. There is no fucking no point in crying rape on a stage when his own ministers are raping the population and killing the families of victims who dare complain.",2018-08-16 11:35:53
316,Go suck Modi some more.,2018-08-16 12:07:53
317,"I think Modi is the worst prime minister since Rajiv Gandhi.

Do you have anything to add other than assuming political affiliations? ",2018-08-16 12:13:38
318,Anyday. Modi should just polish my shoes. No need to make false speeches. ,2018-08-16 12:43:59
319,A little rewording and this will be ready when it is time for Modi too.,2018-08-16 13:05:05
320,Congress is really angry at Modi ji!,2018-08-16 13:12:26
321,"Did Rajnath and Modi did their official fly-bys yet? If not, ask the fuckers to donate the money for flood relief that they'd otherwise use for flyby photo-ops. And all this while showering money and projects for UP, Rajasthan etc. Modi and his minions are fueling an internal rebellion. AP, Telengana, Karnataka and now Kerala, CMs of all these states have been raising their voice against erosion of federalism and center's neglect. This is not going to end well. Coalition politics is the only stable form of governance in this country IMO. This strongman culture isn't good for the economy or the health of our federal democracy. ",2018-08-16 13:17:31
322,He did some good things while as a Prime Minister but he or Advani were no different to Modi and Adityanath.,2018-08-16 13:22:26
323,"Actually the RSS organization in Kerala is most well working Rss organization in the country.They actually help people.Even modi acknowledged this once.

Obviously they aren't like the RSS in the north whose only duty is to disrupt public life and spread hatred.The RSS in Kerala has actually helped many.",2018-08-16 13:29:44
324,"He was pretty statesmanlike when in power. It was reasonably acknowledged that he was the good cop while Advani played bad cop (spreading hatred, etc).

I think folks forget or aren't aware of how vile he was, and time, nostalgia, along with comparisons to Modi have whitewashed his bad side.",2018-08-16 13:33:00
325,"Choose good people in your local district. Voting for fucking parties got us in this unholy mess. 

I won't vote for Modi or Rahul or Kejriwal, I will vote for someone who did work in my area.",2018-08-16 13:43:51
326,"Woh ek aur tum do, 

Phir Bhi wapas aa gaye

Khaali Haath

Kya soch kar aaye the, Modi khush hoga, sabashi dega?

Shahzaado! ",2018-08-16 13:51:36
327,"Yeah, back then there was respect between both sides. He also said ""modi should step down as cm"" back in 2002 post riots.",2018-08-16 13:53:03
328,Modi also didn't speak about the Cricket team's poor performance in their tour of England. FUCK MODI!!11!,2018-08-16 13:53:59
329,"You have written it correctly. But he was smarter or more cunning than Advani. He stayed in New Delhi while Advani was actually present at the site for the demolition of the Babri masjid and hence got forever tarred. Vajpayee, who conveniently stayed away, reaped almost all the political benefit and became the face or ""mask"" of the BJP and the Prime Minister. 

Also, in the case of Narendra Modi and the Godhra riots, it was very clever to remind Modi of his rajdharma towards the citizens of Gujarat. But he conveniently forgot his own rajdharma - as Prime Minister of India he should have taken action against the CM who was not able to contain the communal riots.

Vajpayee and Advani are the main architects of the Hindutva wave and the anti-minority sentiments which may doom the country in the future.",2018-08-16 13:56:02
330,We know that there is no impact economically. We just want to milk this opportunity politically and rightly so because that's what Modi/BJP did (and would do) when they were in opposition. ,2018-08-16 15:01:39
331,"&gt; He also said ""modi should step down as cm"" back in 2002 post riots.

I wish we had such *high* benchmarks these days.",2018-08-16 15:24:41
332,"BJP fan jumping in - "" Water is the most essential part of human body. Let me remind you that life on Earth would cease to exist if water wasn't available to Humans. A normal person needs 7 litres of Water per day. Now multiply the STREAH of a normal person to the STREAH of a person who has responsibility of the Nation. Modi needs water more than anyone on the face of the Earth.""",2018-08-16 15:56:09
333,I am not a Modi fan but drinking water even if the national anthem is playing is not some big issue. Snowflakes,2018-08-16 16:20:52
334,This is more awkward than Rahul Hugging Modi,2018-08-16 16:21:24
335,"Modi gave a really long speech and didn't realise the anthem would start so soon. It started soon as he went for the glass. Surjewala and Congress need to be more tactful than this. This is just simply error of judgement. This is the kind of shit BJP IT cell peddles. Congress tactic since GJ elections has been to rise above this rhetoric. Hope he takes this crap tweet down. 

",2018-08-16 16:56:22
336,"Thanks for this https://old.reddit.com/r/india/comments/97omc3/kerala_floods_state_asks_for_rs_1220_cr_as/e4a5jtn/ but if this happened near elections times in Kerala, Modi would have flown here, announced 5000 crore already and would have taken some selfies with the local units of RSS here.
",2018-08-16 17:03:55
337,"I know we don't want to criticize people at their death, but Vajpayee was a sanghi. Hindutva was at the core of BJP's policy then too. 

You normalize Vajpayee, you get Modi. You normalize Modi, you get Yogi. You normalize Yogi, you get another fringe leader who's currently in the making. ",2018-08-16 17:12:01
338,Such publicity is in addition to 4000+ crores Modi has spent! ,2018-08-16 17:12:49
339,"Kerala floods have seen tremendous traction over social media and the account details of the CM relief fund are now doing rounds on whatsapp. Expect funds pouring in or relief, As for Media attention. Do you really care, do you want Rahul Gandhi/Modi/Kejriwal to do a ""Hawaai Yatra"" or survey the devastation. Relief will reach you, like it reaches Assam or it reached Chennai last year. Fuck the media bro. This showing of victim and validation that your natural disaster is biggest is not going to take you anywhere, Indians are helping. ",2018-08-16 17:24:09
340,"Vajyapaee's biggest mistake was not stopping the ""asteen ka saanp"" that is Modi. ",2018-08-16 17:26:48
341,"&gt; ""Atal Ji's passing away is a personal and irreplaceable loss for me,"" says Prime Minister Narendra Modi 

&gt; https://twitter.com/ndtv/status/1030066134278520832

",2018-08-16 17:53:54
342,"A true political leader, who tried his best to resolve pak differences. His contribution towards the renovation of NH is still spectacular, and although I do not absolve him of any blame regarding Babri, he seems to have definitely undergone a change of heart. His resignation speech was class, Gujral doctrine was still a better bit of policy than doval doctrine (my opinion) and the shady crook of Mr Swamy who left no stone unturned in portraying the man as a villain today maintains his relevance by peddling communal hate. Nobody is perfect, but Mr. ATAL was way ahead of the current class of politicians, be it in opposition or in government. Today we have shikanjiwalas and pakodawalas in opposition and government. To earn a place in the heart of plebs, you really don't need to be a mere POPULIST, like erdogan or duterte or modi. You can be better than that. ",2018-08-16 18:32:33
343,"The media should have said Kerala cows are drowning, and Modi *kaka* himself would have parachuted down to Kerala with the money ... /s",2018-08-16 18:37:28
344,"&gt; The usual range for the first two categories is around Rs 1 lakh to Rs 3 lakh, and the Rs 3,800 aid is unprecedented ... Seems to me the state government needs to come up with a more realistic compensation plan ...

*Mallu's* are very politically aware about their rights and quiet aggressive in demanding it from those in power (as every citizen should be). Thus the Kerala government doesn't really have a choice in this.

Moreover, the government is not doing us any favour by giving such relief money as it is public money. 

And Modi *kaka* and his supporters should be ashamed of coming with such kind of excuses about ""realistic compensation plan"", when the BJP governments (in both the centre and state combined) have spent around a BILLION dollar of the same public money on PR campaigns, And are also planning to spend around Rs. 4000 to Rs. 6000 crores on statues!",2018-08-16 18:50:01
345,"I don't really know how to feel about this. On one hand he put into place many policies which benefited Indians like my dad in the late 1970s to get a passport quickly and leave the country but I also know someone who lost his family in the Gujarat Riots and blames Modi, Atal and Advani as the ones with his family's blood on their hands. I hope Mr. Vajpayee finds whatever peace he is entitled to.",2018-08-16 19:04:05
346,Lol. You can say the same about Modi.,2018-08-16 19:26:18
347,"Thank you for this comment. It is unreal the kind if whitewashing that’s happening to his image. The man was as communal and hardcore sanghi as Modi is today

[Atal Bihari Vajpayee, the Bharatiya Janata Party's mask of moderation so far, has in fact been an unwavering adherent of the Sangh Parivar's credo and policy, whether on Hindutva, the Babri Masjid, or the communal riots in India since 1967.](https://www.frontline.in/static/html/fl2114/stories/20040716005400400.htm) 

[The campaign of hate, intimidation and violence by the Sangh Parivar that escalated with the assumption of power by the Bharatiya Janata Party at the Centre last year has peaked, undermining social solidarities and plunging the nation towards anarchy and chaos.  ](https://www.frontline.in/static/html/fl1603/16030040.htm) ",2018-08-16 19:32:02
348,"&gt;Nice propoganada,but BJP won 2014 without AB so not sure what is there to Milk,this is not congress.

That was your comment, and I showed you Modi was milking Vajpayee's legacy yesterday. I am sorry, but I can't help if you want to be intentionally obtuse. ",2018-08-16 19:35:40
349,"""Did PM Modi intentionally Misquote WHO?"" ",2018-08-16 19:37:07
350,Well I wouldn't give Godhra a rest when Modi dies. Congress shouldn't be given a rest for 1984. Something's shouldn't be given a rest as long as the ramifications of those actions persist,2018-08-16 19:52:04
351,"Modi doesn't step out of his home unless there is a camera there to give him his publicity

He shoved gas hike down our throats #GiveItUp

Couldn't be ask #StandWithKerala?

Can't expect him to be human. The way he had treated Delhi public is disgusting

I hope Delhi public keep voting AAPin power",2018-08-16 20:00:20
352,"bhakts say that when Modi even takes a dump

&gt;at least he is doing something

Supreme leader's any mindless action for them is better than maunmohan's paralysis. This sort of macho thinking leaks into the minds of eager bhakts who want to prove they are better bhakts than others.

Hashtag dharm khatrey mein hai",2018-08-16 20:10:43
353,"1. Should have kicked out Modi in 2002 after the Gujarat pogrom.

2. Far too eager to make peace with Pakistan.",2018-08-16 20:37:03
354,"1. Terrorists were openly occupying the golden temple. Temple needed cleansing, Indira Gandhi was decisive thankfully. And had popular.support. secularism does not mean to.also support terrorists
2. Point taken. What about Advani? And PV Narasimha Rao who famously ignored all the Babri buildup and let.it.happen
3. He did what he could as PM, demanded action. It was a state/Modi issue.

Given the current crop of politicians, Vajapayee was among the better ones.
",2018-08-16 20:41:47
355,"IIRC, he took part in, or if not he tacitly approved, Advani's Rath Yatra in 1990 that campaigned for the demolition of the Babri Masjid. Whether it was ideology or pragmatism that led to this, one wishes he had distanced himself from that exercise of hatred.    

He also let Modi continue as CM in the aftermath of the Gujarat riots in 2002.    

Also, a possible ""flaw"" in his party's books would be that he failed to gauge voter sentiment during the ""India Shining"" campaign of 2004.     

Still, he was a great politician and a good human being, and I'd rather prefer him as the PM than Modi.   ",2018-08-16 20:41:58
356,"Yes you are right, we do have a huge burden of issues in the country, but there's a lot of development happening to.

What I'm most worried about is that our freedom is under threat, and not many people recognize the threat because it comes from within. Our country is slowly moving towards dictatorship thanks to the sinister moves hy Modi and Shah to dissolve all our democratic institutions and replace them with ""yes-people"". 

Like the Americans, we'll be fed just enough to keep our mouths shut, but we'll be helpless to protest or force positive change in iur country, because we'll be branded as anti-nationals and terrorists.

A majority of our country people put caste, religion and political party ahead of Our Country. And this is a very detrimental trend. ",2018-08-16 20:42:03
357,"&gt; modi should step down as cm

A Generation later, people are terrified to say the same, instead he is the PM now. How time changes in 20 years.",2018-08-16 20:43:59
358,"I would prefer Dr. Manmohan singh over Modi, 

ffs, I would prefer Rahul Gandhi over Modi.

Modi is a liar, a murder, a narcissist and a coward. 

PS: back in 2014 I wanted Modi to win ",2018-08-16 20:55:17
359,Modi is now on tv telling how vajpayee death is a personal loss for him. He is milking it for all it is worth ,2018-08-16 21:17:41
360,My experiments with truth - Modi ,2018-08-16 21:33:57
361,"What else you want him to tell ? he doesn't care? Modi was mentored by AB.

Any way find other excuse as now many non BJP states declared holiday tomorrow the sympathy for election theory went out of window.",2018-08-16 21:42:26
362,So why modi keep bringing Nehru and Rajeev Gandhi? No decency for the dead there?,2018-08-16 22:06:39
363,"See man,that Babri incident was ugly.
The politics was really ugly.
From Modi,Advani to Mulayam and UP CM Kalyan Singh,everyone got into their ugly mode.
People were puppets.Air firing from helicopters and that blood bath was so unhuman.
My family was in Gorakhpur that time.
The elders have narrated the story and situation.

Riots and killings have been the story of this country since 1947.
Does anything come close to the bloodbath of partition ? I don’t think so.
It’s just so that you look for the person who is least dirty.
Emergency,assassination of Rajiv Gandhi was shocking for the country.The incompetent PMs after that was sending the nation into a tough period.
AVB was lone light of that time.
He handled whatever he had at his disposal very well.
I respect him for his work.
Rightnow,even Modi’s hand are bloody as the theory suggests.
But I respect him as he is at the post where he is supposed to be respected.
I hope you get what I mean.

When I said AVB deserved Bharat Ratna I meant that others for example: Sachin Tendulkar didn’t fit the bill for me to be the recipient of India’s Highest award.

I was talking about difference makers.
",2018-08-16 22:28:36
364,"Vajpayee got away lightly. He is as hardcore hindutvawadi as Modi and Advani is. People are now trying to whitewash his legacy by saying he was an orator and a poet. Guess what? Hitler was a painter too. But we don’t use that to whitewash him. 

He stood by Modi when Modi unleashed unprecedented violence on Muslims. He stood by Advani when Advani went on murder spree. This man is no hero.",2018-08-16 23:06:39
365,"This is a defeatist perspective. I expected better from TheWire. 

ISRO has been working on human flight long before Modi arrived. Sending a human flight will strengthen our knowledge on spaceflight. ISRO does not work alone. Our Academia will get to participate in research and development of spaceshuttle. It is not as if they are not working right now. Putting an Indian in space is Inspiration but let us not forget the technological challenges that will strengthen ISRO and other organisations which are participating in this program.

Already our organisations are struggling to build a capable fighter aircraft. ISRO has quietly tested a reusable craft and is on its way to testing. This is what a space agency should be doing. This is not failure. This is not propaganda. We should be having our own people on ISS. 

The author talks as if ISRO has given up on everything else and is only focussing on this. That’s just not true. We are doing both. And this isn’t the time to talk about letting private players send spacecrafts to space. The private industry simply doesn’t exist in India. We are the launchers for first world countries! ISRO is the agency which is undercutting private players to launch payload into space! And even if we were to encourage private players, this mission will be even more helpful. Look at how ISRO has opened up their battery tech to industry.

This article is aerospace equivalent of the west’s why is India sending rockets when it has poverty. 

US’s space ambition have contributed a lot to its aeronautical industry. They came up with SR71, F14 tomcats because of the research on inter space travel. 

This is just a poorly written opposition because Modi chutiya announced. If anything, it was UPA which okayed the mission. ",2018-08-16 23:20:53
366,"Atal Bihari Vajpayee ; 25 December 1924[1] – 16 August 2018) was an Indian politician who thrice served as the Prime Minister of India, first for a term of 13 days in 1996, for a period of eleven months from 1998 to 1999, and then for a full term from 1999 to 2004.

He was a member of the Indian Parliament for over four decades, being elected to the Lok Sabha, the lower house, ten times, and twice to the Rajya Sabha, the upper house. He served as the Member of Parliament for Lucknow, Uttar Pradesh until 2009 when he retired from active politics due to health concerns. Vajpayee was among the founding members of the erstwhile Bharatiya Jana Sangh which he also headed from 1968 to 1972. He was the Minister of External Affairs in the cabinet of Prime Minister Morarji Desai.

When the Janata government collapsed, Vajpayee restructured the Jana Sangh into the Bharatiya Janata Party in 1980. He was the first Indian prime minister who was not a member of the Indian National Congress party to have served a full five-year term in office.

He was conferred India's highest civilian honour, the Bharat Ratna, by the President of India in 2015.The Modi government declared in 2014 that Vajpayee's birthday, 25 December, would be marked as Good Governance Day. He died on 16 August 2018 due to age related illness.

Early life and education

Vajpayee was born to Krishna Devi and Krishna Bihari Vajpayee on 25 December 1924 in Gwalior. His grandfather, Pandit Shyam Lal Vajpayee, had migrated to Morena, Gwalior from his ancestral village of Bateshwar, Uttar Pradesh. His father, Krishna Bihari Vajpayee, was a school teacher in his hometown. Vajpayee did his schooling from the Saraswati Shishu Mandir, Gwalior. He subsequently attended Gwalior's Victoria College (now Laxmi Bai College) and graduated with distinction in Hindi, English and Sanskrit. He completed his post-graduation with an M.A. in Political Science from DAV College, Kanpur, and was awarded a first-class degree.

His activism started with Arya Kumar Sabha of Gwalior, the youth wing of the Arya Samaj, of which he became the general secretary in 1944. He also joined the Rashtriya Swayamsevak Sangh (RSS) as a swayamsevak in 1939. Influenced by Babasaheb Apte, he attended the Officers Training Camp of the RSS during 1940–44 and became a pracharak, RSS terminology for a a full-time worker, in 1947. He gave up studying law due to the partition riots. He was sent as a vistarak, a probationary pracharak, to Uttar Pradesh and quickly began working for the newspapers of Deendayal Upadhyaya, Rashtradharma (a Hindi monthly), Panchjanya (a Hindi weekly) and the dailies Swadesh and Veer Arjun.

Death

Vajpayee underwent knee replacement surgery at Breach Candy Hospital in Mumbai in 2001. He suffered a stroke in 2009 which impaired his speech. His health had been a major source of concern and those in the know said he was often confined to a wheelchair and failed to recognise people. He also suffered from dementia and long-term diabetes. For many years, he was not known to have attended any public event and rarely ventured out of the house, except for checkups at the All India Institutes of Medical Sciences.On 11 June 2018, Vajpayee was admitted to a hospital in critical condition.

He died at 5:05 pm IST on 16 August 2018 at AIIMS hospital due to age related illness.",2018-08-17 00:27:26
367,"Didn't you see it all over the media?  It's been making news the last week and before as well.

[Source.](https://economictimes.indiatimes.com/news/politics-and-nation/modi-government-splurges-over-rs-4300cr-in-publicity-rti/articleshow/64158090.cms)",2018-08-17 00:41:25
368,UNLIKE MODI....amirite?,2018-08-17 02:39:00
369,"Although I disagree with you on almost all occasions, today, i see you on the same boat. Whatever be it, abv was a cut above the current crop of lodus who run the country and even in opposition he was staunch. Its his sad fate that he gave recognition that Viper of a swamy . Swamy, is and always was a talented and intelligent asshole. Abv was a bit too empathetic towards a man who would be his undoing.

And those who support jayalalitha, lol they should rather go and find out how the HC made valuations from some outcrops, justice Kumaraswamy judgement.

The difference between modi and abv is evident from the way they speak, one has a tenor of narcissism, other the rigor of a statesman. And when in opposition, the sole relevant leader who speaks some sanity is Tharoor. Abv did better because he spoke more lucidly, was way more eloquent, and did not take cover in the cloak of elitism, the reason why tharoor lacks much appeal.",2018-08-17 03:56:23
370,Hmmm! I wonder how Modi will react to such a suggestion!!,2018-08-17 05:54:26
371,"I don’t see any criticism. 

What she said is true. His death has caused a lot of so called VIPs including Modi to throng his residence to pay their last respects and for the photo op. This movement has caused significant traffic block.

What is disappointing is you putting zero effort in trying to understand.",2018-08-17 06:22:37
372,"Vajpayee was a good statesman but he presided over a very problematic government. His own government was allegedly involved in  scandals ranging such as corruption  in procuring coffins for soldiers killed in Kargil. And his party and he stayed woefully silent as Narendra Modi and his goons were responsible for the deaths of many in Gujarat. All for political gain.

He was probably a good man and he deserves dignity in death but spare me this sanctimonious plea to humanity. Where was his humanity when unspeakable things were happening on the watch of his leadership and he chose not to say or do anything about it?",2018-08-17 08:16:56
373,"Yeah, so how about we all focus on flood relief and save the bickering for later? Because right now all i am seeing on social media is posts about how terrible modi is for not releasing enough money, JIO institute bullshit and bullshit about statues.

Which, in my humble opinion, ought to be reserved for later.",2018-08-17 09:15:40
374,Modi is a Narcissistic psychopath. ,2018-08-17 10:01:04
375,"&gt; PS: back in 2014 I wanted Modi to win

Why? You didn’t know anything about his lies, murders, narcissism or cowardice then?",2018-08-17 10:30:33
376,You created this account yesterday just to defend Modi .. Wow Wow..,2018-08-17 10:53:55
