,article,article_date
0,"- people gonna be effin pissed at Modi
- another major former celebrity death prolly
- petrol prices will hike again
- SRK/Salman, any of those I'd love to see them retire, they're just not doing it anymore
- Sushant bags an IIFA for MS Dhoni 
- Trump visits ind for his business deals or whatever he had going on",2016-12-17 00:19:30
1,Why not snatch away that privilege?I mean if Modi can cancel the fu cking currency surely he is capable of that?,2016-12-17 00:33:07
2,"How is that even an excuse? Demonetisation was supposed to be a strike against black money. More importantly, it was branded as the opening shot in a broader struggle against corruption.

This just shows that the government was never serious. Ever. Won't stop bhakts from defending Modi like slaves.",2016-12-17 00:36:32
3,"Still a better human than Modi, if not a better politician. ",2016-12-17 00:42:19
4,"Next , victim blaming. Its the population's fault because they questioned modi and didn't cooperate.",2016-12-17 00:43:13
5,"The last month or so has seen Modi's surgical strike..  

Compare that to Indira's surgical strike.. against heavy odds (US + China + Pakistan alliance) in 1971.

And all this Bigot RSS Pracharak can think of is to blame her for something,  on this day, when he should have been praising the contribution of the people who achieved this feat.

No one is saying Indira was not flawed. 

Modi has only managed a surgical strike against the poor people of his own country.",2016-12-17 00:59:34
6,"*Modi is definitely going down hill.

*a lot of the upcoming elections in European countries are pushing towards anti immigration.

*cash crisis will continue.

*Rupee would breach 70 against dollar.",2016-12-17 01:04:28
7,"Abbe chutiye, where is your evidence of corruption against Modi? Goa kyon chala gaya?",2016-12-17 01:19:44
8,"Thank you for the links. This brings out my point. My problem is not with the DD covering the speech of Mr Modi.  
  
The problem lies with intent. 
  
In all other instances the intent was of a broadcaster covering News and events of importance.  
  
However, from the article  
  
&gt;DD officials did not comment on why a BJP event would be covered live, but sources within the right-wing party said the PM, who had recently claimed that he was not being allowed to speak in the Parliament, could use the opportunity to reach out to the people directly.

&gt;“Post demonetisation, there is a lot of concern among people on what to expect next; the PM might have a message for them. He may also want to respond to the charges levelled by the Opposition,” a BJP functionary said.    
  

The intention here does not lie with the DD, rather, its being used by a bearer of a public office for personal purposes.  
  
Its not the DD who 'wants' to cover this event, but rather they are being made to. Of course, there is no lack of sycophants in DD who would bow down before someone who is definitely gonna be elected in 2019 as well and rule the country at least till 2024. 
  
",2016-12-17 01:27:04
9,"Another major difference here is that the captain of the team (Modi) has no idea what the rest of the players (RBI, Banks, public, etc) are doing or capable of doing, its as if he is just handing decisions on a platter.",2016-12-17 01:30:44
10,Pappu does not have any evidence against Modi he is just attention whoring.,2016-12-17 01:31:16
11,"If that was the case, why did Modi and Sub Swami dressed as sikhs to prevent getting arrested during emergency?",2016-12-17 01:41:57
12,"Modi had the gall to go after poor and informal workers. If he is half as bold as his bhakt fanboys portray him as then he should damn fucking well make a serious run to clean up politics. 

People will forgive him even if he can't pass the law. I doubt that they'd vote for the people blocking progress if they tried.

But *this*? He is doing no reform at all at the root causes of black money, instead ineptly going after the informal economy where most Indians are employed and almost all are paid in cash and spend in cash.",2016-12-17 02:07:17
13,"Modi is innocent. It's all the Indira, MMS fault. ",2016-12-17 02:48:12
14,"&gt;  informing people why this move won't matter.

Yea, so that Modi benefits from it? I don't think Congress will ever do that, or for that matter any Party in opposition.",2016-12-17 02:49:55
15,"Chutiya Modi claims his surgical attack is as legit as '71 war. Hence no one should ask for proof. He doesn't remember that people had the evidence for '71 war. There were photographs, Pakistani surrender, and a brand new country. 

Only his drone bhakts will fall for his schizophrenic speeches. ",2016-12-17 03:30:12
16,"IT Act grants exemption from tax to political parties on income that could be from house property, other sources, capital gains and contributions.

---

&gt; * NEW DELHI: The government has said political parties depositing the demonetised Rs 500 and Rs 1,000 notes in their accounts will not face income tax investigation.

&gt; * ""If it is a deposit in the account of a political party, they are exempt.

&gt; * If the individual is putting money in his own account, then we will get information,"" revenue secretary Hasmukh Adhia told reporters.The Section 13A of the Income Tax Act, 1961 grants exemption from tax to political parties in respect of their income from house property, other sources, capital gains and income by way of voluntary contributions received from any person.Adhia was replying in response to a question whether the government is also investigating political parties/political treasuries depositing their own cash in banks.This came on a day the government gave tax offenders a last chance to come clean.The exemption in respect of contributions is available only when in the case of all voluntary contributions in excess of ten thousand rupees, such political party keeps and maintains a record of such contribution and the name and address of the person who has made such contribution.This mean anonymous contribution cannot be more than Rs 20,000.

&gt; * Farmers exempt from tax on agricultural income will need to furnish a self-declaration that his earnings are less than Rs 2.5 lakh in a year to make deposits in bank without PAN.

---



Here are some other news items:^credits ^to ^u-sr33

&gt; * [Tax exemptions to political parties subject to conditions, says government](http://timesofindia.indiatimes.com/india/political-parties-depositing-old-notes-in-banks-are-exempt-from-income-tax/articleshow/56023361.cms)

&gt; * [Black money fight: Narendra Modi government exempts political parties from paying tax](http://www.financialexpress.com/economy/black-money-fight-narendra-modi-government-exempts-political-parties-from-paying-tax/476756/)

&gt; * [Home](http://www.timesnow.tv/india/video/political-parties-exempted-to-deposit-old-currency-in-their-bank-accounts/53074)

---

^I'm ^a ^bot ^| ^OP ^can ^reply ^with ^""delete"" ^to ^remove ^| [^Message ^Creator](http://www.reddit.com/message/compose/?to=sallurocks) ^| [^Source](https://github.com/hunkdivine/samacharbot2) ^| ^Did ^I ^just ^break? ^See ^how ^you ^can ^help! ^Visit ^the ^source ^and ^check ^out ^the ^Readme",2016-12-17 04:50:28
17,"There are some worthy people , but worthy doesn't mean they can become PM . Modi will win next election , the other leaders for now seem like a blabbering mess . Considering that and the die hard Modi supporters , he will win . ",2016-12-17 05:05:54
18,"I don't personally want Congress but the thought that an impotent Raga, who will never be able to make any moves if he becomes PM aka Lame Duck PM, is a lot less scary than Modi making brash and incompetent moves as a PM. I don't think I could vote it but it's tempting.",2016-12-17 06:50:16
19,Then why did Modi withdraw most of the cash from the system if his minions were not ready to go cashless yet? Is he a fool?,2016-12-17 07:11:27
20,my first WTF moment in this demonetization phase. modi has finally lost it. ,2016-12-17 09:15:26
21,What about foreign nationals of Indian origin living in India like me? I am not eligible for Adhar and doesn't seem like Modi has given much thought to this since his first few months when he said that foreign nationals of Indian origin are free to come and stay in India for as long as they like without implications. ,2016-12-17 09:44:05
22,"So here is an interesting turn of events. RG claims he has proof of Modis ""personal involvement"" in corruption, then suddenly gets to meet Modi, which is bizarrely rare considering Modi never even acknowledges his presence. And now all the talk of Modi's corruption has died down.",2016-12-17 09:59:58
23,"&gt; Modi ends up doing the big deals that may go bad.

Except he always finds someone else to blame when they do go bad. So I'd say it is lower risk for higher PR.",2016-12-17 10:10:15
24,"The exemption is applicable if the party keeps books and other documents and are audited by a Chartered Accountant

---

&gt; * New Delhi: As it levies stiff penalties on unaccounted cash in banks, the government yesterday said political parties depositing old Rs 500 and Rs 1000 notes in their accounts will be exempt from income tax.

&gt; * ""If it is a deposit in the account of a political party, they are exempt.

&gt; * Section 13A of the Income Tax Act, 1961 grants exemption from tax to political parties in respect of their income.

&gt; * However, the tax exemption is applicable only if the political party keeps and maintains books and other documents of the income and the accounts are audited by a chartered accountant.

---



Here are some other news items:^credits ^to ^u-sr33

&gt; * [Tax exemption to political parties depositing old Rs 500, Rs 1,000 notes](http://www.business-standard.com/article/economy-policy/tax-exemption-to-political-parties-depositing-old-rs-500-rs-1-000-notes-116121601242_1.html)

&gt; * [Deposit in bank accounts of political parties exempt from tax](http://economictimes.indiatimes.com/news/politics-and-nation/poliitcal-parties-exempted-from-scrutiny-for-cash-deposit-of-old-notes/articleshow/56022656.cms)

&gt; * [Black money fight: Narendra Modi government exempts political parties from paying tax](http://www.financialexpress.com/economy/black-money-fight-narendra-modi-government-exempts-political-parties-from-paying-tax/476756/)

&gt; * [Political parties to get tax exemption, can deposit old currency notes in their bank accounts: Finance Secretary Ashok Lavasa](http://www.india.com/news/india/political-parties-to-get-tax-exemption-can-deposit-old-currency-notes-in-their-bank-accounts-finance-secretary-ashok-lavasa-1710034/)

---

^I'm ^a ^bot ^| ^OP ^can ^reply ^with ^""delete"" ^to ^remove ^| [^Message ^Creator](http://www.reddit.com/message/compose/?to=sallurocks) ^| [^Source](https://github.com/hunkdivine/samacharbot2) ^| ^Did ^I ^just ^break? ^See ^how ^you ^can ^help! ^Visit ^the ^source ^and ^check ^out ^the ^Readme",2016-12-17 10:27:05
25,"Why should Jaitley be the fallman for a scheme that his boss concocted? 

It's not just that the implementation was terrible. The idea was garbage. Modi didn't consult a single independent economist. The result is what you see.

Blaming Jaitley is letting Modi *way* too easily off the hook.",2016-12-17 10:54:27
26,"The country’s bungling effort to cut down on cash has undermined Narendra Modi’s credibility, says Sadanand Dhume in The Wall Street Journal.

---

&gt; * Nearly six weeks after India abruptly scrapped high-denomination banknotes accounting for about 85% of its currency by value, the economy continues to slow.

&gt; * Poor and middle-class Indians are still suffering from the shortage of new bills.

&gt; * But the most significant casualty may well be Prime Minister Narendra Modis reputation as a sound economic manager.

&gt; * On Nov. 8, Mr. Modi announced that Indias two highest-denomination currency bills1,000 rupees ($14.84) and 500 rupeeswould immediately cease to be legal tender in most...

---

^I'm ^a ^bot ^| ^OP ^can ^reply ^with ^""delete"" ^to ^remove ^| [^Message ^Creator](http://www.reddit.com/message/compose/?to=sallurocks) ^| [^Source](https://github.com/hunkdivine/samacharbot2) ^| ^Did ^I ^just ^break? ^See ^how ^you ^can ^help! ^Visit ^the ^source ^and ^check ^out ^the ^Readme",2016-12-17 11:09:08
27,"Modi is bad news for India and for BJP. He has drained BJP of all good leaders and centralized all power to himself. He is doing the same to country's institutions. The effect of being led by an uneducated chest thumper who is not open to consultation and feedback will be severe and will take India back by decades.

Modi is doing to BJP, what Gandhis have done to Congress party.

Also the myth that BJP is full of buffoons but Modi is not one of them is a deliberately created farce so that Modi can distance himself from anything stupid that happens under his watch.",2016-12-17 11:19:54
28,"Example of Modi shifting blame: ""demonetisation was a great idea but dear leader was let down by corrupt bankers"".

Now you give me an example of everybody wanting a personal exception. Note that it has to be everybody in India because you've made a far more general statement than I have.",2016-12-17 11:21:44
29,"Investigations by the CID of Karnataka Police into the death of Ramesh has revealed that the driver was involved in at least one attempt at exchanging old currency on behalf of Naik in Ramanagar district.

---

&gt; * Prior to his death on December 7, driver K C Ramesh (30) had written a 12-page note stating that his boss, KAS officer L Bhima Naik, helped launder money for former BJP leader Gali Janardhan Reddy, who is accused of illegal mining, and his associate B Sriramulu, BJP MP from Bellary, for the wedding of Reddys daughter in November.

&gt; * The police found that Naik, who is under arrest, travelled to Ramanagar district bordering Bengaluru on November 17 with Ramesh to meet Rameshs friend Suresh Kumar, a driver for the Ramanagar district collector, who claimed to have contacts for the exchange of the Rs 50 lakh that was in Naiks possession.

&gt; * An exchange was arranged, a source said.

&gt; * A cricket betting and gambling operator from Bengaluru and a BJP leader from Bellary have emerged as being associated with Naiks activities, and investigations are on about their roles in the money exchange racket and suicide of the driver, sources said.

---



Here are some other news items:^credits ^to ^u-sr33

&gt; * [PM Modi on demonetisation: Bear pain for 50 days, then punish me](http://indianexpress.com/article/india/india-news-india/demonetisation-of-rs-500-rs-1000-notes-pm-modi-bear-pain-for-50-days-then-punish-me-4373933/)

---

^I'm ^a ^bot ^| ^OP ^can ^reply ^with ^""delete"" ^to ^remove ^| [^Message ^Creator](http://www.reddit.com/message/compose/?to=sallurocks) ^| [^Source](https://github.com/hunkdivine/samacharbot2) ^| ^Did ^I ^just ^break? ^See ^how ^you ^can ^help! ^Visit ^the ^source ^and ^check ^out ^the ^Readme",2016-12-17 11:26:07
30,Modi Modi Modi ,2016-12-17 11:28:56
31,"It's completely natural for the media to compare authoritarian leaders with prominent authoritarian leaders in history. The differences in degrees is obvious, but that doesn't just completely invalidate the comparisons.

I've watched a lot of Caspianreport videos, and honestly they're not all that different from what the BBC says in their documentaries and analyses, or what any of the documentaries I listed say. Shirvan seems to focus on history and geopolitics, and tries to be somewhat neutral; that's all. This isn't the only correct way of looking at the world, obviously. I haven't watched the other talk you linked, but I'll take a look soon. However caspianreport doesn't really justify Russian aggression or Putinism in any way.

On the neutrality of Caspianreport, take a look at these videos he made recently: 

[Decline of Putin's Russia](https://www.youtube.com/watch?v=BT4sK36cU3Y)

[Unrest in Kashmir](https://www.youtube.com/watch?v=-P_urGRxJ8M)


[Can India become a superpower?](https://www.youtube.com/watch?v=zXZ4pRhY-kU)

&gt;No sooner did I finish writing this, I stumbled upon this. Lol.

Modi gets a lot of flak over what happened in Gujarat, and a lot of authors naturally compare him to Milosevic or other dictators. It's not really that far off from comparisons people make between Trump and other populist authoritarian leaders, or Islamists and the Nazis. I don't see the point in just dismissing these comparisons when people have justifiable reasons for making them.

&gt;the Russians clearly mention that a Ukraine under NATO would have made Russia indefensible. 

But that's the Russian version of events. They portray themselves as victims of NATO aggression. How has NATO actually been a threat to Russia ? But Russia has infringed on the sovereignty of other nations multiple times. Putin doesn't particularly care about these things.

&gt;just bald face lies or misleads by stating that Ukraine was not a member of NATO

It's not a lie though. Ukraine isn't a member of NATO. Now of course they would want to become a member, why wouldn't they ? Getting article 5 protection is something a lot of countries might want.

&gt;nation are just imperialistic, nationalist Nazis while they themselves are pure as snow.

Nobody is anywhere making the claim that the US is pure as snow. America has a lot of freedom given to media, and much of the information you get that's critical of the West is from America. With Russia there simply isn't freedom of media, and being excessively critical of the govt can get you killed.

&gt;snide accusations of how Putin is just a judo thug

I don't think that's what they tried at all. They were very respectful towards that approach to geopolitics. They did that in Maskirovka too - in fact quite a few western commenters in the podcast admired this russian strategy.

&gt;I advise that we study yoga then perhaps we would not be taken by surprise by Modi's next moves.

Judo and yoga aren't really comparable though. I think you're being unfairly dismissive of the BBC for whatever reason and not even giving them a chance. Maybe you have your own personal biases against them.",2016-12-17 11:29:52
32,"I think you have a conception of media that is very different from what the media is actually like in the West, and consequently how media is in most parts of the world.

I'd imagine you'd think newsreading like Doordarshan is ideal. The problem is that's simply not how media behaves nowadays. Newsreading itself has a lot of problems and is often just a govt mouthpiece (CCTV of china is this way too, much like how DD often is).

The Media has no compulsion whatsoever to reflect public opinion if the don't agree with it, and they have every right to present their own opinions.

&gt;These news sources are all on the fringe (sans BBC). When was the last time Vox or Slate or Vice got an interview or inside access from a leading Congressman or a President?

Vice regularly has interviews with US politicians. They've had a recent interview with Obama.

&gt;There's a very well known quid pro quo media houses have with the US government

Perhaps. The point is the western model (not just America) lends itself to a media that is a lot more free than India, Russia or China. 

&gt;Why exactly wouldn't Muslims support Modi at this point?

It's not necessarily Modi himself, but the hindutva organizations that lean towards the far-right that support the BJP. The Sangh Parivar is widely seen as anti-muslim, anti-christian, misogynistic, anti-left, anti-West and anti-intellectual. So anybody from these groups sympathizing with them strikes me as odd. The beef drama alone should be enough for muslims to think twice before supporting them. Which is the case actually most of the time. Muslims in India have always tended to support the most viable anti-BJP party, and with good reason.

&gt;In the US, I mean, for one NRIs are pretty socially conservative. 

Yep they are. African americans are quite socially conservative too, as are hispanics. Being a minority tends to override all that though, except for people who think they are somehow shielded from majoritarianism.

&gt;I don't really think you can even compare Muslims supporting BJP and NRIs supporting Republicans to Jews and women support Hitler and Salafists.

&gt;I don't think it's absurd a high income bunch of professionals want to support candidates who want to lower their taxes and make running their small businesses easier. 

It's not an equivalence of course; but the idea of a minority thinking that they are somehow shielded from toxic political forces is common. This is a very common delusion that goes back centuries. The Russian aristocracy going up to the Tsars had people who thought they would be somehow immune to the far-left.

&gt; I don't think it's absurd a high income bunch of professionals want to support candidates who want to lower their taxes and make running their small businesses easier. 

It's not absurd - it's just incredibly selfish. The world today promotes ruthless individualism so it's not too far fetched. However I do think only a minority of Indian-Americans feel this way.
",2016-12-17 11:44:18
