,article,article_date
110,"&gt; All this so that Modi can continue sucking the dick of Mukesh Ambani.

Mods, please tell me how comments like these add to the quality of discussion on this subreddit. You would delete reposts, posts with editorialized titles, posts that are in Hindi, but not this. ",2014-10-30 14:18:33
111,"No I didn't, but the whole premise of your post is look BJP is doing something much more than Congress . You're right and BJP is getting a lot less slack. But that's because this is reddit and people are here anti Hindu anti RSS which tanslates into anti BJP. But there is a whole world outside reddit. Where nothing changes. 

When Kejriwel says sab mile hue hain, he is right. Arun Shourie said it himself. The reality is Modi or Sonia both are going to support various black money channels. Both are equally corrupt in this aspect. Why would either raid builders?",2014-10-30 14:20:01
112,"So, we weren't being paranoid when we thought this is the kind of heavy handedness and goondagiri we'd see when Modi got elected and gave free reign to his MPs. ""Development"" on one side and barbarism on the other. The worst side of this debacle we'll get to witness personally (or not) is the silent downvoting of this content by rabid-Modists.

&gt;A number of gram sabhas, powerful bodies under the provisions of Panchayati Raj Act, adopted resolutions under section 129 (G) of State Panchayati Raj Act, banning ""non-Hindu religious propaganda, prayers and speeches in villages"".

So, people who cry pseudo-secularism aren't so secular themselves? I wonder why they'd complain of pseudo-secularism in the first place, then. Finger-pointing is a fun game to play.",2014-10-30 14:23:12
113,"&gt;Despite India’s poor track record in sustaining low-cost computing devices such as the Simputer handheld and Aakash tablet, the Narendra Modi-led National Democratic Alliance government is taking another shot at introducing such a device.

Whatever happened to minimum government?",2014-10-30 14:28:55
114,"[**@timesnow**](https://twitter.com/timesnow):
&gt;[2014-10-30 09:08:18 UTC](https://twitter.com/timesnow/status/527748821036457984)

&gt;Shahi Imam announces son as successor, invites Pak PM Nawaz Sharif for anointment ceremony. No invite sent to PM Modi [#AntiIndiaInvite](https://twitter.com/search?q=%23AntiIndiaInvite)

----

[^[Mistake?]](http://www.reddit.com/message/compose/?to=TweetPoster&amp;subject=Error%20Report&amp;message=http://reddit.com/2krlnu%0A%0APlease leave above link unaltered.)
[^[Suggestion]](http://www.reddit.com/message/compose/?to=TweetPoster&amp;subject=Suggestion)
[^[FAQ]](http://np.reddit.com/r/TweetPoster/comments/13relk/)
[^[Code]](https://github.com/buttscicles/TweetPoster)
[^[Issues]](https://github.com/buttscicles/TweetPoster/issues)
",2014-10-30 14:46:57
115,"Asking a question is now rambling? Seriously, why don't you answer this simple, logical question?

UPA in power . UPA raises gas prices &gt; Minister protests &gt; Sonia replaces him &gt; UPA raises gas prices &gt; AK blames Modi.

Please tell me, how does Modi fit into this train? ",2014-10-30 15:00:50
116,haha hypocrites..where were you when Modi and gang was criticizing UPA for same things ?,2014-10-30 15:06:29
117,And Prime Minister Modi. And Ramdev. And RSS. And LK Advani. And S Gurumurthy. ,2014-10-30 15:07:13
118,"Because r/india's only subject is Modi-bashing?

I know your kind well. If there were no retarded statements you'd attack him for 2002. Or Ishrat Jehan. Or Ram Mandir. Or the color of his vest.",2014-10-30 15:08:36
119,"&gt; However, Bukhari has failed to invite his own Prime Minister, Narendra Modi, to the event. Though, he has sent out invites to several ministers, including Rajnath Singh and Dr Harsh Vardhan.

&gt; http://zeenews.india.com/news/india/shahi-imam-invites-nawaz-sharif-but-leaves-out-pm-narendra-modi-for-sons-anointment_1491523.html

Probably still clinging on to the 2002 riots. ",2014-10-30 15:09:49
120,And it continues. The Modi-fication of the country. Seems like we are moving in a backward direction while the rest of the world is moving forward.,2014-10-30 15:10:10
121,"how about Modi starting from his own home ? less lavish life, less designer clothing, less spending on PR ? you may see it as blatant criticism, but I have got a point here.",2014-10-30 15:11:17
122,I note that the ones lambasting the Modi govt for not controlling price rise have shut up these days or switched to other issues to bash him over.,2014-10-30 15:13:14
123,"&gt;The Union Ministry of Human Resource Development (HRD) has forwarded a letter from a Madhya Pradesh based ‘swayamsevak’ to the directors of all 16 Indian Institutes of Technology (IITs). The letter from SSK Jain, a grain trader from Katni in MP, is addressed to HRD Minister Smriti Irani, with copies marked to Prime Minister Narendra Modi and BJP president Amit Shah. He accuses IITs of giving “kusanskar” or **""bad culture of the West to students through food.""**

Chow mein reloaded!",2014-10-30 15:17:17
124,"&gt; whole govt. = Modi? 

It's Modi sarkar, not BJP or anything else.

Hell, he was the face of the elections in maharashtra and haryana as well. ",2014-10-30 15:19:17
125,"Here, best I can do on short notice:

[Interest in Supreme Court as a search term over time is stable except for early 2013.](https://www.google.co.in/trends/explore#q=%22Supreme%20Court%22&amp;geo=IN&amp;gprop=news&amp;cmpt=q)

Unless you have a better source of data or transformation which compiles all comments by the SC, I'll assume that there is substance to the assertion that this is an observer bias issue.


Also as mentioned to another user - while management may have changed, the GoI is still the entity in the docket. So it's not modi who is being pulled up. It's the GoI.

",2014-10-30 15:20:53
126,He did admit that in Times Now. He said Gujrat Muslims have not forgiven Modi.,2014-10-30 15:27:48
127,What u-turn. I don't think modi ever thought of stopping it. Heck he probably make sure it was successful.,2014-10-30 15:39:04
128,"&gt; UPA in power . UPA raises gas prices &gt; Minister protests &gt; Sonia replaces him &gt; UPA raises gas prices &gt; **AK blames Modi**.

Actually, AAP blamed Congress multiple times. One example

[On gas pricing, Congress ka haath Ambani ke saath, says AAP](http://firstbiz.firstpost.com/elections/on-gas-pricing-congress-ka-haath-ambani-ke-saath-says-aap-80726.html)

In fact, he even filed a [FIR against Veerapa Moily](http://zeenews.india.com/news/nation/gas-pricing-aap-govt-books-moily-deora-mukesh-ambani-congress-open-to-probe_910544.html) (Minister of Petroleum and Natural Gas Minister of Corporate Affairs from the UPA) for the gas price hike. The picture where Modi comes into play is after he got hold a letter from GPSC (Gujarat PSU) to the Central Government on a steep gas price hike. It was a transitional period in India's political space and Kejriwal was merely questioning the silence of the next Prime Minister of India on the gas price hike in context of the letter. I think it is fair game.
",2014-10-30 15:41:43
129,"Bullshit, most people here will call for a coup if Modi even holds the fork with the wrong hand",2014-10-30 15:51:05
130,"Jaitley and others keep on saying UPA gave amnesty to 100 people. That's a lie. I agree with you for the rest. About SIT, Modi is falsely taking credit. Supreme Court ordered it.

http://www.business-standard.com/article/current-affairs/cabinet-obeys-sc-order-for-sit-to-probe-black-money-114052701740_1.html

btw, MB Shah who heads SIT gave several clean chits to modi. Won't be surprised this time.",2014-10-30 15:56:10
131,"&gt; did not launch investigation against anyone

sorry for making another comment. 

MMS was not as good as Modi in marketing.  A quick search landed me to this marketing page from UPA : http://www.upagovt.com/2014/01/efforts-of-government-in-tackling-black.html

Only if MMS had a PR agency :(

http://indiatoday.intoday.in/story/black-money-upa-pranab-mukherjee/1/156829.html",2014-10-30 16:03:52
132,"Or in the case of /r/India about 1 election.


Sep 27, 2013  [Modi questions validity of Aadhar card project](http://www.niticentral.com/2013/09/27/modi-questions-validity-in-aadhar-card-project-138250.html)

March 21, 2014 [Aadhaar a 'fraud', will review it if voted to power: BJP](http://timesofindia.indiatimes.com/news/Aadhaar-a-fraud-will-review-it-if-voted-to-power-BJP/articleshow/31864188.cms)


March 13, 2014 [Ananth Kumar : 'Nilekani shouldn't be proud, but ashamed of Aadhar programme'](http://www.rediff.com/news/interview/ls-election-nilekani-shouldnt-be-proud-but-ashamed-of-aadhar-programme/20140313.htm)

March 29, 2014 [We'll throw Aadhaar into the dustbin: H N Ananth Kumar](http://www.business-standard.com/article/elections-2014/we-ll-throw-aadhaar-into-the-dustbin-h-n-ananth-kumar-114032800298_1.html)

April 9, 2014 [Narendra Modi seeks to connect to IT crowd, attacks Aadhar](http://indiatoday.intoday.in/story/narendra-modi-seeks-to-connect-to-it-crowd-attacks-aadhar/1/353632.html)

",2014-10-30 16:04:47
133,"&gt; About SIT, Modi is falsely taking credit. Supreme Court ordered it.

Ok, but he did form it and that's all they are saying. How is it falsely taking credit?

&gt;btw, MB Shah who heads SIT gave several clean chits to modi. Won't be surprised this time.

Why would you trash an otherwise reasonable comment with a totally baseless, Yugpurush-level conpiracy theory like that?

",2014-10-30 16:16:16
134,"As I said, if you blame liberals for everything bad, care to give them credit for good things. We are now largest consumers in various sectors.. where this consumption capacity came from ? do you know what was India's position in 50 years ago and what is it now? aren't modi just felt proud of MOM ? aren't we are a military superpower ? if you are blaming them for everything bad, I would love to see good words from you for good things.",2014-10-30 16:18:24
135,"My question is why the minions and not Sonia? In the same context he should have been questioning the MD of the GPSC and not Modi.

So in one case he questions the Minister, leaves Sonia. While Sonia was the one responsible for everything. In the other he attacks Modi.

Also keep in mind the GPSC is a profit oriented organisation and is independent. It will do what it should to maximise profits. How exactly is this suddenly Modi's stance?

For the n'th time, why did he not ask Sonia why the prices were raised, why ministers were fired etc etc?",2014-10-30 16:20:04
136,"&gt; Ok, but he did form it and that's all they are saying. How is it falsely taking credit?


SC ordered it , he couldn't defy SC order. 

&gt; totally baseless

there is a reason I don't like despite their honest intentions.
Here we go :

http://www.niticentral.com/2012/10/03/mb-shah-commission-gives-clean-chit-to-modi-11057.html

http://www.bilkulonline.com/gujarat-news/political/970-pucl-boycotts-mb-shah-enquiry-commission-calls-it-modi-bachao-and-a-farce-drama-expects-no-justice-or-truth-to-come-out-in-its-report

http://www.ndtv.com/article/india/shah-panel-gives-clean-chit-to-narendra-modi-s-govt-in-land-allotment-cases-275218

http://articles.economictimes.indiatimes.com/2013-09-30/news/42536882_1_congress-mla-1-47-crore-narendra-modi",2014-10-30 16:22:14
137,modi pls do the needful,2014-10-30 16:24:32
138,"My problem isn't with people who hate Modi, but with people who can't appreciate or stand any good news coming from BJP gov. It's okay to have personal feelings, but the greater good comes first. Take a look at trade, gdp, inflation, jobs ... good news is coming from all quarters. But all you see on rIndia is cheap talk about ""black money"", insinuations about ""riots"", lindoos and vegetarians.",2014-10-30 16:35:08
139,"&gt; My question is why the minions and not Sonia?

The ""Minister of Petroleum and Natural Gas Minister of Corporate Affairs from the UPA"" is not a minion to file an FIR against. It is the ministry who takes a decision and hence the FIR. Meanwhile, the Modi government has clipped the wings of the Delhi ACB (which was the primary investigation agency). May I ask why?

&gt; In the same context he should have been questioning the MD of the GPSC and not Modi.

You are mentioning two very contradictory points. The MD of gas price hike is not Sonia but you want him to question Sonia. OTOH, you want the MD of GPSC to be questioned.

&gt; Also keep in mind the GPSC is a profit oriented organisation and is independent. It will do what it should to maximise profits. How exactly is this suddenly Modi's stance?

The Gujarat government has 95% equity in GPSC. More than 2/3rds of the BoG in GPSC are either serving or served members of the Gujarat government. The CAG indicted the Gujarat government to give undue favors to GSPC. Kejriwal merely raised a question based on these three facts. Just like you are raising questions on Kejriwal - it is fair game to raise important questions like gas price hike.

&gt; For the n'th time, why did he not ask Sonia why the prices were raised, why ministers were fired etc etc?

In that case, you have not watched news channels. AAP has lambasted the Congress on the firing of the ministers on TV news debate. Every time this gas price hike came in - they said talked about Jairam Ramesh and Anand Sharma. 

You want them to target Sonia Gandhi. Why? Sonia Gandhi is not the government just like Amit Shah is not the government. AAP talks about the government. In other cases, you say don't shoot off before having any proof. In case of gas price hike, the appropriate person is the Head of the Oil Ministry. They clearly have stated that Congress are hand in-glove with the Ambanis. AAP has also repeatedly cited the Radia tapes - *Congress toh humor dukaan hai.* 

TL;DR - You can not use AAP's shoulder to shoot on Sonia Gandhi. Your likes, dislikes aside. This calling out specific names will never end - Why does Modi not call out Ambani? Why does Modi not call out X or Y?

**Edit** - Before you argue Kejriwal NEVER calls out Sonia, here a link

[Kejriwal attacks, Sonia defends; Why is Robert Vadra silent?](http://ibnlive.in.com/news/kejriwal-attacks-sonia-defends-why-is-robert-vadra-silent/298321-37-64.html)

[Kejriwal questions Modi wave, attacks Sonia](http://www.indiatvnews.com/politics/national/kejriwal-questions-modi-wave-attacks-sonia--16194.html?page=3)

[Sonia, Rahul ignored Amethi: Arvind Kejriwal](http://kejriwalexclusive.com/sonia-rahul-ignored-amethi-arvind-kejriwal/)



",2014-10-30 16:37:59
140,"correct me, weren't there news reports how Srilanka govt respects Modi and released fishermen back in May ? ",2014-10-30 16:41:26
141,"A perfect example of retarded comments by fanboys which put people off. 

I voted for Modi, I support BJP on most issues but I don't blindly support them like some people here.",2014-10-30 16:47:01
142,"&gt;You are mentioning two very contradictory points. The MD of gas price hike is not Sonia but you want him to question Sonia. OTOH, you want the MD of GPSC to be questioned.

I think you got it wrong, let me break it down.

If AK questions Moily = He should question the MD of GPSC
If AK questions Sonia = He should question Modi (which is still asinine considering he wasn't even in power and had nothing to do with the hike).

Why did AK question Moily and leave Sonia, but question Modi and not the MD?

&gt;The Gujarat government has 95% equity in GPSC. More than 2/3rds of the BoG in GPSC are either serving or served members of the Gujarat government. The CAG indicted the Gujarat government to give undue favors to GSPC. Kejriwal merely raised a question based on these three facts. Just like you are raising questions on Kejriwal - it is fair game to raise important questions like gas price hike.

It still does not take away from my point. It is an org that seeks to maximise profits (that is the Modi model of reviving moribund PSU's). It is not Gujarat state policy.

&gt;In that case, you have not watched news channels. AAP has lambasted the Congress on the firing of the ministers on TV news debate. Every time this gas price hike came in - they said talked about Jairam Ramesh and Anand Sharma.

Again, Jairam, Anand Sharma, Congress but no Sonia...why? If AK had questioned, attacked the BJP and not Modi, it makes sense. Why did AK campaign against Modi in Varanasi and not Amethi against Sonia? 

&gt;You want them to target Sonia Gandhi. Why? Sonia Gandhi is not the government just like Amit Shah is not the government. AAP talks about the government. In other cases, you say don't shoot off before having any proof. In case of gas price hike, the appropriate person is the Head of the Oil Ministry. They clearly have stated that Congress are hand in-glove with the Ambanis. AAP has also repeatedly cited the Radia tapes - Congress toh humor dukaan hai.

Do you really believe in this shit? You must be the ONLY guy in India who believes in this crap. Sonia ran the UPA, and only a fool (not insulting you, using it as a figure of speech) would say otherwise. Only Sonia had the power to change cabinet ministers, and the whole fucking world knew about this. Your argument is disingenuous at best.

Saar, what is the date of that link? During the entire campaign, IIRC he issued some 200 tweets against Modi, ZERO against Sonia. Care to explain why?",2014-10-30 16:47:52
143,"You be the better person, ask you camp to stop creating ruckus on puny issues and see if it brings any changes. Maybe opposite camp starts paying necessary attention to genuine concerns since they do not have to defend Modi/BJP on puny ones.  
You follow Gandhian philosophy so be the change you want to see. ",2014-10-30 16:52:53
144,"I don't think this discussion is going anywhere. One one had you say Sonia run the government on the other hand you say Modi had nothing to do with GPSC. 

&gt; It still does not take away from my point. It is an org that seeks to maximise profits (that is the Modi model of reviving moribund PSU's). It is not Gujarat state policy.

The state policy which CAG indicted for giving undue favors. You can't have plausible deniability with Modi and with Sonia connect the dots. Select one and use it for both.

I have a simple question - if your argument is should he blame Sonia (let me accept it), should he then have proof before he blames Sonia or is it just ok to blame Sonia with conjecture?

",2014-10-30 16:55:07
145,[Subramanian Swamy 'appoints' Narendra Modi as a Brahmin on Twitter 'through authority vested in him'](http://ibnlive.in.com/news/subramanian-swamy-appoints-narendra-modi-as-a-brahmin-on-twitter-through-authority-vested-in-him-sparks-off-controversy/470725-37-64.html),2014-10-30 17:00:28
146,"&gt;Once you question on morals - they are independent of past positions.

How does that make sense or even matter? Even Modi left his post as Gujarat CM to become Indian PM and Gujaratis encouraged him for it. The people who elected Harshvardhan and those who elected Modi were happy with their decision. Harshvardhan has been in the assembly since 1993, Modi has been CM since 2001. They both deserved the promotion. Can you say the same for Kejriwal?

&gt;You can blame Kejriwal for resigning as the CM but you can't blame him for what followed after it - the blame lies with the parties who want to keep it chaotic for political point scoring.

Imagine if you keep your money in a safe, appoint a guard outside. If the guard abandons his post, leaves the safe opened and some thieves steal all your money, who is more at fault here? The thieves or the guard? You'll obviously blame the guard you appointed, even accuse him of being their accomplice. And no, I don't mean BJP-Congress are thieves, it's just an analogy going by the standards you've set for them.",2014-10-30 17:05:32
147,"&gt;I don't think this discussion is going anywhere. One one had you say Sonia run the government on the other hand you say Modi had nothing to do with GPSC

Modi's way of functioning is not the same as Sonia's. Modi is known to give his bureaucrats a free hand while Sonia controls EVERYTHING in her government.

&gt;The state policy which CAG indicted for giving undue favors. You can't have plausible deniability with Modi and with Sonia connect the dots. Select one and use it for both.

How exactly is the GPSC showing undue favours? It is a profit seeking org, and asked for a price rise. Technically the money will come back to the public as these are after all PSU's.

&gt;I have a simple question - if your argument is should he blame Sonia (let me accept it), should he then have proof before he blames Sonia or is it just ok to blame Sonia with conjecture?

My argument is very simple, be it gas price or corruption or crony capitalism, he went hammer and tongs at Modi. 

* He went on ""inspection tours"" to Gujarat but not Amethi. 

* The real head of the UPA for 10 years was SOnia, the real target should have been Sonia. Why did he after the initial Vadra rush (in 2012) ignore Sonia altogether? 

* Why 200 or whatever number of Tweets targetting Modi and zero on Sonia. 

* Why the sudden switch to ""communalism is the greatest threat"" despite the UPA running THE most corrupt government in India history. Why did the anti corruption crusader not hit the most corrupt government in our history?",2014-10-30 17:06:03
148,so did I say anything wrong that he had already given several clean chits to Modi ? I substantiated my claim with valid source. You seem to be obsessed with your ideology and unwilling to accept anything. I can't help. ,2014-10-30 17:07:50
149,"Modi making U-Turn on several thing that he blatantly opposed when he was in opposition. How does this make puny ? Was Modi too puny ? I think they are following every policy of old govt which they opposed, nrega, aadhar, any , you name it.",2014-10-30 17:09:41
150,"No, your claim was not just that he had already given several clean chits to Modi. You were insinuating that he is biased towards Modi. None of your sources substantiate that.",2014-10-30 17:10:14
151,"I said

&gt; MB Shah who heads SIT gave several clean chits to modi. Won't be surprised this time.


I stand for my argument. Why the person, who has record of giving clean chits is appointed again ? And his clean chits in land grab got opposition from locals too (as one link above points out). Had it been any other person with no record of working with Modi , I would not have doubted intentions. ",2014-10-30 17:13:22
152,"Yah ..important issues, sad they get lost in useless "" why PR is so imporatant for Modi"" posts.

I would reevaluate them after their tenure is completed.  Compare them with tenures of other government.  If I see improvement, I would vote for them again. 
How many U-turns he makes is not of that much importance to me. Everybody does that.  
You and I know India’s current economic growth per year. If the percentage increase in economy grows up along with percentage decrease in poverty(along with other evaluating indicators), I would give them my vote again. 
Whether they implemented aadhar or sudhar to get the desired result is of minuscule importance.

Congress had their 10 years, how great their policies were does not transform into what they have achieved. 

",2014-10-30 17:29:52
153,"&gt; How many U-turns he makes is not of that much importance to me

If you are opposing one thing in opposition and practicing same in power, it shows nothing but how much you care of national interest. In either case, (in opposition, or in power) you are not giving importance to national interest. (for sake of power, may be). So, this matters to me. I like people who are man of their words. Not someone, who can't be trusted for his words, for what he is saying, because you know, he may be a totally different person tomorrow. 

&gt;Congress had their 10 years, how great their policies were does not transform into what they have achieved.

What was India's position in 2005 in world economy and what it was in 2014. Would you google it for me ? Congress had educated , literate and people with global exposure. That helped indeed. Sad, they are bad in marketing. 

Edit :
Modi touts about development in Gujarat. Going by standards you mentioned how it made any progress ? Did poverty decreased there ? or education / health care improved ?",2014-10-30 17:33:46
154,"&gt; Why would either raid builders?

[This happened after a month of Modi being sworn in actually. ](http://www.dnaindia.com/india/report-it-raids-expose-gujarat-as-home-to-black-money-1558995)",2014-10-30 17:34:16
155,"The **day after** Modi was sworn in, they constituted the SIT. The UPA had let it sit (no pun intended) for a couple of years. You *don't* see a difference? ",2014-10-30 17:39:31
156,"Don`t think so. Just imagine if Modi was Muslim and BJP was a Muslim nationalist Party. All this support for development and Modi would have vanished in thin air. 
BJP govt so far has continued mostly same policies that they criticized, when they were in opposition. Fans have found new justifications because they need to stop their cognitive dissonance. BJP is just UPA 3.0 version but with Saffron interface. 

",2014-10-30 17:47:07
157,Modi is three and four-star hotel agent.,2014-10-30 17:58:24
158,"&gt; ""Disgraceful that Govt is ignoring the martyrdom of our only Prime Minister who was killed in office in the line of duty. Oct 31 forgotten?"", Tharoor tweeted.


&gt; The Modi government has declared 31 October as ""Rashtriya Ekta Diwas"" (National Unity Day) to mark the birth anniversary of country's first home minister Sardar Vallabhbhai Patel.",2014-10-30 18:04:21
159,Modi didn't tweet or remember Bhagat Singh either IIRC very recently on his (Bhagat Singh's ) bday. ,2014-10-30 18:19:39
