,article,article_date
330,"^This ^article ^is ^adblocker ^unfriendly, ^following ^is ^the ^text ^of ^the ^article. 

 ______ 
**Denying Nehru his due** 

 ______ 
Written by

Ashutosh Varshney

|

Updated: February 14, 2018 9:01 am

If Modi is able to give the gift of a swachch Bharat (clean India) to Gandhi
on his 150th birthday in 2019, as he promised from the Red Fort in 2014, he
will be called the architect of swachch Bharat, though thousands of his
colleagues have worked on the project. Leadership matters. (Express Photo by
Tashi Tobgyal)

In his widely noted parliament speech on February 7, Prime Minister Narendra
Modi made the following claim about India’s democracy. “India did not get
democracy due to Pandit Nehru, as Congress wants us to believe. Please look at
our rich history. There are many examples of rich democratic traditions that
date back centuries ago. Democracy is integral to this nation and is in our
culture.” Modi called attention to the ancient Indian polities, especially
those inspired by the Buddh paramapara (Buddhist tradition). He concluded that
“loktantra hamaari ragon mein hai” (democracy is in our blood).

How valid are these claims? Two analytically distinguishable issues require
discussion. Were ancient Indian polities democratic, democracy thus
representing India’s enduring culture? And what was Nehru’s role in
institutionalising democracy?

To answer these questions, we need to start with a conceptual question: What
is democracy? For at least two and a half centuries scholars have debated
democracy. Two conceptions of democracy have emerged: A narrower concept, and
a broader one.

The narrower concept is purely electoral. It focuses on (a) contestation and
(b) participation. The first means the capacity of political parties freely to
contest the incumbent government in elections. The second points to adult
universal franchise. The right to vote should not depend on caste, creed,
race, ethnicity, income, gender or religion.

The broader notion of democracy goes beyond elections. It also speaks of
politics between elections. Special note is taken of three freedoms — freedom
of speech, freedom of religious practice, and freedom of association — without
which everyday politics can become authoritarian, despite free elections.

In what sense were ancient Indian polities democratic? Did they satisfy the
narrow conception, let alone the broader one? Did they have elected
governments? How widespread was the franchise? One can indeed find polities in
ancient India where kings bound themselves to assemblies and debates. But
kings were unelected, and very few subjects had the privilege of participating
in political debates.

That there was discussion and debate (charchaa and vichaar vimarsh, as Modi
put it) in several ancient Indian polities is beyond doubt, but democracy goes
beyond such constrained contestation. Some scholars have used terms like
“oligarchies” for systems that encouraged limited assembly and debate, but
didn’t have elected governments or broad citizen participation.

The “democracies” of the ancient city-states of Greece also had this problem.
While going quite far towards popular constraints on governments, they
excluded women and slaves from their assemblies.

Indeed, as late as the 19th century, the idea that everyone should have the
right to political participation had few takers. Europe accorded the right to
vote on the basis of property, education and gender, for it was believed that
only the propertied and educated men had the rational capacities to vote.
Women and the poor did not. Nineteenth century democracy satisfied only one
half of the narrower concept of democracy: Contestation. Universal
participation was an anathema.

Consider, also, the claims of John Stuart Mill, arguably the father of modern
liberalism. In the 1860s, he wrote that (a) for their political enhancement,
the Scots and Welsh in Britain required England’s tutelage, and the Basques
and Bretons in France would benefit from Parisian cultural tuitions, and (b)
while white British colonies deserved democratic government, non-white
colonies did not. As Uday Singh Mehta argues in Liberalism and Empire, Mill
viewed white colonies as “of similar civilisation to the ruling country,
capable of representative government: Such as the British possessions in
America and Australia”. And non-white colonies included “others, like India
(that) are still at a great distance from that state”. The latter deserved
colonial tutelage, not democracy.

Claims about differential worth of human beings were also present in India,
especially taking the form of the caste system. To talk about India’s ancient
democracies, as Modi did, and ignore the caste system, legitimated by the
Manusmriti dating back to the 2nd century BC, a text that heaps indignities on
the “lower” castes, can’t be called a plausible claim about democracy being
“integral to Indian culture”. Caste inequalities were also in India’s blood.
There is much to be proud of in ancient India, especially its scientific
discoveries such as the decimal system and the heliocentric view of the
planetary system, but democracy was not one of them.

Nehru departed from the old prejudices. He contended that universal franchise,
including poor and rich, educated and uneducated, men and women, upper and
lower castes, was based on the great 20th-century premise that “each person
should be treated as having equal political and social value”. Nehru also
endorsed the broader freedoms: “Civil liberty is not merely for us an airy
doctrine or a pious wish, but something which we consider essential for the
orderly development and progress of the nation”. This was the reason why,
despite admiring the Soviet Union for its economic achievements in the 1930s
and 1940s, he would claim that “Communism, for all its triumphs in many
fields, crushes the free spirit of man”.

Modi is right to say that Nehru alone did not produce India’s democracy. In
the Constituent Assembly, there was no great resistance to the idea of
universal franchise. But Nehru and Ambedkar led the argument about citizen
equality as a foundation for the new polity. Despite his differences with
Ambedkar, Gandhi also believed in such equality, but his life’s energies were
focused on securing India’s freedom, not on the post-Independence constitution
or polity.

Consider an analogy. If Modi is able to give the gift of a swachch Bharat
(clean India) to Gandhi on his 150th birthday in 2019, as he promised from the
Red Fort in 2014, he will be called the architect of swachch Bharat, though
thousands of his colleagues have worked on the project. Leadership matters.

Nehru has a similar relationship with democracy (as does Ambedkar with the
Constitution). Without the first three universal-franchise elections — 1952,
1957, 1962 — under Nehru’s leadership, when democracies were collapsing in
developing countries, it is hard to imagine the institutionalisation of
democracy in India. Ancient polities did not create, or sustain, India’s
post-1947 democracy.

_The writer is director, Centre for Contemporary South Asia, Sol Goldman
Professor of International Studies and the Social Sciences, Watson Institute
for International and Public Affairs, Brown University_

For all the latest Opinion News, download Indian Express App



 ______ 
 ^I ^am ^just ^a ^bot, ^I ^cannot ^reply ^to ^your ^queries. ^Send ^a ^[*modmail*](http://www.reddit.com/message/compose?to=%2Fr%2Findia&amp;subject=Anti+Anti+Ad+Block+Bot) ^if ^you ^have ^any ^queries. ^Please ^provide ^a ^link ^to ^your ^submission. ^We ^would ^not ^be ^able ^to ^help ^you ^without ^a ^link.",2018-02-14 13:40:47
331,"^This ^article ^is ^adblocker ^unfriendly, ^following ^is ^the ^text ^of ^the ^article. 

 ______ 
**Mumbai-Ahmedabad bullet train to start a year earlier, work set to begin in June** 

 ______ 
MUMBAI: Work on the bullet train, one of the

Narendra Modi

government’s signature projects, appears to be moving at high speed.

Civil work on the 508km-long Mumbai-Ahmedabad high-speed rail corridor (MAHSR)
has been fast-tracked to begin in June this year and railway authorities have
advanced the completion deadline to August 15, 2022, from 2023 earlier, to
coincide with 75 years of India’s independence.

An official of the

National High-Speed Rail Corporation Ltd

(

NHSRCL

), which is the implementing body, said, “Geo-technical surveys have already
been done and civil works will begin in June 2018 after we receive the green
signal for the entire corridor.”

Tests have also been carried out beneath the sea bed for the underground
section of the project, which extends from

Bandra-Kurla Complex

(BKC) to Boisar. Of the 21km underground, almost 7km will be beneath the sea.

The project is aimed at reducing travel time between Mumbai and Ahmedabad to
roughly two hours from its present eight-hour duration. The corridor which
falls within the

Western Railway zone

extends from BKC to Sabarmati.

The official said, “Land acquisition is yet to begin but misinformation is
being spread. For example, farmers are worried that soil will be dumped in
their fields and it will make their land untillable. Also, some fear that
access from one side of the train corridor to the other will be blocked.
Maharashtra recently appointed a liaison officer and we hope that misgivings
are resolved to the satisfaction of all.”

In Maharashtra, land acquisition will be needed most in Palghar district.



 ______ 
 ^I ^am ^just ^a ^bot, ^I ^cannot ^reply ^to ^your ^queries. ^Send ^a ^[*modmail*](http://www.reddit.com/message/compose?to=%2Fr%2Findia&amp;subject=Anti+Anti+Ad+Block+Bot) ^if ^you ^have ^any ^queries. ^Please ^provide ^a ^link ^to ^your ^submission. ^We ^would ^not ^be ^able ^to ^help ^you ^without ^a ^link.",2018-02-14 14:42:25
332,"In what world do you group gujarat with up/bihar and compare with bengal?

Up/bihar/bengal are not just geographically contiguous, they also share a lot of culture. 

If you just look at rioting over past century, gujarat has had less violence. With 1947 and 1971 highlighting the problems of gangetic delta. 

But obviously, like a broken record, I'm sure you just want to talk about 2002.

I bet the best argument you'd make is that modi is literally Hitler. 
",2018-02-14 15:09:59
333,"&gt;On 22 October, Modi, in a rally in his native state of Gujarat, termed the Opposition-ruled states as anti-development and said that the ""central government would not dole out a single penny to such states"".


How can he talk like that being the PM.

This guy is a disgrace to his office. ",2018-02-14 15:54:20
334,"^This ^article ^is ^adblocker ^unfriendly, ^following ^is ^the ^text ^of ^the ^article. 

 ______ 
**Why Arvind Kejriwal Hasn't Tweeted The Word 'Modi' In 11 Months** 

 ______ 
Arvind Kejriwal has never tagged PM Modi in any of his tweets in 2017 and 2018
so far. (File photo)

**New Delhi: **

Delhi Chief Minister Arvind Kejriwal, whose government completes three years
in office on Wednesday, is now a quieter person vis-a-vis targeting his bitter
political rival -- Prime Minister Narendra Modi.

Mr Kejriwal, with 13 million followers on Twitter, has not tweeted the word
""Modi"" even once in the past 11 months. His last tweet mentioning PM Modi was
on March 9, 2017. In 2016, he had mentioned ""Modi"" 124 times in his tweets and
33 times in 2017 -- mostly attacking the Prime Minister.

Party leaders and political analysts say the change from tweeting ""Modi
declares emergency in Delhi"", ""dictatorial Modi govt"" and ""Isn't Modi govt
anti-army"" to stopping all mention of PM Modi's name follows AAP's election
losses -- first in Punjab and Goa and then in Delhi civic polls and a by-
election from Rajouri Garden in 2017.

Also, the AAP chief has never tagged PM Modi (@narendramodi) in any of his
tweets in 2017 and 2018 so far. In 2016, he tagged the Prime Minister eight
times.

Mr Kejriwal even refrained from personally attacking the Prime Minister when
tempers between the central government and Delhi government ran high over
disqualification of 20 AAP legislators in January this year. The AAP said its
legislators were disqualified at the behest of the BJP government at the
Centre.

Party leaders and some political analysts said it was more of a strategy than
an accidental quietude.

A senior party leader said the ""conscious decision"" was taken in a meeting
that Mr Kejriwal convened after last year's debacle in Delhi civic polls in
which the AAP emerged a distant second with 48 seats after the BJP swept the
polls by winning 181 seats.

It was a big blow for the AAP that swept the Delhi elections in 2015 by
winning 67 out of 70 Assembly seats.

""It (attacking Modi) was not taking us anywhere and we decided to rather focus
on governance,"" the AAP leader said.

Political analyst Neerja Chowdhury agreed that it ""was a definite change in
(Kejriwal's) strategy"" to stop attacking PM Modi personally. ""It is evident
that the AAP has lost the trust of the middle class and they need to win back
the trust if they have to keep Delhi.""

Praveen Rai, another political analyst with the Centre for Study of Developing
Societies (CSDS), said: ""We have been seeing a much, much more sober Mr
Kejriwal. He is growing as a leader and is becoming a seasoned politician. But
he has a long way to go.""

AAP Chief spokesperson Saurabh Bharadwaj attributed the shift to ""a good
communication system (that) keeps reinventing itself"" and the party follows
that idea.

__ Comments

""Initially people wanted to know why works in Delhi were not being done and we
had to explain to them in the first two years. Now people understand that LG
is not allowing many works and files go through him,"" Mr Bharadwaj said.

He said the strategy of attacking PM Modi and the central government ""served
its purpose"" and there was no need to repeat it.



 ______ 
 ^I ^am ^just ^a ^bot, ^I ^cannot ^reply ^to ^your ^queries. ^Send ^a ^[*modmail*](http://www.reddit.com/message/compose?to=%2Fr%2Findia&amp;subject=Anti+Anti+Ad+Block+Bot) ^if ^you ^have ^any ^queries. ^Please ^provide ^a ^link ^to ^your ^submission. ^We ^would ^not ^be ^able ^to ^help ^you ^without ^a ^link.",2018-02-15 01:45:21
335,"I'd like to say something about 'a real Tanmay Bhat' comment.

You see the entire country suffers with a condition where anyone who's standing behind a screen is seen as someone who has made it or someone who's perfect.

This dramatic over idealization is extremely destructive.
When 'the real Tendulkar' didn't perform in cricket, his effigies were burnt in front of his home. 
Treat them as human beings and not people with supernatural abilities. 

Tanmay is 'just' a comedian, and no one can/should escape criticism. I personally don't think Tanmay would be civil in a discussion or a debate. He would resort down to making fun of his opponent, because that's how his defense works. But I may be wrong, we'll never know.

Tendulkar is 'just' a cricketer, Lata Mangeshkar is 'just' a singer, Amitabh is 'just' an actor and Modi is 'just' the head of the state.
Parameters on what they can and cannot do need to exist. 

Over idealization has led to an entire country believing that their supreme leader doesn't shit.
Now that's pretty messed up.",2018-02-14 16:37:08
336,"Oh god , modi is at it again!!! Clearly it is him conspiring with the movie makers. It has to be him !!! but the bhakts won't see it like always!",2018-02-14 16:58:59
337,"To my friends that I don't hate Modi, I just don't like the way this government is working. I'm not anti-nationalist or some leftist prick I'm just a normal guy with little different opinions than you Modi bhakts.",2018-02-14 17:30:45
338,Gandhi ji aur Nelson Mandela bhi ghar pe nikamme they. Not saying Modi is that great a person. But a person's home life doesn't need to have any bearing on their professional life.,2018-02-14 17:39:13
339,"###Yes. Hail Modi.

Btw http://swasthyasathi.gov.in/",2018-02-14 17:47:49
340,"Pakistan spreads love &amp; peace ? Dude even Pakistanis will call you mad.

Indians despise Pakistan because of it's nature &amp; history. That nation was created om communal grounds which divided India into two parts , many Indians lost their home &amp; property. First decision that newly formed Pakistan made was to wage war with India.Pakistan funded terrorists even when it was at nascent stage. Pakistan treats it's minority like shit. They rape &amp; kill minorities. Can you imagine a PM or President who isn't a muslim in Pakistan ? Pakistan is plotting to destroy India since it's inception.


India didn't bend over , that's it's only mistake. India should have annihilated Pakistan when it had the chance but it didn't, every time Pakistan fucks up , India defends itself, then forgive Pakistan &amp; give them a chance to improve. Even Modi a radical Hindu gave Pakistan a chance to make relations good but he got Pathankot, Uri &amp; several such attacks.

Neither Pakistan nor Islam teaches peace. There are few exceptions , intelligent &amp; peaceful Muslims whom neither Pakistan nor Islamic pundits will call true Muslims.",2018-02-14 17:55:05
341,"The branch or even this bank didn't give any money to the fraudsters. The branch issued 'letter of comfort' which the fraudsters used to avail Buyers Credit (short term credit to pay oversees party) from other banks. 

The money was given by other banks based upon PNB letter which was forged by the branch manager. 

The banks which gave the credit are at risk. For PNB it's currently a contingent liability but they will have to pay up to the other banks ultimately. 

The fraudsters are companies connected to Gitanjai Gems run by Nirav *Modi* (tring tring). 

Let's hope the amount isn't usd1.7bn as right now they have been classified as transactions.",2018-02-14 18:31:45
342,"&gt;Pakistan is a relatively free country, and has had democratic governments in office when then worst of the violence was wreaked on India.

Exactly.. Pak army uses these terrorist attacks to destabilize their government. 

Remember how Nawaz and Modi became close, and all of a sudden Pathankot happened?

 If India and Pakistan leaves behind their dispute, Pak generals will be out of power. They need the hatred. 

When a terrorist attack happens India retaliates, Pak Media says India attacked them without provocation. Common Pakistani gets behind their army.   

And the cycle of hate continues.

Now, am saying India shouldn't retaliate? No, that will make us look weak, which will make separatists confident. A proportionate retaliation is the only thing to do for us.

The whole this hopeless. But I refuse to believe a country as a whole is evil.",2018-02-14 20:09:23
343,"when he lay with his nephews too, that was not something a person can accept as morality(by our standards). Yet he did that, i don't think he was a very astute politician. If he knew politics he wouldn't have refrained from being the first prime minister of independent India. The account of him refusing medicine and of beating his wife are told in his own letters. He does not for instance quote the abandonment of Sita devi by Sri Ram to justify his actions. In a way he is acknowledging he is a man of many flaws. Such action is in sharp contrast to Mr Modi, who clearly will take any alibi/excuse he can get. Showing as he consistently has before that beyond his twitter handles and radio shows he is rarely aware of situation, let alone know how to manage it. My point was simply this, a man who is unable to keep small promises and small commitments(at home), cannot be trusted with bigger things. There are very few exceptions, proving how strong this correlation is.",2018-02-14 20:54:47
344,"^This ^article ^is ^adblocker ^unfriendly, ^following ^is ^the ^text ^of ^the ^article. 

 ______ 
**CBI Gets Complaints Against Nirav Modi From Punjab National Bank** 

 ______ 
Nirav Modi, who's in trouble with Punjab National Bank, founded $2.3 billion
Firestar Diamond

**New Delhi: **

The CBI has received two complaints from the Punjab National Bank (PNB)
against celebrity jeweller Nirav Modi and a jewellery company, linked to a
fraud worth Rs 10,000 crore, news agency Press Trust of India said today
quoting official sources.

The CBI received the bank's complaint late last night, official sources said,
adding that the allegations are being looked into and the course of action
will be decided soon.

It's unclear whether the complaint is linked to the bank's revelation this
morning that it had detected a $1.8 billion (over Rs 11,000 crore) fraud at a
single branch in Mumbai.

India's second-biggest state-run bank said in a regulatory filing to the stock
exchange that it had detected ""fraudulent and unauthorised transactions in one
of its branches in Mumbai for the benefit of a few select account holders with
their apparent connivance"". Based on these transactions, said PNB, ""other
banks appear to have advanced money to these customers abroad"".

Nirav Modi, 48, is being investigated by the CBI, which has

filed a case against him

in connection with fraud worth Rs 280 crore.

On January 29, the Deputy General Manager of a Punjab National Bank branch in
Mumbai, Avineesh Nepalia, complained to the CBI that some officials were
causing a loss to the bank. The bank claimed that two of its officials had
issued Letters of Understanding (LoU) without following procedure and without
making entries in the systems. Eight fraud LoUs amounting to Rs 280 crore were
issued for Hong Kong-based banks.

Nirav Modi was also raided by income tax officials on January 31; his offices
in Delhi, Surat and Jaipur were searched.

Nirav Modi is the founder of $2.3 billion Firestar Diamond and counts among
his clients several world renowned celebrities. He has boutiques across three
continents - in London, New York, Las Vegas, Hawai, Singapore, Beijing and
Macau. In India, Mr Modi has his stores in Mumbai and Delhi.

__ Comments

Mr Modi was named among Forbes' list of India's Richest in 2016, with a net
worth of $ 1.74 billion.

**With inputs from PTI**



 ______ 
 ^I ^am ^just ^a ^bot, ^I ^cannot ^reply ^to ^your ^queries. ^Send ^a ^[*modmail*](http://www.reddit.com/message/compose?to=%2Fr%2Findia&amp;subject=Anti+Anti+Ad+Block+Bot) ^if ^you ^have ^any ^queries. ^Please ^provide ^a ^link ^to ^your ^submission. ^We ^would ^not ^be ^able ^to ^help ^you ^without ^a ^link.",2018-02-14 21:02:51
345,"aur jo ek jo modi hai uske bare mein bhi complain karna hai, kaha karu? 

",2018-02-14 21:32:06
