,article,article_date
0,Gangster Nayeem's encounter was KCR's gift to NaMo. Nayeem was one of the key witnesses of Sohrabuddin's fake encounter case where Amit Shah is/was [citation needed] accused.,2017-04-16 18:59:44
1,NaMo Army wants to discourage critics who usually register dissenting opinions. They see reddit as a repository of zeitgeist that will be referenced in the future when one wants to evaluate their Supremo. ,2017-04-18 16:57:27
2,"BJP has made special 'clubs' in each state to make an inlet to find and nurture future supreme judges which can then be appointed. The last appointment ran into problems due to the same reason. At present they're not dominant but will be in sometime. Its funny that judges are supposed to be neutral and above politics, but the reality is so far from truth.

Edit-Also about Advani, presidency was a perfect ploy to appease Advani for Namo and its quite clear who has benefited from the 'Justice' ",2017-04-19 22:00:29
3,"Lord commander of the night watch - for a Gurkha Watchmen

Cupbearer - for a water Delivery boy

First servent of Lord of light - dudhwala

High septon - tehsil mantri

Master of coin - urjit patel

Master of whisperers - karan johar
Protector of 35 kingdom,
Protector of the realm - NaMo

Hand of the king - Amit Shah


",2017-04-22 08:12:34
4,Yea baby India number one again namo namo,2017-04-22 23:48:00
5,"Arvind Kejriwal said there should be an alliance of good leaders and parties, but as usual Times NaMo is taking his comments out of context.

And OP is in constant search of articles, news which portray AAP in negative shades, so it's a win-win",2017-04-25 11:02:03
6,"*OMMM Jai NaMo Yogi Yogi Namah: |*

*Pleasetrainthemproperly | pleasetrainthemproperly | pleasetrainthemproperly | pleasetrainthemproperly ||
Pleasetrainthemproperly | pleasetrainthemproperly | pleasetrainthemproperly | pleasetrainthemproperly ||
Pleasetrainthemproperly | pleasetrainthemproperly | pleasetrainthemproperly | pleasetrainthemproperly ||
Pleasetrainthemproperly | pleasetrainthemproperly | pleasetrainthemproperly | pleasetrainthemproperly ||
Pleasetrainthemproperly | pleasetrainthemproperly | pleasetrainthemproperly | pleasetrainthemproperly ||* 

OM Jai Yogi-ji Saha-re |

Last thing we need is *even more* chutiya cops with no understanding of their jobs.",2017-04-26 03:29:36
7,"'Grate' is not the same as 'tearing into the flesh.' Namo, I love Hindu Rashtra grate. You know what would make some people 'tear into flesh' I am just saying there is similar stuff that makes Marathis tear into flesh too. Not just vegetarian fundamentalists.

This tearing into flesh business and a willingness to do it should stop. As long as that exists, there is really nothing in pointing outwards while ignoring our own.",2017-04-27 10:39:21
8, Bhakts: Srilankaaaa.....Namo---Namo..,2017-04-27 11:07:53
9,"To be fair, asking Raga to recite the alphabet might cause him to panic and  act like a blithering idiot but yes, the namo interview was kind of a letdown. ",2017-04-27 16:46:47
10,NaMo,2017-04-27 19:59:45
11,Can we have NaMo for an AMA soon given his love for attention ?,2017-04-27 20:35:35
12,So that's what NaMo is: narth mombai..,2017-04-28 21:18:41
13,"They learned from NaMo, the best of the best",2017-04-29 20:37:28
14,"The commonality being the efforts NaMo and CBN put in reach out to the community. Kerala, Karnataka and TN also have a strong non resident community, but simply aren't doing enough to engage them in any meaningful way.",2017-04-30 12:01:12
15,Yes Iam with NaMo,2017-04-30 22:46:50
16,"&gt;sees title

NaMo is both SRK and AK?? TF",2017-05-01 01:31:32
17,"I have no issues on what you brought. I take it more as inefficiency and inexperience of NaMo on handling the case than anything else. Being recently appointed to the CM position(something which initially didn't want to but then said he had to have full authority of being CM than just a deputy-CM) and then in 5 months to face a riot that ripped through his state with no prior hint of the possibility would've been a fumbling point for even [the army as it came a full 2 days late](http://m.ndtv.com/cheat-sheet/2002-gujarat-riots-no-conspiracy-narendra-modi-showed-alacrity-in-calling-the-army-says-court-545818)

Allowing the VHP a free hand was a bad move, but with even police members being reported to have not done anything (a common point used by the oppn parties while in reality police inaction in large scale riots is usually common in India) my guess is that he saw the VHP as a reliable task force. His post-2002 interactions with the VHP have been anything than warm (at times the VHP has even been vocal against Modi) which might stem from a possible regret of allowing the bundhs which the VHP asked for.",2017-05-01 18:46:33
18,"But why would anybody roast someone who works 32 Hours a day and is Certified by UNESCO, UNO, ISI, BIS, NAMO App &amp; Wikileaks as the best PM of the Universe.",2017-05-01 21:21:20
19,NAMO DOESN'T SLEEP. HE WORKS 25 HOURS IN A DAY.,2017-05-01 21:59:38
20,Om namo shivaay 💁,2017-05-01 22:05:39
21,`NaMo` + `DeMo`,2017-05-09 14:34:40
22,"i mean, why those who switched from BJP to AAP didn't take this ""secret"" with them to AAP.

ooh i know why...it's because only NaMO and amit Shah have knowlege on how to hack evm, they personally hack all the evms.
",2017-05-10 06:06:14
23,"https://www.reddit.com/r/india/comments/6a4vyn/aap_demonstrates_how_to_rig_a_vote_machine_evm/dhcrdow/

Amit Shah and NaMo",2017-05-10 06:07:09
24,"Didn't i tell you, namo and amit shah do it personally",2017-05-10 16:48:05
25,"/r/theunkillnetwork material, straight from the fucking prime minister.

We should have seen this coming from a guy who ran his campaign calling himself NaMo.


Name: Narendra Modi

Occupation: Prime Minister

Hobby: Dank ass acronyms",2017-05-10 18:10:11
26,"I dont think your reply really addresses what I said before. Anyway...

Look, I understand that you like Modi and think he has great intentions. You're saying that because he has great intentions, we should atleast treat him with respect and criticize constructively to act as support for our leadership instead of breaking its back.

I am all for respect and support for Indian leadership when its warranted. 

But what if I clearly see that the leadership is manipulating its people by - 
1. Emotionally charged propaganda
2. Lies
3. Artificial surveys on NaMo APP
4. Shameless self promotion

When someone asks for data on DeMo he is denied. Early doubters were hounded and called names by the top leadership.

All this insults the intelligence of every person that voted for him and yet nobody realizes this (which to me is just baffling). It speaks volumes about his ""great intentions"".

With all this going on, how can anyone criticize constructively because even for that, you need access to information which you're being denied?

Its like - you can criticize in mild words but only if you first pledge your undying support to the dear leader. 

NO. I cannot pledge my undying support to anyone. Their actions will define my support and in this case Modi has proven that he doesn't deserve it.
",2017-05-11 19:46:44
27,"&gt;I heard you people are pretty lefty

Yes to legalization. Yes to marriage. Don't care if they want to follow religion, their's or someone else's, it's their choice. First two are basic human rights, so that needs to be fixed asap. Social and religious taboos will only start to fade if we legalize their existence in the country. How Soon? Not for the next decade if NaMo gets a second term. They're beating up/killing people eating mutton just because they think it's beef ffs.",2017-05-11 21:10:12
28,"That's what anyone who wants to survive in Congress will say . Why would Tharoor jeopardize his career by speaking against Buddhu RG ?

Remember how NaMo kept praising and praising Advani JI till he became the PM, and then unceremoniously booted him out of any significant role within the party ? That is how all politicians roll. 



Congress will run itself to the ground with their obsession to the family , and Tharoor is one of the few who'll emerge relatively unscathed from the ruins. ",2017-05-12 13:26:12
29,Watchout! NaMo-minions will downvote this  politically sound article to death!,2017-05-13 18:18:04
