,article,article_date
226,"im no fan of kejriwal. quite the opposite. but why do these jholas throw words like hitler, stalin, holocaust, purge, gulag like they are behenchod, madarchod? modi kills a musquito, he's literally hitler. kejriwal throws out his pals, he's literally stalin.",2015-03-31 18:08:50
227,"This is why we supported Modi: ""bowing"" to pressure is merely deal-making for him.",2015-03-31 18:49:33
228,"Oh, but you can. That's how you score political points. Just like modi made remarks about Delhi's electricity subsidy. This is politics and aap has learnt to play it.Just like Center provides monetary support to states in return for rajya sabha support. That's why they say, have good relations with the Center. More for Delhi since they get no benefit of the finance commission report since they're not a state. Delhi simply doesn't have the money to sustain mcd's profligacy.As aap has already said that if the Center gives them money, they'll bail the mcd out.Also if aap runs Delhi's finances to the ground by giving subsidy or doing wholesale corruption, you're saying you'd want the Center to bail them out?http://www.indiaspend.com/cover-story/delhi-seeking-381-subsidy-rise-complains-about-new-delhi-17837",2015-03-31 19:13:46
229,"It helps in situations like now when the opposition is against every law being proposed only to stop the government from doing any work. 

The opposition believes they can stop Modi for another year till BJP has a majority in RS. By delaying the work till then they will delay development. It will help them in the upcoming elections and the next Lok Sabha elections.

Using ordinances is right by law and considered wrong in spirit. But the behaviour of the opposition is also not in the right spirit. 

You have to appreciate that the govt is trying to have a debate and convince the opposition. They did not directly jump to an ordinance without debating in the parliament. But if opposition is playing cheap politics and not going by the merit of the discussion then all's fair in love and war. ",2015-03-31 20:02:52
230,"Where is Mr. Kejriwal, who said Modi government will increase the gas price to $16. He is an Ambani agent, who is trying to give benefit to him. ",2015-03-31 20:14:51
231,"Pakka 

I thought that too. But I think thanks to modi its now 2L

Bhai sure shot bata de plz",2015-03-31 20:49:40
232,Waiting for AAP supporters to come and claim Modi did it because of Kejriwal's pressure.,2015-03-31 22:14:49
233,They are on mission of reinstalling Rome Raj again in this country. Modi/BJP needs to go aggressive against these news-traders. ,2015-03-31 22:19:57
234,"But Sri Sri Kej-chu Ji said Modi is a Ambani agent and want gas price at $16/mmbtu? 

I am confused onlee. :( ",2015-03-31 22:36:09
235,"Copy-pasting from a self-post i made regarding the BJP controlled MCD throwing thrash on Delhi's roads:

Basically the BJP is trying to play politics here. They are in control of the corrupt MCD who have been in charge for 7 years. They've been swallowing all the funds resulting in no money left to pay the workers. Even the centre is not supporting their own hoping it will result in a bad image for the AAP. They have even curtailed the powers of the Delhi govt. controlled ACB to investigate the MCD.

In fact, they are playing right into Kejriwal/AAP's hands. I love how Kejriwal is handling this. He knows he's in charge for the next 5 years. The MCD/BJP are digging a hole for themselves. They can keep dumping garbage on the street for as long as they like. They seem to forget that AAP is here to stay for the next 5 years.

I love how Kejri is going to keep squeezing their balls till they give in. And then he will take all the credit. LOL, at the BJP strategists (chai-wallahs?) who thought this was such a great idea. They will soon be staring at another ass-pounding in the upcoming MCD elections.

Edit: It is amusing to see the Modi devotees trying to pin this on AAP/Kejriwal. Your whining is in vain. Kejriwal is a shrewd guy. He knows not to let go when he's got someone by the balls. It is going to be fun to see the egg on Modi's face when he finally gives in.

",2015-03-31 22:36:55
236,Only for getting back at Modi. These guys are desperate.,2015-03-31 22:44:01
237,malaysia's gas price is lower than india's. wtf is modi govt. doing,2015-03-31 22:46:50
238,"These so called seculars trying to split our country make my blood boil. I don't understand why Modi treats them with kid gloves. He has clear cut evidence about ndtv and its illegal activities, what is he waiting for? Arrest them ",2015-03-31 22:58:56
239,Stephens is fucking disgrace. Produced some of the worst macaulayputras in this country.They call themselves liberal but are some of the most intolerant people you will meet. Their own principal doesn't giver permission to publish interview he himself gave.Why is the govt giving subsidy to this institute which has quota based on religion? I thought secularism meant separation of state and church. Modi must immediately remove subsidy to such communal institutions. Tbh im a bit disappointed that he hasn't already acted.,2015-03-31 23:04:39
240,"Many prominent journalists, NGOs, activists and other self appointed intelligentsia of the country have staked their careers and reputation and spent the better part of the last 12 years trying to implicate Modi and finish him off politically. Its not like they're going to stop and just give up now. Expect the discourse to turn shriller and for there to be more fear mongering and hysterics in the years to come in an effort to polarize and wean away any voting bloc which doesn't have a strong reason to dislike the BJP and might consider voting for them. BJP and Modi will just have to figure out a smart way to deal with it politically. Comments like ""its a global conspiracy to defame India"" don't help their cause.",2015-03-31 23:05:13
241,"Desperate and dangerous. Once they build a mood in the country, it will be difficult. In today's media whoever flings shit first, wins. Modi must use all those land irregularities involving Congi media against them.",2015-03-31 23:11:30
242,"Thanks dude. People who will keep supporting AAP even when they go exactly against the agendas they fought on, will insure that AAP will never venture out of Delhi. Score for AAP will be worse than 292-4 next time. These are the kind of men BJP needs!

Thanks for being the greatest supporter of Modi. ",2015-03-31 23:23:40
243,This is not about modi. This about framing the narrative for a generation. People part of the mainstream like rega jha are getting to this generation with their skewed narrative and thus making Hindus prisoners in their own country.I just hope modi isn't putting political pragmatism over what is needed for this country. Sometimes I fear the worst. :/,2015-03-31 23:30:39
244,"Ummm.... fellow BJP supporters, let's do remember that [BJP had promised to regularize Delhi's unauthorized colonies too...](http://zeenews.india.com/news/delhi/pm-modi-to-address-over-dozen-rallies-in-delhi-focus-on-unauthorised-colonies_1524779.html)",2015-03-31 23:41:23
245,Epic scale fear mongering. Modi ji should just ignore and keep working. These people are going to look awfully silly in a couple of years.,2015-03-31 23:55:32
246,It's good to see Modi is disappointing people from all over the political spectrum,2015-04-01 00:01:35
247,"**NOTE for those waiting for AAP supporters to come and claim Modi did it because of Kejriwal's pressure:** wait for the day when that gas price increases... even by 2%... they will come out of the woodwork to scream that Modi is an Ambani agent! 

That is how the game is played... ",2015-04-01 00:35:03
248,Modi swach bharat abhigyan ,2015-04-01 01:08:24
249,"Reasons are abundantly explained in this thread.

But in a nutshell it's a combination of

1. Media, intellegentsia and certain sections of the population already made up their mind about the BJP long ago: They just hate it, think the worst of it and cannot ever trust it. They have already formed their conclusions, all they do every day is look for selective observations to reinforce it. 

2. There are vested interests at work. India has a large, well-developed support network for the left-liberal community that spans across political parties, educational institutions, NGOs and media. They all stand to suffer whenever a BJP government is in power anywhere in India, and especially at the Centre. 

For example I have journalist friends who make no bones of the fact that they are hardcore Congress supporters because the Congress party has long been wining and dining journalists, editors and media owners across India, paying for their vacations and junkets etc. and the BJP(especially under Modi, who has a grudge against the media for their coverage of Gujarat under his rule) does not mollycoddle them the same way.",2015-04-01 01:47:10
250,"As a Modi hater, I will say this: there is deliberate media manipulation. You thought Congress and the opposition would just let Modi steamroll over them? They've realized that people are really uncomfortable with communism. They saw how that helped AK whip BJP in Delhi, so they are playing it up.

THAT SAID, you can't deny that Hindutva agenda has given a lot of confidence and courage to some rogue elements inside RSS/VHP to take matters into their own hands. 

Woh kehte hain na, taali ek haath se nahin bajti",2015-04-01 02:31:13
251,"Media? You mean Tehelka and HT who are on Essar payrolls, or ToI which belongs to the highest bidder, or Hindu which won't print anything longer than 2 paras unless it's critical of Modi/BJP/RSS/Right wing/Hinduism, or NDTV which is owned by Congress, or Times NOW which has a smaller attention span than an ADHD cat, ... who do you mean when you say ""media""?",2015-04-01 03:25:37
252,"Their hate of Modi/BJP far exceeds their distaste for AAP. Shows in their reluctance to print the truths about AAP fuckups. Also, obviously, shows in their not publishing these very truths: that AAP is siphoning off Delhi budget to pay its volunteers under the guise of DDC, Mohalla Sabha, Secretaries and various other positions they have opened up in the Capital. Cronyism has never been more plain to see, even in Congress tenures.",2015-04-01 03:31:19
253,"There is doing the right thing and there is winning/losing the perception battle. And right now, Modi is losing the perception battle. As much as it is right that there should be a separation of the state and religion, any attempt to cut this funding or to cut funding for Haj etc. will result in an outcry that he's anti-minorities. 

In the bigger scheme of things, sometimes one has to let go of the smaller battles to win the war. That is called pragmatism. ",2015-04-01 05:26:50
254,And yet you have no problem with the BJP controlled MCD swallowing all its funds and not paying it's workers. Typical hypocritical Modi/BJP supporter.,2015-04-01 07:46:09
255,How about Modi does a ghar wapsi on Jagan.  Also not related I keep thinking about your username.,2015-04-01 08:06:24
256,Fuck. That fellow and his dad were scum. They made so much fuckin money and converted so many people. I remember they wanted to install a big cross at the entrance of Tirupati or something ... Dont remember now. Modi should stay awaaaay from him.,2015-04-01 08:10:34
257,"Honestly AP is irrelevant to BJP now since its just a small state , i am 90 % sure TDP - BJP alliance is over next election  . It is clear to them TDP is dead in telangana and jagan will support anyone who can help in CBI probe .  
  
No wonder TDP affiliated media is doing 24/7 hate news on modi instead of jagan .        
  
",2015-04-01 08:17:07
258,"Basically the BJP is trying to play politics here. They are in control of the corrupt MCD who have been in charge for 7 years. They've been swallowing all the funds resulting in no money left to pay the workers. Even the centre is not supporting their own hoping it will result in a bad image for the AAP. They have even curtailed the powers of the Delhi govt. controlled ACB to investigate the MCD.

In fact, they are playing right into Kejriwal/AAP's hands. I love how Kejriwal is handling this. He knows he's in charge for the next 5 years. The MCD/BJP are digging a hole for themselves. They can keep dumping garbage on the street for as long as they like. They seem to forget that AAP is here to stay for the next 5 years.

I love how Kejri is going to keep squeezing their balls till they give in. And then he will take all the credit. LOL, at the BJP strategists (chai-wallahs?) who thought this was such a great idea. They will soon be staring at another ass-pounding in the upcoming MCD elections.

Edit: It is amusing to see the Modi devotees trying to pin this on AAP/Kejriwal. Your whining is in vain. Kejriwal is a shrewd guy. He knows not to let go when he's got someone by the balls. It is going to be fun to see the egg on Modi's face when he finally gives in.

",2015-04-01 08:31:45
259,"&gt; AAP has only been in power for a month, the mess the MCDs are in for 8 months has been under the rule of the BJP in the MCDs themselves

We have to understand one thing. Legally and for all practical purposes, your party affiliation only matters until election results are announced. Once you get appointed to a position, say PM, it stops mattering which party you're from. You always carry the burden of your predecessor.

And in a way, your predecessor's fuckups are what you based your election plank on to begin with! Modi won the elections saying he'll fix Congress' fuckups. Once elected, he is going about fixing things, not shirking them.

Similarly, AAP won elections saying that they will fix things. Now they have to deliver.

&gt;AAP can't fix 8 months

Nobody put that pressure on them. There are very normal ways and means by which (1) they can simply send one formal request for funds to the Center, and pay salaries, and then (2) let ACB loose on MCD's corruption and weed out all the bad elements. 

(1) is a routine step that every previous Delhi Gov has taken to bridge MCD funding gaps, and

(2) is a something no previous Delhi Gov had taken because they were *not* against corruption. AAP is against corruption, they have fixed a lot of bad elements in traffic police, DJB, and so on, they can easily remove corrupt elements from MCD.",2015-04-01 09:40:46
260,Your comment is ironically funny. You are doing pretty much what the OP is disgusted about. How is your comment related to OP? You bring Modi and BJP into this. Just the other corner of the box. I wait for the day when all Indians care more for the well being of our nation than the well being of a political party or upholding some ridiculous idea of religion.,2015-04-01 10:02:49
261,"I know there is a problem. Unfortunately, its not like the other side has done much better. They have fucked up the MCD to point where its bankrupt, dysfunctional and rife with corruption.

I'm a Modi supporter and I think he is doing a great job but thats about it. Most of the rest of BJP (especially state/local level units) are corrupt goondas just like every other party.

Personally, I would have preferred if instead of AAP winning Delhi elections, they would rather have won municipal elections. I think they would perform much better that level because while they lack the kind of long term economic/strategic thinking which is required to run a state/country, their focus on local issues and low level corruption is exactly what is required at a municipality level.",2015-04-01 10:17:45
262,"&gt; I just hope modi isn't putting political pragmatism over what is needed for this country. Sometimes I fear the worst. :/

Exactly my thoughts too, bro.",2015-04-01 10:17:50
263,"What Modi says

&gt;exhorting them to work with an agenda and highlight achievements through social media and other platforms.

What MSM implies

&gt;Feku

When in reality there was a lot more on the pep talk agenda

&gt;Modi asked the ministers at the meeting, which last almost two hours, to **seek feedback** from the people on government policies and maintain **strict work transparency**.

&gt;He insisted **people’s welfare** should be paramount when a policy is drafted and there should be a proper mechanism to **receive feedback** on the initiatives.

The whole year is April Fool's Day when it comes to MSM's sensationalism and outrage manufacturing.",2015-04-01 11:01:29
264,"I was active on those threads, and no I won't fucking say it.

What Sachin did was mandated and required. Read the damn article,

&gt;&gt;It was last November that Sachin stepped in to adopt the village under the Sansad Adarsh Gram Yojana, flagged off by Prime Minister Narendra Modi a month earlier. Unlike other similar high-profile village adoptions where work is yet to begin on the ground, a lot has already been accomplished in this village thanks to quick decisions and constant supervision. 

Guess who actually executed this?

[Gorle Rekha Rani](http://www.deccanchronicle.com/141112/nation-current-affairs/article/master-stroke-nellore-joint-collector) the district collector.

Now we sing praises of people for doing the barest fucking minimum?

BC, his job and duty is to fucking attend parliament, adopt a village AND use his MPLAD funds. How does this excuse him of the other? 

[Here, read about the guidelines for this scheme](http://pib.nic.in/archieve/others/2014/oct/d2014101101.pdf)

",2015-04-01 11:12:03
265,"&gt; Modi asked the ministers at the meeting, which last almost two hours, to seek feedback from the people on government policies and maintain strict work transparency.

&gt; He insisted people’s welfare should be paramount when a policy is drafted and there should be a proper mechanism to receive feedback on the initiatives.

I was talking about this need for a feedback mechanism in [one](http://np.reddit.com/r/india/comments/30sy6z/karnataka_assembly_passes_bill_to_hike_salary_of/cpvmsoz) of my comments. It's well and good that our PM is taking initiative on this front. But this shouldn't be one of those things that fizzles out on its way down the hierarchy. An efficient feedback system, that gives a unbiased picture of a minister's performance (or any elected person for that matter), would go a long way in solving many of our country's chronic problems. Hope, people start giving serious thought to this.",2015-04-01 11:15:05
266,"WTF? Did you even read the article? He didn't do it on his own accord or using his own money or something, he adopted a village under the Sansad Adarsh Gram Yogna scheme flagged off by Modi. He used his MPLAD funds which he was supposed to anyways.

[Here, read about the guidelines for this scheme](http://pib.nic.in/archieve/others/2014/oct/d2014101101.pdf)",2015-04-01 11:15:29
267,"What Sachin did was mandated and required. 

&gt;&gt;It was last November that Sachin stepped in to adopt the village under the Sansad Adarsh Gram Yojana, flagged off by Prime Minister Narendra Modi a month earlier. Unlike other similar high-profile village adoptions where work is yet to begin on the ground, a lot has already been accomplished in this village thanks to quick decisions and constant supervision. 

Guess who actually executed this?

[Gorle Rekha Rani](http://www.deccanchronicle.com/141112/nation-current-affairs/article/master-stroke-nellore-joint-collector) the district collector.

Now we sing praises of people for doing the barest fucking minimum?

BC, his job and duty is to fucking attend parliament, adopt a village AND use his MPLAD funds. How does this excuse him of the other? 

[Here, read about the guidelines for this scheme](http://pib.nic.in/archieve/others/2014/oct/d2014101101.pdf)
",2015-04-01 11:15:58
268,"Jagan has been trying to cozy up with Modi for a long time. He has lots of corruption cases against him and needs someone powerful enough to keep things from heating up till 2019. He is sure of coming to power in AP in 2019 and once he is in power, he is capable of doing anything to get rid of those cases.

Modi might just engage with this guy, to keep CBN and his incessant demands for central aid, in check. BJP is trying to expand in AP and it is reported in some local media that Mr.Venkaiah (another powerful leader from AP in BJP) facilitated this meeting between Jagan n Modi. I guess Jagan might be stroking and playing the differences between the two Naidu's to his advantage.",2015-04-01 11:18:35
269,"Modi really needs to scale up and/or devise new structures. Depending too much on his CM experience will be disastrous. He's adapted well to the diplomacy role that's new to him. But his style of communication and feedback (that he copied from CBN) which made him efficient in GJ is useless in the Center. Neither does he have the time, nor does the sheer vastness of India permit this.

Edit: good observation and comment.",2015-04-01 11:23:58
270,&gt;An influential American Senator has said Prime Minister Narendra Modi is probably the strongest Indian leader to have emerged in his lifetime and asserted that the US needs to have more cooperation with India. ,2015-04-01 12:03:25
271,"&gt;NEW DELHI: Prime Minister Narendra Modi today held a meeting with Ministers of State with Independent Charge, seeking to know about their work and feedback about government's policies. ",2015-04-01 12:06:12
272,"&gt;Modi is learnt to have asked each of the 13 Ministers about their experience in government and whether they faced any difficulties in discharge of their duties, sources said. ",2015-04-01 12:06:31
273,Modi ki Maaya tum kya jaano!,2015-04-01 12:08:56
274,*Ab McCain ne bhi Modi ka lemon juice pi liya kya?*,2015-04-01 12:45:10
275,"Chandhra babu's support is falling by the day since his policies bankrupted the state and modi / amit shah knows that , if they are cozying up to sharad pawar  i guess jagan is not off limits as well .  But Jagan and BJP will never ally before elections cause of his big christian voters.
  
Venkaih naidu wants to stay with TDP since they are of same caste but  amit shah is the one in charge of party now .  Venkaih naidu has little grass roots support but he has a good name and amit shah clipped his wings regarding alliances",2015-04-01 13:02:04
276,Can't wait to see what Palin has to say about Modi.,2015-04-01 13:53:41
277,"if modi doesnt manage the media, he is going to pay for it in the next term. and after 10 years, he will be too old to campaign like he did last year.",2015-04-01 14:08:52
278,Modi is secret assassin and Shansi Gandhi was a Templar.,2015-04-01 14:41:08
279,If Narendra Modi was Muslim would BJP have accepted him,2015-04-01 14:52:24
280,"It's the best advice. Modi has proven that you can perform and promote yourself effectively no matter what the MSM tries to do to you. Sooner or later, those TRP dogs will be silenced if you make the right moves and bring people's attention to them yourself. People want to be addressed directly, and luckily, there are enough mediums for doing that efficiently today. 

Sincere mainstream journalism died a long time ago. Social media is a solid bridge of communication for politicians and people.",2015-04-01 15:30:42
281,"So you are saying that the congress would not have accepted a Nigerian Sonia.

Or

Are you saying BJP would have accepted a Muslim Modi?",2015-04-01 15:46:32
282,"A Muslim Modi would never have joined RSS, perhaps a Muslim Nationalist org, and might have ended up in Congress, in all probability, since Congress the only other party to have been active in Gujarat.",2015-04-01 15:53:34
283,Well Modi wouldn't be Modi if he was a muslim. His religion played a big part in making him who he is. His entire ideology would have been different so I doubt he'd have ended up in the BJP.,2015-04-01 16:51:46
284,"No. Kejriwal chor nahi hai, tu hoga modi ka sipahi. ",2015-04-01 17:35:30
285,"Such a shame he is fooling so many people about development , all this capital plan is a huge real estate scam by TDP .  
   
Singapore government is not really involved , its two private firms that are developing the blueprint for a big consulting fee.   
  
He wants like 100,000 crores  initially to develop this city , why shouldnt other states like bihar , uttar pradesh , etc deserve the same cause they dont have a proper capital ??   Dont tell me about the AP reorganisation bill , its just a stupid stunt by sonia gandhi for elections.   Modi is giving enough funds for a small city  .    
  
If anyone hears naidu's plan for this place , you will be stunned on how much amount he wants to spend there , there hasnt been a single new road in my district since they came to power and he has all the money to spend on capital .  
  
AP is in  5,000 crores overdraft  already cause this chut raised employee salary to save his party in telangana  , he raised petrol rates by 4 to 5 , petrol rate in AP is around 70 , TN = 63 .
  
He is begging for loans from world bank , ADB  , etc and will indebt the whole state just for his real estate venture.  There will be no development in rest of AP if he goes through with it . why doesnt other cities need funds ?? If he wants to raise money for capital then take loans in the name of it  .
  
Dont fucking tell me jagan is worse and justify this scam , that bastard jagan already owns upto 4200 acres near the capital . Jagan is complicit with chandra babu on this , otherwise he could have easily stalled it .   
  
Even the report submitted by siva ramakrishnan committee asked state not to go overboard on capital and develop existing cities ,  they were not idiots or corrupt  .
  
TLDR : Real estate scam by naidu  by destroying rest of AP and blackmailing modi for funds  . This is not development this is chutiya giri
  

  
",2015-04-01 18:00:01
